USER_ID,ORDER_ID,PURCHASE_TS,SHIP_TS,PRODUCT_NAME,PRODUCT_ID,GBP_PRICE,PURCHASE_PLATFORM,MARKETING_CHANNEL,ACCOUNT_CREATION_METHOD,CITY,PURCHASE_TS_FINAL,SHIP_TS_FINAL
23b8c1e9,bdd640fb-0667-4a,2025-06-11,2025-06-12,Accessory,m001,24.99,website,email,desktop,Leeds,2025-06-11,2025-06-12
972a8469,bd9c66b3-ad3c-4d,2025-03-23,2025-03-25,Steam Deck,c912,499.99,website,search,desktop,Manchester,2025-03-23,2025-03-25
9a1de644,17fc695a-07a0-4a,2025-04-24,04-28-2025,Kindle Paperwhite,j877,129.99,website,affiliate,desktop,Birmingham,2025-04-24,2025-04-28
9a1de644,17fc695a-07a0-4a,2025-04-24,2025-04-26,Steam Deck,c912,499.99,website,search,desktop,Manchester,2025-04-24,2025-04-26
6b65a6a4,b74d0fb1-32e7-46,2025-06-02,2025-06-08,Accessory,m001,24.99,mobile_app,direct,mobile,Manchester,2025-06-02,2025-06-08
c241330b,47378190-96da-4d,2025-03-22,2025-03-25,Kindle Paperwhite,j877,129.99,website,direct,unknown,Manchester,2025-03-22,2025-03-25
371ecd7b,6c307511-b2b9-43,2025-04-10,04-13-2025,MacBook Air,g770,1199.99,mobile_app,direct,desktop,Manchester,2025-04-10,2025-04-13
5be6128e,1a2a73ed-562b-4f,2025-02-15,2025-02-16,iPhone 15,f521,899.99,website,social,desktop,Glasgow,2025-02-15,2025-02-16
5be6128e,1a2a73ed-562b-4f,2025-02-15,2025-02-18,iPhone 15,f521,899.99,mobile_app,affiliate,unknown,,2025-02-15,2025-02-18
5be6128e,1a2a73ed-562b-4f,2025-02-15,02-20-2025,Smartwatch,h301,249.99,website,social,desktop,Leicester,2025-02-15,2025-02-20
759cde66,43b7a3a6-9a8d-4a,07-05-2025,2025-05-10,Google Pixel 8,i920,699.99,mobile_app,search,desktop,Manchester,2025-05-07,2025-05-10
3139d32c,e2acf72f-9e57-4f,20-01-2025,2025-01-21,Steam Deck,c912,499.99,mobile_app,email,mobile,Manchester,2025-01-20,2025-01-21
fc377a4c,a9488d99-0bbb-45,2025-04-08,2025-04-11,Accessory,m001,24.99,website,email,mobile,Manchester,2025-04-08,2025-04-11
7412b293,ddd1dfb2-3b98-4e,2025-02-08,2025-02-14,Steam Deck,c912,499.99,mobile_app,affiliate,unknown,Leeds,2025-02-08,2025-02-14
7412b293,ddd1dfb2-3b98-4e,2025-02-08,2025-02-10,Accessory,m001,24.99,website,direct,mobile,London,2025-02-08,2025-02-10
ab9099a4,29a3b2e9-5d65-44,2025-04-18,2025-04-21,MacBook Air,g770,1199.99,website,email,desktop,Leeds,2025-04-18,2025-04-21
a28defe3,aefcfad8-efc8-48,2025-05-14,2025-05-15,Steam Deck,c912,499.99,mobile_app,social,mobile,Birmingham,2025-05-14,2025-05-15
a28defe3,aefcfad8-efc8-48,2025-05-14,2025-05-16,PS5,a245,479.99,mobile_app,direct,,London,2025-05-14,2025-05-16
451b4cf3,3eabedcb-baa8-4d,2025-04-08,2025-04-12,Smartwatch,h301,249.99,mobile_app,direct,mobile,Liverpool,2025-04-08,2025-04-12
5304317f,b02b61c4-a3d7-46,24-04-2025,2025-04-26,Xbox Series X,b104,499.99,mobile_app,search,mobile,London,2025-04-24,2025-04-26
ce177b4e,0e51f30d-c6a7-4e,2025-04-09,04-13-2025,Kindle Paperwhite,j877,129.99,mobile_app,direct,desktop,London,2025-04-09,2025-04-13
9132b63e,10f1bc81-448a-4a,2025-01-09,2025-01-13,Google Pixel 8,i920,699.99,website,affiliate,desktop,Leeds,2025-01-09,2025-01-13
e27a984d,366eb16f-508e-4a,2025-01-11,01-17-2025,Xbox Series X,b104,499.99,website,social,,Manchester,2025-01-11,2025-01-17
beb79919,24933b83-7577-40,2025-05-27,05-31-2025,PS5,a245,479.99,mobile_app,search,,Manchester,2025-05-27,2025-05-31
956269f0,bf3c4c06-4343-48,2025-01-07,2025-01-10,Google Pixel 8,i920,699.99,website,affiliate,unknown,Liverpool,2025-01-07,2025-01-10
7e570ddf,ff50bde4-3825-47,2025-01-23,2025-01-26,Google Pixel 8,i920,699.99,mobile_app,affiliate,mobile,London,2025-01-23,2025-01-26
28f49481,dc713d96-0c0f-41,2025-04-08,04-10-2025,MacBook Air,g770,1199.99,mobile_app,affiliate,unknown,,2025-04-08,2025-04-10
988c24c9,98ae4334-6c12-4c,2025-03-15,2025-03-20,AirPods,d633,159.99,website,search,desktop,Birmingham,2025-03-15,2025-03-20
f143262f,405cacec-8774-49,2025-04-14,04-17-2025,Accessory,m001,24.99,website,direct,mobile,Glasgow,2025-04-14,2025-04-17
f143262f,405cacec-8774-49,2025-04-14,2025-04-19,Xbox Series X,b104,499.99,website,search,mobile,Glasgow,2025-04-14,2025-04-19
c0398710,1d53434b-b881-49,2025-01-13,2025-01-14,Smartwatch,h301,249.99,website,email,mobile,Manchester,2025-01-13,2025-01-14
287d06ca,5715bd6f-a416-42,2025-04-04,2025-04-05,Steam Deck,c912,499.99,website,search,desktop,Bristol,2025-04-04,2025-04-05
287d06ca,5715bd6f-a416-42,2025-04-04,2025-04-10,PS5,a245,479.99,mobile_app,affiliate,unknown,Manchester,2025-04-04,2025-04-10
f8cda88b,b8db0672-f42d-47,2025-05-04,2025-05-06,Xbox Series X,b104,499.99,mobile_app,search,desktop,Sheffield,2025-05-04,2025-05-06
a013ac6e,81f76d1c-2dbc-41,02-04-2025,2025-04-07,AirPods,d633,159.99,mobile_app,direct,unknown,Glasgow,2025-04-02,2025-04-07
5fb8d16c,81f631d4-a392-41,12-01-2025,2025-01-18,Steam Deck,c912,499.99,mobile_app,social,unknown,Manchester,2025-01-12,2025-01-18
eb2263dd,f4188f3f-8a14-4e,2025-04-26,2025-04-29,Accessory,m001,24.99,mobile_app,search,mobile,Manchester,2025-04-26,2025-04-29
eb2263dd,f4188f3f-8a14-4e,2025-04-26,2025-04-28,PS5,a245,479.99,website,affiliate,mobile,London,2025-04-26,2025-04-28
5cec4eb5,7d154385-52fb-44,2025-03-27,2025-04-01,Nintendo Switch,e682,299.99,website,search,desktop,London,2025-03-27,2025-04-01
5cec4eb5,7d154385-52fb-44,2025-03-27,2025-03-28,Nintendo Switch,e682,299.99,website,direct,desktop,Leeds,2025-03-27,2025-03-28
3da9c2a9,ce88cb2d-d4e8-48,2025-01-08,2025-01-11,Nintendo Switch,e682,299.99,website,search,desktop,Glasgow,2025-01-08,2025-01-11
3da9c2a9,ce88cb2d-d4e8-48,2025-01-08,2025-01-14,AirPods,d633,159.99,mobile_app,direct,unknown,Glasgow,2025-01-08,2025-01-14
d0e6e660,14296c07-f26b-47,2025-02-24,2025-03-02,Xbox Series X,b104,499.99,mobile_app,direct,mobile,Sheffield,2025-02-24,2025-03-02
a8e56e0c,885f6e66-c2b6-42,2025-04-09,04-11-2025,MacBook Air,g770,1199.99,website,affiliate,unknown,London,2025-04-09,2025-04-11
9b49bd26,2a45c2ab-8cbf-4d,2025-02-12,2025-02-15,MacBook Air,g770,1199.99,mobile_app,,mobile,Manchester,2025-02-12,2025-02-15
b09b2a5c,edcd465e-3638-48,2025-03-17,03-23-2025,Nintendo Switch,e682,299.99,website,affiliate,mobile,Leicester,2025-03-17,2025-03-23
5f987c71,66245bfa-4fcc-43,2025-06-22,2025-06-23,iPhone 15,f521,899.99,website,direct,,Manchester,2025-06-22,2025-06-23
1064005c,7394988f-847f-49,2025-04-02,2025-04-06,Google Pixel 8,i920,699.99,website,social,desktop,Glasgow,2025-04-02,2025-04-06
01d74256,8dcdcd03-969b-46,2025-04-23,2025-04-27,AirPods,d633,159.99,website,affiliate,mobile,Birmingham,2025-04-23,2025-04-27
080aadfb,0f1259e0-a18f-46,06-02-2025,2025-02-07,Google Pixel 8,i920,699.99,website,search,desktop,London,2025-02-06,2025-02-07
080aadfb,0f1259e0-a18f-46,2025-02-06,02-08-2025,PS5,a245,479.99,website,social,mobile,Glasgow,2025-02-06,2025-02-08
7c441fe7,839fbc50-1223-45,2025-04-16,2025-04-18,Smartwatch,h301,249.99,mobile_app,affiliate,desktop,Leeds,2025-04-16,2025-04-18
93829b43,b92da22b-21df-40,2025-04-16,04-17-2025,MacBook Air,g770,1199.99,mobile_app,email,mobile,Manchester,2025-04-16,2025-04-17
1825bc54,7914c120-c8dc-41,2025-04-19,04-23-2025,AirPods,d633,159.99,mobile_app,direct,desktop,Birmingham,2025-04-19,2025-04-23
dd2467ac,5ab33edf-6e59-4e,2025-03-07,03-09-2025,AirPods,d633,159.99,website,search,unknown,Manchester,2025-03-07,2025-03-09
dd2467ac,5ab33edf-6e59-4e,07-03-2025,2025-03-08,Google Pixel 8,i920,699.99,mobile_app,affiliate,desktop,Birmingham,2025-03-07,2025-03-08
0f844fef,a748dbcf-ac61-4e,2025-06-01,2025-06-05,Kindle Paperwhite,j877,129.99,website,affiliate,unknown,Birmingham,2025-06-01,2025-06-05
310c0c00,ccf3a171-56dc-49,2025-02-10,02-12-2025,PS5,a245,479.99,website,search,desktop,Manchester,2025-02-10,2025-02-12
766ecb15,23e2fcb4-72d8-46,2025-05-25,2025-05-27,Accessory,m001,24.99,mobile_app,affiliate,unknown,Glasgow,2025-05-25,2025-05-27
db20a56e,134c6c92-ec5b-42,2025-06-12,2025-06-17,Steam Deck,c912,499.99,website,search,desktop,Glasgow,2025-06-12,2025-06-17
03c72ba8,a6f2f7b8-0cf3-4b,2025-02-09,2025-02-15,MacBook Air,g770,1199.99,mobile_app,email,desktop,London,2025-02-09,2025-02-15
03c72ba8,a6f2f7b8-0cf3-4b,2025-02-09,2025-02-15,Accessory,m001,24.99,mobile_app,direct,mobile,Birmingham,2025-02-09,2025-02-15
680ac07a,c0e9ab30-ed26-42,24-05-2025,2025-05-26,MacBook Air,g770,1199.99,mobile_app,social,mobile,Bristol,2025-05-24,2025-05-26
680ac07a,c0e9ab30-ed26-42,2025-05-25,2025-05-24,PS5,a245,479.99,mobile_app,search,unknown,Liverpool,2025-05-25,2025-05-24
2a25a888,dd59ba71-36b8-44,08-05-2025,2025-05-09,PS5,a245,479.99,website,search,mobile,Glasgow,2025-05-08,2025-05-09
2a25a888,dd59ba71-36b8-44,08-05-2025,2025-05-11,Xbox Series X,b104,499.99,website,direct,mobile,Manchester,2025-05-08,2025-05-11
c8fe3ccd,63f2ae24-fc3d-43,2025-04-18,2025-04-20,AirPods,d633,159.99,mobile_app,search,unknown,Manchester,2025-04-18,2025-04-20
c88a618e,b253d218-6c4a-47,2025-04-16,2025-04-21,AirPods,d633,159.99,website,search,mobile,Leicester,2025-04-16,2025-04-21
37bb3eec,7c967f79-b7e9-4a,2025-01-14,2025-01-15,Accessory,m001,24.99,website,email,,London,2025-01-14,2025-01-15
504867ba,bc594585-9445-48,2025-04-07,2025-04-13,PS5,a245,479.99,website,email,mobile,Birmingham,2025-04-07,2025-04-13
87f7e1fb,7a0ecfea-958c-49,2025-04-27,2025-04-29,Kindle Paperwhite,j877,129.99,mobile_app,direct,unknown,London,2025-04-27,2025-04-29
118a9d29,82010c62-f5f5-4b,2025-02-06,2025-02-09,Accessory,m001,24.99,mobile_app,email,desktop,Nottingham,2025-02-06,2025-02-09
f10c718b,dca02eec-acda-4a,2025-06-27,07-03-2025,PS5,a245,479.99,mobile_app,email,desktop,Leeds,2025-06-27,2025-07-03
14fcdd54,94340a03-3f07-48,01-04-2025,2025-04-04,Nintendo Switch,e682,299.99,website,email,desktop,Manchester,2025-04-01,2025-04-04
42c18a62,90b2b633-956b-4c,2025-03-03,2025-03-08,Smartwatch,h301,249.99,mobile_app,search,desktop,Leeds,2025-03-03,2025-03-08
21813d25,506e5a9a-b758-48,2025-06-14,2025-06-15,PS5,a245,479.99,website,search,desktop,Bristol,2025-06-14,2025-06-15
ef8c485b,750cab75-4ccc-4b,2025-01-24,2025-01-29,iPhone 15,f521,899.99,website,social,desktop,London,2025-01-24,2025-01-29
19985f15,9f044aed-7552-43,2025-04-01,2025-04-04,Nintendo Switch,e682,299.99,mobile_app,affiliate,mobile,Manchester,2025-04-01,2025-04-04
5958a499,8181a8cc-3691-47,2025-02-01,2025-02-07,Steam Deck,c912,499.99,website,affiliate,mobile,London,2025-02-01,2025-02-07
702cdd20,3e896c64-e117-4a,2025-04-22,2025-04-26,Google Pixel 8,i920,699.99,website,direct,desktop,Birmingham,2025-04-22,2025-04-26
ce9e1a11,4d71c366-b41b-41,2025-01-15,2025-01-19,Xbox Series X,b104,499.99,website,direct,unknown,Leicester,2025-01-15,2025-01-19
ee87905e,aaf91531-0200-41,2025-04-02,2025-04-06,iPhone 15,f521,899.99,website,email,desktop,London,2025-04-02,2025-04-06
e3c43657,e0ccedc5-f05d-47,2025-02-22,2025-02-26,PS5,a245,479.99,website,social,desktop,London,2025-02-22,2025-02-26
e3c43657,e0ccedc5-f05d-47,22-02-2025,2025-02-26,Steam Deck,c912,499.99,mobile_app,email,desktop,London,2025-02-22,2025-02-26
35ebd32d,27cb6f2a-8da0-40,2025-05-25,2025-05-26,Steam Deck,c912,499.99,website,social,mobile,Glasgow,2025-05-25,2025-05-26
35ebd32d,27cb6f2a-8da0-40,2025-05-25,2025-05-26,AirPods,d633,159.99,mobile_app,email,unknown,Manchester,2025-05-25,2025-05-26
81627cf1,afffcfd2-341e-44,2025-04-20,04-24-2025,Google Pixel 8,i920,699.99,mobile_app,affiliate,desktop,Glasgow,2025-04-20,2025-04-24
a2607723,e87d1c78-e7c4-41,2025-05-12,2025-05-14,AirPods,d633,159.99,mobile_app,affiliate,desktop,Bristol,2025-05-12,2025-05-14
217d65a0,0b49452d-46d4-43,2025-04-23,2025-04-27,Kindle Paperwhite,j877,129.99,mobile_app,email,mobile,Birmingham,2025-04-23,2025-04-27
b4a69f3c,295d6fbf-430f-40,22-02-2025,2025-02-27,Kindle Paperwhite,j877,129.99,website,social,unknown,Glasgow,2025-02-22,2025-02-27
b0e6a969,1ca3c448-0279-46,2025-01-06,2025-01-09,Steam Deck,c912,499.99,website,social,desktop,London,2025-01-06,2025-01-09
8d7248e2,093923de-8bab-4e,2025-03-08,2025-03-13,Google Pixel 8,i920,699.99,website,email,mobile,Leeds,2025-03-08,2025-03-13
eededb07,0ab54bde-20a0-45,04-04-2025,2025-04-10,PS5,a245,479.99,mobile_app,search,mobile,Liverpool,2025-04-04,2025-04-10
ae9bec36,0a368ce7-dc57-41,03-04-2025,2025-03-03,Accessory,m001,24.99,mobile_app,search,mobile,Glasgow,2025-04-03,2025-03-03
dfed2c43,5a8aaeca-1a50-4e,2025-06-10,2025-06-14,Accessory,m001,24.99,mobile_app,social,unknown,London,2025-06-10,2025-06-14
3c9ad14c,bfddc3d9-9ee3-4c,2025-03-26,2025-03-31,AirPods,d633,159.99,website,direct,mobile,Manchester,2025-03-26,2025-03-31
3c9ad14c,bfddc3d9-9ee3-4c,2025-03-26,2025-03-30,Accessory,m001,24.99,website,search,unknown,Manchester,2025-03-26,2025-03-30
698c206f,ccc56569-f9e8-43,2025-05-09,2025-05-13,AirPods,d633,159.99,website,email,mobile,Birmingham,2025-05-09,2025-05-13
698c206f,ccc56569-f9e8-43,2025-05-09,2025-05-13,Steam Deck,c912,499.99,mobile_app,social,mobile,Manchester,2025-05-09,2025-05-13
698c206f,ccc56569-f9e8-43,2025-05-09,2025-05-15,Smartwatch,h301,249.99,website,search,mobile,Bristol,2025-05-09,2025-05-15
696608aa,ecab3301-bc8f-4d,2025-02-22,2025-02-28,Xbox Series X,b104,499.99,website,email,unknown,Birmingham,2025-02-22,2025-02-28
28c13091,bc2cbb0d-dd33-4c,2025-03-16,2025-03-22,Accessory,m001,24.99,mobile_app,affiliate,desktop,Glasgow,2025-03-16,2025-03-22
787f2425,61ee411a-1bac-47,2025-03-23,2025-03-26,Accessory,m001,24.99,website,direct,desktop,Manchester,2025-03-23,2025-03-26
d20eac17,eb1fa9f2-d10b-41,2025-02-22,2025-02-23,Nintendo Switch,e682,299.99,website,social,unknown,Manchester,2025-02-22,2025-02-23
6601ddd0,39118497-3a43-42,2025-01-17,2025-01-21,PS5,a245,479.99,mobile_app,search,desktop,London,2025-01-17,2025-01-21
59e4b671,11c58ef0-dd46-4c,2025-02-16,2025-02-20,MacBook Air,g770,1199.99,mobile_app,direct,desktop,Manchester,2025-02-16,2025-02-20
59e4b671,11c58ef0-dd46-4c,2025-02-16,2025-02-22,Accessory,m001,24.99,website,affiliate,mobile,Glasgow,2025-02-16,2025-02-22
59e4b671,11c58ef0-dd46-4c,2025-02-16,2025-02-18,Steam Deck,c912,499.99,mobile_app,affiliate,unknown,London,2025-02-16,2025-02-18
54c63cd8,adf4e62d-6651-42,2025-03-23,2025-03-24,Steam Deck,c912,499.99,mobile_app,direct,mobile,Manchester,2025-03-23,2025-03-24
94a1875d,e08596db-1d87-49,2025-05-20,2025-05-25,Accessory,m001,24.99,mobile_app,social,unknown,London,2025-05-20,2025-05-25
94a1875d,e08596db-1d87-49,2025-05-20,05-24-2025,Google Pixel 8,i920,699.99,mobile_app,direct,unknown,Glasgow,2025-05-20,2025-05-24
587ef344,09cb3942-43f5-4a,2025-05-05,2025-05-09,Smartwatch,h301,249.99,mobile_app,direct,unknown,Birmingham,2025-05-05,2025-05-09
1d9af659,6fb78271-504d-48,2025-06-02,2025-06-07,AirPods,d633,159.99,mobile_app,direct,mobile,Manchester,2025-06-02,2025-06-07
6fa17735,30a900ad-939b-46,2025-06-24,2025-06-25,Smartwatch,h301,249.99,mobile_app,direct,mobile,Birmingham,2025-06-24,2025-06-25
f0b5156b,ce777f00-ecf2-4e,2025-02-19,2025-02-22,iPhone 15,f521,899.99,website,direct,desktop,Liverpool,2025-02-19,2025-02-22
f2e9702d,3270e4fa-abae-4f,2025-05-08,2025-05-12,Steam Deck,c912,499.99,website,direct,desktop,Bristol,2025-05-08,2025-05-12
1fe771d6,9f871ce7-5487-4d,2025-01-14,2025-01-18,MacBook Air,g770,1199.99,mobile_app,search,mobile,Manchester,2025-01-14,2025-01-18
5380b904,81d2c7de-4ce1-4b,2025-04-17,2025-04-18,MacBook Air,g770,1199.99,website,social,mobile,Birmingham,2025-04-17,2025-04-18
aa38d0a1,8dedf9fb-4bb0-4f,2025-04-02,2025-04-08,Kindle Paperwhite,j877,129.99,website,search,mobile,Manchester,2025-04-02,2025-04-08
91b0e1d9,bf85bf0e-ad64-45,2025-04-18,2025-04-19,Smartwatch,h301,249.99,mobile_app,email,mobile,Glasgow,2025-04-18,2025-04-19
35ce8841,d56f0350-8c45-4c,2025-04-21,2025-04-26,MacBook Air,g770,1199.99,website,,desktop,Nottingham,2025-04-21,2025-04-26
35ce8841,d56f0350-8c45-4c,2025-04-21,2025-04-25,AirPods,d633,159.99,mobile_app,affiliate,mobile,,2025-04-21,2025-04-25
7118e364,9b4e2c24-9479-41,2025-04-03,2025-04-09,iPhone 15,f521,899.99,mobile_app,direct,mobile,Leicester,2025-04-03,2025-04-09
f5b78cc7,82dc4c8e-36b5-42,2025-03-07,2025-03-12,Xbox Series X,b104,499.99,website,social,unknown,Glasgow,2025-03-07,2025-03-12
a9f25336,a8aa7158-2b70-45,2025-04-12,2025-04-18,Kindle Paperwhite,j877,129.99,website,affiliate,unknown,London,2025-04-12,2025-04-18
a9f25336,a8aa7158-2b70-45,2025-04-12,2025-04-14,MacBook Air,g770,1199.99,mobile_app,direct,desktop,Leeds,2025-04-12,2025-04-14
3c20592f,17e8392a-55ce-45,2025-01-17,2025-01-21,AirPods,d633,159.99,mobile_app,direct,mobile,Glasgow,2025-01-17,2025-01-21
3c20592f,17e8392a-55ce-45,2025-01-17,2025-01-20,iPhone 15,f521,899.99,mobile_app,email,mobile,Glasgow,2025-01-17,2025-01-20
0bd4a990,ce7ae7f6-3982-4c,2025-03-19,2025-03-20,AirPods,d633,159.99,mobile_app,affiliate,unknown,London,2025-03-19,2025-03-20
74962764,9c7c7377-79a2-49,2025-06-12,06-13-2025,Google Pixel 8,i920,699.99,mobile_app,direct,unknown,London,2025-06-12,2025-06-13
624c69b6,935f2b0a-a138-4d,2025-04-20,2025-04-26,PS5,a245,479.99,website,affiliate,desktop,Glasgow,2025-04-20,2025-04-26
624c69b6,935f2b0a-a138-4d,2025-04-20,2025-04-21,Steam Deck,c912,499.99,website,direct,desktop,Glasgow,2025-04-20,2025-04-21
624c69b6,935f2b0a-a138-4d,2025-04-20,2025-04-26,Smartwatch,h301,249.99,website,search,desktop,London,2025-04-20,2025-04-26
e4855aa1,25c73c44-3e75-43,2025-03-27,2025-04-02,Smartwatch,h301,249.99,mobile_app,email,desktop,Manchester,2025-03-27,2025-04-02
3805f907,e2add909-c521-4f,2025-05-07,2025-05-12,Kindle Paperwhite,j877,129.99,website,direct,mobile,Manchester,2025-05-07,2025-05-12
3805f907,e2add909-c521-4f,2025-05-07,2025-05-12,PS5,a245,479.99,website,email,unknown,Glasgow,2025-05-07,2025-05-12
8eb22579,b227462c-f53d-43,2025-04-05,2025-04-09,Accessory,m001,24.99,mobile_app,direct,desktop,Birmingham,2025-04-05,2025-04-09
76f2dbfe,1f115b76-d92c-42,2025-04-15,2025-04-21,Kindle Paperwhite,j877,129.99,website,affiliate,,Manchester,2025-04-15,2025-04-21
c1581092,8f15ba58-fce6-45,2025-04-06,2025-04-12,AirPods,d633,159.99,website,search,desktop,Manchester,2025-04-06,2025-04-12
c1581092,8f15ba58-fce6-45,2025-04-06,2025-04-11,iPhone 15,f521,899.99,mobile_app,email,desktop,Birmingham,2025-04-06,2025-04-11
6d3ee1dc,d0a44432-9cd6-48,2025-05-26,2025-06-01,Google Pixel 8,i920,699.99,mobile_app,affiliate,mobile,Manchester,2025-05-26,2025-06-01
dc8aee30,722764e6-8c41-46,2025-02-08,2025-02-09,Smartwatch,h301,249.99,mobile_app,email,unknown,London,2025-02-08,2025-02-09
46fde062,c074718e-425a-40,2025-05-07,2025-05-13,Smartwatch,h301,249.99,website,social,desktop,Leicester,2025-05-07,2025-05-13
709b7d97,7c0e8cd8-8573-47,2025-03-19,2025-03-25,Google Pixel 8,i920,699.99,mobile_app,search,unknown,Leeds,2025-03-19,2025-03-25
709b7d97,7c0e8cd8-8573-47,2025-03-19,2025-03-23,Smartwatch,h301,249.99,mobile_app,search,mobile,Glasgow,2025-03-19,2025-03-23
e49d681d,3c07c574-4925-4a,2025-06-07,2025-06-09,iPhone 15,f521,899.99,website,email,mobile,London,2025-06-07,2025-06-09
271e3ee2,269cd696-236c-4b,26-03-2025,2025-03-30,Steam Deck,c912,499.99,mobile_app,email,desktop,Birmingham,2025-03-26,2025-03-30
7746d0ba,6a34c854-1071-4d,2025-05-07,2025-05-10,Smartwatch,h301,249.99,website,social,desktop,Birmingham,2025-05-07,2025-05-10
7746d0ba,6a34c854-1071-4d,2025-05-07,2025-05-10,iPhone 15,f521,899.99,mobile_app,email,unknown,Glasgow,2025-05-07,2025-05-10
c51155ff,d5385b0e-34f3-49,2025-03-17,2025-03-22,AirPods,d633,159.99,website,search,desktop,Manchester,2025-03-17,2025-03-22
c51155ff,d5385b0e-34f3-49,2025-03-17,2025-03-19,PS5,a245,479.99,mobile_app,social,unknown,Glasgow,2025-03-17,2025-03-19
c51155ff,d5385b0e-34f3-49,2025-03-17,03-23-2025,Steam Deck,c912,499.99,mobile_app,social,mobile,London,2025-03-17,2025-03-23
9360715f,05000bc6-b20d-4b,2025-06-13,2025-06-14,Nintendo Switch,e682,299.99,mobile_app,direct,mobile,Manchester,2025-06-13,2025-06-14
9360715f,05000bc6-b20d-4b,2025-06-13,2025-06-16,Steam Deck,c912,499.99,mobile_app,,unknown,Bristol,2025-06-13,2025-06-16
63d62a39,f1578470-0182-47,2025-06-05,2025-06-08,Google Pixel 8,i920,699.99,mobile_app,search,mobile,Manchester,2025-06-05,2025-06-08
bc10fa52,d5f25073-f414-42,2025-01-15,2025-01-21,iPhone 15,f521,899.99,mobile_app,email,mobile,Glasgow,2025-01-15,2025-01-21
45df16b6,e5d6f6e6-9a6e-42,2025-04-21,2025-04-23,AirPods,d633,159.99,website,direct,mobile,Birmingham,2025-04-21,2025-04-23
cc530e36,638c254c-076e-4b,2025-04-11,2025-04-17,PS5,a245,479.99,website,direct,desktop,London,2025-04-11,2025-04-17
fb10987f,d72b6108-2a40-4f,2025-05-12,2025-05-15,Smartwatch,h301,249.99,mobile_app,affiliate,desktop,Manchester,2025-05-12,2025-05-15
fb10987f,d72b6108-2a40-4f,12-05-2025,2025-05-14,AirPods,d633,159.99,mobile_app,direct,mobile,London,2025-05-12,2025-05-14
fb10987f,d72b6108-2a40-4f,2025-05-12,2025-05-18,Nintendo Switch,e682,299.99,website,email,desktop,Manchester,2025-05-12,2025-05-18
a9ba5a27,e82c7d7b-06e7-45,2025-03-18,2025-03-23,Nintendo Switch,e682,299.99,mobile_app,direct,unknown,Manchester,2025-03-18,2025-03-23
2e85cb21,6db99102-a48b-4d,2025-02-27,2025-02-28,Smartwatch,h301,249.99,website,search,mobile,Birmingham,2025-02-27,2025-02-28
56666f9f,53cd6268-610c-43,20-03-2025,03-24-2025,Smartwatch,h301,249.99,mobile_app,email,desktop,Glasgow,2025-03-20,2025-03-24
6bebac31,473bd358-610e-4a,2025-02-03,2025-02-06,Nintendo Switch,e682,299.99,mobile_app,affiliate,desktop,Liverpool,2025-02-03,2025-02-06
0d557b61,78660765-14f7-4e,2025-04-15,2025-04-19,MacBook Air,g770,1199.99,website,search,unknown,Bristol,2025-04-15,2025-04-19
0d557b61,78660765-14f7-4e,15-04-2025,2025-04-16,Accessory,m001,24.99,website,direct,unknown,Manchester,2025-04-15,2025-04-16
f510ab53,39669fa7-5997-40,2025-04-05,2025-04-06,AirPods,d633,159.99,website,affiliate,unknown,Manchester,2025-04-05,2025-04-06
f510ab53,39669fa7-5997-40,2025-04-05,2025-04-10,MacBook Air,g770,1199.99,website,search,mobile,London,2025-04-05,2025-04-10
d6d7b3b8,07f194f9-c115-4d,2025-06-17,06-21-2025,Smartwatch,h301,249.99,mobile_app,search,mobile,London,2025-06-17,2025-06-21
d6d7b3b8,07f194f9-c115-4d,2025-06-17,2025-06-22,AirPods,d633,159.99,website,search,unknown,Birmingham,2025-06-17,2025-06-22
1d48a071,3d114802-2702-47,2025-05-17,2025-05-19,PS5,a245,479.99,website,email,unknown,Liverpool,2025-05-17,2025-05-19
5e6fea07,770c7798-37cc-46,2025-03-01,03-03-2025,PS5,a245,479.99,website,direct,unknown,Manchester,2025-03-01,2025-03-03
c71d5e60,f6b751f7-9b74-42,2025-04-05,2025-04-07,PS5,a245,479.99,website,social,mobile,Leicester,2025-04-05,2025-04-07
edcb8cb6,4fa03f26-f6f7-40,05-04-2025,2025-04-09,Kindle Paperwhite,j877,129.99,mobile_app,affiliate,desktop,Birmingham,2025-04-05,2025-04-09
edcb8cb6,4fa03f26-f6f7-40,2025-04-05,2025-04-11,AirPods,d633,159.99,mobile_app,social,desktop,Leeds,2025-04-05,2025-04-11
edcb8cb6,4fa03f26-f6f7-40,2025-04-05,2025-04-07,Accessory,m001,24.99,mobile_app,search,unknown,London,2025-04-05,2025-04-07
f1043785,e87466d7-ad66-41,2025-02-01,2025-02-05,Steam Deck,c912,499.99,website,search,desktop,Sheffield,2025-02-01,2025-02-05
3e2b6091,9793b9b4-1374-41,2025-02-17,2025-02-19,Accessory,m001,24.99,mobile_app,direct,desktop,Leeds,2025-02-17,2025-02-19
ce3714af,4d3485c5-c5c1-4e,2025-02-07,2025-02-09,Nintendo Switch,e682,299.99,mobile_app,search,unknown,Birmingham,2025-02-07,2025-02-09
8861fe18,90e0f4a0-fbdd-49,2025-05-27,05-30-2025,Kindle Paperwhite,j877,129.99,mobile_app,affiliate,mobile,London,2025-05-27,2025-05-30
033d2bce,11a72609-5edd-4b,27-06-2025,2025-07-03,AirPods,d633,159.99,mobile_app,email,unknown,London,2025-06-27,2025-07-03
033d2bce,11a72609-5edd-4b,2025-06-27,2025-07-01,Google Pixel 8,i920,699.99,mobile_app,affiliate,unknown,Manchester,2025-06-27,2025-07-01
5cb85aed,7d7ddbed-d284-47,2025-05-21,2025-05-25,Nintendo Switch,e682,299.99,mobile_app,search,mobile,Glasgow,2025-05-21,2025-05-25
2d174fc9,75b17a55-d426-49,2025-06-02,2025-06-03,Nintendo Switch,e682,299.99,website,search,unknown,London,2025-06-02,2025-06-03
2d174fc9,75b17a55-d426-49,2025-06-02,2025-06-08,Nintendo Switch,e682,299.99,mobile_app,search,desktop,Glasgow,2025-06-02,2025-06-08
eb6c1016,a6846099-f729-49,2025-03-02,2025-03-06,Xbox Series X,b104,499.99,mobile_app,email,,London,2025-03-02,2025-03-06
97ac6aa8,7701f7bb-7bc6-4e,2025-05-23,2025-05-27,Kindle Paperwhite,j877,129.99,mobile_app,affiliate,mobile,Glasgow,2025-05-23,2025-05-27
4767d76c,3ed8c56c-da09-4f,2025-05-10,05-14-2025,iPhone 15,f521,899.99,mobile_app,email,unknown,Bristol,2025-05-10,2025-05-14
ab0e664e,c01f36bf-3e6d-45,2025-02-24,02-26-2025,PS5,a245,479.99,mobile_app,social,unknown,Manchester,2025-02-24,2025-02-26
7cd0129d,7e8adee7-0758-42,2025-03-11,2025-03-14,Smartwatch,h301,249.99,mobile_app,search,desktop,Glasgow,2025-03-11,2025-03-14
989d9d4a,4223623b-cc3e-4d,2025-04-23,2025-04-24,Smartwatch,h301,249.99,mobile_app,email,mobile,Manchester,2025-04-23,2025-04-24
30e912f2,8e485223-46b9-49,2025-02-08,2025-02-12,PS5,a245,479.99,website,search,mobile,Manchester,2025-02-08,2025-02-12
3d85de89,680bac63-b856-40,03-03-2025,2025-03-04,MacBook Air,g770,1199.99,website,search,mobile,Glasgow,2025-03-03,2025-03-04
046a0df5,b63b4dc3-a559-44,2025-04-19,2025-04-23,Kindle Paperwhite,j877,129.99,mobile_app,affiliate,desktop,Manchester,2025-04-19,2025-04-23
046a0df5,b63b4dc3-a559-44,2025-04-19,2025-04-24,AirPods,d633,159.99,website,email,mobile,Manchester,2025-04-19,2025-04-24
046a0df5,b63b4dc3-a559-44,19-04-2025,2025-04-20,Smartwatch,h301,249.99,website,search,desktop,London,2025-04-19,2025-04-20
a9f948b2,6786d506-38ba-4a,2025-01-01,2025-01-04,Xbox Series X,b104,499.99,website,search,mobile,Glasgow,2025-01-01,2025-01-04
ff233d5f,8db06746-7927-49,17-05-2025,2025-05-19,PS5,a245,479.99,website,social,desktop,Glasgow,2025-05-17,2025-05-19
4e7ed827,5a104129-54ae-4d,2025-01-25,2025-01-27,Accessory,m001,24.99,mobile_app,email,unknown,Glasgow,2025-01-25,2025-01-27
be2d740a,b8a6171f-1ee3-4d,11-04-2025,2025-04-15,AirPods,d633,159.99,mobile_app,social,desktop,Bristol,2025-04-11,2025-04-15
bd1531c8,b0ae8f08-c31e-4b,2025-03-01,03-06-2025,Smartwatch,h301,249.99,website,social,desktop,Manchester,2025-03-01,2025-03-06
98c7472a,96ef2ad6-b97e-47,2025-06-15,2025-06-20,Kindle Paperwhite,j877,129.99,website,affiliate,mobile,London,2025-06-15,2025-06-20
5c62b3a2,d52721e7-19bc-44,2025-04-23,2025-04-26,MacBook Air,g770,1199.99,mobile_app,affiliate,mobile,Glasgow,2025-04-23,2025-04-26
0ba6eab9,b540b30e-039f-4a,27-01-2025,2025-02-01,AirPods,d633,159.99,mobile_app,direct,mobile,Manchester,2025-01-27,2025-02-01
a34b6cf6,4ac9778d-8da8-4e,2025-05-14,2025-05-18,Google Pixel 8,i920,699.99,mobile_app,email,unknown,Birmingham,2025-05-14,2025-05-18
48ca7651,1a432f0a-7daa-49,2025-05-06,2025-05-10,Google Pixel 8,i920,699.99,mobile_app,email,desktop,Glasgow,2025-05-06,2025-05-10
40a26c60,5738811d-70c2-40,2025-02-05,2025-02-10,Steam Deck,c912,499.99,mobile_app,direct,mobile,Manchester,2025-02-05,2025-02-10
7de31a51,1d34d08e-7a4c-45,2025-05-22,2025-05-25,Nintendo Switch,e682,299.99,mobile_app,social,mobile,London,2025-05-22,2025-05-25
cfa701cd,afbb411a-a123-4a,20-05-2025,05-26-2025,Accessory,m001,24.99,website,,desktop,London,2025-05-20,2025-05-26
8edddfcd,15ce6a66-4dc8-4a,2025-04-18,2025-04-23,Xbox Series X,b104,499.99,mobile_app,affiliate,mobile,Manchester,2025-04-18,2025-04-23
c693da11,989bc4da-9b37-42,2025-04-08,2025-04-13,PS5,a245,479.99,mobile_app,affiliate,unknown,Glasgow,2025-04-08,2025-04-13
96a9954f,e893be3d-7354-4a,2025-03-05,03-09-2025,Xbox Series X,b104,499.99,website,affiliate,mobile,London,2025-03-05,2025-03-09
f5c9b047,9191b363-4e2d-46,2025-04-24,2025-04-27,AirPods,d633,159.99,mobile_app,affiliate,mobile,,2025-04-24,2025-04-27
43bfd931,c342bd2b-f295-45,2025-06-21,2025-06-26,Accessory,m001,24.99,mobile_app,email,unknown,Manchester,2025-06-21,2025-06-26
2812859a,3d67cde9-2834-44,2025-02-04,2025-02-09,Smartwatch,h301,249.99,website,search,desktop,Liverpool,2025-02-04,2025-02-09
085b15fb,b07aa066-7354-45,2025-05-24,05-30-2025,Steam Deck,c912,499.99,mobile_app,direct,,Bristol,2025-05-24,2025-05-30
1238d630,48603b32-b4fb-4e,08-04-2025,2025-04-12,PS5,a245,479.99,website,affiliate,mobile,Birmingham,2025-04-08,2025-04-12
96fc734d,43b9da13-ec85-4f,2025-05-20,2025-05-26,Xbox Series X,b104,499.99,mobile_app,affiliate,desktop,Nottingham,2025-05-20,2025-05-26
96fc734d,43b9da13-ec85-4f,2025-05-20,05-21-2025,iPhone 15,f521,899.99,mobile_app,email,mobile,Liverpool,2025-05-20,2025-05-21
96fc734d,43b9da13-ec85-4f,2025-05-22,2025-05-20,MacBook Air,g770,1199.99,website,search,mobile,Leeds,2025-05-22,2025-05-20
398d1ca6,32a447b2-ef04-45,2025-02-19,2025-02-25,Kindle Paperwhite,j877,129.99,website,direct,desktop,Liverpool,2025-02-19,2025-02-25
0f44704f,44007d5a-e88d-47,2025-04-26,2025-05-01,PS5,a245,479.99,mobile_app,search,unknown,London,2025-04-26,2025-05-01
ebd34616,9854ce4e-4ebf-45,2025-02-22,2025-02-26,Steam Deck,c912,499.99,website,direct,mobile,Birmingham,2025-02-22,2025-02-26
ebd34616,9854ce4e-4ebf-45,2025-02-22,2025-02-25,Accessory,m001,24.99,mobile_app,email,unknown,Manchester,2025-02-22,2025-02-25
670acc5c,77fc9703-1fd5-44,2025-04-01,2025-04-05,Nintendo Switch,e682,299.99,mobile_app,search,desktop,Glasgow,2025-04-01,2025-04-05
9918ee46,8a3c3b5e-801e-41,11-04-2025,2025-04-15,PS5,a245,479.99,mobile_app,search,mobile,Sheffield,2025-04-11,2025-04-15
069f14f1,bc0a6a5d-6e99-4e,2025-04-06,2025-04-10,Accessory,m001,24.99,mobile_app,social,mobile,London,2025-04-06,2025-04-10
964db03f,ac9ed156-f63f-4e,2025-01-12,2025-01-16,Steam Deck,c912,499.99,mobile_app,,desktop,Manchester,2025-01-12,2025-01-16
9384ec2b,c3c75611-ffe3-4a,2025-01-05,2025-01-10,MacBook Air,g770,1199.99,mobile_app,search,mobile,Manchester,2025-01-05,2025-01-10
7135f221,2cd94cbb-c19a-45,2025-04-06,2025-04-07,AirPods,d633,159.99,mobile_app,email,desktop,London,2025-04-06,2025-04-07
d0725b5c,ff37d19c-2e76-42,2025-06-12,2025-06-18,Kindle Paperwhite,j877,129.99,website,search,unknown,London,2025-06-12,2025-06-18
5230dfbd,785299f4-175b-49,2025-06-02,2025-06-05,Smartwatch,h301,249.99,website,search,mobile,Manchester,2025-06-02,2025-06-05
5230dfbd,785299f4-175b-49,2025-06-02,2025-06-08,Steam Deck,c912,499.99,website,search,mobile,Manchester,2025-06-02,2025-06-08
7ed70ed7,292bd156-db94-45,08-04-2025,2025-04-14,Accessory,m001,24.99,website,affiliate,unknown,Liverpool,2025-04-08,2025-04-14
0964fbbf,668409e3-f1f8-44,2025-05-03,05-04-2025,Accessory,m001,24.99,mobile_app,social,desktop,Manchester,2025-05-03,2025-05-04
0964fbbf,668409e3-f1f8-44,2025-05-03,2025-05-06,Kindle Paperwhite,j877,129.99,website,affiliate,mobile,Leeds,2025-05-03,2025-05-06
c5c5b37a,409d3602-5084-42,2025-04-04,2025-04-10,iPhone 15,f521,899.99,mobile_app,direct,,London,2025-04-04,2025-04-10
de8ede0b,d32e6dcd-83bc-44,2025-04-08,2025-04-13,Xbox Series X,b104,499.99,mobile_app,search,unknown,London,2025-04-08,2025-04-13
9f64eeed,0de051a6-69ca-47,2025-04-06,2025-04-08,AirPods,d633,159.99,mobile_app,social,mobile,Glasgow,2025-04-06,2025-04-08
445dcc38,71299889-a01a-49,2025-04-17,2025-04-18,iPhone 15,f521,899.99,mobile_app,affiliate,,Bristol,2025-04-17,2025-04-18
7c16128d,49bc473f-ed7b-46,2025-04-08,2025-04-14,Steam Deck,c912,499.99,mobile_app,search,mobile,Manchester,2025-04-08,2025-04-14
b5b453ca,a14923c2-f920-46,2025-03-03,2025-03-07,PS5,a245,479.99,website,,unknown,Glasgow,2025-03-03,2025-03-07
3985fb62,03802b70-8d03-49,2025-02-15,02-19-2025,PS5,a245,479.99,mobile_app,email,unknown,Liverpool,2025-02-15,2025-02-19
a5d04d53,1d0bc9bd-e9b5-45,2025-04-27,2025-05-03,MacBook Air,g770,1199.99,mobile_app,affiliate,unknown,Leeds,2025-04-27,2025-05-03
b495db4e,eec259dc-7f95-49,2025-03-05,2025-03-09,Steam Deck,c912,499.99,website,search,unknown,Leeds,2025-03-05,2025-03-09
74eff545,7b85179a-d5b0-47,2025-02-02,2025-02-07,iPhone 15,f521,899.99,website,affiliate,unknown,Leeds,2025-02-02,2025-02-07
bf0d073d,30cbd755-6232-41,2025-03-06,2025-03-12,Smartwatch,h301,249.99,mobile_app,social,desktop,Glasgow,2025-03-06,2025-03-12
bf0d073d,30cbd755-6232-41,2025-03-06,2025-03-07,Xbox Series X,b104,499.99,website,email,mobile,London,2025-03-06,2025-03-07
dabac50d,11df12d7-dd30-4e,2025-04-15,2025-04-16,PS5,a245,479.99,website,search,desktop,Leeds,2025-04-15,2025-04-16
00a81de9,c9a7d91f-ef2a-47,2025-02-12,2025-02-16,MacBook Air,g770,1199.99,mobile_app,search,mobile,Leeds,2025-02-12,2025-02-16
a8f1e091,d664d264-4c6e-47,2025-04-04,2025-04-10,Kindle Paperwhite,j877,129.99,website,social,unknown,Glasgow,2025-04-04,2025-04-10
551ac8ea,7250ee18-260a-49,2025-03-11,2025-03-15,PS5,a245,479.99,mobile_app,email,desktop,Sheffield,2025-03-11,2025-03-15
de9e3757,6090d697-8b1e-4b,2025-02-23,2025-02-25,iPhone 15,f521,899.99,mobile_app,social,desktop,London,2025-02-23,2025-02-25
db23aa8c,3d225c30-b28f-41,2025-02-14,2025-02-13,iPhone 15,f521,899.99,mobile_app,search,unknown,Manchester,2025-02-14,2025-02-13
db23aa8c,3d225c30-b28f-41,2025-02-13,2025-02-14,iPhone 15,f521,899.99,mobile_app,email,desktop,Manchester,2025-02-13,2025-02-14
e9d68f23,517400f8-0b2c-48,2025-04-11,2025-04-15,PS5,a245,479.99,website,direct,unknown,Sheffield,2025-04-11,2025-04-15
a6eab79e,fd08b32c-62d6-4e,2025-04-24,2025-04-29,Accessory,m001,24.99,website,affiliate,mobile,Manchester,2025-04-24,2025-04-29
f72169bb,f6febc0e-7ecd-4b,2025-05-26,2025-05-28,Steam Deck,c912,499.99,website,affiliate,unknown,Manchester,2025-05-26,2025-05-28
1986b4b2,19b17e80-dea4-4e,2025-01-09,2025-01-14,Steam Deck,c912,499.99,website,direct,mobile,Bristol,2025-01-09,2025-01-14
def57689,03edd1f8-74f9-4d,21-01-2025,2025-01-26,Xbox Series X,b104,499.99,website,email,desktop,Manchester,2025-01-21,2025-01-26
43d88870,1327f1bc-2784-47,2025-05-01,2025-05-06,Xbox Series X,b104,499.99,mobile_app,direct,desktop,Liverpool,2025-05-01,2025-05-06
541cdfcd,65c17795-b155-46,2025-04-21,2025-04-22,Accessory,m001,24.99,website,affiliate,mobile,London,2025-04-21,2025-04-22
a075e927,889b78d5-dbfd-49,2025-02-25,2025-03-02,Steam Deck,c912,499.99,mobile_app,affiliate,desktop,Manchester,2025-02-25,2025-03-02
9e11d2cd,7cea2045-c268-48,2025-03-25,2025-03-26,AirPods,d633,159.99,website,social,unknown,Liverpool,2025-03-25,2025-03-26
3a3c8a71,af34cf65-a193-44,2025-04-27,2025-05-03,PS5,a245,479.99,website,social,mobile,Birmingham,2025-04-27,2025-05-03
3a3c8a71,af34cf65-a193-44,2025-04-27,2025-05-02,iPhone 15,f521,899.99,website,social,unknown,London,2025-04-27,2025-05-02
b4323070,fa745761-6f18-41,2025-04-19,2025-04-24,Steam Deck,c912,499.99,website,search,mobile,Manchester,2025-04-19,2025-04-24
0769165f,2a96e1e2-7194-4a,2025-02-21,2025-02-27,Smartwatch,h301,249.99,website,affiliate,mobile,Bristol,2025-02-21,2025-02-27
6e417d47,0e5dd462-cbd0-4e,2025-04-22,2025-04-26,MacBook Air,g770,1199.99,website,social,unknown,Manchester,2025-04-22,2025-04-26
2e183554,697c3923-87fa-44,2025-04-17,04-18-2025,Smartwatch,h301,249.99,website,email,unknown,Nottingham,2025-04-17,2025-04-18
aee1e86b,9c07a751-1437-45,2025-03-08,2025-03-09,Xbox Series X,b104,499.99,website,email,unknown,Glasgow,2025-03-08,2025-03-09
a34db7c5,9549c931-e9af-49,2025-01-23,2025-01-28,Accessory,m001,24.99,mobile_app,social,unknown,London,2025-01-23,2025-01-28
771ad655,aab612c9-415d-47,2025-03-17,2025-03-20,Google Pixel 8,i920,699.99,mobile_app,search,unknown,Manchester,2025-03-17,2025-03-20
771ad655,aab612c9-415d-47,2025-03-17,2025-03-18,MacBook Air,g770,1199.99,website,search,unknown,London,2025-03-17,2025-03-18
f1faf665,8beddb12-ad77-48,2025-01-14,2025-01-18,Steam Deck,c912,499.99,mobile_app,direct,mobile,Birmingham,2025-01-14,2025-01-18
b0b862ef,4c955f6a-966b-49,2025-04-17,2025-04-21,iPhone 15,f521,899.99,mobile_app,social,unknown,London,2025-04-17,2025-04-21
da743152,4d57d880-d865-46,2025-02-01,2025-02-04,PS5,a245,479.99,mobile_app,email,unknown,London,2025-02-01,2025-02-04
4bbe4aff,61a11729-3cb9-43,2025-05-10,2025-05-13,AirPods,d633,159.99,website,social,desktop,London,2025-05-10,2025-05-13
6553867d,059dd55d-4b94-4e,2025-03-23,2025-03-24,PS5,a245,479.99,website,social,desktop,Nottingham,2025-03-23,2025-03-24
f93e08d5,dd750e98-90e0-49,2025-05-08,2025-05-10,iPhone 15,f521,899.99,website,search,unknown,Manchester,2025-05-08,2025-05-10
f93e08d5,dd750e98-90e0-49,2025-05-08,2025-05-11,Google Pixel 8,i920,699.99,website,social,mobile,Manchester,2025-05-08,2025-05-11
e726be23,bec39a37-9b3d-44,2025-04-08,04-12-2025,Accessory,m001,24.99,website,email,unknown,Manchester,2025-04-08,2025-04-12
3810ae66,3ae909fe-cc82-48,2025-02-01,2025-02-04,AirPods,d633,159.99,website,search,unknown,Glasgow,2025-02-01,2025-02-04
3810ae66,3ae909fe-cc82-48,2025-02-01,2025-02-03,Steam Deck,c912,499.99,mobile_app,direct,desktop,Birmingham,2025-02-01,2025-02-03
c478f6f1,402913ec-9ef2-49,2025-06-24,2025-06-29,iPhone 15,f521,899.99,mobile_app,affiliate,mobile,Leeds,2025-06-24,2025-06-29
c478f6f1,402913ec-9ef2-49,2025-06-24,2025-06-26,Kindle Paperwhite,j877,129.99,mobile_app,search,unknown,Nottingham,2025-06-24,2025-06-26
a0a11839,2303f6c6-d69d-42,2025-02-14,2025-02-20,Kindle Paperwhite,j877,129.99,website,search,unknown,London,2025-02-14,2025-02-20
a0a11839,2303f6c6-d69d-42,2025-02-14,2025-02-15,AirPods,d633,159.99,website,email,unknown,Bristol,2025-02-14,2025-02-15
5d678bb1,c9e26074-4f16-49,2025-01-23,2025-01-26,AirPods,d633,159.99,mobile_app,affiliate,desktop,Liverpool,2025-01-23,2025-01-26
6a5e6920,e8dd5e5a-1712-4b,2025-05-18,05-23-2025,Xbox Series X,b104,499.99,mobile_app,affiliate,desktop,Bristol,2025-05-18,2025-05-23
5da8d6d2,c958e75e-21d5-49,2025-03-10,2025-03-11,Accessory,m001,24.99,website,,desktop,Liverpool,2025-03-10,2025-03-11
5da8d6d2,c958e75e-21d5-49,2025-03-10,2025-03-14,MacBook Air,g770,1199.99,mobile_app,email,desktop,London,2025-03-10,2025-03-14
e9ff1cae,45c45a3e-e9da-48,05-08-2025,05-05-2025,iPhone 15,f521,899.99,mobile_app,search,unknown,London,2025-05-08,2025-05-05
ded255d0,f7a67b94-7b5a-41,12-03-2025,2025-03-13,PS5,a245,479.99,website,direct,unknown,Manchester,2025-03-12,2025-03-13
c1101266,77e490c7-1d7b-43,2025-05-17,2025-05-23,Nintendo Switch,e682,299.99,website,email,mobile,Liverpool,2025-05-17,2025-05-23
c1101266,77e490c7-1d7b-43,2025-05-17,2025-05-21,Accessory,m001,24.99,mobile_app,search,mobile,Glasgow,2025-05-17,2025-05-21
c1101266,77e490c7-1d7b-43,17-05-2025,2025-05-20,MacBook Air,g770,1199.99,website,search,desktop,Bristol,2025-05-17,2025-05-20
65bcc272,ad238d36-dc32-4c,2025-03-19,2025-03-23,iPhone 15,f521,899.99,website,email,unknown,,2025-03-19,2025-03-23
65bcc272,ad238d36-dc32-4c,2025-03-19,2025-03-24,Accessory,m001,24.99,mobile_app,search,unknown,Birmingham,2025-03-19,2025-03-24
6502d6a2,8eac0a33-cdf9-44,09-03-2025,2025-03-10,AirPods,d633,159.99,website,social,unknown,Manchester,2025-03-09,2025-03-10
bfbf397b,1fa382e8-895c-4d,2025-06-26,2025-06-27,Nintendo Switch,e682,299.99,website,email,desktop,Bristol,2025-06-26,2025-06-27
bfbf397b,1fa382e8-895c-4d,2025-06-26,2025-06-29,Xbox Series X,b104,499.99,mobile_app,email,desktop,Birmingham,2025-06-26,2025-06-29
5f18e583,618ae305-95a5-4a,21-05-2025,2025-05-25,Nintendo Switch,e682,299.99,mobile_app,direct,desktop,Leeds,2025-05-21,2025-05-25
f1738856,78b2b549-3bdb-40,2025-01-05,2025-01-10,MacBook Air,g770,1199.99,website,search,unknown,Birmingham,2025-01-05,2025-01-10
a2a9d4d8,9c2e58de-ea4e-46,2025-02-10,2025-02-13,Accessory,m001,24.99,website,social,unknown,Manchester,2025-02-10,2025-02-13
a2a9d4d8,9c2e58de-ea4e-46,2025-02-10,2025-02-14,Nintendo Switch,e682,299.99,website,social,desktop,Manchester,2025-02-10,2025-02-14
1dde7969,b379cb1e-e8cd-40,02-04-2025,2025-04-07,iPhone 15,f521,899.99,mobile_app,search,mobile,Glasgow,2025-04-02,2025-04-07
1dba1267,0986bbeb-f23e-42,2025-02-13,02-17-2025,Accessory,m001,24.99,mobile_app,affiliate,mobile,,2025-02-13,2025-02-17
5efa9c5b,899ca782-e323-4d,2025-05-14,2025-05-17,Nintendo Switch,e682,299.99,website,search,mobile,Manchester,2025-05-14,2025-05-17
965befdf,b24cc64f-be3e-4e,2025-04-19,2025-04-20,iPhone 15,f521,899.99,mobile_app,affiliate,desktop,Manchester,2025-04-19,2025-04-20
d56ce8ea,e2aa7a5d-278e-40,2025-01-11,2025-01-16,MacBook Air,g770,1199.99,mobile_app,search,desktop,London,2025-01-11,2025-01-16
d56ce8ea,e2aa7a5d-278e-40,2025-01-11,2025-01-14,MacBook Air,g770,1199.99,mobile_app,direct,mobile,London,2025-01-11,2025-01-14
b0b63bcf,f065c817-687a-48,2025-03-03,03-04-2025,Xbox Series X,b104,499.99,website,search,unknown,Sheffield,2025-03-03,2025-03-04
5cd8fe1a,71d79665-7181-4d,2025-06-22,2025-06-25,Steam Deck,c912,499.99,mobile_app,direct,desktop,Birmingham,2025-06-22,2025-06-25
a5135ea0,5e09a9ee-af88-4d,2025-01-20,2025-01-22,PS5,a245,479.99,mobile_app,direct,desktop,Manchester,2025-01-20,2025-01-22
f2f25eef,46a02a9b-65ec-4a,2025-05-27,2025-05-29,Kindle Paperwhite,j877,129.99,website,direct,unknown,Glasgow,2025-05-27,2025-05-29
f2f25eef,46a02a9b-65ec-4a,2025-05-27,2025-05-31,Smartwatch,h301,249.99,mobile_app,search,unknown,London,2025-05-27,2025-05-31
a3b5cece,1777e8cb-7468-4b,2025-01-09,2025-01-14,Accessory,m001,24.99,mobile_app,email,desktop,London,2025-01-09,2025-01-14
a3b5cece,1777e8cb-7468-4b,2025-01-09,2025-01-10,Smartwatch,h301,249.99,mobile_app,social,unknown,London,2025-01-09,2025-01-10
fd235def,0cf2b69b-0577-4e,2025-04-25,2025-04-28,AirPods,d633,159.99,website,email,unknown,Manchester,2025-04-25,2025-04-28
8de08fc2,34885a46-9088-4e,2025-05-12,2025-05-15,PS5,a245,479.99,mobile_app,social,desktop,Nottingham,2025-05-12,2025-05-15
8de08fc2,34885a46-9088-4e,2025-05-12,2025-05-15,Nintendo Switch,e682,299.99,mobile_app,affiliate,unknown,Manchester,2025-05-12,2025-05-15
c63d04ee,d0243d72-3748-46,2025-03-27,2025-04-01,PS5,a245,479.99,mobile_app,social,unknown,Bristol,2025-03-27,2025-04-01
fbe94499,989240ac-e689-43,2025-06-23,2025-06-29,Google Pixel 8,i920,699.99,website,social,unknown,Glasgow,2025-06-23,2025-06-29
1c24220e,8a4b8f7c-2147-4a,2025-06-19,2025-06-21,Accessory,m001,24.99,mobile_app,search,mobile,Birmingham,2025-06-19,2025-06-21
c9d6a63b,21bddb41-0699-47,2025-04-22,2025-04-24,Google Pixel 8,i920,699.99,website,social,desktop,Glasgow,2025-04-22,2025-04-24
c9d6a63b,21bddb41-0699-47,2025-04-22,2025-04-28,iPhone 15,f521,899.99,website,search,unknown,Leicester,2025-04-22,2025-04-28
20733f6d,040a3aae-52e2-4f,2025-04-27,04-28-2025,Xbox Series X,b104,499.99,website,social,mobile,Leicester,2025-04-27,2025-04-28
20733f6d,040a3aae-52e2-4f,2025-04-27,2025-05-02,Google Pixel 8,i920,699.99,website,email,mobile,Sheffield,2025-04-27,2025-05-02
72c22a16,1d181ee9-86ad-4a,2025-04-07,2025-04-11,AirPods,d633,159.99,mobile_app,email,unknown,Leicester,2025-04-07,2025-04-11
38b77c07,97fa7f04-8363-40,2025-04-07,2025-04-08,Kindle Paperwhite,j877,129.99,mobile_app,affiliate,mobile,Manchester,2025-04-07,2025-04-08
a8addf36,ba2c98ce-0b19-48,2025-03-16,2025-03-21,PS5,a245,479.99,mobile_app,email,mobile,Manchester,2025-03-16,2025-03-21
ffa361be,a4b1f991-7542-46,2025-05-20,2025-05-25,Accessory,m001,24.99,website,email,desktop,Liverpool,2025-05-20,2025-05-25
b65feea9,6d204496-66d0-43,2025-05-17,05-23-2025,Kindle Paperwhite,j877,129.99,website,email,mobile,Birmingham,2025-05-17,2025-05-23
25f934bf,e63658c9-12d0-49,2025-04-13,2025-04-19,Accessory,m001,24.99,mobile_app,direct,unknown,Manchester,2025-04-13,2025-04-19
b64fa54a,9fd34579-4667-42,2025-03-23,2025-03-26,PS5,a245,479.99,mobile_app,email,desktop,London,2025-03-23,2025-03-26
816bcb9f,98eeac2b-fe9f-4c,2025-05-04,2025-05-10,Accessory,m001,24.99,website,social,unknown,Leeds,2025-05-04,2025-05-10
a79b44b6,cb08587d-1963-42,2025-04-16,04-17-2025,iPhone 15,f521,899.99,mobile_app,email,desktop,London,2025-04-16,2025-04-17
6e191042,8d244e3e-c4da-4d,2025-03-03,2025-03-06,Steam Deck,c912,499.99,mobile_app,direct,desktop,,2025-03-03,2025-03-06
6e191042,8d244e3e-c4da-4d,2025-03-03,2025-03-05,Xbox Series X,b104,499.99,website,email,desktop,Manchester,2025-03-03,2025-03-05
66132e69,69efafb1-3a7e-4e,2025-04-03,2025-04-08,Google Pixel 8,i920,699.99,website,email,unknown,Manchester,2025-04-03,2025-04-08
66132e69,69efafb1-3a7e-4e,2025-04-03,2025-04-08,Xbox Series X,b104,499.99,mobile_app,direct,desktop,Manchester,2025-04-03,2025-04-08
4140752c,50032b35-1857-4b,2025-01-21,2025-01-27,Xbox Series X,b104,499.99,website,social,desktop,London,2025-01-21,2025-01-27
175a81ec,afd380c4-2713-48,2025-03-25,2025-03-28,MacBook Air,g770,1199.99,website,social,unknown,Leeds,2025-03-25,2025-03-28
5f65c8ce,6e8f75a1-17dd-4d,05-03-2025,2025-03-11,AirPods,d633,159.99,mobile_app,direct,unknown,Birmingham,2025-03-05,2025-03-11
8fca7b6a,0f5ae9d3-8e6e-40,2025-04-24,2025-04-27,Steam Deck,c912,499.99,mobile_app,direct,mobile,London,2025-04-24,2025-04-27
f0ede303,692ac139-1f4a-4c,2025-02-25,2025-03-02,Accessory,m001,24.99,mobile_app,social,mobile,London,2025-02-25,2025-03-02
49a214ae,ea74bb18-de3b-49,2025-01-15,2025-01-20,MacBook Air,g770,1199.99,mobile_app,direct,desktop,London,2025-01-15,2025-01-20
49a214ae,ea74bb18-de3b-49,2025-01-15,01-17-2025,Kindle Paperwhite,j877,129.99,mobile_app,affiliate,unknown,Birmingham,2025-01-15,2025-01-17
279c658a,1a85910d-5a05-4c,2025-06-05,2025-06-08,Smartwatch,h301,249.99,website,search,desktop,Manchester,2025-06-05,2025-06-08
8e676a01,d8e7012f-3968-4c,2025-05-14,2025-05-15,AirPods,d633,159.99,website,email,mobile,Glasgow,2025-05-14,2025-05-15
6dda4f8d,47503f1d-c33a-4f,2025-06-07,2025-06-09,Google Pixel 8,i920,699.99,mobile_app,affiliate,desktop,Leicester,2025-06-07,2025-06-09
6dda4f8d,47503f1d-c33a-4f,2025-06-07,2025-06-10,Smartwatch,h301,249.99,website,social,desktop,Manchester,2025-06-07,2025-06-10
accb461a,c4767556-f97b-42,21-04-2025,04-26-2025,MacBook Air,g770,1199.99,mobile_app,direct,mobile,Liverpool,2025-04-21,2025-04-26
accb461a,c4767556-f97b-42,2025-04-21,2025-04-24,PS5,a245,479.99,website,affiliate,mobile,Manchester,2025-04-21,2025-04-24
b18753e6,9be71737-06b8-42,2025-03-09,2025-03-15,PS5,a245,479.99,mobile_app,direct,desktop,Manchester,2025-03-09,2025-03-15
ebe9e207,45f50c52-2e2f-4f,2025-03-05,2025-03-08,Nintendo Switch,e682,299.99,mobile_app,direct,,Glasgow,2025-03-05,2025-03-08
ebe9e207,45f50c52-2e2f-4f,2025-03-05,2025-03-09,Smartwatch,h301,249.99,website,affiliate,desktop,Manchester,2025-03-05,2025-03-09
a847bce7,2e709838-0190-46,2025-04-17,2025-04-19,AirPods,d633,159.99,website,search,unknown,Manchester,2025-04-17,2025-04-19
177d6e7e,bdb025ff-2451-45,2025-05-17,2025-05-22,Kindle Paperwhite,j877,129.99,mobile_app,affiliate,mobile,Manchester,2025-05-17,2025-05-22
284bf962,604e46cb-3712-42,2025-02-24,2025-02-27,Steam Deck,c912,499.99,website,affiliate,desktop,Birmingham,2025-02-24,2025-02-27
284bf962,604e46cb-3712-42,2025-02-24,2025-03-02,MacBook Air,g770,1199.99,mobile_app,affiliate,desktop,Manchester,2025-02-24,2025-03-02
98a21f1c,530ac1c7-b8ba-43,2025-05-11,2025-05-16,Smartwatch,h301,249.99,website,search,unknown,Liverpool,2025-05-11,2025-05-16
98a21f1c,530ac1c7-b8ba-43,2025-05-11,2025-05-17,Steam Deck,c912,499.99,website,email,mobile,Manchester,2025-05-11,2025-05-17
0cbd3c03,27d415b6-0d77-45,2025-05-25,2025-05-30,Nintendo Switch,e682,299.99,mobile_app,direct,unknown,Liverpool,2025-05-25,2025-05-30
9b69554d,716fda0a-45a8-48,2025-03-25,2025-03-27,MacBook Air,g770,1199.99,website,search,mobile,Glasgow,2025-03-25,2025-03-27
585d3f86,372f871a-45ee-43,2025-03-15,2025-03-20,PS5,a245,479.99,website,social,mobile,Manchester,2025-03-15,2025-03-20
86e52753,ad9fb00d-4882-47,2025-01-18,2025-01-24,Nintendo Switch,e682,299.99,mobile_app,email,mobile,Manchester,2025-01-18,2025-01-24
0e0630cd,3873e57f-0ba0-48,2025-04-05,04-08-2025,Nintendo Switch,e682,299.99,website,email,desktop,Leicester,2025-04-05,2025-04-08
c3a00c6f,f200c261-4d29-41,2025-05-19,05-25-2025,Accessory,m001,24.99,website,search,unknown,Liverpool,2025-05-19,2025-05-25
6e3f683a,1eb74b56-53ff-43,2025-04-27,2025-04-29,iPhone 15,f521,899.99,website,email,unknown,Liverpool,2025-04-27,2025-04-29
8f0881ee,88575117-6155-46,2025-04-16,2025-04-22,iPhone 15,f521,899.99,website,social,unknown,Birmingham,2025-04-16,2025-04-22
bdf66ba5,5aaab32f-ce63-42,2025-05-09,2025-05-15,Smartwatch,h301,249.99,website,direct,desktop,London,2025-05-09,2025-05-15
bdf66ba5,5aaab32f-ce63-42,2025-05-09,2025-05-10,Smartwatch,h301,249.99,mobile_app,direct,desktop,Manchester,2025-05-09,2025-05-10
5024bdc6,75b27455-04cc-4e,2025-01-27,2025-01-28,Steam Deck,c912,499.99,mobile_app,,unknown,Leeds,2025-01-27,2025-01-28
5024bdc6,75b27455-04cc-4e,2025-01-27,2025-02-01,MacBook Air,g770,1199.99,mobile_app,email,desktop,Manchester,2025-01-27,2025-02-01
4a1dab32,67884209-92ca-42,2025-05-19,2025-05-21,Accessory,m001,24.99,mobile_app,email,desktop,Liverpool,2025-05-19,2025-05-21
4a1dab32,67884209-92ca-42,2025-05-19,2025-05-22,Accessory,m001,24.99,mobile_app,affiliate,mobile,Manchester,2025-05-19,2025-05-22
f296d9f0,f758dce2-0556-4a,2025-02-07,2025-02-11,MacBook Air,g770,1199.99,mobile_app,social,mobile,Manchester,2025-02-07,2025-02-11
f296d9f0,f758dce2-0556-4a,2025-02-07,2025-02-11,Xbox Series X,b104,499.99,mobile_app,email,unknown,Leeds,2025-02-07,2025-02-11
6fcc57dd,b08a4895-d4ff-46,2025-04-07,2025-04-08,AirPods,d633,159.99,mobile_app,affiliate,mobile,Manchester,2025-04-07,2025-04-08
6fcc57dd,b08a4895-d4ff-46,2025-04-07,2025-04-09,Kindle Paperwhite,j877,129.99,mobile_app,email,,Manchester,2025-04-07,2025-04-09
1422373f,6f887f28-3e49-4d,2025-04-08,2025-04-11,PS5,45a2,479.99,mobile_app,email,mobile,,2025-04-08,2025-04-11
c77444cb,beed10b6-4f6e-47,03-04-2025,2025-04-09,Kindle Paperwhite,j877,129.99,mobile_app,direct,unknown,Manchester,2025-04-03,2025-04-09
31a3ac4d,a21b0307-82af-48,2025-01-09,2025-01-12,Smartwatch,h301,249.99,mobile_app,affiliate,unknown,Nottingham,2025-01-09,2025-01-12
a53bc024,59e1ac09-5970-48,2025-04-05,2025-04-10,iPhone 15,f521,899.99,mobile_app,email,unknown,Manchester,2025-04-05,2025-04-10
2c6a6e9a,1a5165ca-3c7c-4d,2025-04-18,2025-04-19,Nintendo Switch,e682,299.99,mobile_app,email,unknown,Sheffield,2025-04-18,2025-04-19
2c6a6e9a,1a5165ca-3c7c-4d,2025-04-18,2025-04-20,Accessory,m001,24.99,website,direct,unknown,Manchester,2025-04-18,2025-04-20
f387e1bd,c257cf73-c29d-48,2025-04-22,2025-04-26,Accessory,m001,24.99,website,direct,desktop,London,2025-04-22,2025-04-26
f387e1bd,c257cf73-c29d-48,2025-04-22,2025-04-28,Steam Deck,c912,499.99,mobile_app,email,mobile,Glasgow,2025-04-22,2025-04-28
9458054e,76c5a0dc-7e7e-44,2025-05-15,2025-05-16,Kindle Paperwhite,j877,129.99,website,social,mobile,Nottingham,2025-05-15,2025-05-16
fc8d5b93,e1cde87f-ec95-4f,2025-02-12,2025-02-16,iPhone 15,f521,899.99,website,search,desktop,Manchester,2025-02-12,2025-02-16
70944bdb,f891b0c3-dd3f-48,2025-03-15,2025-03-18,Google Pixel 8,i920,699.99,mobile_app,email,unknown,Leeds,2025-03-15,2025-03-18
97674900,a1a27485-7134-4c,2025-01-02,2025-01-04,AirPods,d633,159.99,website,affiliate,unknown,London,2025-01-02,2025-01-04
09a0a0f6,12fe28bf-81e0-44,2025-03-13,2025-03-17,Xbox Series X,b104,499.99,mobile_app,search,desktop,Liverpool,2025-03-13,2025-03-17
09a0a0f6,12fe28bf-81e0-44,2025-03-13,2025-03-16,AirPods,d633,159.99,mobile_app,,unknown,Glasgow,2025-03-13,2025-03-16
09a0a0f6,12fe28bf-81e0-44,2025-03-13,2025-03-19,AirPods,d633,159.99,mobile_app,direct,desktop,Liverpool,2025-03-13,2025-03-19
fa34d2e8,497de16d-d4ea-42,2025-05-15,2025-05-16,Xbox Series X,b104,499.99,mobile_app,direct,unknown,Birmingham,2025-05-15,2025-05-16
949077c2,98159d6c-9d71-40,2025-03-17,2025-03-18,Smartwatch,h301,249.99,mobile_app,email,unknown,Nottingham,2025-03-17,2025-03-18
e8b77f7b,bd29ede9-cab4-42,2025-04-15,2025-04-20,PS5,a245,479.99,mobile_app,email,desktop,London,2025-04-15,2025-04-20
80599b93,30307633-a6de-41,25-03-2025,2025-03-27,Accessory,m001,24.99,mobile_app,search,desktop,London,2025-03-25,2025-03-27
d65e59dd,73557b9d-0fd6-44,2025-03-06,2025-03-08,PS5,a245,479.99,website,direct,mobile,Manchester,2025-03-06,2025-03-08
0a0537f0,15969802-b6dd-42,2025-01-25,2025-01-28,Nintendo Switch,e682,299.99,mobile_app,social,unknown,Birmingham,2025-01-25,2025-01-28
9c1c3517,fdb1429e-7010-4d,2025-04-27,2025-05-02,Xbox Series X,b104,499.99,website,affiliate,mobile,Nottingham,2025-04-27,2025-05-02
c6435300,eafde7d9-5f73-4a,2025-05-21,05-27-2025,MacBook Air,g770,1199.99,mobile_app,search,mobile,,2025-05-21,2025-05-27
55ab946d,0d67d38e-990f-4c,2025-04-07,2025-04-12,MacBook Air,g770,1199.99,website,direct,mobile,Glasgow,2025-04-07,2025-04-12
4082cbb9,8ed6ad5e-1831-4a,2025-01-26,2025-01-27,Accessory,m001,24.99,mobile_app,social,unknown,Glasgow,2025-01-26,2025-01-27
267eddce,f6e39356-a814-45,2025-04-14,2025-04-17,Google Pixel 8,i920,699.99,website,search,unknown,Glasgow,2025-04-14,2025-04-17
267eddce,f6e39356-a814-45,2025-04-14,2025-04-16,Kindle Paperwhite,j877,129.99,website,social,unknown,Glasgow,2025-04-14,2025-04-16
4f6b58c8,a9e27ba9-952e-4a,2025-04-16,2025-04-17,Nintendo Switch,e682,299.99,website,email,desktop,Glasgow,2025-04-16,2025-04-17
b576255e,a981b098-b2cf-45,2025-04-21,2025-04-24,Xbox Series X,b104,499.99,website,email,unknown,Glasgow,2025-04-21,2025-04-24
54170a17,8f158449-4f40-42,2025-06-17,2025-06-18,AirPods,d633,159.99,mobile_app,direct,unknown,Manchester,2025-06-17,2025-06-18
ff4625af,b3ecb951-ab8c-4f,2025-03-14,2025-03-17,Google Pixel 8,i920,699.99,website,email,unknown,Nottingham,2025-03-14,2025-03-17
822c4d32,17ec889c-86c1-46,2025-04-25,2025-04-26,Google Pixel 8,i920,699.99,website,search,unknown,Liverpool,2025-04-25,2025-04-26
577bc55a,4f11d8dc-5cd3-43,2025-01-22,01-24-2025,Xbox Series X,b104,499.99,mobile_app,search,desktop,Birmingham,2025-01-22,2025-01-24
577bc55a,4f11d8dc-5cd3-43,2025-01-22,2025-01-23,Nintendo Switch,e682,299.99,website,search,mobile,Manchester,2025-01-22,2025-01-23
27aa7cbc,31274148-7c7c-40,2025-04-15,2025-04-17,Accessory,m001,24.99,mobile_app,search,unknown,Glasgow,2025-04-15,2025-04-17
8a2e6a93,c9c23e69-d82c-45,2025-04-10,2025-04-14,Nintendo Switch,e682,299.99,mobile_app,email,mobile,Leeds,2025-04-10,2025-04-14
e05b46c5,86cac6f4-e238-4e,2025-01-01,2025-01-07,Steam Deck,c912,499.99,mobile_app,email,mobile,Manchester,2025-01-01,2025-01-07
e05b46c5,86cac6f4-e238-4e,2025-01-01,2025-01-07,PS5,a245,479.99,website,direct,mobile,London,2025-01-01,2025-01-07
2e4bebc4,98e52499-218c-4e,2025-01-22,2025-01-26,MacBook Air,g770,1199.99,mobile_app,direct,mobile,London,2025-01-22,2025-01-26
b89f72f3,9feefdff-c566-4a,2025-02-26,02-28-2025,Kindle Paperwhite,j877,129.99,mobile_app,email,unknown,Leeds,2025-02-26,2025-02-28
b89f72f3,9feefdff-c566-4a,2025-02-26,2025-03-02,iPhone 15,f521,899.99,website,email,unknown,Manchester,2025-02-26,2025-03-02
b89f72f3,9feefdff-c566-4a,2025-02-26,2025-02-27,Google Pixel 8,i920,699.99,mobile_app,direct,mobile,Manchester,2025-02-26,2025-02-27
f836f571,5d42b9e9-692e-47,2025-04-03,2025-04-06,PS5,a245,479.99,mobile_app,direct,desktop,,2025-04-03,2025-04-06
3be79df4,c09cb506-48f1-49,2025-04-09,2025-04-10,PS5,a245,479.99,mobile_app,social,unknown,Birmingham,2025-04-09,2025-04-10
e76adca9,f7315749-4f39-49,2025-04-20,2025-04-22,MacBook Air,g770,1199.99,website,email,unknown,London,2025-04-20,2025-04-22
e76adca9,f7315749-4f39-49,2025-04-20,2025-04-22,iPhone 15,f521,899.99,website,social,unknown,Leeds,2025-04-20,2025-04-22
70cafdd8,ada58417-5e2a-43,2025-05-04,2025-05-08,Smartwatch,h301,249.99,mobile_app,social,desktop,Glasgow,2025-05-04,2025-05-08
6b2d5b09,c7332304-4822-41,09-04-2025,2025-04-13,PS5,a245,479.99,mobile_app,direct,desktop,Manchester,2025-04-09,2025-04-13
6b2d5b09,c7332304-4822-41,2025-04-09,2025-04-12,Kindle Paperwhite,j877,129.99,website,affiliate,mobile,London,2025-04-09,2025-04-12
df7d0dd7,331f63fb-d11f-48,2025-04-12,04-17-2025,Smartwatch,h301,249.99,mobile_app,email,unknown,Manchester,2025-04-12,2025-04-17
ef2ddcc4,7b07fd31-a424-4f,2025-02-23,2025-02-24,Nintendo Switch,e682,299.99,mobile_app,direct,mobile,London,2025-02-23,2025-02-24
ef2ddcc4,7b07fd31-a424-4f,23-02-2025,2025-02-27,iPhone 15,f521,899.99,mobile_app,,mobile,Birmingham,2025-02-23,2025-02-27
1578d709,8412a335-d88c-45,2025-03-19,03-24-2025,Nintendo Switch,e682,299.99,website,email,unknown,Manchester,2025-03-19,2025-03-24
1578d709,8412a335-d88c-45,19-03-2025,2025-03-20,AirPods,633d,159.99,mobile_app,search,mobile,,2025-03-19,2025-03-20
d4bf7a4b,73069588-45d5-46,2025-03-24,2025-03-27,Google Pixel 8,i920,699.99,website,direct,desktop,Nottingham,2025-03-24,2025-03-27
e27718c5,e916da57-f248-43,2025-02-03,2025-02-06,MacBook Air,g770,1199.99,mobile_app,,mobile,Manchester,2025-02-03,2025-02-06
5fbbf0b1,6a36af18-06d3-4b,2025-02-07,2025-02-09,Xbox Series X,b104,499.99,mobile_app,search,desktop,London,2025-02-07,2025-02-09
519554e3,14e4180c-fe99-46,2025-04-24,04-25-2025,Nintendo Switch,e682,299.99,website,email,mobile,London,2025-04-24,2025-04-25
519554e3,14e4180c-fe99-46,2025-04-24,2025-04-28,Google Pixel 8,i920,699.99,website,search,unknown,London,2025-04-24,2025-04-28
25637cc3,b6f6dbf1-d6d4-41,2025-06-24,06-27-2025,Xbox Series X,b104,499.99,mobile_app,direct,mobile,Glasgow,2025-06-24,2025-06-27
d4c3a832,eada79a3-4970-4d,2025-04-26,05-02-2025,Kindle Paperwhite,j877,129.99,mobile_app,search,mobile,Birmingham,2025-04-26,2025-05-02
e7e646c7,781799ff-b49e-44,2025-05-02,05-07-2025,Google Pixel 8,i920,699.99,mobile_app,search,mobile,Leeds,2025-05-02,2025-05-07
f0b2a5d1,3735262d-4184-4b,2025-06-26,2025-06-27,Smartwatch,h301,249.99,mobile_app,email,unknown,Bristol,2025-06-26,2025-06-27
3cd5fd7f,6c5a6c93-871c-48,2025-04-08,2025-04-12,PS5,a245,479.99,mobile_app,affiliate,unknown,Liverpool,2025-04-08,2025-04-12
9f708368,3d0a5f0c-0c39-4e,2025-05-04,2025-05-07,Smartwatch,h301,249.99,website,affiliate,unknown,Bristol,2025-05-04,2025-05-07
893ad232,d6312a80-1c61-4e,2025-02-14,2025-02-16,Smartwatch,h301,249.99,mobile_app,direct,unknown,Glasgow,2025-02-14,2025-02-16
4a90cd0c,93364f7e-83ef-49,2025-01-09,2025-01-10,Steam Deck,c912,499.99,website,direct,desktop,Manchester,2025-01-09,2025-01-10
2ff3cde4,5a5226e6-9d64-49,24-03-2025,2025-03-27,Smartwatch,h301,249.99,mobile_app,direct,mobile,Glasgow,2025-03-24,2025-03-27
2ff3cde4,5a5226e6-9d64-49,2025-03-24,2025-03-28,Steam Deck,c912,499.99,mobile_app,affiliate,unknown,Birmingham,2025-03-24,2025-03-28
f4124360,8603156a-15ea-4b,2025-04-25,2025-04-30,Xbox Series X,b104,499.99,website,search,mobile,Nottingham,2025-04-25,2025-04-30
0534a101,c9525185-81e0-4a,2025-04-01,2025-04-05,Accessory,m001,24.99,mobile_app,email,desktop,Leeds,2025-04-01,2025-04-05
5f90bed6,0b251279-785a-45,2025-06-15,06-20-2025,Smartwatch,h301,249.99,mobile_app,search,mobile,Manchester,2025-06-15,2025-06-20
3dba6da8,5b6a8102-0428-43,2025-03-16,2025-03-22,Accessory,m001,24.99,mobile_app,search,mobile,Glasgow,2025-03-16,2025-03-22
3dba6da8,5b6a8102-0428-43,2025-03-16,2025-03-18,Steam Deck,c912,499.99,mobile_app,search,mobile,London,2025-03-16,2025-03-18
c1b5b5ca,1a89b71e-a0d5-42,2025-03-20,2025-03-23,Steam Deck,c912,499.99,mobile_app,direct,unknown,Glasgow,2025-03-20,2025-03-23
c1b5b5ca,1a89b71e-a0d5-42,2025-03-20,2025-03-23,Smartwatch,h301,249.99,mobile_app,email,unknown,Sheffield,2025-03-20,2025-03-23
a48e40f1,5a304528-0b59-45,2025-03-25,2025-03-28,AirPods,d633,159.99,website,search,unknown,Glasgow,2025-03-25,2025-03-28
7a8104de,af475b49-c775-43,2025-04-17,2025-04-21,Google Pixel 8,i920,699.99,mobile_app,email,desktop,Liverpool,2025-04-17,2025-04-21
f1901b7e,2285b2ef-cfbe-4f,2025-04-15,2025-04-16,AirPods,d633,159.99,mobile_app,affiliate,mobile,Glasgow,2025-04-15,2025-04-16
f1901b7e,2285b2ef-cfbe-4f,2025-04-15,2025-04-21,Smartwatch,h301,249.99,mobile_app,social,desktop,Glasgow,2025-04-15,2025-04-21
e2c328aa,339b77a8-4b1f-4d,2025-06-09,2025-06-14,Steam Deck,c912,499.99,mobile_app,search,unknown,Glasgow,2025-06-09,2025-06-14
d0be73ee,4f612217-eef1-46,2025-01-23,2025-01-25,AirPods,d633,159.99,website,search,unknown,Manchester,2025-01-23,2025-01-25
d0be73ee,4f612217-eef1-46,2025-01-23,01-25-2025,Kindle Paperwhite,j877,129.99,website,affiliate,unknown,Manchester,2025-01-23,2025-01-25
493e904d,095ffa81-40d9-4b,2025-01-19,2025-01-21,Google Pixel 8,i920,699.99,website,affiliate,desktop,Manchester,2025-01-19,2025-01-21
45f18619,0c3ce284-c7e5-4b,2025-06-27,24-06-2025,MacBook Air,g770,1199.99,mobile_app,affiliate,unknown,Birmingham,2025-06-27,2025-06-24
7092947d,6fdc0bad-5e36-41,2025-03-25,2025-03-26,Xbox Series X,b104,499.99,website,social,unknown,Glasgow,2025-03-25,2025-03-26
b12b6680,56cb1ab0-62fb-46,2025-04-23,2025-04-27,Smartwatch,h301,249.99,website,email,mobile,Birmingham,2025-04-23,2025-04-27
15260718,cc1b4157-ec9f-4c,2025-01-13,2025-01-19,AirPods,d633,159.99,website,affiliate,unknown,Manchester,2025-01-13,2025-01-19
2e326567,6e3c4532-1434-4f,2025-04-08,2025-04-10,Kindle Paperwhite,j877,129.99,website,direct,mobile,Nottingham,2025-04-08,2025-04-10
2e326567,6e3c4532-1434-4f,2025-04-08,2025-04-09,Xbox Series X,b104,499.99,mobile_app,social,desktop,Manchester,2025-04-08,2025-04-09
4baf0f5e,1a43db54-523a-49,2025-03-05,2025-03-06,AirPods,d633,159.99,website,email,unknown,Nottingham,2025-03-05,2025-03-06
71a3fad2,b7b8c1a5-9a45-49,2025-04-23,2025-04-24,Kindle Paperwhite,j877,129.99,mobile_app,email,mobile,Sheffield,2025-04-23,2025-04-24
9d66e815,ba108217-0ad7-49,2025-04-17,2025-04-22,Accessory,m001,24.99,mobile_app,direct,unknown,Liverpool,2025-04-17,2025-04-22
0eaf04b5,a3b442bd-4649-42,2025-05-27,2025-05-30,Smartwatch,h301,249.99,website,affiliate,mobile,Sheffield,2025-05-27,2025-05-30
0eaf04b5,a3b442bd-4649-42,2025-05-27,06-02-2025,Xbox Series X,b104,499.99,mobile_app,email,unknown,Birmingham,2025-05-27,2025-06-02
bff9507d,67fd64c4-a334-45,2025-02-16,2025-02-17,Xbox Series X,b104,499.99,mobile_app,email,unknown,Liverpool,2025-02-16,2025-02-17
ad973b67,07f8d4f0-f3ea-41,2025-04-02,2025-04-04,Accessory,m001,24.99,website,search,,Leicester,2025-04-02,2025-04-04
a52964ff,20509c62-08e8-45,2025-06-09,2025-06-13,MacBook Air,g770,1199.99,mobile_app,affiliate,mobile,Leicester,2025-06-09,2025-06-13
2747b93c,f31046dc-6202-4e,09-01-2025,2025-01-10,Accessory,m001,24.99,website,direct,mobile,Manchester,2025-01-09,2025-01-10
2747b93c,f31046dc-6202-4e,2025-01-09,2025-01-11,iPhone 15,f521,899.99,website,email,mobile,Birmingham,2025-01-09,2025-01-11
13aec376,5ef787b8-f2e6-49,2025-06-19,2025-06-23,Steam Deck,c912,499.99,mobile_app,email,mobile,Leeds,2025-06-19,2025-06-23
13aec376,5ef787b8-f2e6-49,2025-06-19,2025-06-25,Kindle Paperwhite,j877,129.99,website,email,unknown,Leeds,2025-06-19,2025-06-25
4758367b,5df06e8c-878a-4e,2025-03-11,2025-03-17,iPhone 15,f521,899.99,website,affiliate,unknown,London,2025-03-11,2025-03-17
4758367b,5df06e8c-878a-4e,11-03-2025,2025-03-15,PS5,a245,479.99,mobile_app,direct,mobile,London,2025-03-11,2025-03-15
848af440,06a241af-1d0a-47,2025-03-01,2025-03-06,Accessory,m001,24.99,mobile_app,affiliate,unknown,London,2025-03-01,2025-03-06
b43bd27f,1e2595b8-8fc9-48,2025-04-25,2025-04-28,AirPods,d633,159.99,website,direct,desktop,Glasgow,2025-04-25,2025-04-28
ffa623d0,9ca3fbb3-ff11-48,2025-03-06,03-08-2025,Smartwatch,h301,249.99,mobile_app,search,mobile,Manchester,2025-03-06,2025-03-08
2c33350c,22bf18f5-1f65-4a,2025-04-10,2025-04-16,MacBook Air,g770,1199.99,mobile_app,search,unknown,Leeds,2025-04-10,2025-04-16
f7b217c7,ff4c96d6-71f2-4e,2025-04-08,2025-04-10,Steam Deck,c912,499.99,website,search,mobile,Glasgow,2025-04-08,2025-04-10
8ccc9cea,aaf78c67-51d0-41,2025-01-26,2025-02-01,Google Pixel 8,i920,699.99,mobile_app,affiliate,unknown,Manchester,2025-01-26,2025-02-01
b5a5f8e6,4cc9f5f2-e42e-40,2025-04-15,2025-04-16,PS5,a245,479.99,website,search,unknown,Glasgow,2025-04-15,2025-04-16
3967e60a,2c913a7c-a340-4f,2025-05-06,2025-05-08,Xbox Series X,b104,499.99,mobile_app,search,mobile,Birmingham,2025-05-06,2025-05-08
7e7838c9,cac4d0eb-3373-43,2025-04-21,2025-04-27,PS5,a245,479.99,website,search,mobile,Manchester,2025-04-21,2025-04-27
fba6abf7,9280c5aa-8dd4-49,2025-04-15,2025-04-20,PS5,a245,479.99,mobile_app,affiliate,mobile,Manchester,2025-04-15,2025-04-20
65edcfe3,e25df9a8-9ca8-45,2025-01-21,2025-01-26,Xbox Series X,b104,499.99,mobile_app,social,unknown,London,2025-01-21,2025-01-26
65edcfe3,e25df9a8-9ca8-45,2025-01-21,01-26-2025,Nintendo Switch,e682,299.99,mobile_app,email,unknown,Manchester,2025-01-21,2025-01-26
68d0a2a8,7a89cbeb-b807-47,2025-04-21,2025-04-25,Nintendo Switch,e682,299.99,mobile_app,affiliate,unknown,London,2025-04-21,2025-04-25
12fc7a87,20156a72-12e1-43,2025-05-03,2025-05-08,Steam Deck,c912,499.99,website,affiliate,mobile,Glasgow,2025-05-03,2025-05-08
d43cdd6d,8471b4b0-ae1b-4f,2025-04-02,2025-04-08,iPhone 15,f521,899.99,website,search,desktop,London,2025-04-02,2025-04-08
21084dd9,96792482-a3c9-48,2025-02-15,2025-02-11,PS5,a245,479.99,website,email,mobile,Manchester,2025-02-15,2025-02-11
84a2576c,de431e06-e924-40,2025-05-07,2025-05-09,Xbox Series X,b104,499.99,mobile_app,email,mobile,London,2025-05-07,2025-05-09
84a2576c,de431e06-e924-40,2025-05-07,2025-05-11,Smartwatch,h301,249.99,mobile_app,,unknown,Leeds,2025-05-07,2025-05-11
39b86bb2,2976aab2-2a26-47,2025-06-20,2025-06-25,Accessory,m001,24.99,website,email,desktop,Glasgow,2025-06-20,2025-06-25
143029a9,84d67c4f-f0df-46,2025-04-24,2025-04-29,Xbox Series X,b104,499.99,mobile_app,search,desktop,Glasgow,2025-04-24,2025-04-29
143029a9,84d67c4f-f0df-46,2025-04-24,2025-04-25,Steam Deck,c912,499.99,website,email,mobile,Manchester,2025-04-24,2025-04-25
a0017720,f4d375c1-a293-49,2025-04-21,2025-04-27,Accessory,m001,24.99,mobile_app,search,mobile,Bristol,2025-04-21,2025-04-27
9780c215,17eaec83-8892-44,2025-02-10,02-12-2025,Steam Deck,c912,499.99,mobile_app,email,desktop,Manchester,2025-02-10,2025-02-12
e6e987ca,2bd3cdcd-2779-46,2025-06-24,2025-06-26,AirPods,d633,159.99,website,affiliate,unknown,London,2025-06-24,2025-06-26
dd20c3bf,ec86a890-d7b0-4b,2025-05-18,2025-05-23,MacBook Air,g770,1199.99,website,direct,desktop,Birmingham,2025-05-18,2025-05-23
43c07d43,f2d3f761-0ba3-42,2025-04-25,2025-04-26,PS5,a245,479.99,website,social,unknown,Manchester,2025-04-25,2025-04-26
43c07d43,f2d3f761-0ba3-42,2025-04-25,05-01-2025,Accessory,m001,24.99,website,direct,unknown,Glasgow,2025-04-25,2025-05-01
07c0d116,92779574-c457-4c,15-04-2025,2025-04-19,Nintendo Switch,e682,299.99,mobile_app,direct,unknown,Manchester,2025-04-15,2025-04-19
4d560a3d,8baaf744-a08d-42,2025-04-21,2025-04-22,Steam Deck,c912,499.99,website,search,mobile,Manchester,2025-04-21,2025-04-22
4d560a3d,8baaf744-a08d-42,2025-04-21,2025-04-27,Steam Deck,c912,499.99,mobile_app,search,unknown,Manchester,2025-04-21,2025-04-27
741b77f5,ceae71cf-ce00-4a,2025-04-11,04-14-2025,Accessory,m001,24.99,website,email,desktop,Manchester,2025-04-11,2025-04-14
76e5ae78,2877f5d9-0f56-45,25-04-2025,2025-04-30,Accessory,m001,24.99,website,social,mobile,Leicester,2025-04-25,2025-04-30
51beb80e,24c778a5-9b4e-46,2025-04-03,2025-04-04,AirPods,d633,159.99,website,social,unknown,London,2025-04-03,2025-04-04
c2baf0e0,586a346a-dc5b-47,2025-04-11,2025-04-12,Smartwatch,h301,249.99,mobile_app,social,unknown,Leicester,2025-04-11,2025-04-12
1f5d988f,1b2ededb-8fc8-4f,2025-01-26,2025-02-01,iPhone 15,f521,899.99,mobile_app,social,desktop,London,2025-01-26,2025-02-01
f204be89,24108e9a-3f77-4c,2025-05-04,2025-05-08,AirPods,d633,159.99,website,search,mobile,Manchester,2025-05-04,2025-05-08
f204be89,24108e9a-3f77-4c,2025-05-04,2025-05-06,Steam Deck,c912,499.99,mobile_app,direct,mobile,Bristol,2025-05-04,2025-05-06
e6fdd7af,6b0ae0e3-9d89-40,2025-03-27,2025-04-01,Nintendo Switch,e682,299.99,mobile_app,social,unknown,London,2025-03-27,2025-04-01
3098f7b2,ef0a573d-53d2-45,02-03-2025,2025-03-04,Google Pixel 8,i920,699.99,mobile_app,,mobile,Birmingham,2025-03-02,2025-03-04
e10b1a47,fef7d9ea-7f8e-44,2025-04-08,2025-04-11,Steam Deck,c912,499.99,website,social,mobile,Bristol,2025-04-08,2025-04-11
750d112e,170d7507-05ee-41,2025-04-26,2025-05-01,PS5,a245,479.99,website,affiliate,mobile,London,2025-04-26,2025-05-01
4806f804,95560a2d-3713-44,2025-06-02,2025-06-08,MacBook Air,g770,1199.99,website,affiliate,desktop,London,2025-06-02,2025-06-08
4926ce5f,d7c4fe9c-e1e0-4f,20-03-2025,2025-03-26,Kindle Paperwhite,j877,129.99,website,social,desktop,Manchester,2025-03-20,2025-03-26
4926ce5f,d7c4fe9c-e1e0-4f,2025-03-20,2025-03-23,iPhone 15,f521,899.99,website,direct,desktop,Glasgow,2025-03-20,2025-03-23
4926ce5f,d7c4fe9c-e1e0-4f,2025-03-20,2025-03-26,PS5,a245,479.99,mobile_app,direct,unknown,Sheffield,2025-03-20,2025-03-26
43b47ee5,1b84edc3-d8e0-49,2025-04-25,2025-05-01,Kindle Paperwhite,j877,129.99,website,social,desktop,Manchester,2025-04-25,2025-05-01
0d18ab95,673ba8bd-c38c-4d,2025-03-23,03-26-2025,Google Pixel 8,i920,699.99,mobile_app,social,mobile,Leeds,2025-03-23,2025-03-26
62e7c1a6,5cce5ba9-31d4-4e,20-04-2025,2025-04-26,Google Pixel 8,i920,699.99,mobile_app,email,mobile,London,2025-04-20,2025-04-26
9f8cc29f,8cc36f3b-c3af-4c,2025-01-19,2025-01-24,iPhone 15,f521,899.99,mobile_app,social,desktop,Manchester,2025-01-19,2025-01-24
5f89ed12,20f0156a-1e6a-46,2025-06-12,2025-06-15,Smartwatch,h301,249.99,website,email,mobile,Manchester,2025-06-12,2025-06-15
5f89ed12,20f0156a-1e6a-46,12-06-2025,2025-06-13,MacBook Air,g770,1199.99,website,direct,desktop,Birmingham,2025-06-12,2025-06-13
5f89ed12,20f0156a-1e6a-46,2025-06-12,06-17-2025,AirPods,d633,159.99,mobile_app,email,desktop,Manchester,2025-06-12,2025-06-17
24eeb4a6,8ece1128-56ce-4b,01-05-2025,2025-05-04,Steam Deck,c912,499.99,website,social,unknown,Glasgow,2025-05-01,2025-05-04
09f64405,66c14dca-8255-4a,2025-02-14,2025-02-18,Steam Deck,c912,499.99,mobile_app,email,mobile,Manchester,2025-02-14,2025-02-18
2620f9a9,cdd0b4d4-5542-47,2025-03-09,2025-03-15,Accessory,m001,24.99,mobile_app,social,,Manchester,2025-03-09,2025-03-15
518b2f21,23c8afdb-83f8-4f,2025-04-11,2025-04-13,iPhone 15,f521,899.99,website,search,mobile,Liverpool,2025-04-11,2025-04-13
518b2f21,23c8afdb-83f8-4f,2025-04-11,04-16-2025,Xbox Series X,b104,499.99,website,search,desktop,London,2025-04-11,2025-04-16
97fe56c5,9dd2f9de-fd98-4e,2025-05-06,2025-05-12,PS5,a245,479.99,website,affiliate,mobile,Bristol,2025-05-06,2025-05-12
97fe56c5,9dd2f9de-fd98-4e,2025-05-06,2025-05-12,Xbox Series X,b104,499.99,website,affiliate,unknown,Glasgow,2025-05-06,2025-05-12
901bcdef,827c9f8c-d40a-45,2025-05-10,2025-05-11,Xbox Series X,b104,499.99,website,search,mobile,Glasgow,2025-05-10,2025-05-11
901bcdef,827c9f8c-d40a-45,2025-05-10,2025-05-11,iPhone 15,f521,899.99,mobile_app,social,desktop,London,2025-05-10,2025-05-11
901bcdef,827c9f8c-d40a-45,2025-05-10,2025-05-15,Nintendo Switch,e682,299.99,mobile_app,affiliate,desktop,Glasgow,2025-05-10,2025-05-15
1c0f0bdc,044251db-d0d4-4a,2025-04-10,04-16-2025,Google Pixel 8,i920,699.99,mobile_app,search,mobile,Liverpool,2025-04-10,2025-04-16
df41e335,4ec3f970-956d-40,2025-05-20,2025-05-25,Nintendo Switch,e682,299.99,mobile_app,direct,desktop,Leeds,2025-05-20,2025-05-25
df41e335,4ec3f970-956d-40,2025-05-20,2025-05-25,PS5,a245,479.99,website,direct,desktop,London,2025-05-20,2025-05-25
a7d4cf50,98cf1188-06d2-49,03-02-2025,2025-02-08,Kindle Paperwhite,j877,129.99,mobile_app,email,mobile,London,2025-02-03,2025-02-08
0d259caa,9416e4dc-c6b2-4d,2025-04-25,2025-04-26,MacBook Air,g770,1199.99,mobile_app,social,mobile,Glasgow,2025-04-25,2025-04-26
0d259caa,9416e4dc-c6b2-4d,2025-04-25,2025-04-27,Kindle Paperwhite,j877,129.99,website,email,unknown,London,2025-04-25,2025-04-27
0d259caa,9416e4dc-c6b2-4d,2025-04-25,2025-05-01,PS5,a245,479.99,website,affiliate,mobile,London,2025-04-25,2025-05-01
c64c9647,86341718-2ba6-4d,2025-02-16,2025-02-20,MacBook Air,g770,1199.99,mobile_app,affiliate,unknown,Leeds,2025-02-16,2025-02-20
9293f705,d25864f2-25d4-40,2025-04-09,2025-04-15,Nintendo Switch,e682,299.99,website,affiliate,mobile,Liverpool,2025-04-09,2025-04-15
6b352f85,30d73df7-1c22-4c,2025-02-21,2025-02-27,MacBook Air,g770,1199.99,mobile_app,search,,Manchester,2025-02-21,2025-02-27
9c89d374,34323ec6-b0c4-40,2025-06-12,2025-06-13,Google Pixel 8,i920,699.99,website,direct,unknown,Nottingham,2025-06-12,2025-06-13
b4adaf89,d92f3c1e-df70-4b,2025-03-14,2025-03-18,Kindle Paperwhite,j877,129.99,mobile_app,affiliate,desktop,Liverpool,2025-03-14,2025-03-18
7a768555,8f964685-3514-48,11-05-2025,2025-05-14,Accessory,m001,24.99,website,direct,mobile,,2025-05-11,2025-05-14
887b03e5,f4e95734-5052-47,2025-02-19,2025-02-21,Nintendo Switch,e682,299.99,website,social,desktop,Glasgow,2025-02-19,2025-02-21
ae455cc6,ad05b912-5ab2-4d,2025-02-11,2025-02-13,AirPods,d633,159.99,website,search,mobile,Leeds,2025-02-11,2025-02-13
f5141058,43ad3d62-b17c-4b,2025-03-23,2025-03-28,Accessory,m001,24.99,mobile_app,social,unknown,Manchester,2025-03-23,2025-03-28
fb756923,4c6a70f4-8ede-44,2025-02-14,2025-02-20,Xbox Series X,b104,499.99,website,search,unknown,Manchester,2025-02-14,2025-02-20
7d2f4e58,b4746349-49fc-4c,2025-01-04,2025-01-05,iPhone 15,f521,899.99,website,social,desktop,Glasgow,2025-01-04,2025-01-05
b8beff3d,8f7c1d59-594b-4a,2025-02-20,2025-02-23,PS5,a245,479.99,mobile_app,email,desktop,Manchester,2025-02-20,2025-02-23
e5508ea2,92cf6021-1f33-44,18-05-2025,2025-05-21,Accessory,m001,24.99,mobile_app,social,desktop,Manchester,2025-05-18,2025-05-21
257f7595,585abefb-d181-4f,2025-03-03,2025-03-08,iPhone 15,f521,899.99,mobile_app,social,desktop,London,2025-03-03,2025-03-08
257f7595,585abefb-d181-4f,2025-03-03,2025-03-08,Accessory,m001,24.99,mobile_app,affiliate,unknown,London,2025-03-03,2025-03-08
ec8be537,f48f709c-49a2-44,2025-04-22,2025-04-24,AirPods,d633,159.99,website,affiliate,mobile,Nottingham,2025-04-22,2025-04-24
ec8be537,f48f709c-49a2-44,2025-04-22,2025-04-26,Xbox Series X,b104,499.99,website,social,mobile,Manchester,2025-04-22,2025-04-26
d3f4a49b,bf519362-41a6-4f,2025-03-06,2025-03-07,iPhone 15,f521,899.99,website,affiliate,mobile,Manchester,2025-03-06,2025-03-07
1bf645f6,8fe069b6-eeda-48,07-02-2025,2025-02-10,Smartwatch,h301,249.99,mobile_app,affiliate,desktop,Glasgow,2025-02-07,2025-02-10
1bf645f6,8fe069b6-eeda-48,2025-02-07,2025-02-09,PS5,a245,479.99,mobile_app,social,unknown,London,2025-02-07,2025-02-09
e7ba26ac,3d4196fe-963a-46,2025-04-21,2025-04-26,Google Pixel 8,i920,699.99,mobile_app,affiliate,desktop,Leeds,2025-04-21,2025-04-26
e7ba26ac,3d4196fe-963a-46,2025-04-21,2025-04-24,PS5,a245,479.99,website,search,unknown,Sheffield,2025-04-21,2025-04-24
548e1f6b,3b9b2d45-a350-45,2025-01-11,2025-01-15,iPhone 15,f521,899.99,website,email,mobile,London,2025-01-11,2025-01-15
f6eab3a0,ae62990c-19bd-4f,2025-01-26,2025-01-27,MacBook Air,g770,1199.99,website,search,unknown,Manchester,2025-01-26,2025-01-27
f6eab3a0,ae62990c-19bd-4f,2025-01-26,2025-02-01,Xbox Series X,b104,499.99,mobile_app,direct,desktop,Liverpool,2025-01-26,2025-02-01
e1721c83,286ed390-edd9-4a,2025-04-03,2025-04-06,AirPods,d633,159.99,mobile_app,social,desktop,London,2025-04-03,2025-04-06
4988e418,a689b424-7a3a-40,2025-04-21,2025-04-23,PS5,a245,479.99,mobile_app,email,mobile,Sheffield,2025-04-21,2025-04-23
a6fd0cb1,0f25477d-a559-40,2025-01-24,2025-01-28,AirPods,d633,159.99,website,email,mobile,London,2025-01-24,2025-01-28
098c60b3,bd1a8f4b-88ff-4d,01-03-2025,2025-03-07,Steam Deck,c912,499.99,mobile_app,search,unknown,Liverpool,2025-03-01,2025-03-07
ef158d5b,6afa828c-2cd1-4b,2025-06-21,2025-06-25,Steam Deck,c912,499.99,website,direct,mobile,Liverpool,2025-06-21,2025-06-25
2fb21e66,d61169a1-ff46-46,2025-03-22,2025-03-26,Nintendo Switch,e682,299.99,mobile_app,search,mobile,Glasgow,2025-03-22,2025-03-26
0997623a,df4e713e-f64e-4d,2025-01-24,2025-01-28,iPhone 15,f521,899.99,mobile_app,social,unknown,Bristol,2025-01-24,2025-01-28
55c551fc,9a4ffc0c-9165-42,2025-06-23,2025-06-25,Kindle Paperwhite,j877,129.99,mobile_app,email,unknown,Birmingham,2025-06-23,2025-06-25
e3a68a70,a42d0cd7-fd35-4f,2025-01-11,2025-01-15,Steam Deck,c912,499.99,mobile_app,direct,mobile,Birmingham,2025-01-11,2025-01-15
cf0e6d2b,811414f8-d9df-4d,2025-01-17,2025-01-20,iPhone 15,f521,899.99,mobile_app,search,desktop,Sheffield,2025-01-17,2025-01-20
cf0e6d2b,811414f8-d9df-4d,2025-01-17,01-21-2025,iPhone 15,f521,899.99,mobile_app,social,mobile,Birmingham,2025-01-17,2025-01-21
b7f60cdf,bb2aa146-2999-49,2025-03-11,2025-03-16,PS5,a245,479.99,website,search,unknown,Nottingham,2025-03-11,2025-03-16
aca58d95,564cfbd2-bc92-4d,2025-05-19,2025-05-25,Xbox Series X,b104,499.99,website,social,unknown,Manchester,2025-05-19,2025-05-25
aca58d95,564cfbd2-bc92-4d,2025-05-19,05-23-2025,Steam Deck,c912,499.99,mobile_app,affiliate,mobile,Manchester,2025-05-19,2025-05-23
67ce378f,9c678393-2ced-4c,2025-05-10,2025-05-14,Accessory,m001,24.99,website,email,desktop,Manchester,2025-05-10,2025-05-14
186b2880,53f30073-83e9-4e,2025-06-08,2025-06-14,AirPods,d633,159.99,website,social,mobile,Leeds,2025-06-08,2025-06-14
01bf9e73,7a3a6e96-23ff-43,2025-03-18,2025-03-22,PS5,a245,479.99,mobile_app,search,mobile,Manchester,2025-03-18,2025-03-22
546252e7,725d4259-3c4b-4e,2025-02-09,2025-02-14,Google Pixel 8,i920,699.99,mobile_app,search,desktop,Glasgow,2025-02-09,2025-02-14
5c0b9b10,92a81713-b90e-44,2025-01-18,2025-01-24,iPhone 15,f521,899.99,website,affiliate,desktop,London,2025-01-18,2025-01-24
28e333b6,aaf407f7-0fe7-41,2025-04-02,04-08-2025,Accessory,m001,24.99,mobile_app,direct,unknown,Glasgow,2025-04-02,2025-04-08
c5144d98,ec50ace4-80a5-4e,2025-04-02,2025-04-03,Kindle Paperwhite,j877,129.99,mobile_app,email,mobile,Manchester,2025-04-02,2025-04-03
5e175b66,a38295d3-1e0e-45,2025-06-23,2025-06-24,PS5,a245,479.99,website,email,desktop,Manchester,2025-06-23,2025-06-24
74797b61,f5159494-3818-4f,2025-04-26,2025-05-02,Google Pixel 8,i920,699.99,website,social,mobile,Glasgow,2025-04-26,2025-05-02
e9ad0e9b,5fa5e0aa-9b11-45,2025-02-21,2025-02-25,MacBook Air,g770,1199.99,website,email,desktop,Birmingham,2025-02-21,2025-02-25
e9ad0e9b,5fa5e0aa-9b11-45,2025-02-21,2025-02-22,Smartwatch,h301,249.99,mobile_app,social,desktop,Glasgow,2025-02-21,2025-02-22
c3093b6e,cd4f8b2b-899a-42,2025-06-26,2025-07-02,PS5,a245,479.99,website,email,mobile,Leeds,2025-06-26,2025-07-02
86879aa9,98874bfe-c136-4c,2025-05-09,2025-05-13,iPhone 15,f521,899.99,website,search,mobile,Glasgow,2025-05-09,2025-05-13
86879aa9,98874bfe-c136-4c,2025-05-09,2025-05-13,iPhone 15,f521,899.99,website,social,unknown,Glasgow,2025-05-09,2025-05-13
1cb9b73a,5c9deee0-b42a-44,2025-06-14,06-17-2025,Smartwatch,h301,249.99,website,email,desktop,Birmingham,2025-06-14,2025-06-17
89628f6e,e723ada3-8c32-4d,2025-04-11,2025-04-12,PS5,a245,479.99,mobile_app,affiliate,unknown,London,2025-04-11,2025-04-12
89628f6e,e723ada3-8c32-4d,2025-04-11,2025-04-17,Xbox Series X,b104,499.99,website,search,desktop,Leeds,2025-04-11,2025-04-17
ae27d432,dabf984e-53ff-44,2025-04-13,2025-04-15,Google Pixel 8,i920,699.99,mobile_app,search,mobile,Manchester,2025-04-13,2025-04-15
720b274b,7d23d479-9549-4a,27-04-2025,2025-04-29,Smartwatch,h301,249.99,mobile_app,direct,,Nottingham,2025-04-27,2025-04-29
905c7bdd,21c71aa3-7414-43,12-02-2025,2025-02-18,Accessory,m001,24.99,mobile_app,social,desktop,Birmingham,2025-02-12,2025-02-18
0592bfa5,ac3a812f-765e-4c,24-04-2025,2025-04-26,Kindle Paperwhite,j877,129.99,mobile_app,search,mobile,Glasgow,2025-04-24,2025-04-26
12b2102d,00c59f30-d103-44,2025-02-07,2025-02-08,MacBook Air,g770,1199.99,website,direct,mobile,Glasgow,2025-02-07,2025-02-08
0f6ce9bf,b34c6c73-5833-4b,2025-03-08,2025-03-13,PS5,a245,479.99,website,search,desktop,London,2025-03-08,2025-03-13
0f6ce9bf,b34c6c73-5833-4b,2025-03-08,2025-03-11,iPhone 15,f521,899.99,website,social,desktop,Manchester,2025-03-08,2025-03-11
497ec6d1,fc737d92-11ab-4d,2025-04-01,04-07-2025,AirPods,d633,159.99,mobile_app,search,unknown,London,2025-04-01,2025-04-07
bab2b77d,22ab7752-c4db-4a,02-05-2025,2025-05-07,iPhone 15,f521,899.99,mobile_app,search,mobile,Manchester,2025-05-02,2025-05-07
72d35458,5fdcabbf-6b9c-47,2025-04-07,2025-04-08,Kindle Paperwhite,j877,129.99,mobile_app,email,mobile,Glasgow,2025-04-07,2025-04-08
f6d22a7b,60a399d4-e821-47,09-03-2025,03-11-2025,Kindle Paperwhite,j787,129.99,mobile_app,search,unknown,Glasgow,2025-03-09,2025-03-11
1e5ebe54,220b9ea9-8a0f-45,2025-05-22,2025-05-28,PS5,a245,479.99,website,email,desktop,Liverpool,2025-05-22,2025-05-28
fa8dae42,649f7d88-8989-45,2025-04-21,2025-04-24,Steam Deck,c912,499.99,website,direct,mobile,London,2025-04-21,2025-04-24
76876c62,c194f97f-00e3-40,2025-02-23,2025-02-28,Xbox Series X,b104,499.99,mobile_app,social,unknown,London,2025-02-23,2025-02-28
3acb43a3,6c93a791-8b60-45,2025-02-15,2025-02-20,Xbox Series X,b104,499.99,mobile_app,social,desktop,London,2025-02-15,2025-02-20
e00da49d,27b608dc-589d-4c,2025-05-03,2025-05-09,Smartwatch,h301,249.99,website,search,desktop,Manchester,2025-05-03,2025-05-09
9d6b9b62,083f64c3-1ce3-42,2025-01-07,2025-01-10,Smartwatch,h301,249.99,website,direct,mobile,Manchester,2025-01-07,2025-01-10
1139fa12,e39836bb-e23d-4f,2025-03-25,2025-03-30,Smartwatch,h301,249.99,website,email,desktop,London,2025-03-25,2025-03-30
df495037,7249f62c-0898-44,2025-05-14,2025-05-16,Smartwatch,h301,249.99,website,social,unknown,Birmingham,2025-05-14,2025-05-16
8a2db2e6,0b531932-bd94-49,2025-02-20,2025-02-26,Google Pixel 8,i920,699.99,mobile_app,social,unknown,Glasgow,2025-02-20,2025-02-26
fe54ee4b,c6ac1b04-dd1d-4c,2025-04-18,2025-04-22,Smartwatch,h301,249.99,mobile_app,social,desktop,Glasgow,2025-04-18,2025-04-22
93d563ae,ea98fef8-d0d7-4e,2025-03-14,2025-03-19,PS5,a245,479.99,website,direct,mobile,Manchester,2025-03-14,2025-03-19
e0527739,d18183d1-ac2b-4c,26-04-2025,2025-04-29,Nintendo Switch,e682,299.99,website,search,mobile,Birmingham,2025-04-26,2025-04-29
46707cd6,8570b59f-a903-4e,2025-04-16,04-20-2025,Xbox Series X,b104,499.99,mobile_app,search,unknown,London,2025-04-16,2025-04-20
46707cd6,8570b59f-a903-4e,2025-04-16,2025-04-21,PS5,a245,479.99,website,email,unknown,Manchester,2025-04-16,2025-04-21
2cd58759,97777f10-f2d2-49,2025-02-20,02-25-2025,iPhone 15,f521,899.99,website,social,unknown,Manchester,2025-02-20,2025-02-25
582b91ee,8e4c3ab5-6d5d-44,2025-05-25,2025-05-29,Steam Deck,c912,499.99,website,direct,mobile,Sheffield,2025-05-25,2025-05-29
582b91ee,8e4c3ab5-6d5d-44,2025-05-25,2025-05-29,Nintendo Switch,e682,299.99,mobile_app,email,desktop,Glasgow,2025-05-25,2025-05-29
b2414482,61935990-abdd-4a,2025-04-16,2025-04-17,Smartwatch,h301,249.99,website,direct,unknown,Manchester,2025-04-16,2025-04-17
89b5aab0,4cc57e0d-2633-40,2025-06-11,2025-06-17,Kindle Paperwhite,j877,129.99,mobile_app,search,unknown,Birmingham,2025-06-11,2025-06-17
24f43c62,39b02e2a-d96e-48,2025-02-20,2025-02-22,MacBook Air,g770,1199.99,website,direct,desktop,London,2025-02-20,2025-02-22
24f43c62,39b02e2a-d96e-48,2025-02-20,2025-02-25,Nintendo Switch,e682,299.99,mobile_app,search,mobile,London,2025-02-20,2025-02-25
24f43c62,39b02e2a-d96e-48,2025-02-20,2025-02-25,Kindle Paperwhite,j877,129.99,website,email,unknown,Manchester,2025-02-20,2025-02-25
6aa0426d,0ec0713d-ea2c-4a,2025-05-13,2025-05-16,AirPods,d633,159.99,mobile_app,search,unknown,Birmingham,2025-05-13,2025-05-16
548c1d84,636f6e5c-2253-47,2025-05-19,2025-05-21,PS5,a245,479.99,mobile_app,affiliate,mobile,Manchester,2025-05-19,2025-05-21
548c1d84,636f6e5c-2253-47,2025-05-19,2025-05-21,Accessory,m001,24.99,website,direct,desktop,London,2025-05-19,2025-05-21
891f6912,73253aa3-ec17-42,2025-05-05,2025-05-07,iPhone 15,f521,899.99,mobile_app,social,desktop,Glasgow,2025-05-05,2025-05-07
891f6912,73253aa3-ec17-42,2025-05-05,2025-05-11,Kindle Paperwhite,j877,129.99,mobile_app,social,mobile,London,2025-05-05,2025-05-11
9adf4709,0d31812e-30c3-47,2025-04-26,2025-04-27,Smartwatch,h301,249.99,website,social,unknown,Manchester,2025-04-26,2025-04-27
9adf4709,0d31812e-30c3-47,2025-04-26,2025-05-02,AirPods,d633,159.99,mobile_app,social,mobile,Birmingham,2025-04-26,2025-05-02
966be275,12a1fe7d-dfa5-47,2025-03-25,2025-03-30,iPhone 15,f521,899.99,website,affiliate,unknown,Manchester,2025-03-25,2025-03-30
e8334da5,378e6510-8f10-43,2025-02-12,2025-02-18,Smartwatch,h301,249.99,mobile_app,affiliate,unknown,Manchester,2025-02-12,2025-02-18
30a5648e,e8b3d763-f4ff-4f,2025-04-04,2025-04-06,MacBook Air,g770,1199.99,mobile_app,direct,mobile,Manchester,2025-04-04,2025-04-06
30a5648e,e8b3d763-f4ff-4f,2025-04-04,04-07-2025,AirPods,d633,159.99,mobile_app,email,unknown,London,2025-04-04,2025-04-07
ea18d32c,bf337a15-1e08-4f,2025-01-07,01-09-2025,Kindle Paperwhite,j877,129.99,mobile_app,email,unknown,Manchester,2025-01-07,2025-01-09
3d44cb2c,b42a2d93-9aba-4f,2025-02-16,2025-02-17,Nintendo Switch,e682,299.99,website,social,desktop,London,2025-02-16,2025-02-17
3d44cb2c,b42a2d93-9aba-4f,2025-02-16,2025-02-18,PS5,a245,479.99,mobile_app,social,desktop,London,2025-02-16,2025-02-18
a6129a1c,48769153-c688-43,09-02-2025,2025-02-11,MacBook Air,g770,1199.99,website,email,desktop,Glasgow,2025-02-09,2025-02-11
a6129a1c,48769153-c688-43,2025-02-09,2025-02-10,AirPods,d336,159.99,mobile_app,,desktop,Manchester,2025-02-09,2025-02-10
774c0afa,5c11ab6d-42f5-43,2025-06-25,2025-07-01,iPhone 15,f521,899.99,website,affiliate,mobile,London,2025-06-25,2025-07-01
51facefa,b8f0188e-fb37-4f,2025-05-06,05-09-2025,Accessory,m001,24.99,website,social,unknown,Bristol,2025-05-06,2025-05-09
dd34aa18,501ba851-5ee6-44,20-04-2025,2025-04-26,PS5,a245,479.99,website,affiliate,desktop,Manchester,2025-04-20,2025-04-26
95831d58,0426fcc9-255b-40,2025-03-26,03-27-2025,Smartwatch,h301,249.99,website,search,desktop,London,2025-03-26,2025-03-27
95831d58,0426fcc9-255b-40,2025-03-26,2025-04-01,Google Pixel 8,i920,699.99,mobile_app,affiliate,desktop,Manchester,2025-03-26,2025-04-01
3ae28023,4b91b8cb-6ae6-45,2025-06-18,2025-06-19,iPhone 15,f521,899.99,mobile_app,direct,mobile,Manchester,2025-06-18,2025-06-19
f186e47a,3ee82983-d557-42,2025-02-17,2025-02-19,PS5,a245,479.99,mobile_app,affiliate,unknown,London,2025-02-17,2025-02-19
b93b17fb,c36b9a0a-41e0-4a,2025-04-25,2025-04-26,PS5,a245,479.99,mobile_app,email,mobile,Manchester,2025-04-25,2025-04-26
b93b17fb,c36b9a0a-41e0-4a,2025-04-25,2025-04-29,Xbox Series X,b104,499.99,website,direct,desktop,Manchester,2025-04-25,2025-04-29
b93b17fb,c36b9a0a-41e0-4a,2025-04-25,2025-04-30,Google Pixel 8,i920,699.99,website,search,unknown,Birmingham,2025-04-25,2025-04-30
5a2837b2,75f8e3a8-7d97-4c,2025-01-22,2025-01-26,Xbox Series X,b104,499.99,mobile_app,direct,unknown,Glasgow,2025-01-22,2025-01-26
e3ad64d4,8bea75c1-b866-47,2025-01-02,2025-01-06,Xbox Series X,b104,499.99,mobile_app,direct,desktop,London,2025-01-02,2025-01-06
d6cd3155,f50d7a37-a44d-4f,2025-05-17,2025-05-19,PS5,a245,479.99,website,search,unknown,Glasgow,2025-05-17,2025-05-19
01a25ed1,d1682e09-f1f7-49,2025-04-01,2025-04-04,MacBook Air,g770,1199.99,mobile_app,email,desktop,London,2025-04-01,2025-04-04
26a9e100,a175a9c3-d7b1-42,2025-04-25,2025-04-28,Steam Deck,c912,499.99,website,direct,unknown,Birmingham,2025-04-25,2025-04-28
a3422e50,74bd0c93-8177-46,2025-03-07,2025-03-12,Kindle Paperwhite,j877,129.99,mobile_app,affiliate,unknown,Glasgow,2025-03-07,2025-03-12
0406ff44,e9aa144b-9dd4-46,2025-04-27,2025-04-29,AirPods,d633,159.99,website,social,mobile,London,2025-04-27,2025-04-29
b8e19f56,694d7b00-8d38-43,2025-05-07,2025-05-08,Accessory,m001,24.99,website,social,mobile,Liverpool,2025-05-07,2025-05-08
b2a6e468,49646b96-fa3c-46,2025-05-20,2025-05-22,PS5,a245,479.99,mobile_app,search,desktop,Glasgow,2025-05-20,2025-05-22
eb053fc4,f090f5a0-ce61-41,2025-05-22,2025-05-23,Google Pixel 8,i920,699.99,mobile_app,email,desktop,Manchester,2025-05-22,2025-05-23
409e7a80,3db02235-261e-45,2025-06-08,2025-06-13,MacBook Air,g770,1199.99,mobile_app,email,unknown,Leicester,2025-06-08,2025-06-13
f5948a54,cb80f288-446f-44,2025-01-25,2025-01-27,Accessory,m001,24.99,mobile_app,affiliate,desktop,Manchester,2025-01-25,2025-01-27
f5948a54,cb80f288-446f-44,2025-01-25,2025-01-26,Kindle Paperwhite,j778,129.99,website,email,desktop,London,2025-01-25,2025-01-26
4ccb2355,3e42df5b-90a3-4b,2025-03-03,2025-03-04,Nintendo Switch,e682,299.99,mobile_app,search,mobile,Manchester,2025-03-03,2025-03-04
a65f7b8a,14a34f7f-d90d-41,2025-05-18,2025-05-24,Accessory,m001,24.99,mobile_app,social,unknown,Manchester,2025-05-18,2025-05-24
79db7862,67c0518b-17ef-46,2025-02-12,2025-02-13,MacBook Air,g770,1199.99,website,email,desktop,Glasgow,2025-02-12,2025-02-13
d867888b,b3eda8f1-026b-43,2025-05-04,05-05-2025,AirPods,d633,159.99,website,direct,unknown,London,2025-05-04,2025-05-05
f94d8fcb,54ce26be-c8cc-42,2025-04-15,2025-04-19,iPhone 15,f521,899.99,website,email,unknown,Bristol,2025-04-15,2025-04-19
e6b9d31a,eb4d8f42-8735-40,2025-02-20,2025-02-26,MacBook Air,g770,1199.99,website,affiliate,desktop,Glasgow,2025-02-20,2025-02-26
ec95b3ac,9118c400-e336-42,2025-04-13,2025-04-17,PS5,a245,479.99,website,social,unknown,Bristol,2025-04-13,2025-04-17
a879d8f8,47c68688-ecf3-40,2025-06-01,2025-06-02,Kindle Paperwhite,j877,129.99,mobile_app,direct,desktop,Glasgow,2025-06-01,2025-06-02
3508507a,d9b59f84-edc3-41,16-03-2025,2025-03-22,Nintendo Switch,e682,299.99,website,affiliate,desktop,Manchester,2025-03-16,2025-03-22
edcabf94,d218c9d6-c093-4f,2025-04-22,2025-04-25,Smartwatch,h301,249.99,mobile_app,direct,mobile,Liverpool,2025-04-22,2025-04-25
d9750f00,905f9096-2996-46,2025-04-23,2025-04-29,Xbox Series X,b104,499.99,mobile_app,affiliate,desktop,Nottingham,2025-04-23,2025-04-29
bd5ff093,8a624cbd-e582-46,21-06-2025,2025-06-25,iPhone 15,f521,899.99,mobile_app,search,desktop,Birmingham,2025-06-21,2025-06-25
bed63da0,b076a7dc-fd0c-44,2025-06-26,2025-07-02,AirPods,d633,159.99,website,social,mobile,London,2025-06-26,2025-07-02
1375ee90,1901ef87-0dbf-4c,2025-01-25,2025-01-28,Google Pixel 8,i920,699.99,website,social,unknown,Manchester,2025-01-25,2025-01-28
f80b2cea,9d264599-c4dd-4d,26-05-2025,2025-05-29,Xbox Series X,b104,499.99,website,email,desktop,Manchester,2025-05-26,2025-05-29
735741e5,a255e1bb-0795-4c,09-02-2025,2025-02-15,Kindle Paperwhite,j877,129.99,website,direct,unknown,Leeds,2025-02-09,2025-02-15
2f8c83e5,8d93e14a-5b16-41,2025-04-12,2025-04-13,Google Pixel 8,i920,699.99,website,affiliate,desktop,Leicester,2025-04-12,2025-04-13
4b9dfd58,614c721d-a921-4b,2025-04-09,2025-04-13,Nintendo Switch,e682,299.99,mobile_app,social,desktop,London,2025-04-09,2025-04-13
4b9dfd58,614c721d-a921-4b,2025-04-09,2025-04-10,Xbox Series X,b104,499.99,mobile_app,direct,mobile,Glasgow,2025-04-09,2025-04-10
6147adeb,12d15585-b68e-47,2025-03-26,03-30-2025,Steam Deck,c912,499.99,mobile_app,email,desktop,Manchester,2025-03-26,2025-03-30
6147adeb,12d15585-b68e-47,2025-03-26,2025-03-29,Kindle Paperwhite,j877,129.99,website,search,unknown,Manchester,2025-03-26,2025-03-29
5c56d9bc,277eb0aa-a247-44,03-04-2025,2025-04-05,Nintendo Switch,e682,299.99,website,search,desktop,Manchester,2025-04-03,2025-04-05
c2e79a98,f165d779-0154-49,2025-04-26,2025-04-27,MacBook Air,g770,1199.99,mobile_app,email,mobile,Glasgow,2025-04-26,2025-04-27
8e969227,16591c89-21eb-4a,2025-04-17,2025-04-18,iPhone 15,f521,899.99,mobile_app,affiliate,mobile,Liverpool,2025-04-17,2025-04-18
8de1596c,1a7167c7-6875-45,2025-06-03,2025-06-06,Steam Deck,c912,499.99,mobile_app,search,desktop,Manchester,2025-06-03,2025-06-06
0328c136,c8d0f9e5-9919-45,2025-01-03,2025-01-06,Smartwatch,h301,249.99,mobile_app,direct,unknown,Birmingham,2025-01-03,2025-01-06
8f3dc97f,c777a07f-6346-44,2025-02-09,2025-02-11,Google Pixel 8,i920,699.99,website,affiliate,mobile,Birmingham,2025-02-09,2025-02-11
af70de70,3e245fbf-fa69-4c,2025-01-03,2025-01-05,Nintendo Switch,e682,299.99,mobile_app,affiliate,mobile,Birmingham,2025-01-03,2025-01-05
af70de70,3e245fbf-fa69-4c,2025-01-03,2025-01-09,Nintendo Switch,e682,299.99,mobile_app,email,desktop,Glasgow,2025-01-03,2025-01-09
af70de70,3e245fbf-fa69-4c,2025-01-03,01-08-2025,Steam Deck,c912,499.99,website,social,mobile,London,2025-01-03,2025-01-08
255bfc1c,44d7df9a-238b-45,2025-01-21,2025-01-23,Nintendo Switch,e682,299.99,mobile_app,affiliate,desktop,London,2025-01-21,2025-01-23
c85cd714,46a56fe8-6f46-41,2025-06-17,2025-06-22,Steam Deck,c912,499.99,mobile_app,email,mobile,Leeds,2025-06-17,2025-06-22
c85cd714,46a56fe8-6f46-41,2025-06-17,2025-06-22,PS5,a245,479.99,website,search,desktop,Leeds,2025-06-17,2025-06-22
7eece88d,f1b88d65-406f-44,2025-02-01,2025-02-05,Accessory,m001,24.99,website,search,unknown,Liverpool,2025-02-01,2025-02-05
01bb819c,75366b9f-320f-42,2025-02-02,2025-02-06,Nintendo Switch,e682,299.99,website,direct,mobile,London,2025-02-02,2025-02-06
dcb9075e,d773f98d-550c-4f,2025-05-08,2025-05-11,AirPods,d633,159.99,mobile_app,email,mobile,Manchester,2025-05-08,2025-05-11
a6aa59e5,6e3cdd4f-55b1-45,2025-05-27,2025-05-30,Smartwatch,h301,249.99,website,affiliate,desktop,London,2025-05-27,2025-05-30
b1fead13,4ce953a7-22d9-4d,2025-04-26,2025-05-01,Xbox Series X,b104,499.99,website,direct,desktop,Nottingham,2025-04-26,2025-05-01
51b30182,2d79a2d1-506e-40,2025-04-14,2025-04-18,Xbox Series X,b104,499.99,mobile_app,email,mobile,Bristol,2025-04-14,2025-04-18
c82f78fd,a205e54f-b1e8-40,2025-05-20,2025-05-25,PS5,a245,479.99,mobile_app,direct,mobile,Leicester,2025-05-20,2025-05-25
c82f78fd,a205e54f-b1e8-40,2025-05-20,2025-05-24,AirPods,d633,159.99,mobile_app,affiliate,desktop,Glasgow,2025-05-20,2025-05-24
5d71a898,47c1c017-6045-49,25-04-2025,2025-05-01,Xbox Series X,b104,499.99,mobile_app,search,desktop,London,2025-04-25,2025-05-01
2e0fb5b3,33261887-9058-41,2025-01-06,2025-01-09,Steam Deck,c912,499.99,website,affiliate,unknown,Manchester,2025-01-06,2025-01-09
2e0fb5b3,33261887-9058-41,2025-01-06,2025-01-09,Steam Deck,c912,499.99,mobile_app,search,desktop,Manchester,2025-01-06,2025-01-09
f166cdcf,06e3f949-8cd3-4c,2025-01-01,2025-01-04,Accessory,m001,24.99,mobile_app,direct,desktop,London,2025-01-01,2025-01-04
11b461e9,cc351e4f-703e-45,2025-04-03,2025-04-07,MacBook Air,g770,1199.99,website,affiliate,mobile,Manchester,2025-04-03,2025-04-07
23a13e20,cb881c32-cbb0-4a,2025-04-27,2025-04-29,PS5,a245,479.99,website,affiliate,desktop,Bristol,2025-04-27,2025-04-29
6c521d13,40afbf3f-3df5-49,2025-04-14,2025-04-16,Steam Deck,c912,499.99,website,social,mobile,London,2025-04-14,2025-04-16
6c521d13,40afbf3f-3df5-49,2025-04-14,2025-04-20,Accessory,m001,24.99,website,search,unknown,Leicester,2025-04-14,2025-04-20
950df1a0,72f60958-12ef-41,2025-04-17,2025-04-18,AirPods,d633,159.99,website,affiliate,,London,2025-04-17,2025-04-18
6b15c11b,ec6a37ad-81b1-4d,2025-02-14,2025-02-18,Accessory,m001,24.99,website,affiliate,mobile,Liverpool,2025-02-14,2025-02-18
cff2b1c4,f7eae66e-ca6c-4f,2025-01-20,2025-01-21,PS5,a245,479.99,mobile_app,affiliate,desktop,Manchester,2025-01-20,2025-01-21
3f8c1097,ea163354-a35f-49,2025-04-09,2025-04-13,Kindle Paperwhite,j877,129.99,mobile_app,social,desktop,Bristol,2025-04-09,2025-04-13
902f3465,2a9528c3-5ae1-4b,2025-05-30,24-05-2025,MacBook Air,g770,1199.99,mobile_app,direct,mobile,Sheffield,2025-05-30,2025-05-24
54e38579,a590fd3c-ad6e-4c,08-04-2025,2025-04-10,Steam Deck,c912,499.99,mobile_app,email,mobile,London,2025-04-08,2025-04-10
38d5101f,1b1f2eb1-6e32-45,2025-05-09,2025-05-10,Xbox Series X,b104,499.99,website,email,mobile,London,2025-05-09,2025-05-10
38958939,8ed8a80d-84cf-4e,2025-02-21,2025-02-26,MacBook Air,g770,1199.99,mobile_app,affiliate,desktop,Glasgow,2025-02-21,2025-02-26
b0c07fcc,768b4f7e-6421-4e,2025-04-04,2025-04-08,AirPods,d633,159.99,website,social,desktop,Birmingham,2025-04-04,2025-04-08
4ba17233,ff69723d-584f-48,2025-02-12,2025-02-17,Accessory,m001,24.99,website,search,desktop,Glasgow,2025-02-12,2025-02-17
baeb286b,15fa9483-f633-4c,2025-06-02,2025-06-08,MacBook Air,g770,1199.99,mobile_app,social,unknown,London,2025-06-02,2025-06-08
8567c805,57d337d3-4fd8-4b,2025-02-06,2025-02-09,Smartwatch,h301,249.99,mobile_app,social,mobile,Manchester,2025-02-06,2025-02-09
8567c805,57d337d3-4fd8-4b,2025-02-06,2025-02-07,Xbox Series X,b104,499.99,mobile_app,search,desktop,Manchester,2025-02-06,2025-02-07
8567c805,57d337d3-4fd8-4b,2025-02-06,2025-02-09,Nintendo Switch,e682,299.99,website,social,unknown,London,2025-02-06,2025-02-09
73d39457,18fdd2b9-79e5-49,2025-01-08,2025-01-13,iPhone 15,f521,899.99,website,direct,desktop,Manchester,2025-01-08,2025-01-13
05c8234b,0b705933-4cde-4b,2025-04-13,2025-04-19,Steam Deck,c912,499.99,website,email,unknown,Glasgow,2025-04-13,2025-04-19
ee0f65a8,1bff3142-a5e1-4b,2025-04-13,2025-04-15,Nintendo Switch,e682,299.99,mobile_app,email,desktop,London,2025-04-13,2025-04-15
54bbbcf8,84182d35-3e71-44,2025-04-17,2025-04-19,Xbox Series X,b104,499.99,mobile_app,email,unknown,Manchester,2025-04-17,2025-04-19
a137f8e4,76492e64-f55d-4e,2025-01-01,2025-01-07,Nintendo Switch,e682,299.99,mobile_app,search,unknown,London,2025-01-01,2025-01-07
bcc57be0,a84554c3-a3f6-4c,2025-04-10,2025-04-15,Xbox Series X,b104,499.99,website,social,unknown,London,2025-04-10,2025-04-15
bcc57be0,a84554c3-a3f6-4c,2025-04-10,2025-04-12,AirPods,d633,159.99,mobile_app,affiliate,desktop,Sheffield,2025-04-10,2025-04-12
0123a348,7317591a-3283-4a,2025-01-09,2025-01-11,Nintendo Switch,e682,299.99,website,affiliate,unknown,Leeds,2025-01-09,2025-01-11
cbc72f1a,47419b48-34ae-4a,2025-05-23,2025-05-24,Smartwatch,h301,249.99,mobile_app,search,desktop,Liverpool,2025-05-23,2025-05-24
5da49cb9,ccac2fb5-1a0c-4c,2025-04-19,04-22-2025,Xbox Series X,b104,499.99,website,email,desktop,London,2025-04-19,2025-04-22
7d4ed26e,1d2c2721-7522-46,2025-02-08,2025-02-10,Nintendo Switch,e682,299.99,website,affiliate,unknown,,2025-02-08,2025-02-10
7d4ed26e,1d2c2721-7522-46,2025-02-08,2025-02-09,iPhone 15,f521,899.99,mobile_app,social,unknown,London,2025-02-08,2025-02-09
647dc392,503b4078-a39c-4e,2025-04-12,2025-04-15,PS5,a245,479.99,mobile_app,email,desktop,Birmingham,2025-04-12,2025-04-15
647dc392,503b4078-a39c-4e,2025-04-12,2025-04-18,Xbox Series X,b104,499.99,mobile_app,social,unknown,London,2025-04-12,2025-04-18
2c2ac34b,5a1baf0e-5911-46,2025-06-05,2025-06-07,iPhone 15,f521,899.99,mobile_app,direct,unknown,Manchester,2025-06-05,2025-06-07
97154633,ccf4ffb0-b4bb-47,13-01-2025,2025-01-15,Kindle Paperwhite,j877,129.99,mobile_app,email,unknown,Liverpool,2025-01-13,2025-01-15
1df05d18,502cf0ee-224a-46,2025-05-18,2025-05-20,AirPods,d633,159.99,website,affiliate,unknown,Manchester,2025-05-18,2025-05-20
98af5cca,243012da-b185-4e,2025-04-18,2025-04-22,Kindle Paperwhite,j877,129.99,website,direct,unknown,Manchester,2025-04-18,2025-04-22
8991b01a,6c4c450b-623a-40,2025-04-17,2025-04-22,iPhone 15,f521,899.99,website,search,desktop,Manchester,2025-04-17,2025-04-22
2ab7b2ef,ee4205ee-a52f-43,2025-03-07,2025-03-09,Smartwatch,h301,249.99,mobile_app,affiliate,desktop,London,2025-03-07,2025-03-09
9e91a71c,2fe5b140-23ea-49,2025-04-19,2025-04-22,iPhone 15,f521,899.99,website,affiliate,unknown,Glasgow,2025-04-19,2025-04-22
31f3f0c0,f3abea0d-5be9-4d,2025-04-22,2025-04-28,Accessory,m001,24.99,mobile_app,social,desktop,Manchester,2025-04-22,2025-04-28
68bd075b,8fc3d7d3-f6bd-40,2025-02-06,2025-02-08,AirPods,d633,159.99,website,affiliate,mobile,Manchester,2025-02-06,2025-02-08
2ad11fe8,b5cbe3f5-6a66-41,2025-01-16,2025-01-17,AirPods,d633,159.99,website,affiliate,mobile,Leicester,2025-01-16,2025-01-17
2ad11fe8,b5cbe3f5-6a66-41,2025-01-16,2025-01-22,Smartwatch,h301,249.99,mobile_app,direct,mobile,Liverpool,2025-01-16,2025-01-22
085eb489,cbbed980-07e6-4c,2025-04-11,2025-04-15,Smartwatch,h301,249.99,mobile_app,search,mobile,Glasgow,2025-04-11,2025-04-15
90ce77e9,49e64c22-89a0-47,2025-01-21,2025-01-25,PS5,a245,479.99,website,direct,mobile,Leeds,2025-01-21,2025-01-25
929d6377,7eccdaf4-c413-4d,2025-04-24,2025-04-25,PS5,a245,479.99,mobile_app,affiliate,mobile,Birmingham,2025-04-24,2025-04-25
8ac35ac4,8b0901ab-c66d-4e,2025-04-18,2025-04-19,AirPods,d633,159.99,website,email,desktop,London,2025-04-18,2025-04-19
8ac35ac4,8b0901ab-c66d-4e,2025-04-18,2025-04-20,MacBook Air,g770,1199.99,website,search,desktop,Manchester,2025-04-18,2025-04-20
37f25d36,c28fa16b-0aa6-4c,2025-05-12,2025-05-17,iPhone 15,f521,899.99,mobile_app,affiliate,mobile,,2025-05-12,2025-05-17
3f5e3b8c,bc69c155-1a37-46,2025-05-15,2025-05-17,Accessory,m001,24.99,mobile_app,direct,desktop,Leeds,2025-05-15,2025-05-17
3f5e3b8c,bc69c155-1a37-46,2025-05-15,2025-05-18,PS5,a245,479.99,website,direct,mobile,Manchester,2025-05-15,2025-05-18
dcb91d5f,0840405a-ffd2-44,2025-01-27,2025-02-02,Google Pixel 8,i920,699.99,mobile_app,email,mobile,Glasgow,2025-01-27,2025-02-02
dcb91d5f,0840405a-ffd2-44,2025-01-27,2025-01-28,Steam Deck,c912,499.99,website,social,unknown,Birmingham,2025-01-27,2025-01-28
cfd7f3b9,dd83ad03-7066-42,2025-03-24,03-28-2025,Google Pixel 8,i920,699.99,website,affiliate,mobile,Manchester,2025-03-24,2025-03-28
dc6dafff,bcd4344f-cf8a-46,2025-01-01,2025-01-05,Nintendo Switch,e682,299.99,website,email,unknown,London,2025-01-01,2025-01-05
c8ebe27a,6d9c5b50-a1fd-41,2025-01-18,2025-01-23,Accessory,m001,24.99,mobile_app,direct,desktop,Glasgow,2025-01-18,2025-01-23
88438de2,ce315937-34fa-42,2025-01-11,2025-01-13,Nintendo Switch,e682,299.99,website,email,,London,2025-01-11,2025-01-13
4aea1b8f,2b1ac76c-89ec-4c,2025-04-02,2025-04-03,Smartwatch,h301,249.99,mobile_app,social,,Liverpool,2025-04-02,2025-04-03
e67093a0,f3d04ffb-4470-48,04-04-2025,2025-04-10,Smartwatch,h301,249.99,mobile_app,affiliate,unknown,Manchester,2025-04-04,2025-04-10
695e5ea9,22b5f457-1860-4d,2025-02-24,02-28-2025,Google Pixel 8,i920,699.99,website,email,mobile,Glasgow,2025-02-24,2025-02-28
695e5ea9,22b5f457-1860-4d,2025-02-24,2025-02-26,iPhone 15,f521,899.99,mobile_app,affiliate,mobile,Nottingham,2025-02-24,2025-02-26
695e5ea9,22b5f457-1860-4d,2025-02-24,2025-02-28,Smartwatch,h301,249.99,mobile_app,direct,mobile,London,2025-02-24,2025-02-28
b390b059,46feacd4-fe13-43,2025-01-27,2025-01-28,Kindle Paperwhite,j877,129.99,website,affiliate,desktop,Manchester,2025-01-27,2025-01-28
3f5fbf4f,257035db-3fea-49,2025-05-15,2025-05-18,Accessory,m001,24.99,mobile_app,search,desktop,Glasgow,2025-05-15,2025-05-18
a1e518a2,64880945-ad1d-45,05-05-2025,2025-05-06,Google Pixel 8,i920,699.99,mobile_app,search,mobile,Sheffield,2025-05-05,2025-05-06
cb6ad0c7,600b4b35-6a0a-47,2025-05-04,05-10-2025,Google Pixel 8,i920,699.99,mobile_app,search,desktop,Leicester,2025-05-04,2025-05-10
b1d81887,67213a70-17d5-4f,2025-01-27,2025-01-30,Smartwatch,h301,249.99,website,social,unknown,Nottingham,2025-01-27,2025-01-30
94fb09f0,7466ef02-5e7b-42,2025-03-16,2025-03-21,Nintendo Switch,e682,299.99,website,affiliate,mobile,Leeds,2025-03-16,2025-03-21
f8ded777,d8dff535-c62d-4a,2025-04-13,2025-04-15,Xbox Series X,b104,499.99,website,direct,desktop,Glasgow,2025-04-13,2025-04-15
f8ded777,d8dff535-c62d-4a,2025-04-13,2025-04-17,Nintendo Switch,e682,299.99,website,social,desktop,Leeds,2025-04-13,2025-04-17
f8ded777,d8dff535-c62d-4a,13-04-2025,2025-04-15,Accessory,m001,24.99,mobile_app,email,unknown,Liverpool,2025-04-13,2025-04-15
cbb18c79,b28187c4-aa05-44,2025-03-13,2025-03-14,PS5,a245,479.99,mobile_app,search,mobile,Manchester,2025-03-13,2025-03-14
7ea5a387,f7d7465d-37c3-43,2025-03-12,2025-03-15,Google Pixel 8,i920,699.99,mobile_app,search,mobile,Manchester,2025-03-12,2025-03-15
216e9fe5,48998e5f-d40e-43,2025-04-01,2025-04-07,Nintendo Switch,e682,299.99,mobile_app,affiliate,mobile,Glasgow,2025-04-01,2025-04-07
216e9fe5,48998e5f-d40e-43,2025-04-01,04-03-2025,Xbox Series X,b104,499.99,website,affiliate,unknown,,2025-04-01,2025-04-03
c3231466,c9ce44bd-7c3f-4a,2025-04-11,2025-04-14,PS5,a245,479.99,mobile_app,social,mobile,Manchester,2025-04-11,2025-04-14
042b03ca,a04d4d14-197d-4a,2025-04-24,2025-04-18,MacBook Air,g770,1199.99,mobile_app,search,unknown,Glasgow,2025-04-24,2025-04-18
042b03ca,a04d4d14-197d-4a,2025-04-18,2025-04-19,Smartwatch,h301,249.99,website,email,mobile,Glasgow,2025-04-18,2025-04-19
fde91c42,28719b9b-db8f-4e,2025-02-21,2025-02-26,Xbox Series X,b104,499.99,mobile_app,affiliate,mobile,Manchester,2025-02-21,2025-02-26
e1d46f82,fee5ce69-33cb-40,2025-04-22,2025-04-28,iPhone 15,f521,899.99,website,affiliate,unknown,Manchester,2025-04-22,2025-04-28
e1d46f82,fee5ce69-33cb-40,2025-04-22,2025-04-25,Smartwatch,h301,249.99,mobile_app,affiliate,mobile,Nottingham,2025-04-22,2025-04-25
17e52113,dfda35b2-28b2-4f,13-04-2025,2025-04-16,AirPods,d633,159.99,mobile_app,,unknown,London,2025-04-13,2025-04-16
17e52113,dfda35b2-28b2-4f,2025-04-13,2025-04-14,Accessory,m001,24.99,website,direct,mobile,Manchester,2025-04-13,2025-04-14
a61f0b96,1519830c-4019-43,05-04-2025,2025-04-08,Smartwatch,h301,249.99,mobile_app,social,unknown,Leeds,2025-04-05,2025-04-08
c156e501,a0279a18-6576-44,2025-05-12,2025-05-13,Accessory,m001,24.99,website,social,desktop,Nottingham,2025-05-12,2025-05-13
36a2c52b,1758d47e-a7cd-41,2025-04-12,2025-04-18,MacBook Air,g770,1199.99,mobile_app,search,mobile,Glasgow,2025-04-12,2025-04-18
36a2c52b,1758d47e-a7cd-41,2025-04-12,2025-04-17,Nintendo Switch,e682,299.99,website,affiliate,mobile,Liverpool,2025-04-12,2025-04-17
71efe72a,97fb613a-21f8-4d,2025-03-06,2025-03-10,Google Pixel 8,i920,699.99,website,search,,Glasgow,2025-03-06,2025-03-10
dc3f42e0,57f479b5-b212-46,2025-03-27,2025-03-29,Nintendo Switch,e682,299.99,website,direct,desktop,Glasgow,2025-03-27,2025-03-29
16de66c9,7a4a902f-21d6-4b,2025-04-19,04-20-2025,Steam Deck,c912,499.99,mobile_app,affiliate,mobile,Bristol,2025-04-19,2025-04-20
4c9bff5c,1a6b6a7d-1a38-4a,2025-03-15,2025-03-18,Steam Deck,c912,499.99,mobile_app,social,unknown,Leeds,2025-03-15,2025-03-18
a43e558c,d038e153-c601-41,2025-06-16,2025-06-22,MacBook Air,g770,1199.99,website,affiliate,desktop,Leicester,2025-06-16,2025-06-22
9c3de1b0,11836c4f-2492-44,2025-01-17,2025-01-21,iPhone 15,f521,899.99,mobile_app,direct,mobile,Liverpool,2025-01-17,2025-01-21
bf8e8bfa,59e7703a-70aa-4b,2025-01-06,2025-01-11,Kindle Paperwhite,j877,129.99,mobile_app,email,desktop,Manchester,2025-01-06,2025-01-11
bf8e8bfa,59e7703a-70aa-4b,2025-01-06,2025-01-12,AirPods,d633,159.99,website,email,desktop,Manchester,2025-01-06,2025-01-12
379d58f9,9db7284b-6965-41,23-02-2025,2025-02-24,MacBook Air,g770,1199.99,website,search,desktop,Manchester,2025-02-23,2025-02-24
379d58f9,9db7284b-6965-41,2025-02-23,2025-03-01,Steam Deck,c912,499.99,website,direct,mobile,London,2025-02-23,2025-03-01
379d58f9,9db7284b-6965-41,2025-02-23,2025-02-27,Accessory,m001,24.99,website,affiliate,mobile,Birmingham,2025-02-23,2025-02-27
bae1e137,23d7e6a1-19b8-44,2025-04-10,2025-04-16,Xbox Series X,b104,499.99,website,search,desktop,Glasgow,2025-04-10,2025-04-16
3f6eed9d,6dec6bbd-f697-47,2025-05-09,2025-05-12,Steam Deck,c912,499.99,mobile_app,email,mobile,London,2025-05-09,2025-05-12
b89f3a92,3f87dfc2-1591-42,2025-06-15,2025-06-18,MacBook Air,g770,1199.99,mobile_app,email,desktop,Leicester,2025-06-15,2025-06-18
d8d994b8,f0f7ad22-c76a-4e,08-06-2025,2025-06-11,Smartwatch,h301,249.99,mobile_app,search,desktop,London,2025-06-08,2025-06-11
304b2370,34981735-4d38-44,2025-04-25,2025-04-30,Nintendo Switch,e682,299.99,mobile_app,search,unknown,Glasgow,2025-04-25,2025-04-30
cb35097a,a56b61e0-4ba8-44,2025-01-08,2025-01-13,Kindle Paperwhite,j877,129.99,mobile_app,email,unknown,Leeds,2025-01-08,2025-01-13
a3595d1f,62c965b2-7eb0-46,2025-05-04,2025-05-08,PS5,a245,479.99,website,email,mobile,Birmingham,2025-05-04,2025-05-08
5c70ee97,e3837348-873d-48,02-03-2025,2025-03-05,Accessory,m001,24.99,mobile_app,email,unknown,Manchester,2025-03-02,2025-03-05
6bbdb66f,6307d4d1-21c9-41,2025-03-06,2025-03-09,Accessory,m001,24.99,website,direct,unknown,London,2025-03-06,2025-03-09
fcc4091b,2c3aacdc-aed5-4a,2025-04-13,2025-04-14,Steam Deck,c912,499.99,mobile_app,email,unknown,Sheffield,2025-04-13,2025-04-14
373aedf8,965d744f-0445-41,2025-06-27,2025-07-03,Xbox Series X,b104,499.99,website,social,mobile,Liverpool,2025-06-27,2025-07-03
495743a2,f2dcb12b-0f7a-43,2025-01-02,2025-01-06,AirPods,d633,159.99,mobile_app,social,unknown,Leeds,2025-01-02,2025-01-06
66fba71d,c4615234-8044-4e,2025-01-02,01-07-2025,Nintendo Switch,e682,299.99,website,email,unknown,Birmingham,2025-01-02,2025-01-07
15669e36,89a3c811-895c-4f,2025-02-02,2025-02-08,Steam Deck,c912,499.99,mobile_app,email,unknown,London,2025-02-02,2025-02-08
27c6cbb1,ebc1bb52-82e4-4d,2025-06-23,2025-06-25,AirPods,d633,159.99,website,email,desktop,Bristol,2025-06-23,2025-06-25
27c6cbb1,ebc1bb52-82e4-4d,2025-06-23,2025-06-25,Smartwatch,h301,249.99,mobile_app,search,desktop,London,2025-06-23,2025-06-25
a65be22b,9620bee6-6406-4a,09-02-2025,2025-02-12,Accessory,m001,24.99,website,,mobile,Manchester,2025-02-09,2025-02-12
f413db19,4f67448e-10ec-4b,2025-02-19,02-25-2025,Steam Deck,c912,499.99,mobile_app,social,mobile,Glasgow,2025-02-19,2025-02-25
1db14bfc,3e9639ba-0ed2-4c,23-05-2025,2025-05-26,iPhone 15,f521,899.99,mobile_app,social,desktop,Liverpool,2025-05-23,2025-05-26
a8761e85,0e165b12-9bdc-40,2025-05-22,05-23-2025,Smartwatch,h301,249.99,website,social,desktop,Manchester,2025-05-22,2025-05-23
02e7df89,033e02f7-1e93-41,14-02-2025,2025-02-15,Google Pixel 8,i920,699.99,mobile_app,search,mobile,Liverpool,2025-02-14,2025-02-15
d28fcf68,58c1aad6-f3f8-4e,2025-04-04,2025-04-05,MacBook Air,g770,1199.99,website,direct,desktop,Manchester,2025-04-04,2025-04-05
d28fcf68,58c1aad6-f3f8-4e,2025-04-04,2025-04-08,iPhone 15,f521,899.99,mobile_app,direct,mobile,Leeds,2025-04-04,2025-04-08
df9b141e,5f32d5d8-2abe-45,2025-04-15,2025-04-14,Xbox Series X,b104,499.99,mobile_app,email,unknown,Bristol,2025-04-15,2025-04-14
55c34853,1e38f711-e2ec-43,2025-04-09,2025-04-12,Xbox Series X,b104,499.99,website,affiliate,mobile,Birmingham,2025-04-09,2025-04-12
55c34853,1e38f711-e2ec-43,2025-04-09,2025-04-11,AirPods,d633,159.99,website,search,desktop,London,2025-04-09,2025-04-11
f99cea5c,861b4f5b-45a0-45,2025-04-26,2025-04-27,Smartwatch,h301,249.99,website,search,mobile,Birmingham,2025-04-26,2025-04-27
0e3141ec,7f0386fa-13ba-4c,2025-05-24,2025-05-28,Accessory,m001,24.99,mobile_app,social,mobile,Liverpool,2025-05-24,2025-05-28
c5f8e2f8,2ab8bd33-911f-43,2025-02-25,2025-02-26,MacBook Air,g770,1199.99,website,search,desktop,Manchester,2025-02-25,2025-02-26
bda3c162,ac93281a-92eb-4a,2025-05-11,2025-05-12,iPhone 15,f521,899.99,mobile_app,search,desktop,London,2025-05-11,2025-05-12
bda3c162,ac93281a-92eb-4a,2025-05-11,2025-05-17,Nintendo Switch,e682,299.99,website,direct,desktop,Liverpool,2025-05-11,2025-05-17
0bc57207,dbd30aec-0b46-41,2025-05-15,2025-05-18,iPhone 15,f521,899.99,website,affiliate,mobile,Sheffield,2025-05-15,2025-05-18
f5d8fb91,eb93f78c-620a-41,2025-03-24,2025-03-29,Google Pixel 8,i920,699.99,mobile_app,direct,desktop,Nottingham,2025-03-24,2025-03-29
a7dc2bc0,cd98f9e2-8d88-4b,2025-04-26,2025-04-29,Nintendo Switch,e682,299.99,mobile_app,social,unknown,,2025-04-26,2025-04-29
51e744e4,3f8e2d0d-5261-4d,2025-05-23,2025-05-28,Google Pixel 8,i920,699.99,mobile_app,social,unknown,Manchester,2025-05-23,2025-05-28
51e744e4,3f8e2d0d-5261-4d,2025-05-23,05-26-2025,Xbox Series X,b104,499.99,mobile_app,email,desktop,Manchester,2025-05-23,2025-05-26
ac5f12ef,92502e59-13f0-48,2025-04-01,04-05-2025,Xbox Series X,b104,499.99,website,direct,desktop,London,2025-04-01,2025-04-05
0bc1f9e5,3922a7e4-2de9-42,25-04-2025,2025-04-27,Xbox Series X,b104,499.99,website,search,unknown,London,2025-04-25,2025-04-27
c605e58a,e0827f76-11a5-49,2025-05-12,2025-05-13,Xbox Series X,b104,499.99,mobile_app,affiliate,mobile,Leicester,2025-05-12,2025-05-13
5e717fca,161d5c87-53c9-4e,2025-04-07,2025-04-10,Accessory,m001,24.99,website,search,desktop,Glasgow,2025-04-07,2025-04-10
3e19fc1d,c8d57717-9055-43,18-04-2025,2025-04-19,Accessory,m001,24.99,website,affiliate,unknown,Glasgow,2025-04-18,2025-04-19
c6a07656,f8cbab4c-9779-4e,2025-01-07,2025-01-11,PS5,a245,479.99,mobile_app,social,desktop,Leeds,2025-01-07,2025-01-11
c6a07656,f8cbab4c-9779-4e,2025-01-07,2025-01-10,Google Pixel 8,i920,699.99,mobile_app,direct,,London,2025-01-07,2025-01-10
268b84b6,8beb4e78-e683-43,2025-05-16,2025-05-22,Accessory,m001,24.99,website,email,mobile,London,2025-05-16,2025-05-22
268b84b6,8beb4e78-e683-43,2025-05-16,2025-05-17,Accessory,m001,24.99,mobile_app,search,unknown,Liverpool,2025-05-16,2025-05-17
a2cd1590,061efb95-68f8-40,2025-04-04,2025-04-08,Xbox Series X,b104,499.99,website,search,unknown,Birmingham,2025-04-04,2025-04-08
c2492e5e,0274ce40-e090-46,2025-03-24,2025-03-25,Kindle Paperwhite,j877,129.99,mobile_app,affiliate,desktop,Sheffield,2025-03-24,2025-03-25
34879e41,bcf2fc3b-d958-44,2025-04-06,2025-04-08,Smartwatch,h301,249.99,website,email,unknown,Glasgow,2025-04-06,2025-04-08
f8f9a45d,6b790d01-3cf8-4d,2025-04-22,2025-04-25,Steam Deck,c912,499.99,mobile_app,email,desktop,Glasgow,2025-04-22,2025-04-25
3b41c943,47a2a10b-b62e-4b,2025-01-13,2025-01-18,Nintendo Switch,e682,299.99,mobile_app,direct,,Manchester,2025-01-13,2025-01-18
755d814b,69be173a-850e-40,2025-04-12,2025-04-15,Smartwatch,h301,249.99,website,affiliate,desktop,Manchester,2025-04-12,2025-04-15
a3209116,94ad6252-15bc-4a,2025-02-06,2025-02-07,Accessory,m001,24.99,website,search,unknown,London,2025-02-06,2025-02-07
a995ecc3,97867b12-1328-47,10-02-2025,2025-02-12,Smartwatch,h301,249.99,website,search,desktop,Manchester,2025-02-10,2025-02-12
ed1115d7,4aab47b2-3c9d-42,2025-03-12,03-15-2025,PS5,a245,479.99,website,social,mobile,Glasgow,2025-03-12,2025-03-15
73e7f042,d4f76322-b362-40,2025-04-04,2025-04-08,AirPods,d633,159.99,website,affiliate,desktop,Manchester,2025-04-04,2025-04-08
c5285425,f18cccdc-131e-47,2025-05-23,2025-05-26,Nintendo Switch,e682,299.99,mobile_app,email,mobile,Leeds,2025-05-23,2025-05-26
50647c59,1b0c62eb-27c8-4c,2025-04-26,2025-04-27,PS5,a245,479.99,website,affiliate,desktop,Liverpool,2025-04-26,2025-04-27
50647c59,1b0c62eb-27c8-4c,2025-04-26,2025-05-02,Accessory,m001,24.99,website,email,mobile,Glasgow,2025-04-26,2025-05-02
73b0d676,5bb8b9c8-8932-49,2025-03-09,2025-03-14,Smartwatch,h301,249.99,mobile_app,affiliate,mobile,Manchester,2025-03-09,2025-03-14
cebeabaa,da3c45ca-43d7-4f,2025-01-21,2025-01-23,iPhone 15,f521,899.99,website,social,mobile,London,2025-01-21,2025-01-23
370b9a29,b46788bd-d38e-43,2025-02-25,2025-02-28,Smartwatch,h130,249.99,mobile_app,social,mobile,London,2025-02-25,2025-02-28
f7e9101d,25f88c74-53ea-49,2025-03-04,2025-03-06,Accessory,m001,24.99,website,direct,unknown,Glasgow,2025-03-04,2025-03-06
d1f16485,0c880714-8372-47,2025-04-11,2025-04-13,Nintendo Switch,e682,299.99,website,social,unknown,Liverpool,2025-04-11,2025-04-13
d1f16485,0c880714-8372-47,2025-04-11,2025-04-16,Smartwatch,h301,249.99,mobile_app,direct,unknown,Glasgow,2025-04-11,2025-04-16
8e52fc42,f3bc9a71-07f4-4e,2025-02-27,2025-03-02,MacBook Air,07g7,1199.99,website,,mobile,London,2025-02-27,2025-03-02
cb371d97,183fea70-3ff6-47,2025-02-02,02-03-2025,Smartwatch,h301,249.99,mobile_app,social,desktop,Glasgow,2025-02-02,2025-02-03
38e7e019,0fc98d2e-030f-4b,2025-01-12,2025-01-15,PS5,a245,479.99,mobile_app,affiliate,unknown,Manchester,2025-01-12,2025-01-15
f004e897,668c879b-d2dc-42,2025-06-05,2025-06-10,Accessory,m001,24.99,website,email,unknown,Glasgow,2025-06-05,2025-06-10
f004e897,668c879b-d2dc-42,2025-06-05,2025-06-11,Google Pixel 8,i920,699.99,website,social,unknown,Birmingham,2025-06-05,2025-06-11
f004e897,668c879b-d2dc-42,2025-06-05,2025-06-09,Steam Deck,c912,499.99,mobile_app,social,desktop,Glasgow,2025-06-05,2025-06-09
13325c31,960be0f4-9513-4c,2025-05-17,2025-05-22,Google Pixel 8,092i,699.99,website,affiliate,unknown,Manchester,2025-05-17,2025-05-22
cf2e3296,329fc417-1081-4d,26-02-2025,2025-03-03,Xbox Series X,b104,499.99,mobile_app,social,desktop,Liverpool,2025-02-26,2025-03-03
1f5df912,d8e70aeb-e7b3-40,2025-03-13,2025-03-17,PS5,a245,479.99,mobile_app,direct,mobile,Leeds,2025-03-13,2025-03-17
6ee35607,0cf697a5-7603-43,2025-03-11,2025-03-12,AirPods,d633,159.99,website,search,unknown,Manchester,2025-03-11,2025-03-12
6d39da75,7f0223bc-651e-42,2025-06-24,2025-06-28,MacBook Air,g770,1199.99,website,affiliate,mobile,Birmingham,2025-06-24,2025-06-28
722dce13,e886a011-36f7-42,2025-01-14,2025-01-19,Smartwatch,h301,249.99,mobile_app,affiliate,mobile,Manchester,2025-01-14,2025-01-19
a5b40983,9d3616a1-08de-49,2025-01-20,01-23-2025,Smartwatch,h301,249.99,website,social,unknown,Manchester,2025-01-20,2025-01-23
1674eb65,e1fdc6d1-6978-42,2025-03-06,2025-03-07,Accessory,m001,24.99,website,social,mobile,Glasgow,2025-03-06,2025-03-07
cc152a1b,6b52f93c-2321-46,2025-04-21,2025-04-26,Nintendo Switch,e682,299.99,website,affiliate,unknown,Nottingham,2025-04-21,2025-04-26
04ffeab2,fe7c80e9-a179-4e,2025-06-18,2025-06-24,Kindle Paperwhite,j877,129.99,mobile_app,search,unknown,Glasgow,2025-06-18,2025-06-24
c80c2195,b69f75c5-c82b-41,2025-04-03,2025-04-09,Steam Deck,c912,499.99,mobile_app,email,mobile,Manchester,2025-04-03,2025-04-09
453b45fe,90ce82e8-e9a5-43,2025-02-11,2025-02-13,Nintendo Switch,e682,299.99,mobile_app,email,unknown,Birmingham,2025-02-11,2025-02-13
cf89569d,98dc9e0b-51a1-45,2025-06-18,2025-06-23,Kindle Paperwhite,j877,129.99,mobile_app,email,unknown,Liverpool,2025-06-18,2025-06-23
5b80b8d1,cf03f0c8-0eff-45,2025-06-16,2025-06-17,Smartwatch,h301,249.99,website,direct,desktop,Glasgow,2025-06-16,2025-06-17
3f738f50,3b964c74-ffe6-49,27-03-2025,2025-03-30,iPhone 15,f521,899.99,mobile_app,search,unknown,Leicester,2025-03-27,2025-03-30
bcaff931,889fe107-443b-4d,25-02-2025,03-03-2025,iPhone 15,f521,899.99,website,affiliate,desktop,Bristol,2025-02-25,2025-03-03
fb8fe8c4,f2a32efd-ff13-4c,2025-02-18,2025-02-20,Smartwatch,h301,249.99,mobile_app,,mobile,Leicester,2025-02-18,2025-02-20
2c78644f,ef69a980-5ad4-49,2025-05-27,2025-05-29,Kindle Paperwhite,j877,129.99,website,affiliate,mobile,London,2025-05-27,2025-05-29
5bd93609,5168bbf2-97af-4b,2025-03-16,2025-03-20,Steam Deck,c912,499.99,website,email,desktop,Nottingham,2025-03-16,2025-03-20
91519998,b4157cea-0738-4b,2025-02-08,2025-02-09,MacBook Air,g770,1199.99,website,social,mobile,Leeds,2025-02-08,2025-02-09
91519998,b4157cea-0738-4b,2025-02-13,2025-02-08,Accessory,m001,24.99,website,social,desktop,London,2025-02-13,2025-02-08
cf767343,f2c84743-9027-47,2025-04-17,2025-04-23,Google Pixel 8,290i,699.99,website,search,mobile,Manchester,2025-04-17,2025-04-23
09b7fdf7,8ac8ad93-7e02-42,2025-05-22,2025-05-26,Kindle Paperwhite,j877,129.99,website,search,desktop,Glasgow,2025-05-22,2025-05-26
7a5d7c82,9a069295-3b8d-44,2025-05-10,2025-05-11,Xbox Series X,b104,499.99,mobile_app,search,unknown,Leeds,2025-05-10,2025-05-11
7a5d7c82,9a069295-3b8d-44,2025-05-10,2025-05-15,iPhone 15,f521,899.99,mobile_app,social,unknown,Manchester,2025-05-10,2025-05-15
573bfc17,9d37efb6-eafb-4e,2025-02-23,2025-02-26,Steam Deck,c912,499.99,mobile_app,email,mobile,Birmingham,2025-02-23,2025-02-26
573bfc17,9d37efb6-eafb-4e,2025-02-25,2025-02-23,Smartwatch,h301,249.99,website,social,unknown,Manchester,2025-02-25,2025-02-23
0f3f0f48,cd6bb03b-eb35-47,2025-01-03,2025-01-06,Google Pixel 8,i920,699.99,mobile_app,search,unknown,Bristol,2025-01-03,2025-01-06
1c654aa2,b466fab6-962c-44,2025-06-22,2025-06-24,Steam Deck,c912,499.99,website,search,unknown,London,2025-06-22,2025-06-24
b45c9a54,5d696bc8-dc54-45,2025-06-25,2025-07-01,AirPods,d633,159.99,mobile_app,direct,unknown,Leeds,2025-06-25,2025-07-01
b45c9a54,5d696bc8-dc54-45,2025-06-25,2025-06-27,Accessory,m001,24.99,mobile_app,affiliate,mobile,London,2025-06-25,2025-06-27
52961fb3,96053035-6545-40,2025-05-03,2025-05-07,Google Pixel 8,i920,699.99,mobile_app,search,mobile,Manchester,2025-05-03,2025-05-07
a3a6ef83,bb7b6c05-2852-4c,2025-03-17,2025-03-18,MacBook Air,g770,1199.99,website,affiliate,mobile,Leeds,2025-03-17,2025-03-18
8fddbebc,51397c06-a630-4d,2025-04-27,2025-04-28,Xbox Series X,b104,499.99,website,direct,mobile,London,2025-04-27,2025-04-28
aa604892,9d1c0838-edc8-4c,2025-06-26,2025-06-29,Xbox Series X,b104,499.99,mobile_app,direct,desktop,Bristol,2025-06-26,2025-06-29
aa604892,9d1c0838-edc8-4c,2025-06-26,2025-06-28,AirPods,d633,159.99,website,email,mobile,Manchester,2025-06-26,2025-06-28
4b657bcc,60ddc7f1-2ce3-48,09-02-2025,2025-02-14,PS5,a245,479.99,website,,mobile,Manchester,2025-02-09,2025-02-14
92a54d04,0075d3d5-ba94-4a,2025-02-24,2025-03-01,Steam Deck,c912,499.99,mobile_app,affiliate,mobile,London,2025-02-24,2025-03-01
92a54d04,0075d3d5-ba94-4a,24-02-2025,2025-02-28,MacBook Air,g770,1199.99,mobile_app,search,desktop,Sheffield,2025-02-24,2025-02-28
92a54d04,0075d3d5-ba94-4a,2025-02-24,2025-03-02,Nintendo Switch,e682,299.99,mobile_app,direct,unknown,Glasgow,2025-02-24,2025-03-02
2e9ce8ff,c55523ed-fe89-46,2025-04-03,2025-04-05,Smartwatch,h301,249.99,mobile_app,search,unknown,London,2025-04-03,2025-04-05
a3bfe403,cf0df860-ebc9-49,2025-02-09,2025-02-07,Kindle Paperwhite,j877,129.99,website,email,mobile,Bristol,2025-02-09,2025-02-07
a3bfe403,cf0df860-ebc9-49,2025-02-07,2025-02-13,Xbox Series X,b104,499.99,website,direct,desktop,Sheffield,2025-02-07,2025-02-13
13eb22c9,7f05fbf5-efca-45,04-03-2025,2025-03-05,Google Pixel 8,i920,699.99,mobile_app,affiliate,,Liverpool,2025-03-04,2025-03-05
13eb22c9,7f05fbf5-efca-45,2025-03-04,2025-03-09,AirPods,d633,159.99,mobile_app,direct,desktop,Bristol,2025-03-04,2025-03-09
f68c62e6,51cbf9e5-fb7d-4b,2025-02-08,2025-02-11,Kindle Paperwhite,j877,129.99,website,email,,Manchester,2025-02-08,2025-02-11
55f3ad50,ab86bafd-b57e-48,2025-05-14,2025-05-15,Xbox Series X,4b10,499.99,website,email,unknown,Manchester,2025-05-14,2025-05-15
59b9222c,35adde88-43e4-46,2025-06-05,2025-06-11,Nintendo Switch,e682,299.99,mobile_app,social,unknown,London,2025-06-05,2025-06-11
702f31e5,b86d066b-1ba8-47,2025-05-04,2025-05-07,Google Pixel 8,i920,699.99,website,email,unknown,Birmingham,2025-05-04,2025-05-07
e1bbb8cd,2a9527f6-f817-4e,2025-04-03,2025-04-05,Steam Deck,c912,499.99,website,search,desktop,Glasgow,2025-04-03,2025-04-05
e1bbb8cd,2a9527f6-f817-4e,2025-04-03,2025-04-08,MacBook Air,g770,1199.99,mobile_app,affiliate,mobile,London,2025-04-03,2025-04-08
c9ea356a,6016c743-8bc8-4a,2025-03-13,2025-03-15,Steam Deck,c912,499.99,mobile_app,email,mobile,Manchester,2025-03-13,2025-03-15
7387928a,c21c3fb3-a6a5-40,2025-05-25,2025-05-27,AirPods,d633,159.99,mobile_app,search,unknown,Glasgow,2025-05-25,2025-05-27
42d943ee,088dbd82-d883-43,2025-03-25,2025-03-26,Nintendo Switch,e682,299.99,mobile_app,social,desktop,Nottingham,2025-03-25,2025-03-26
29310971,5780be17-12fe-4c,2025-03-20,2025-03-25,Accessory,m001,24.99,website,affiliate,unknown,Manchester,2025-03-20,2025-03-25
5683ede0,f11c0ac5-8c0b-49,2025-04-12,2025-04-16,iPhone 15,f521,899.99,website,social,mobile,Manchester,2025-04-12,2025-04-16
6e6b34b9,e4aa786d-9d17-42,05-04-2025,2025-04-11,Google Pixel 8,i920,699.99,mobile_app,affiliate,unknown,Leeds,2025-04-05,2025-04-11
0db5d441,9b792afa-2a3d-41,2025-05-05,2025-05-10,iPhone 15,f521,899.99,mobile_app,social,desktop,Birmingham,2025-05-05,2025-05-10
8dda4ff2,f9722cc1-349e-44,2025-02-16,2025-02-22,AirPods,d633,159.99,website,email,,Bristol,2025-02-16,2025-02-22
8dda4ff2,f9722cc1-349e-44,2025-02-16,2025-02-17,PS5,a245,479.99,website,,unknown,Leeds,2025-02-16,2025-02-17
4c2272f3,8a45a905-badf-43,2025-05-21,2025-05-27,Nintendo Switch,e682,299.99,website,direct,unknown,Glasgow,2025-05-21,2025-05-27
4c2272f3,8a45a905-badf-43,2025-05-21,2025-05-23,Accessory,01m0,24.99,mobile_app,affiliate,desktop,Manchester,2025-05-21,2025-05-23
4c2272f3,8a45a905-badf-43,21-05-2025,2025-05-27,Google Pixel 8,i920,699.99,mobile_app,affiliate,unknown,London,2025-05-21,2025-05-27
7daec949,64953d5f-0cb4-48,2025-05-27,2025-05-29,Accessory,m001,24.99,website,social,unknown,Manchester,2025-05-27,2025-05-29
d2eaef18,00fa0eb4-5c5f-48,2025-02-10,2025-02-11,iPhone 15,f521,899.99,website,affiliate,desktop,Glasgow,2025-02-10,2025-02-11
34fadee1,7af6cd41-99a7-49,15-06-2025,2025-06-18,Xbox Series X,b104,499.99,website,search,desktop,Birmingham,2025-06-15,2025-06-18
1d91fe39,fa207403-4ab4-47,2025-01-01,2025-01-05,AirPods,d633,159.99,mobile_app,social,unknown,Birmingham,2025-01-01,2025-01-05
1d91fe39,fa207403-4ab4-47,2025-01-01,2025-01-05,MacBook Air,g770,1199.99,mobile_app,affiliate,mobile,Manchester,2025-01-01,2025-01-05
43d75413,788fd0cd-65c0-4b,2025-03-02,2025-03-03,Accessory,m001,24.99,website,search,desktop,Birmingham,2025-03-02,2025-03-03
43d75413,788fd0cd-65c0-4b,02-03-2025,2025-03-03,Kindle Paperwhite,j877,129.99,website,email,unknown,Birmingham,2025-03-02,2025-03-03
43d75413,788fd0cd-65c0-4b,2025-03-02,2025-03-05,PS5,a245,479.99,mobile_app,search,desktop,London,2025-03-02,2025-03-05
61a66444,6334fa2a-8b4b-47,2025-04-07,2025-04-11,AirPods,d633,159.99,mobile_app,social,unknown,Liverpool,2025-04-07,2025-04-11
61a66444,6334fa2a-8b4b-47,2025-04-07,2025-04-11,Nintendo Switch,e682,299.99,website,search,desktop,London,2025-04-07,2025-04-11
436e3c49,0b6c03c8-721e-44,2025-01-09,2025-01-15,Xbox Series X,b104,499.99,mobile_app,search,mobile,London,2025-01-09,2025-01-15
b24beb96,907276ea-44c0-4a,03-06-2025,2025-06-05,Accessory,m001,24.99,mobile_app,email,desktop,Manchester,2025-06-03,2025-06-05
69fb0763,ab0b4cc5-15f0-4a,2025-04-13,2025-04-18,Google Pixel 8,i920,699.99,website,affiliate,desktop,Sheffield,2025-04-13,2025-04-18
69fb0763,ab0b4cc5-15f0-4a,2025-04-13,2025-04-18,Nintendo Switch,e682,299.99,mobile_app,search,unknown,Glasgow,2025-04-13,2025-04-18
6319629b,3a3e46b0-96f8-4f,2025-02-04,2025-02-07,PS5,a245,479.99,website,email,desktop,London,2025-02-04,2025-02-07
efb56207,f7336094-6b2b-48,2025-05-08,2025-05-14,MacBook Air,g770,1199.99,website,direct,desktop,Leeds,2025-05-08,2025-05-14
6511e61a,3c53090e-e1b4-41,2025-05-23,2025-05-28,Steam Deck,c912,499.99,mobile_app,direct,desktop,Manchester,2025-05-23,2025-05-28
844e250b,08e3f771-b6dc-4d,2025-05-25,2025-05-31,Xbox Series X,b104,499.99,website,search,mobile,Glasgow,2025-05-25,2025-05-31
f3025d16,fb95d0fc-ad72-4d,2025-03-05,2025-03-10,Accessory,m001,24.99,website,email,unknown,Birmingham,2025-03-05,2025-03-10
363e6ef4,f2f5b176-2c41-4b,2025-02-03,2025-02-06,PS5,524a,479.99,website,direct,unknown,Sheffield,2025-02-03,2025-02-06
363e6ef4,f2f5b176-2c41-4b,2025-02-03,2025-02-07,Kindle Paperwhite,j877,129.99,mobile_app,email,desktop,Manchester,2025-02-03,2025-02-07
aee14f87,0aeccec7-204d-49,2025-05-04,2025-05-10,Accessory,m001,24.99,website,affiliate,mobile,Glasgow,2025-05-04,2025-05-10
aee14f87,0aeccec7-204d-49,2025-05-04,2025-05-05,Kindle Paperwhite,j877,129.99,website,email,mobile,London,2025-05-04,2025-05-05
98550b1e,d2938e6e-ff4d-49,2025-04-08,2025-04-11,Smartwatch,h301,249.99,mobile_app,search,desktop,Manchester,2025-04-08,2025-04-11
98550b1e,d2938e6e-ff4d-49,2025-04-08,2025-04-13,Kindle Paperwhite,j877,129.99,mobile_app,email,mobile,Glasgow,2025-04-08,2025-04-13
16476e3f,ba236c22-e92a-4b,2025-05-19,2025-05-20,Xbox Series X,b104,499.99,mobile_app,direct,desktop,Glasgow,2025-05-19,2025-05-20
850a48d4,8d536c75-65b9-4e,2025-02-01,2025-02-05,Accessory,m001,24.99,mobile_app,email,desktop,Glasgow,2025-02-01,2025-02-05
966b62ea,032a461a-df9b-4c,2025-03-27,2025-04-02,Accessory,m001,24.99,mobile_app,social,mobile,London,2025-03-27,2025-04-02
910c4cb7,1cce08e9-6b6a-40,2025-03-14,03-17-2025,Smartwatch,h301,249.99,mobile_app,social,unknown,Glasgow,2025-03-14,2025-03-17
910c4cb7,1cce08e9-6b6a-40,14-03-2025,2025-03-16,PS5,a245,479.99,website,email,desktop,Manchester,2025-03-14,2025-03-16
1b0ae22e,f6ff3521-c225-45,2025-01-09,2025-01-11,Google Pixel 8,i920,699.99,mobile_app,affiliate,unknown,,2025-01-09,2025-01-11
e1509425,c926a021-19da-42,15-01-2025,2025-01-16,PS5,5a42,479.99,website,search,unknown,London,2025-01-15,2025-01-16
92701d60,439e754c-6930-46,2025-05-07,2025-05-12,MacBook Air,g770,1199.99,website,affiliate,unknown,Glasgow,2025-05-07,2025-05-12
92701d60,439e754c-6930-46,2025-05-07,2025-05-12,AirPods,d633,159.99,mobile_app,direct,,Manchester,2025-05-07,2025-05-12
92701d60,439e754c-6930-46,2025-05-07,2025-05-09,MacBook Air,g770,1199.99,mobile_app,direct,mobile,London,2025-05-07,2025-05-09
9e45455e,2c154804-0997-49,2025-01-24,2025-01-29,Google Pixel 8,i920,699.99,website,social,mobile,London,2025-01-24,2025-01-29
9e45455e,2c154804-0997-49,2025-01-24,2025-01-25,Google Pixel 8,i920,699.99,website,search,unknown,London,2025-01-24,2025-01-25
e1035e1c,66d71d97-b193-48,2025-01-10,2025-01-15,Xbox Series X,b104,499.99,website,social,desktop,Manchester,2025-01-10,2025-01-15
e1035e1c,66d71d97-b193-48,2025-01-10,01-15-2025,Xbox Series X,b104,499.99,website,social,mobile,Nottingham,2025-01-10,2025-01-15
e1035e1c,66d71d97-b193-48,10-01-2025,2025-01-12,Nintendo Switch,e682,299.99,mobile_app,direct,desktop,Manchester,2025-01-10,2025-01-12
44c1f1b5,0c9e5550-3cd1-4f,2025-04-26,2025-04-29,AirPods,d633,159.99,website,affiliate,unknown,Glasgow,2025-04-26,2025-04-29
4f9a5f98,567e642e-052d-4b,2025-04-07,2025-04-12,Steam Deck,c912,499.99,mobile_app,social,mobile,Manchester,2025-04-07,2025-04-12
f8f58a26,dbb54645-7dda-41,2025-04-16,2025-04-17,Smartwatch,h301,249.99,website,email,desktop,Glasgow,2025-04-16,2025-04-17
c626e38f,4cec495b-2267-46,2025-04-26,05-02-2025,Google Pixel 8,i920,699.99,mobile_app,email,unknown,Glasgow,2025-04-26,2025-05-02
16db80db,ba92992e-44f8-45,2025-01-06,2025-01-11,Google Pixel 8,i920,699.99,website,social,unknown,Manchester,2025-01-06,2025-01-11
7c059799,e9d6bb7e-361d-40,2025-04-19,2025-04-22,MacBook Air,g770,1199.99,website,search,mobile,Glasgow,2025-04-19,2025-04-22
ca9f1d59,5fb8944d-de00-48,2025-02-02,2025-02-04,MacBook Air,g770,1199.99,mobile_app,email,mobile,Birmingham,2025-02-02,2025-02-04
c7cfeca8,b5a6571c-4fa5-43,2025-04-09,2025-04-13,Smartwatch,h301,249.99,website,search,desktop,Birmingham,2025-04-09,2025-04-13
e00bd534,9194821e-e11b-40,2025-03-04,2025-03-06,Smartwatch,h301,249.99,website,affiliate,unknown,Manchester,2025-03-04,2025-03-06
0cf173f9,0ec0ad4b-d644-4a,19-02-2025,2025-02-22,Accessory,m001,24.99,website,direct,desktop,Manchester,2025-02-19,2025-02-22
76d70561,32f8dbab-b462-43,2025-06-22,2025-06-25,Xbox Series X,b104,499.99,website,direct,mobile,Sheffield,2025-06-22,2025-06-25
3defa7ba,ec4e8cbb-a2aa-47,2025-05-04,2025-05-10,iPhone 15,f521,899.99,website,social,unknown,Birmingham,2025-05-04,2025-05-10
797e3984,7233d5af-9813-4d,2025-03-17,03-21-2025,Smartwatch,h301,249.99,website,search,desktop,London,2025-03-17,2025-03-21
42378962,5820b3f2-5989-4d,2025-04-19,2025-04-23,Accessory,m001,24.99,website,direct,desktop,Sheffield,2025-04-19,2025-04-23
42378962,5820b3f2-5989-4d,2025-04-19,04-24-2025,Xbox Series X,b104,499.99,website,direct,unknown,London,2025-04-19,2025-04-24
0cb5ee5c,1723ecdb-b058-42,2025-02-06,2025-02-07,Google Pixel 8,i920,699.99,website,affiliate,desktop,Nottingham,2025-02-06,2025-02-07
0cb5ee5c,1723ecdb-b058-42,2025-02-06,2025-02-08,AirPods,d633,159.99,mobile_app,search,unknown,Manchester,2025-02-06,2025-02-08
38aa76df,c7a2f280-927f-41,2025-03-03,2025-03-04,Accessory,m001,24.99,mobile_app,affiliate,desktop,Bristol,2025-03-03,2025-03-04
83666636,34ec5264-ad7d-4f,2025-05-15,2025-05-20,Smartwatch,h301,249.99,mobile_app,social,desktop,Manchester,2025-05-15,2025-05-20
795e6f2b,f796611f-c7c1-4b,26-04-2025,2025-04-30,Steam Deck,c912,499.99,website,search,desktop,Leicester,2025-04-26,2025-04-30
3948fe22,2c56e0cd-a5ba-44,2025-04-09,04-15-2025,Kindle Paperwhite,j877,129.99,mobile_app,direct,unknown,Manchester,2025-04-09,2025-04-15
b599277f,f168c605-ce1a-46,2025-01-17,2025-01-20,Accessory,m001,24.99,mobile_app,search,unknown,Leeds,2025-01-17,2025-01-20
7580e4e9,e53e5f4c-6c7e-4a,2025-06-01,2025-06-03,PS5,a245,479.99,mobile_app,social,desktop,Manchester,2025-06-01,2025-06-03
9fa4a627,4d59616b-7779-45,2025-02-08,2025-02-09,PS5,a245,479.99,website,search,unknown,London,2025-02-08,2025-02-09
f76b9723,01e187d8-1a31-40,2025-02-01,2025-02-05,Accessory,m001,24.99,website,,desktop,Birmingham,2025-02-01,2025-02-05
485d831c,8fbba749-5fcd-45,2025-06-10,2025-06-14,Xbox Series X,b104,499.99,website,search,,Bristol,2025-06-10,2025-06-14
46c79b36,7b53359e-1bac-4d,2025-04-13,2025-04-14,PS5,a245,479.99,mobile_app,direct,unknown,,2025-04-13,2025-04-14
f3c2944a,46e1ee40-dc8a-46,2025-04-23,2025-04-24,Google Pixel 8,i920,699.99,mobile_app,search,mobile,Birmingham,2025-04-23,2025-04-24
3d846fc9,30385dd7-4c7d-43,10-01-2025,2025-01-11,iPhone 15,f521,899.99,mobile_app,direct,mobile,London,2025-01-10,2025-01-11
6772fe9f,db7904e0-ce30-46,2025-05-07,05-10-2025,MacBook Air,g770,1199.99,website,social,desktop,Manchester,2025-05-07,2025-05-10
7f53d344,23d26b8d-ae46-42,2025-05-09,2025-05-13,AirPods,d633,159.99,website,affiliate,mobile,Manchester,2025-05-09,2025-05-13
bc9a7998,e82b5b36-4269-42,2025-03-26,2025-03-31,Kindle Paperwhite,j877,129.99,mobile_app,email,desktop,Manchester,2025-03-26,2025-03-31
bc9a7998,e82b5b36-4269-42,2025-03-26,2025-04-01,Nintendo Switch,e682,299.99,website,search,unknown,Birmingham,2025-03-26,2025-04-01
57d9cbb0,fea82e3a-b544-41,2025-03-11,03-16-2025,PS5,a245,479.99,website,social,unknown,Sheffield,2025-03-11,2025-03-16
79c9c839,afb28b3d-38ec-4b,2025-05-22,2025-05-28,Steam Deck,c912,499.99,mobile_app,social,mobile,Leeds,2025-05-22,2025-05-28
2b843ef3,5bc677ca-abff-42,2025-02-22,2025-02-24,PS5,a245,479.99,mobile_app,search,mobile,Glasgow,2025-02-22,2025-02-24
7885187d,8ee9581a-e061-46,2025-04-04,04-09-2025,AirPods,d633,159.99,mobile_app,search,mobile,Manchester,2025-04-04,2025-04-09
e9a1c6d5,b9a5d4d0-4237-41,06-04-2025,2025-04-09,Kindle Paperwhite,j877,129.99,mobile_app,direct,mobile,Birmingham,2025-04-06,2025-04-09
38e59b27,e64b9b37-ae01-41,2025-02-16,2025-02-21,Google Pixel 8,i920,699.99,mobile_app,direct,mobile,Glasgow,2025-02-16,2025-02-21
e3082ddc,df162ec3-be84-4a,18-06-2025,2025-06-23,Google Pixel 8,i920,699.99,mobile_app,email,mobile,,2025-06-18,2025-06-23
e3082ddc,df162ec3-be84-4a,2025-06-18,2025-06-21,Kindle Paperwhite,j877,129.99,mobile_app,direct,unknown,,2025-06-18,2025-06-21
1e26ed31,95e7f614-42b4-42,2025-01-05,2025-01-11,PS5,a245,479.99,website,social,unknown,Manchester,2025-01-05,2025-01-11
9ee339ff,a267d32f-ddcb-44,10-03-2025,2025-03-11,Xbox Series X,b104,499.99,website,search,mobile,Glasgow,2025-03-10,2025-03-11
9ee339ff,a267d32f-ddcb-44,2025-03-10,2025-03-15,iPhone 15,f521,899.99,website,direct,mobile,London,2025-03-10,2025-03-15
ae423568,31cd9f6e-e3b1-4d,2025-05-25,2025-05-26,Accessory,m001,24.99,website,direct,mobile,Liverpool,2025-05-25,2025-05-26
26996aab,69c165ae-4c61-4a,2025-05-05,2025-05-09,Kindle Paperwhite,j877,129.99,website,affiliate,mobile,London,2025-05-05,2025-05-09
e4917f7d,57b936b0-3346-43,2025-04-10,07-04-2025,Steam Deck,c912,499.99,website,search,desktop,Manchester,2025-04-10,2025-07-04
2e2bdc6c,24aa5685-7523-46,06-06-2025,06-10-2025,MacBook Air,g770,1199.99,mobile_app,search,desktop,Glasgow,2025-06-06,2025-06-10
503be788,55273407-7cd2-49,2025-02-22,02-28-2025,Xbox Series X,b104,499.99,mobile_app,social,desktop,Leeds,2025-02-22,2025-02-28
c606ddc4,73b9c2ac-0134-47,2025-03-16,2025-03-22,Steam Deck,c912,499.99,mobile_app,direct,desktop,Birmingham,2025-03-16,2025-03-22
c606ddc4,73b9c2ac-0134-47,2025-03-16,2025-03-21,Kindle Paperwhite,j877,129.99,website,search,desktop,London,2025-03-16,2025-03-21
c79ddb62,288f3435-c3b5-44,2025-02-05,2025-02-06,Accessory,m001,24.99,mobile_app,direct,unknown,London,2025-02-05,2025-02-06
6dd49c96,6f07b60f-9d4e-4b,2025-03-16,2025-03-18,Nintendo Switch,e682,299.99,website,email,mobile,Manchester,2025-03-16,2025-03-18
bb0c7919,0131ff3b-6221-46,2025-01-02,01-08-2025,iPhone 15,f521,899.99,mobile_app,social,unknown,Glasgow,2025-01-02,2025-01-08
87f1d48c,e45a87e8-039a-4e,2025-03-22,2025-03-27,Steam Deck,c912,499.99,website,affiliate,desktop,Manchester,2025-03-22,2025-03-27
87f1d48c,e45a87e8-039a-4e,2025-03-22,2025-03-25,Google Pixel 8,i920,699.99,mobile_app,email,mobile,Manchester,2025-03-22,2025-03-25
39ec8ca1,010e4265-ad3f-4d,2025-05-14,2025-05-19,Steam Deck,c912,499.99,website,social,mobile,Manchester,2025-05-14,2025-05-19
80daa8ca,4fe54745-5827-4e,2025-04-02,2025-04-03,Kindle Paperwhite,j877,129.99,mobile_app,direct,mobile,Glasgow,2025-04-02,2025-04-03
f2ce7eeb,10b6a662-2ac1-45,2025-02-23,02-24-2025,Google Pixel 8,i920,699.99,website,search,mobile,Manchester,2025-02-23,2025-02-24
6f04af36,85319f0f-ba53-41,2025-03-24,2025-03-25,iPhone 15,f521,899.99,mobile_app,search,unknown,Glasgow,2025-03-24,2025-03-25
7d7c59a5,2240063b-fed7-47,2025-03-01,2025-03-07,AirPods,d633,159.99,mobile_app,social,unknown,Glasgow,2025-03-01,2025-03-07
cfdfc6f9,2a35ce30-303c-40,2025-04-01,2025-04-03,Smartwatch,h301,249.99,mobile_app,social,unknown,Manchester,2025-04-01,2025-04-03
3610901c,396d1ffb-3a79-4e,01-04-2025,2025-04-06,Smartwatch,h301,249.99,website,social,desktop,Glasgow,2025-04-01,2025-04-06
b60b4f87,812faa38-96f6-4c,17-01-2025,2025-01-18,AirPods,d633,159.99,mobile_app,direct,unknown,Glasgow,2025-01-17,2025-01-18
c5709e30,600c9c71-0990-46,24-03-2025,2025-03-27,Steam Deck,c912,499.99,mobile_app,email,unknown,Birmingham,2025-03-24,2025-03-27
c5709e30,600c9c71-0990-46,2025-03-24,2025-03-25,Google Pixel 8,i920,699.99,mobile_app,direct,mobile,Manchester,2025-03-24,2025-03-25
1bad52a8,980b6853-0c70-41,2025-05-07,2025-05-11,PS5,a245,479.99,mobile_app,affiliate,unknown,Leeds,2025-05-07,2025-05-11
71be94c3,0c5921f8-050d-4b,2025-05-17,2025-05-21,Xbox Series X,b104,499.99,mobile_app,email,desktop,Liverpool,2025-05-17,2025-05-21
71be94c3,0c5921f8-050d-4b,2025-05-17,2025-05-20,Kindle Paperwhite,j877,129.99,website,direct,mobile,Birmingham,2025-05-17,2025-05-20
71be94c3,0c5921f8-050d-4b,2025-05-17,05-19-2025,Steam Deck,c912,499.99,website,email,desktop,London,2025-05-17,2025-05-19
349b5089,40b374f8-8c1a-42,2025-02-26,2025-02-28,Steam Deck,c912,499.99,website,search,mobile,Manchester,2025-02-26,2025-02-28
349b5089,40b374f8-8c1a-42,26-02-2025,2025-02-27,Xbox Series X,b104,499.99,website,affiliate,unknown,Manchester,2025-02-26,2025-02-27
19d9d0b5,0261c87a-a15c-45,2025-04-01,2025-04-05,Accessory,m001,24.99,website,search,desktop,London,2025-04-01,2025-04-05
6b382a0a,9f6facc1-451d-48,2025-02-12,2025-02-15,Smartwatch,h301,249.99,mobile_app,social,unknown,London,2025-02-12,2025-02-15
6b382a0a,9f6facc1-451d-48,2025-02-12,02-16-2025,AirPods,d633,159.99,website,search,mobile,Leeds,2025-02-12,2025-02-16
485f7888,82f73861-1adb-48,2025-02-02,2025-02-04,MacBook Air,g770,1199.99,website,affiliate,unknown,London,2025-02-02,2025-02-04
c72850c1,7f6bd3c6-1b34-49,2025-01-14,01-18-2025,MacBook Air,g770,1199.99,website,search,mobile,London,2025-01-14,2025-01-18
68e5c8cd,f91e5fcd-85ec-47,2025-06-16,2025-06-22,MacBook Air,g770,1199.99,website,social,desktop,Manchester,2025-06-16,2025-06-22
68e5c8cd,f91e5fcd-85ec-47,2025-06-16,06-20-2025,Google Pixel 8,i920,699.99,mobile_app,affiliate,desktop,Manchester,2025-06-16,2025-06-20
b02e21aa,8c52d271-0a16-4e,2025-02-08,02-10-2025,Accessory,m001,24.99,mobile_app,search,desktop,Nottingham,2025-02-08,2025-02-10
16c8e3d7,3c088990-54a2-40,2025-04-13,2025-04-16,iPhone 15,f521,899.99,mobile_app,direct,unknown,London,2025-04-13,2025-04-16
f30ee4fe,92fbacf6-d5d1-46,2025-06-20,2025-06-22,AirPods,d633,159.99,mobile_app,social,unknown,Leicester,2025-06-20,2025-06-22
e79f9f3d,13365c0c-82ff-4f,2025-03-19,2025-03-22,iPhone 15,f521,899.99,website,social,mobile,,2025-03-19,2025-03-22
439db29d,74eda60e-3b2d-42,2025-04-23,04-27-2025,Steam Deck,c912,499.99,mobile_app,email,mobile,London,2025-04-23,2025-04-27
da2cf852,d02c75f9-198d-43,2025-04-26,2025-04-30,AirPods,d633,159.99,website,search,desktop,London,2025-04-26,2025-04-30
1dabb10a,ad409244-cd35-46,2025-03-02,03-08-2025,Kindle Paperwhite,j877,129.99,website,affiliate,unknown,Birmingham,2025-03-02,2025-03-08
1dabb10a,ad409244-cd35-46,2025-03-02,2025-03-04,AirPods,d633,159.99,mobile_app,social,desktop,Glasgow,2025-03-02,2025-03-04
236dd176,e3ea2d7f-c219-48,2025-05-24,2025-05-30,Xbox Series X,b104,499.99,website,social,desktop,Glasgow,2025-05-24,2025-05-30
f480b91e,54231dbe-2ba6-41,2025-05-26,2025-05-30,Xbox Series X,b104,499.99,mobile_app,direct,unknown,Glasgow,2025-05-26,2025-05-30
57bcad3a,bbaa574f-e0e3-45,2025-03-26,2025-03-31,Google Pixel 8,i920,699.99,mobile_app,social,mobile,Leeds,2025-03-26,2025-03-31
d5f0fb6a,6676cc75-6699-4a,2025-02-12,2025-02-17,AirPods,d633,159.99,website,social,desktop,Birmingham,2025-02-12,2025-02-17
e2d903c8,7a6e43d0-d9c5-4c,2025-02-06,2025-02-07,Xbox Series X,b104,499.99,website,email,mobile,Birmingham,2025-02-06,2025-02-07
fb481ded,21ec4754-1cf1-46,2025-05-03,2025-05-04,Accessory,m001,24.99,mobile_app,email,mobile,London,2025-05-03,2025-05-04
fb481ded,21ec4754-1cf1-46,2025-05-03,2025-05-06,iPhone 15,f521,899.99,mobile_app,email,desktop,Leeds,2025-05-03,2025-05-06
7b90942f,1a8cf13c-28ce-43,2025-04-10,2025-04-11,MacBook Air,g770,1199.99,mobile_app,search,desktop,London,2025-04-10,2025-04-11
7b90942f,1a8cf13c-28ce-43,2025-04-10,2025-04-15,Kindle Paperwhite,j877,129.99,website,email,mobile,London,2025-04-10,2025-04-15
c7774fae,702b7014-adab-4c,2025-03-08,2025-03-14,iPhone 15,f521,899.99,mobile_app,social,desktop,London,2025-03-08,2025-03-14
ba2eeeb3,dcd1c413-0760-40,2025-02-12,2025-02-17,MacBook Air,g770,1199.99,mobile_app,social,unknown,Birmingham,2025-02-12,2025-02-17
e3395b1a,7bab1baa-2172-40,2025-04-26,2025-04-28,Xbox Series X,b104,499.99,mobile_app,social,unknown,Birmingham,2025-04-26,2025-04-28
032a09e0,1036ca81-0bc4-47,18-05-2025,2025-05-23,Kindle Paperwhite,j877,129.99,mobile_app,affiliate,desktop,Sheffield,2025-05-18,2025-05-23
b9493906,865a7766-ad8c-4f,2025-04-25,2025-04-28,Xbox Series X,b104,499.99,website,email,mobile,Manchester,2025-04-25,2025-04-28
84e3b774,f4acc7e2-fa57-4c,2025-04-01,2025-04-04,Accessory,m001,24.99,mobile_app,search,unknown,Glasgow,2025-04-01,2025-04-04
84e3b774,f4acc7e2-fa57-4c,2025-04-01,2025-04-04,MacBook Air,g770,1199.99,mobile_app,email,unknown,Liverpool,2025-04-01,2025-04-04
ba05dd0f,9e44e98c-b359-49,2025-03-27,2025-04-01,Kindle Paperwhite,j877,129.99,mobile_app,social,desktop,Glasgow,2025-03-27,2025-04-01
260e37cc,a9e8f0d8-5883-49,2025-04-15,2025-04-16,Xbox Series X,b104,499.99,website,direct,unknown,Liverpool,2025-04-15,2025-04-16
02fb2869,e45e2ad0-8eef-45,24-06-2025,06-30-2025,AirPods,d633,159.99,website,direct,desktop,Manchester,2025-06-24,2025-06-30
7eef09ab,816ce054-282c-44,2025-03-08,2025-03-09,MacBook Air,g770,1199.99,website,affiliate,mobile,Manchester,2025-03-08,2025-03-09
54b58635,c05db774-132a-4e,2025-01-21,2025-01-22,Google Pixel 8,i920,699.99,website,social,unknown,Bristol,2025-01-21,2025-01-22
60ee64ba,81c61eeb-0ce3-48,2025-04-14,2025-04-15,PS5,a245,479.99,mobile_app,search,desktop,Birmingham,2025-04-14,2025-04-15
60ee64ba,81c61eeb-0ce3-48,2025-04-14,2025-04-20,PS5,a245,479.99,mobile_app,email,desktop,London,2025-04-14,2025-04-20
92b26acd,142e3df0-3c28-45,2025-05-14,2025-05-08,Steam Deck,c912,499.99,mobile_app,social,unknown,Birmingham,2025-05-14,2025-05-08
92b26acd,142e3df0-3c28-45,2025-05-08,2025-05-10,Xbox Series X,b104,499.99,website,affiliate,desktop,London,2025-05-08,2025-05-10
fb0d3cda,7f9ad277-db49-4e,2025-01-08,2025-01-11,Accessory,m001,24.99,mobile_app,social,mobile,Manchester,2025-01-08,2025-01-11
092c4801,048c8480-a743-44,2025-01-16,2025-01-19,Google Pixel 8,i920,699.99,mobile_app,direct,unknown,Liverpool,2025-01-16,2025-01-19
f692641a,d36ec1bd-000b-4f,27-06-2025,06-29-2025,Google Pixel 8,i920,699.99,mobile_app,search,mobile,Leeds,2025-06-27,2025-06-29
f692641a,d36ec1bd-000b-4f,2025-06-27,2025-07-03,Google Pixel 8,i920,699.99,mobile_app,email,mobile,Liverpool,2025-06-27,2025-07-03
a7939a2e,e3de4ec0-4dfa-41,2025-02-15,2025-02-17,Google Pixel 8,i920,699.99,website,social,mobile,London,2025-02-15,2025-02-17
a7939a2e,e3de4ec0-4dfa-41,15-02-2025,2025-02-19,iPhone 15,f521,899.99,mobile_app,direct,mobile,London,2025-02-15,2025-02-19
a7939a2e,e3de4ec0-4dfa-41,2025-02-15,2025-02-16,Nintendo Switch,e682,299.99,website,email,mobile,Nottingham,2025-02-15,2025-02-16
d10bf4dc,57423882-f34a-49,2025-05-22,2025-05-27,Smartwatch,h301,249.99,website,social,mobile,Glasgow,2025-05-22,2025-05-27
d10bf4dc,57423882-f34a-49,2025-05-22,2025-05-23,AirPods,d633,159.99,mobile_app,email,unknown,London,2025-05-22,2025-05-23
99966612,54fc286f-7457-4d,2025-02-06,2025-02-07,Steam Deck,c912,499.99,mobile_app,direct,mobile,Manchester,2025-02-06,2025-02-07
18f1a1e4,5d00df1b-a83c-4c,2025-04-04,2025-04-08,Google Pixel 8,i920,699.99,mobile_app,direct,desktop,Manchester,2025-04-04,2025-04-08
18f1a1e4,5d00df1b-a83c-4c,2025-04-04,2025-04-08,Accessory,m001,24.99,mobile_app,direct,,Liverpool,2025-04-04,2025-04-08
a2379e6f,008ffab9-38c4-4b,2025-04-20,16-04-2025,PS5,a245,479.99,website,search,unknown,London,2025-04-20,2025-04-16
1b37ef19,8c357321-4abf-4f,2025-03-04,2025-03-07,Accessory,m001,24.99,mobile_app,search,mobile,Leicester,2025-03-04,2025-03-07
be153187,7e0f60b2-2a06-46,2025-03-10,2025-03-12,MacBook Air,g770,1199.99,website,direct,desktop,Manchester,2025-03-10,2025-03-12
be153187,7e0f60b2-2a06-46,2025-03-10,2025-03-11,AirPods,d633,159.99,mobile_app,search,mobile,Glasgow,2025-03-10,2025-03-11
1ee93260,41191aa7-1b61-44,2025-05-11,2025-05-17,AirPods,d633,159.99,mobile_app,direct,mobile,Bristol,2025-05-11,2025-05-17
30c9c51f,3730dfba-6494-4d,2025-04-27,04-29-2025,Nintendo Switch,e682,299.99,website,search,desktop,London,2025-04-27,2025-04-29
a21c0c06,c1d48a10-1b96-49,2025-04-22,04-23-2025,Xbox Series X,b104,499.99,mobile_app,email,desktop,Leeds,2025-04-22,2025-04-23
75175f39,1f8b4af1-96bc-43,2025-04-11,2025-04-17,Smartwatch,h301,249.99,website,direct,desktop,Sheffield,2025-04-11,2025-04-17
011c4544,811317a8-f4c8-43,2025-03-22,2025-03-23,Xbox Series X,b104,499.99,mobile_app,direct,mobile,London,2025-03-22,2025-03-23
011c4544,811317a8-f4c8-43,2025-03-22,03-25-2025,MacBook Air,g770,1199.99,mobile_app,email,mobile,Sheffield,2025-03-22,2025-03-25
95ca788d,8da03d88-0c6f-40,2025-04-09,2025-04-12,Nintendo Switch,e682,299.99,website,direct,desktop,Glasgow,2025-04-09,2025-04-12
b11af726,c7f4f4f9-8222-4a,2025-01-22,2025-01-26,AirPods,d633,159.99,website,search,mobile,Manchester,2025-01-22,2025-01-26
b11af726,c7f4f4f9-8222-4a,2025-01-22,2025-01-24,Xbox Series X,b104,499.99,mobile_app,social,desktop,Glasgow,2025-01-22,2025-01-24
b11af726,c7f4f4f9-8222-4a,2025-01-22,01-28-2025,PS5,a245,479.99,website,social,mobile,Glasgow,2025-01-22,2025-01-28
a8535961,d0b3d752-bb01-42,2025-04-22,2025-04-28,Steam Deck,c912,499.99,website,direct,mobile,Glasgow,2025-04-22,2025-04-28
6b2d9ccc,52645a59-e1f8-4b,2025-06-18,2025-06-23,PS5,a245,479.99,website,social,mobile,Manchester,2025-06-18,2025-06-23
65daced0,b148b2a6-ea79-47,2025-04-11,2025-04-14,Accessory,m001,24.99,mobile_app,direct,unknown,London,2025-04-11,2025-04-14
65daced0,b148b2a6-ea79-47,2025-04-11,2025-04-17,Nintendo Switch,e682,299.99,website,email,mobile,London,2025-04-11,2025-04-17
235fc3d5,4b4ef503-f872-44,2025-06-24,2025-06-27,Accessory,m001,24.99,website,email,desktop,Sheffield,2025-06-24,2025-06-27
d7d3b9d9,e2ed8686-b334-42,2025-04-17,2025-04-19,Accessory,m001,24.99,website,direct,unknown,London,2025-04-17,2025-04-19
d7d3b9d9,e2ed8686-b334-42,2025-04-17,2025-04-20,MacBook Air,g770,1199.99,website,direct,mobile,Bristol,2025-04-17,2025-04-20
8db78572,505c7527-dc57-44,2025-04-08,2025-04-09,Kindle Paperwhite,j877,129.99,mobile_app,direct,desktop,Glasgow,2025-04-08,2025-04-09
afc5c20e,35afbb2d-336d-47,2025-01-26,2025-01-31,Nintendo Switch,e682,299.99,mobile_app,search,desktop,Manchester,2025-01-26,2025-01-31
f9a55cf2,21f6c63d-ac20-4f,2025-05-16,2025-05-17,iPhone 15,f521,899.99,website,direct,mobile,Birmingham,2025-05-16,2025-05-17
b5d9ad36,8ae0b8a0-80ff-49,2025-04-27,2025-05-03,PS5,a245,479.99,mobile_app,affiliate,desktop,Bristol,2025-04-27,2025-05-03
f1530f68,8ff19886-5a2c-41,2025-04-24,2025-04-30,iPhone 15,f521,899.99,website,search,desktop,Bristol,2025-04-24,2025-04-30
88addab1,ac9b389a-6adf-45,2025-02-05,2025-02-09,Xbox Series X,b104,499.99,website,email,unknown,Bristol,2025-02-05,2025-02-09
1b41a61e,6c21835d-d8e8-49,2025-06-08,2025-06-11,Accessory,m001,24.99,mobile_app,direct,desktop,Sheffield,2025-06-08,2025-06-11
4458b006,0d95aaf5-2534-41,2025-02-07,02-10-2025,MacBook Air,g770,1199.99,website,email,desktop,London,2025-02-07,2025-02-10
4458b006,0d95aaf5-2534-41,07-02-2025,2025-02-13,Smartwatch,h301,249.99,mobile_app,search,mobile,London,2025-02-07,2025-02-13
257c54bc,fbc8c77e-2933-4f,2025-05-19,2025-05-25,Google Pixel 8,i920,699.99,mobile_app,direct,unknown,Glasgow,2025-05-19,2025-05-25
8a8a4105,c8cba592-b0ca-42,2025-03-26,2025-03-31,Xbox Series X,b104,499.99,mobile_app,email,unknown,Manchester,2025-03-26,2025-03-31
8a8a4105,c8cba592-b0ca-42,2025-03-26,2025-03-29,Smartwatch,h301,249.99,website,affiliate,,London,2025-03-26,2025-03-29
acef45c4,73dd3bc6-d064-45,2025-01-20,2025-01-24,Xbox Series X,b104,499.99,mobile_app,email,unknown,London,2025-01-20,2025-01-24
638e1388,396c357b-dd66-40,2025-06-25,2025-06-29,iPhone 15,f521,899.99,website,search,mobile,Nottingham,2025-06-25,2025-06-29
b1644235,cbfd4a31-c8c8-4a,2025-03-08,2025-03-09,Xbox Series X,b104,499.99,mobile_app,search,desktop,Manchester,2025-03-08,2025-03-09
c9c1ad45,61af663c-ed2e-4b,2025-02-24,2025-03-02,iPhone 15,f521,899.99,website,search,mobile,Manchester,2025-02-24,2025-03-02
be6127a8,f740d87c-500a-47,2025-03-13,2025-03-18,Steam Deck,c912,499.99,mobile_app,search,desktop,Manchester,2025-03-13,2025-03-18
716ca1f2,de6cf36b-9edd-41,2025-05-18,2025-05-21,Kindle Paperwhite,j877,129.99,mobile_app,social,unknown,London,2025-05-18,2025-05-21
5e244824,a23ff67d-e957-4b,2025-02-23,2025-02-24,iPhone 15,f521,899.99,website,search,unknown,Manchester,2025-02-23,2025-02-24
5e244824,a23ff67d-e957-4b,2025-02-23,2025-02-24,PS5,a245,479.99,website,direct,desktop,Liverpool,2025-02-23,2025-02-24
b993ff63,bd0b0fa2-8bee-48,2025-04-05,2025-04-06,Steam Deck,c912,499.99,mobile_app,direct,desktop,London,2025-04-05,2025-04-06
13106665,72e588e9-4b4f-4b,2025-03-24,2025-03-29,Nintendo Switch,e682,299.99,mobile_app,,unknown,Glasgow,2025-03-24,2025-03-29
13106665,72e588e9-4b4f-4b,2025-03-24,2025-03-30,Kindle Paperwhite,j877,129.99,mobile_app,affiliate,mobile,London,2025-03-24,2025-03-30
0a670143,bc2e2b59-2c7d-46,2025-01-23,2025-01-28,Steam Deck,c912,499.99,website,affiliate,desktop,Leicester,2025-01-23,2025-01-28
d89462e8,43a534d2-8e7d-4f,2025-04-21,2025-04-25,Accessory,m001,24.99,website,social,unknown,London,2025-04-21,2025-04-25
0a398bf7,77617d80-549f-43,2025-04-16,2025-04-19,Nintendo Switch,e682,299.99,mobile_app,email,unknown,Glasgow,2025-04-16,2025-04-19
a0180791,98cd2655-5297-41,2025-04-10,04-15-2025,Nintendo Switch,e682,299.99,mobile_app,search,desktop,London,2025-04-10,2025-04-15
a0180791,98cd2655-5297-41,2025-04-10,2025-04-13,PS5,a245,479.99,website,direct,unknown,Glasgow,2025-04-10,2025-04-13
a0180791,98cd2655-5297-41,2025-04-10,2025-04-11,PS5,a245,479.99,website,search,mobile,Liverpool,2025-04-10,2025-04-11
8cd74c27,4d187b75-a971-43,2025-05-20,2025-05-22,Steam Deck,c912,499.99,website,search,unknown,Manchester,2025-05-20,2025-05-22
8cd74c27,4d187b75-a971-43,2025-05-20,2025-05-25,Xbox Series X,b104,499.99,mobile_app,affiliate,unknown,Glasgow,2025-05-20,2025-05-25
8cd74c27,4d187b75-a971-43,2025-05-20,2025-05-23,Kindle Paperwhite,j877,129.99,mobile_app,social,desktop,London,2025-05-20,2025-05-23
f4fd25b7,b52a9e6b-c8b6-48,2025-04-06,2025-04-08,Xbox Series X,b104,499.99,mobile_app,search,mobile,Liverpool,2025-04-06,2025-04-08
8b074d1a,c948384b-1174-43,2025-05-18,2025-05-20,Accessory,m001,24.99,mobile_app,email,mobile,Manchester,2025-05-18,2025-05-20
a9d049dc,597278c5-1789-4e,2025-03-08,2025-03-11,Google Pixel 8,i920,699.99,mobile_app,social,unknown,Manchester,2025-03-08,2025-03-11
9e47a339,4b27b079-5c5d-4f,2025-02-19,2025-02-25,MacBook Air,g770,1199.99,mobile_app,search,desktop,Birmingham,2025-02-19,2025-02-25
9e47a339,4b27b079-5c5d-4f,2025-02-19,2025-02-24,Kindle Paperwhite,j877,129.99,website,social,unknown,Glasgow,2025-02-19,2025-02-24
9e47a339,4b27b079-5c5d-4f,2025-02-19,2025-02-22,AirPods,d633,159.99,mobile_app,social,mobile,Liverpool,2025-02-19,2025-02-22
a6388854,8fb3a134-ff23-46,2025-06-08,06-14-2025,Nintendo Switch,e682,299.99,website,email,unknown,London,2025-06-08,2025-06-14
a46b6fce,5893ef12-ab3f-4d,2025-02-06,2025-02-11,Nintendo Switch,e682,299.99,website,email,desktop,Liverpool,2025-02-06,2025-02-11
e2ba9fce,3e6b74fd-9f02-4c,2025-05-03,2025-05-05,AirPods,d633,159.99,website,email,desktop,Manchester,2025-05-03,2025-05-05
41afeb2a,cbd431cc-ea7a-4c,2025-03-06,2025-03-11,AirPods,d633,159.99,website,affiliate,desktop,Nottingham,2025-03-06,2025-03-11
41afeb2a,cbd431cc-ea7a-4c,2025-03-06,2025-03-09,Smartwatch,h301,249.99,website,direct,mobile,Glasgow,2025-03-06,2025-03-09
c53f1db3,06531d47-4867-4b,2025-03-03,2025-03-08,iPhone 15,f521,899.99,website,direct,mobile,Sheffield,2025-03-03,2025-03-08
4be318a8,823c7ef9-cd85-45,2025-03-27,2025-03-28,AirPods,d633,159.99,mobile_app,search,desktop,Liverpool,2025-03-27,2025-03-28
4be318a8,823c7ef9-cd85-45,27-03-2025,2025-04-02,PS5,a245,479.99,mobile_app,social,desktop,Leeds,2025-03-27,2025-04-02
189099c9,5200044b-3148-4d,2025-04-09,2025-04-15,Smartwatch,h301,249.99,website,search,unknown,Manchester,2025-04-09,2025-04-15
a07eafb1,c5f833cf-f4ce-44,2025-04-22,04-23-2025,AirPods,d633,159.99,mobile_app,affiliate,desktop,Leeds,2025-04-22,2025-04-23
af76b6c2,a127dc6b-ab9b-45,2025-04-17,2025-04-20,iPhone 15,f521,899.99,mobile_app,social,desktop,Glasgow,2025-04-17,2025-04-20
e0ee5e8a,34a0dcd4-1a9a-42,2025-02-01,2025-02-07,Steam Deck,c912,499.99,website,social,desktop,Glasgow,2025-02-01,2025-02-07
e0ee5e8a,34a0dcd4-1a9a-42,2025-02-01,2025-02-06,AirPods,d633,159.99,website,email,,Manchester,2025-02-01,2025-02-06
12767d13,6f6bbdf3-c673-42,27-02-2025,2025-03-01,Kindle Paperwhite,j877,129.99,mobile_app,search,unknown,Manchester,2025-02-27,2025-03-01
09b2eae6,0614ac41-275c-45,2025-02-26,2025-02-28,Steam Deck,c912,499.99,website,social,mobile,Leeds,2025-02-26,2025-02-28
12087e20,2d90e4ee-0de4-43,2025-01-25,01-30-2025,Kindle Paperwhite,j877,129.99,website,direct,mobile,Birmingham,2025-01-25,2025-01-30
737cf8b5,e9366a85-3a46-4b,2025-05-17,2025-05-21,AirPods,d633,159.99,website,direct,mobile,Birmingham,2025-05-17,2025-05-21
1e494952,50ffde64-6eda-4a,2025-03-14,2025-03-18,PS5,a245,479.99,website,search,mobile,Liverpool,2025-03-14,2025-03-18
1e494952,50ffde64-6eda-4a,2025-03-14,2025-03-15,AirPods,d633,159.99,mobile_app,search,mobile,Manchester,2025-03-14,2025-03-15
bef6a59a,b864a47b-a434-47,2025-02-23,2025-02-25,Xbox Series X,b104,499.99,mobile_app,,desktop,Glasgow,2025-02-23,2025-02-25
80b9ec30,d926fe41-b36d-41,2025-04-20,2025-04-24,Smartwatch,h301,249.99,website,search,unknown,Glasgow,2025-04-20,2025-04-24
481186e9,af95be79-c971-4f,20-01-2025,2025-01-22,Google Pixel 8,i920,699.99,website,affiliate,mobile,London,2025-01-20,2025-01-22
07e3c39a,61a451ff-700b-4b,2025-06-15,2025-06-18,MacBook Air,g770,1199.99,website,affiliate,unknown,Manchester,2025-06-15,2025-06-18
07e3c39a,61a451ff-700b-4b,2025-06-15,2025-06-19,MacBook Air,g770,1199.99,mobile_app,email,desktop,Manchester,2025-06-15,2025-06-19
cbf925b5,38491ecc-8891-47,2025-02-15,2025-02-18,iPhone 15,f521,899.99,website,email,desktop,London,2025-02-15,2025-02-18
4c4d6e40,4b83b570-8bb4-49,2025-06-08,2025-06-13,iPhone 15,f521,899.99,mobile_app,search,desktop,London,2025-06-08,2025-06-13
4c4d6e40,4b83b570-8bb4-49,2025-06-08,2025-06-09,Smartwatch,h301,249.99,website,direct,unknown,Manchester,2025-06-08,2025-06-09
a5df6f85,f7222fbe-ea06-49,2025-05-19,2025-05-21,iPhone 15,f521,899.99,website,affiliate,,Leeds,2025-05-19,2025-05-21
243113fd,02dabd76-f310-45,2025-05-26,05-28-2025,Nintendo Switch,e682,299.99,website,email,desktop,Birmingham,2025-05-26,2025-05-28
8c2aa0b1,929daf9f-0149-42,2025-06-06,2025-06-12,iPhone 15,f521,899.99,website,email,mobile,London,2025-06-06,2025-06-12
b9d707a9,35c606b5-4e00-4d,19-04-2025,2025-04-20,Smartwatch,h301,249.99,mobile_app,direct,unknown,Glasgow,2025-04-19,2025-04-20
2477f047,e7d73d1d-69a3-49,2025-02-11,2025-02-13,Google Pixel 8,i920,699.99,website,search,unknown,London,2025-02-11,2025-02-13
2477f047,e7d73d1d-69a3-49,2025-02-11,2025-02-16,AirPods,d633,159.99,mobile_app,search,unknown,London,2025-02-11,2025-02-16
1d57e734,9dec2b83-3885-4f,2025-01-07,2025-01-13,Xbox Series X,b104,499.99,website,social,unknown,Manchester,2025-01-07,2025-01-13
c04446bf,913a1734-ccb6-45,2025-04-06,2025-04-11,Accessory,m001,24.99,website,email,desktop,London,2025-04-06,2025-04-11
12b99a50,8c8181b4-fe8b-4c,2025-04-20,2025-04-23,Nintendo Switch,e682,299.99,website,search,mobile,Birmingham,2025-04-20,2025-04-23
94a1eab0,402d105b-113e-4f,2025-03-26,2025-03-30,Nintendo Switch,e682,299.99,website,affiliate,mobile,London,2025-03-26,2025-03-30
3c0a584e,5b6d6b7c-54b2-45,2025-04-04,2025-04-07,Accessory,m001,24.99,mobile_app,affiliate,desktop,Glasgow,2025-04-04,2025-04-07
7c6166df,11defebf-9e98-46,2025-03-03,2025-03-09,AirPods,d633,159.99,mobile_app,direct,mobile,Manchester,2025-03-03,2025-03-09
7c6166df,11defebf-9e98-46,2025-03-03,2025-03-09,Google Pixel 8,i920,699.99,website,email,mobile,London,2025-03-03,2025-03-09
7c6166df,11defebf-9e98-46,2025-03-03,2025-03-08,Kindle Paperwhite,j877,129.99,website,direct,desktop,Liverpool,2025-03-03,2025-03-08
27035b27,a8cfe589-9dc8-4e,2025-06-01,2025-06-05,Google Pixel 8,i920,699.99,website,affiliate,desktop,Sheffield,2025-06-01,2025-06-05
2b2bf58c,cec56969-5d4f-41,2025-03-04,2025-03-07,Google Pixel 8,i920,699.99,mobile_app,social,mobile,Manchester,2025-03-04,2025-03-07
a40dfea5,c921057c-3f05-45,2025-02-24,2025-02-25,Xbox Series X,b104,499.99,mobile_app,email,mobile,Glasgow,2025-02-24,2025-02-25
54e14f3a,5c074653-d711-43,2025-06-25,2025-06-28,Accessory,m001,24.99,website,search,mobile,Bristol,2025-06-25,2025-06-28
7caa281b,7202fae5-767d-4b,2025-01-22,2025-01-28,Nintendo Switch,e682,299.99,mobile_app,social,desktop,Birmingham,2025-01-22,2025-01-28
47d6723c,a542deb9-2cff-45,2025-05-10,2025-05-13,Google Pixel 8,i920,699.99,website,direct,mobile,Manchester,2025-05-10,2025-05-13
47d6723c,a542deb9-2cff-45,2025-05-10,2025-05-16,MacBook Air,g770,1199.99,website,affiliate,,London,2025-05-10,2025-05-16
bbc99473,e42c0aea-23d7-46,2025-06-17,2025-06-22,MacBook Air,g770,1199.99,website,social,desktop,Manchester,2025-06-17,2025-06-22
d97e8d3c,ba388c8f-1393-49,26-04-2025,2025-04-28,Kindle Paperwhite,j877,129.99,mobile_app,email,unknown,Birmingham,2025-04-26,2025-04-28
c4ea4ece,d0095507-07fc-48,2025-03-12,2025-03-16,iPhone 15,f521,899.99,website,direct,unknown,Bristol,2025-03-12,2025-03-16
c4ea4ece,d0095507-07fc-48,2025-03-12,2025-03-17,Xbox Series X,b104,499.99,website,direct,mobile,London,2025-03-12,2025-03-17
e4dc4306,09624ec9-e803-42,2025-03-27,2025-03-25,Google Pixel 8,i920,699.99,mobile_app,direct,unknown,Birmingham,2025-03-27,2025-03-25
647ac591,a7668617-78db-4d,2025-04-20,2025-04-22,Kindle Paperwhite,j877,129.99,mobile_app,affiliate,unknown,Liverpool,2025-04-20,2025-04-22
647ac591,a7668617-78db-4d,2025-04-20,2025-04-26,Google Pixel 8,i920,699.99,website,direct,mobile,Manchester,2025-04-20,2025-04-26
22460ac9,96f01335-c5ab-48,06-04-2025,2025-04-12,Xbox Series X,b104,499.99,website,email,mobile,Birmingham,2025-04-06,2025-04-12
02b622e9,172e8c68-82aa-4c,2025-02-15,2025-02-18,MacBook Air,g770,1199.99,mobile_app,email,desktop,London,2025-02-15,2025-02-18
02b622e9,172e8c68-82aa-4c,2025-02-15,2025-02-16,Steam Deck,c912,499.99,website,direct,desktop,Manchester,2025-02-15,2025-02-16
af2537f5,f6c8b8b9-d915-46,2025-04-17,2025-04-22,Kindle Paperwhite,j877,129.99,mobile_app,search,unknown,Manchester,2025-04-17,2025-04-22
90fcc9f1,23ef5561-839e-46,2025-01-27,2025-01-29,Kindle Paperwhite,j877,129.99,website,direct,unknown,Sheffield,2025-01-27,2025-01-29
bb64a525,df482e7c-a8cf-4f,2025-04-23,2025-04-26,Nintendo Switch,e682,299.99,website,social,desktop,Birmingham,2025-04-23,2025-04-26
bb64a525,df482e7c-a8cf-4f,2025-04-23,2025-04-28,Google Pixel 8,i920,699.99,mobile_app,email,desktop,London,2025-04-23,2025-04-28
3b53f64b,0a58f43c-5bda-46,2025-06-08,2025-06-12,MacBook Air,g770,1199.99,mobile_app,direct,desktop,Liverpool,2025-06-08,2025-06-12
8494205c,3be8a5df-5e93-4d,2025-01-13,2025-01-15,Steam Deck,c912,499.99,website,social,desktop,Manchester,2025-01-13,2025-01-15
8494205c,3be8a5df-5e93-4d,2025-01-13,2025-01-17,AirPods,d633,159.99,website,direct,desktop,London,2025-01-13,2025-01-17
e1ad640c,635a11f2-5c7a-48,2025-04-05,2025-04-07,PS5,a245,479.99,mobile_app,search,mobile,Manchester,2025-04-05,2025-04-07
f7ebc69a,a605b7c9-fb07-4e,2025-04-19,2025-04-23,iPhone 15,f521,899.99,website,social,mobile,Birmingham,2025-04-19,2025-04-23
94213090,4603c9ee-d463-41,2025-01-26,2025-01-31,Nintendo Switch,e682,299.99,mobile_app,email,mobile,Leeds,2025-01-26,2025-01-31
96721e98,606cc2f5-2c81-4b,2025-04-22,2025-04-28,Kindle Paperwhite,j877,129.99,website,search,desktop,London,2025-04-22,2025-04-28
f9012b9c,13ed280a-d5e1-4d,2025-01-26,2025-01-30,Smartwatch,h301,249.99,website,direct,unknown,London,2025-01-26,2025-01-30
f9012b9c,13ed280a-d5e1-4d,2025-01-26,2025-01-30,Google Pixel 8,i920,699.99,website,search,mobile,London,2025-01-26,2025-01-30
585409d9,67e54646-8430-40,2025-01-12,2025-01-18,Google Pixel 8,i920,699.99,website,direct,mobile,,2025-01-12,2025-01-18
e1ccff0d,e31db345-7b6b-41,2025-06-01,06-05-2025,Smartwatch,h301,249.99,mobile_app,email,mobile,Manchester,2025-06-01,2025-06-05
47e321c2,3ae0acdb-2a65-44,2025-03-21,2025-03-25,Xbox Series X,b104,499.99,mobile_app,search,desktop,Birmingham,2025-03-21,2025-03-25
d123f7c1,28489240-2fd9-4c,2025-05-16,05-18-2025,Google Pixel 8,i920,699.99,mobile_app,social,desktop,London,2025-05-16,2025-05-18
1d03c3d5,6a241f46-3af7-4a,2025-03-26,2025-03-27,Google Pixel 8,i920,699.99,website,search,unknown,Manchester,2025-03-26,2025-03-27
1d03c3d5,6a241f46-3af7-4a,2025-03-26,2025-03-28,Google Pixel 8,i920,699.99,mobile_app,social,mobile,Liverpool,2025-03-26,2025-03-28
a5b2c7ea,7aa1219a-7a93-48,2025-06-03,2025-06-04,Smartwatch,h301,249.99,website,social,unknown,Manchester,2025-06-03,2025-06-04
97a418b8,3e612d66-05bf-46,2025-05-22,05-26-2025,Steam Deck,c912,499.99,website,email,mobile,Leeds,2025-05-22,2025-05-26
2598f383,833c8f55-a129-4f,2025-03-24,2025-03-30,Accessory,m001,24.99,website,affiliate,desktop,Sheffield,2025-03-24,2025-03-30
2598f383,833c8f55-a129-4f,2025-03-24,2025-03-30,PS5,a245,479.99,mobile_app,email,desktop,Manchester,2025-03-24,2025-03-30
67cbfc39,ec257a75-421d-4d,2025-04-25,2025-05-01,Google Pixel 8,i920,699.99,mobile_app,search,unknown,Glasgow,2025-04-25,2025-05-01
67cbfc39,ec257a75-421d-4d,2025-04-25,2025-04-29,Xbox Series X,b104,499.99,mobile_app,affiliate,desktop,Sheffield,2025-04-25,2025-04-29
ba5c865d,a33b3dfd-9048-45,2025-02-27,2025-03-04,iPhone 15,f521,899.99,website,direct,desktop,Birmingham,2025-02-27,2025-03-04
9b4547e0,f27f3ad7-4890-4b,2025-04-14,2025-04-20,Xbox Series X,b104,499.99,website,social,mobile,Liverpool,2025-04-14,2025-04-20
9b4547e0,f27f3ad7-4890-4b,2025-04-14,2025-04-20,AirPods,d633,159.99,mobile_app,email,unknown,Manchester,2025-04-14,2025-04-20
9b4547e0,f27f3ad7-4890-4b,2025-04-14,2025-04-15,Xbox Series X,b104,499.99,website,direct,desktop,Manchester,2025-04-14,2025-04-15
6928043e,7b4e9ecd-de07-47,2025-05-15,2025-05-18,Kindle Paperwhite,j877,129.99,website,social,mobile,Birmingham,2025-05-15,2025-05-18
9f8acdeb,95284c0a-cb6b-45,2025-03-04,2025-03-09,Smartwatch,h301,249.99,website,search,mobile,Birmingham,2025-03-04,2025-03-09
ec1f41ce,2aefcf3b-43b7-40,24-01-2025,2025-01-26,Steam Deck,c912,499.99,mobile_app,social,mobile,Glasgow,2025-01-24,2025-01-26
ec1f41ce,2aefcf3b-43b7-40,2025-01-24,2025-01-25,Smartwatch,h301,249.99,website,direct,unknown,London,2025-01-24,2025-01-25
21d8b96a,119fb03e-9731-4c,2025-01-04,2025-01-09,AirPods,d633,159.99,website,affiliate,desktop,London,2025-01-04,2025-01-09
af32baf8,85d0691c-33cd-4d,16-04-2025,2025-04-17,Xbox Series X,b104,499.99,mobile_app,affiliate,desktop,Manchester,2025-04-16,2025-04-17
e6cfcbd8,9b02c535-2649-44,2025-04-16,2025-04-22,Nintendo Switch,e682,299.99,mobile_app,email,desktop,Liverpool,2025-04-16,2025-04-22
c09c2ebe,e0b4659a-09fe-4c,2025-03-13,2025-03-14,Nintendo Switch,e682,299.99,mobile_app,direct,,Birmingham,2025-03-13,2025-03-14
8a0ea57a,a8cdf44d-7b74-44,2025-03-15,2025-03-18,Accessory,m001,24.99,website,social,unknown,Birmingham,2025-03-15,2025-03-18
6e76936a,f00f63ef-e59f-41,2025-02-08,2025-02-11,Kindle Paperwhite,877j,129.99,website,affiliate,mobile,Manchester,2025-02-08,2025-02-11
6e76936a,f00f63ef-e59f-41,2025-02-08,02-11-2025,iPhone 15,f521,899.99,mobile_app,affiliate,mobile,London,2025-02-08,2025-02-11
6e76936a,f00f63ef-e59f-41,2025-02-08,2025-02-09,Google Pixel 8,i920,699.99,mobile_app,social,desktop,London,2025-02-08,2025-02-09
6dd013f3,dff47c51-5ed1-4e,2025-03-10,2025-03-16,PS5,a245,479.99,mobile_app,email,unknown,London,2025-03-10,2025-03-16
59bb8900,7b6c7129-cd63-4b,2025-05-07,05-12-2025,MacBook Air,g770,1199.99,website,direct,,Birmingham,2025-05-07,2025-05-12
937ca77c,e869707c-bdcb-4f,2025-02-05,02-06-2025,Nintendo Switch,e682,299.99,website,social,unknown,Manchester,2025-02-05,2025-02-06
937ca77c,e869707c-bdcb-4f,2025-02-05,2025-02-11,Kindle Paperwhite,j877,129.99,mobile_app,social,unknown,Sheffield,2025-02-05,2025-02-11
e8fb5a96,412817eb-2246-49,2025-01-23,2025-01-26,iPhone 15,f521,899.99,mobile_app,direct,unknown,Glasgow,2025-01-23,2025-01-26
41ff81d1,9929afeb-4884-4a,2025-02-26,2025-03-02,Kindle Paperwhite,j877,129.99,mobile_app,social,desktop,Glasgow,2025-02-26,2025-03-02
85c53910,be5f902f-b58a-47,2025-04-16,2025-04-18,Kindle Paperwhite,j877,129.99,mobile_app,direct,desktop,Bristol,2025-04-16,2025-04-18
cde5c35a,6001f54d-01d7-48,2025-05-11,2025-05-12,PS5,a245,479.99,mobile_app,affiliate,unknown,Nottingham,2025-05-11,2025-05-12
95dad216,1b4909b6-5cbd-46,2025-03-09,03-14-2025,Steam Deck,c912,499.99,mobile_app,social,desktop,Manchester,2025-03-09,2025-03-14
95dad216,1b4909b6-5cbd-46,2025-03-09,2025-03-12,iPhone 15,f521,899.99,website,affiliate,unknown,Liverpool,2025-03-09,2025-03-12
95dad216,1b4909b6-5cbd-46,09-03-2025,2025-03-15,Steam Deck,c912,499.99,mobile_app,email,desktop,Liverpool,2025-03-09,2025-03-15
9ca4364d,893e2b89-dadf-44,2025-02-22,2025-02-25,AirPods,d633,159.99,mobile_app,affiliate,desktop,Leeds,2025-02-22,2025-02-25
8d56bff6,65bf8e04-ae3c-4c,03-06-2025,2025-06-06,Accessory,m001,24.99,mobile_app,social,unknown,Leicester,2025-06-03,2025-06-06
7bd7b4bf,2dc09158-7b83-41,2025-04-18,2025-04-23,Kindle Paperwhite,j877,129.99,website,direct,desktop,Manchester,2025-04-18,2025-04-23
65ebd4dc,93e0f235-4e80-41,19-02-2025,2025-02-22,iPhone 15,f521,899.99,mobile_app,social,desktop,Bristol,2025-02-19,2025-02-22
65ebd4dc,93e0f235-4e80-41,2025-02-19,2025-02-21,Accessory,m001,24.99,mobile_app,direct,unknown,London,2025-02-19,2025-02-21
3ad24ac8,dd23ff41-dae1-45,25-06-2025,2025-06-30,Smartwatch,h301,249.99,mobile_app,social,mobile,Manchester,2025-06-25,2025-06-30
8222cd7f,f301bb6c-b306-43,2025-03-25,2025-03-30,Nintendo Switch,e682,299.99,mobile_app,search,unknown,Leeds,2025-03-25,2025-03-30
af3f9d9a,cd04c001-56a3-4c,2025-04-23,2025-04-26,Accessory,m001,24.99,website,direct,unknown,Leeds,2025-04-23,2025-04-26
cdeb2696,639c4c6c-2926-40,2025-02-16,2025-02-19,Accessory,m001,24.99,mobile_app,affiliate,desktop,,2025-02-16,2025-02-19
1690636b,78bf46fa-2534-4e,2025-01-21,2025-01-22,AirPods,d633,159.99,mobile_app,social,unknown,Sheffield,2025-01-21,2025-01-22
b9787c4b,5eef0d1e-38c5-4f,2025-02-02,2025-02-04,Google Pixel 8,i920,699.99,mobile_app,direct,unknown,Bristol,2025-02-02,2025-02-04
49560c36,6690a951-fc04-4a,2025-01-11,2025-01-14,PS5,a245,479.99,mobile_app,affiliate,mobile,London,2025-01-11,2025-01-14
2cde9187,0eb5e5a7-98f3-46,2025-05-27,05-28-2025,MacBook Air,g770,1199.99,mobile_app,direct,mobile,Glasgow,2025-05-27,2025-05-28
ee462fcd,02bdeabe-7060-48,2025-05-15,2025-05-18,Smartwatch,h301,249.99,website,search,mobile,Manchester,2025-05-15,2025-05-18
82b34384,31dae817-4937-49,04-03-2025,2025-03-05,Xbox Series X,b104,499.99,mobile_app,affiliate,desktop,Nottingham,2025-03-04,2025-03-05
5c17ebb5,9d7d1756-3b4e-49,2025-03-27,03-31-2025,PS5,a245,479.99,website,social,unknown,Glasgow,2025-03-27,2025-03-31
46a3cc71,f9c3ee05-0012-43,2025-02-23,2025-02-25,Xbox Series X,b104,499.99,mobile_app,social,unknown,Glasgow,2025-02-23,2025-02-25
46a3cc71,f9c3ee05-0012-43,2025-02-23,2025-02-26,Google Pixel 8,i920,699.99,mobile_app,direct,desktop,Manchester,2025-02-23,2025-02-26
33478a91,ab6ef8dd-5a66-43,2025-05-17,2025-05-23,Google Pixel 8,i920,699.99,website,direct,unknown,Manchester,2025-05-17,2025-05-23
8cb21aa2,b4209103-bca7-46,2025-02-08,2025-02-12,Nintendo Switch,e682,299.99,mobile_app,search,desktop,Sheffield,2025-02-08,2025-02-12
58f42098,8f221604-d46b-47,2025-04-15,2025-04-18,Nintendo Switch,e682,299.99,website,search,desktop,,2025-04-15,2025-04-18
746b161a,39ee80ab-46c9-47,2025-02-10,2025-02-14,iPhone 15,f521,899.99,website,affiliate,unknown,Birmingham,2025-02-10,2025-02-14
8198d1f5,0130d66b-932d-46,2025-05-03,2025-05-09,Accessory,m001,24.99,mobile_app,affiliate,unknown,Glasgow,2025-05-03,2025-05-09
8198d1f5,0130d66b-932d-46,2025-05-03,2025-05-09,AirPods,d633,159.99,website,email,desktop,Birmingham,2025-05-03,2025-05-09
1df44d3e,80cfb1db-1287-43,2025-02-21,2025-02-24,Steam Deck,c912,499.99,mobile_app,search,mobile,Leeds,2025-02-21,2025-02-24
cb1b8eff,41f83199-f4ea-47,2025-02-20,02-26-2025,Smartwatch,h301,249.99,website,email,desktop,Birmingham,2025-02-20,2025-02-26
cb1b8eff,41f83199-f4ea-47,2025-02-20,02-23-2025,Xbox Series X,b104,499.99,website,affiliate,unknown,London,2025-02-20,2025-02-23
7bcf2b31,71594914-b1b6-4e,2025-02-18,2025-02-23,Google Pixel 8,i920,699.99,website,direct,unknown,Manchester,2025-02-18,2025-02-23
ae7cfd14,56f401e5-c1e9-44,2025-03-23,2025-03-28,iPhone 15,f521,899.99,mobile_app,email,desktop,Leeds,2025-03-23,2025-03-28
420079f5,dcad8ec2-963a-43,2025-06-04,2025-06-09,AirPods,d633,159.99,website,direct,desktop,Bristol,2025-06-04,2025-06-09
b38046ef,c9e55c47-a237-48,2025-03-07,2025-03-12,AirPods,d633,159.99,mobile_app,search,mobile,Manchester,2025-03-07,2025-03-12
b38046ef,c9e55c47-a237-48,07-03-2025,2025-03-09,Nintendo Switch,e682,299.99,website,social,unknown,Glasgow,2025-03-07,2025-03-09
89207bc4,6994bf84-50d3-4a,2025-05-20,2025-05-21,Nintendo Switch,e682,299.99,mobile_app,affiliate,desktop,Birmingham,2025-05-20,2025-05-21
89207bc4,6994bf84-50d3-4a,2025-05-20,2025-05-24,MacBook Air,g770,1199.99,website,search,unknown,Liverpool,2025-05-20,2025-05-24
66205167,436ae2bb-d509-4e,2025-02-11,02-17-2025,Accessory,m001,24.99,mobile_app,search,mobile,London,2025-02-11,2025-02-17
2db13deb,578cd875-d231-43,2025-03-02,2025-03-05,AirPods,d633,159.99,website,search,desktop,Manchester,2025-03-02,2025-03-05
2ecaf629,37f3f32b-5a81-46,2025-04-04,2025-04-09,Smartwatch,h301,249.99,website,affiliate,unknown,Nottingham,2025-04-04,2025-04-09
bcb3636d,ee25356a-aee0-4e,2025-04-25,2025-04-26,Smartwatch,h301,249.99,mobile_app,email,unknown,Glasgow,2025-04-25,2025-04-26
bcb3636d,ee25356a-aee0-4e,2025-04-25,2025-05-01,Accessory,m001,24.99,mobile_app,social,desktop,Glasgow,2025-04-25,2025-05-01
3aad5840,3df76a69-bc45-44,2025-05-27,2025-05-29,Steam Deck,c912,499.99,mobile_app,email,mobile,London,2025-05-27,2025-05-29
3aad5840,3df76a69-bc45-44,2025-05-27,2025-06-02,Xbox Series X,b041,499.99,mobile_app,email,mobile,London,2025-05-27,2025-06-02
3aad5840,3df76a69-bc45-44,2025-05-27,2025-05-28,Smartwatch,h301,249.99,website,social,desktop,London,2025-05-27,2025-05-28
c7688339,d61a080a-3fec-4a,2025-05-14,2025-05-18,iPhone 15,f521,899.99,mobile_app,direct,mobile,Manchester,2025-05-14,2025-05-18
7e1f48c4,1417c2f9-eb91-43,2025-03-11,2025-03-16,iPhone 15,f521,899.99,website,search,desktop,Glasgow,2025-03-11,2025-03-16
d91738f8,db6a34ea-c3a5-42,2025-01-18,2025-01-24,MacBook Air,g770,1199.99,website,email,unknown,Manchester,2025-01-18,2025-01-24
d91738f8,db6a34ea-c3a5-42,2025-01-18,2025-01-19,Accessory,m001,24.99,mobile_app,search,mobile,London,2025-01-18,2025-01-19
e1886146,50bf2995-9ee4-40,2025-02-15,02-20-2025,MacBook Air,g770,1199.99,mobile_app,direct,unknown,Manchester,2025-02-15,2025-02-20
c3a6b204,4654e77d-de67-42,2025-02-24,03-01-2025,Steam Deck,c912,499.99,website,social,mobile,Glasgow,2025-02-24,2025-03-01
c3a6b204,4654e77d-de67-42,2025-02-24,2025-02-27,PS5,a245,479.99,website,search,mobile,Manchester,2025-02-24,2025-02-27
20d4ba18,65db6e43-47bf-4d,2025-01-11,2025-01-16,MacBook Air,g770,1199.99,mobile_app,search,unknown,Liverpool,2025-01-11,2025-01-16
08560684,6c5540f0-cc9c-44,2025-04-17,2025-04-19,Steam Deck,c912,499.99,website,search,mobile,Sheffield,2025-04-17,2025-04-19
750acc98,dc432ed5-64ca-41,2025-01-22,2025-01-27,PS5,a245,479.99,mobile_app,email,unknown,London,2025-01-22,2025-01-27
750acc98,dc432ed5-64ca-41,2025-01-22,2025-01-26,PS5,a245,479.99,website,email,mobile,London,2025-01-22,2025-01-26
0227b8d5,84a91789-b2c0-47,10-02-2025,02-15-2025,PS5,a245,479.99,website,search,mobile,Manchester,2025-02-10,2025-02-15
0227b8d5,84a91789-b2c0-47,2025-02-10,2025-02-14,iPhone 15,f521,899.99,website,affiliate,desktop,Glasgow,2025-02-10,2025-02-14
5c91f845,61223189-35f3-4e,2025-02-05,2025-02-10,Xbox Series X,b104,499.99,website,,unknown,Birmingham,2025-02-05,2025-02-10
44f7f01a,2fe938e4-427b-4f,2025-02-18,2025-02-22,Xbox Series X,b104,499.99,mobile_app,social,unknown,Manchester,2025-02-18,2025-02-22
6c878546,57d52b78-9cf3-43,2025-03-26,2025-03-30,Kindle Paperwhite,j877,129.99,website,direct,unknown,Glasgow,2025-03-26,2025-03-30
668d3c8b,c08fe6d7-b361-47,26-02-2025,2025-03-01,iPhone 15,f521,899.99,mobile_app,social,unknown,Manchester,2025-02-26,2025-03-01
af9e7a0e,9247e851-2e0d-48,2025-02-20,2025-02-21,iPhone 15,f521,899.99,website,search,unknown,Glasgow,2025-02-20,2025-02-21
8e2ac3ff,b8875caf-1991-40,2025-04-04,2025-04-06,MacBook Air,g770,1199.99,mobile_app,affiliate,mobile,Manchester,2025-04-04,2025-04-06
8e2ac3ff,b8875caf-1991-40,2025-04-04,2025-04-05,Google Pixel 8,i920,699.99,website,search,mobile,London,2025-04-04,2025-04-05
bd1116ee,323132fa-6181-42,2025-06-15,2025-06-18,PS5,a245,479.99,website,direct,mobile,Bristol,2025-06-15,2025-06-18
226cbc6a,027e789c-ce40-48,2025-04-24,2025-04-28,Kindle Paperwhite,j877,129.99,mobile_app,social,mobile,London,2025-04-24,2025-04-28
50d3802d,a1726883-d971-4e,2025-05-24,2025-05-28,MacBook Air,g770,1199.99,website,direct,mobile,London,2025-05-24,2025-05-28
0c36ad4e,403fd582-4ccf-4a,2025-03-24,2025-03-26,Xbox Series X,b104,499.99,mobile_app,email,mobile,Liverpool,2025-03-24,2025-03-26
0c36ad4e,403fd582-4ccf-4a,2025-03-24,2025-03-27,Xbox Series X,b104,499.99,website,direct,desktop,Leicester,2025-03-24,2025-03-27
411920f6,29d0c613-b0c7-40,2025-05-04,2025-05-10,PS5,a245,479.99,website,direct,unknown,Glasgow,2025-05-04,2025-05-10
42803aa0,18a73d94-a13e-46,2025-05-20,2025-05-26,Smartwatch,h301,249.99,mobile_app,direct,desktop,Sheffield,2025-05-20,2025-05-26
581993cc,8eb7c306-8f73-49,2025-01-27,2025-02-02,Xbox Series X,b104,499.99,mobile_app,social,unknown,Manchester,2025-01-27,2025-02-02
9b0707e5,59e110eb-1f09-4b,2025-03-19,2025-03-23,Kindle Paperwhite,j877,129.99,website,social,unknown,Glasgow,2025-03-19,2025-03-23
9b0707e5,59e110eb-1f09-4b,2025-03-19,2025-03-24,MacBook Air,g770,1199.99,mobile_app,social,mobile,Manchester,2025-03-19,2025-03-24
fab8328f,a65d958e-936d-41,2025-03-13,03-15-2025,Steam Deck,c912,499.99,mobile_app,search,desktop,Liverpool,2025-03-13,2025-03-15
c655a597,53391df4-5ae8-4d,2025-02-15,02-19-2025,Kindle Paperwhite,j877,129.99,website,search,mobile,,2025-02-15,2025-02-19
76b874d3,141283fb-e3be-43,2025-06-02,2025-06-07,MacBook Air,g770,1199.99,mobile_app,affiliate,desktop,London,2025-06-02,2025-06-07
76b874d3,141283fb-e3be-43,2025-06-02,2025-06-06,Kindle Paperwhite,j877,129.99,mobile_app,affiliate,unknown,Bristol,2025-06-02,2025-06-06
edb68b81,de46222e-2514-47,2025-03-14,2025-03-20,Smartwatch,h301,249.99,website,direct,unknown,Manchester,2025-03-14,2025-03-20
e835f080,9cc05b67-a19b-42,2025-04-17,2025-04-20,Google Pixel 8,i920,699.99,mobile_app,search,desktop,Glasgow,2025-04-17,2025-04-20
a72bdddd,57f7d71f-2978-4c,08-01-2025,01-13-2025,Google Pixel 8,i920,699.99,website,direct,mobile,Bristol,2025-01-08,2025-01-13
e33fc52c,9afa8267-4479-42,2025-05-06,2025-05-12,Accessory,m001,24.99,website,search,unknown,Leeds,2025-05-06,2025-05-12
e33fc52c,9afa8267-4479-42,2025-05-06,2025-05-11,AirPods,d633,159.99,website,email,unknown,London,2025-05-06,2025-05-11
855c0a97,f0533851-dce0-42,2025-06-27,07-01-2025,Nintendo Switch,e682,299.99,mobile_app,search,mobile,Manchester,2025-06-27,2025-07-01
20029d9f,2ad55c0b-69fb-4f,2025-03-23,2025-03-29,Kindle Paperwhite,j877,129.99,mobile_app,social,mobile,Manchester,2025-03-23,2025-03-29
bfeef19d,406bf02d-a97a-4f,2025-06-11,2025-06-14,AirPods,d633,159.99,website,affiliate,,Glasgow,2025-06-11,2025-06-14
bfeef19d,406bf02d-a97a-4f,2025-06-11,06-17-2025,Kindle Paperwhite,j877,129.99,mobile_app,search,mobile,Liverpool,2025-06-11,2025-06-17
efd1b588,65a4c79b-2aba-44,2025-04-01,2025-04-07,Nintendo Switch,e682,299.99,mobile_app,search,desktop,London,2025-04-01,2025-04-07
efd1b588,65a4c79b-2aba-44,2025-04-01,04-02-2025,Kindle Paperwhite,j877,129.99,mobile_app,,desktop,London,2025-04-01,2025-04-02
efd1b588,65a4c79b-2aba-44,2025-04-01,2025-04-05,AirPods,d633,159.99,website,direct,unknown,London,2025-04-01,2025-04-05
8623bc74,0dc78104-8c66-47,2025-05-08,2025-05-11,PS5,a245,479.99,mobile_app,direct,unknown,London,2025-05-08,2025-05-11
15956c42,1a9b0d42-154f-43,2025-04-03,2025-04-06,AirPods,d633,159.99,mobile_app,affiliate,unknown,Birmingham,2025-04-03,2025-04-06
bcd2e8eb,63ccf604-e2ae-4f,20-04-2025,2025-04-25,PS5,a245,479.99,website,search,,Leeds,2025-04-20,2025-04-25
2bacf712,205c8491-a061-49,2025-04-06,2025-04-12,Xbox Series X,b104,499.99,mobile_app,email,desktop,Manchester,2025-04-06,2025-04-12
2bacf712,205c8491-a061-49,2025-04-06,2025-04-12,AirPods,d633,159.99,website,social,desktop,,2025-04-06,2025-04-12
dd3ee854,5b59f28e-a9de-4b,2025-05-20,2025-05-21,Google Pixel 8,i920,699.99,mobile_app,affiliate,desktop,Glasgow,2025-05-20,2025-05-21
8c6d768e,def3306a-f998-43,2025-02-08,02-10-2025,Kindle Paperwhite,j877,129.99,mobile_app,social,mobile,Manchester,2025-02-08,2025-02-10
8c6d768e,def3306a-f998-43,2025-02-08,2025-02-14,Steam Deck,c912,499.99,mobile_app,direct,desktop,Nottingham,2025-02-08,2025-02-14
9740b212,f2cffcae-f833-4b,2025-04-11,2025-04-17,Kindle Paperwhite,j877,129.99,mobile_app,affiliate,unknown,London,2025-04-11,2025-04-17
6f5aad52,bfb8abb9-a18c-44,2025-04-16,04-17-2025,AirPods,d633,159.99,website,direct,mobile,Manchester,2025-04-16,2025-04-17
6f5aad52,bfb8abb9-a18c-44,2025-04-16,2025-04-20,MacBook Air,g770,1199.99,mobile_app,,unknown,Glasgow,2025-04-16,2025-04-20
7b4d8646,88a613b4-a3b8-4f,2025-02-26,2025-02-28,Google Pixel 8,i920,699.99,mobile_app,social,mobile,London,2025-02-26,2025-02-28
6986305a,16ed0330-ce01-44,2025-04-19,2025-04-21,AirPods,d633,159.99,mobile_app,affiliate,mobile,Birmingham,2025-04-19,2025-04-21
6986305a,16ed0330-ce01-44,2025-04-19,2025-04-23,Smartwatch,h301,249.99,mobile_app,search,unknown,Manchester,2025-04-19,2025-04-23
c21f84fc,02b3c948-4db6-44,2025-04-01,2025-04-02,Nintendo Switch,e682,299.99,mobile_app,social,unknown,Nottingham,2025-04-01,2025-04-02
b011b125,49694032-5808-47,2025-02-15,2025-02-18,Accessory,m001,24.99,mobile_app,email,mobile,London,2025-02-15,2025-02-18
c4100108,c166a8b3-f26b-4e,2025-04-25,2025-04-28,PS5,a245,479.99,mobile_app,social,unknown,Birmingham,2025-04-25,2025-04-28
8c57a277,98d53cf5-4afc-49,2025-03-19,2025-03-25,Steam Deck,c912,499.99,website,search,mobile,Bristol,2025-03-19,2025-03-25
8c57a277,98d53cf5-4afc-49,2025-03-19,03-25-2025,Accessory,m001,24.99,website,email,unknown,Manchester,2025-03-19,2025-03-25
3ff93134,e1d55f85-6967-45,2025-01-25,2025-01-31,Nintendo Switch,e682,299.99,website,affiliate,desktop,Liverpool,2025-01-25,2025-01-31
3878becf,a55fa725-bcb3-41,2025-06-04,2025-06-05,MacBook Air,g770,1199.99,website,social,mobile,London,2025-06-04,2025-06-05
ccca1e14,a0152b5b-6c17-41,2025-04-11,04-17-2025,Steam Deck,c912,499.99,mobile_app,,desktop,London,2025-04-11,2025-04-17
ccca1e14,a0152b5b-6c17-41,2025-04-11,2025-04-12,Nintendo Switch,e682,299.99,website,affiliate,unknown,Glasgow,2025-04-11,2025-04-12
a60147c3,b1a50a3d-cebd-4b,2025-03-11,2025-03-13,Accessory,m001,24.99,website,affiliate,desktop,Nottingham,2025-03-11,2025-03-13
a60147c3,b1a50a3d-cebd-4b,2025-03-11,2025-03-13,Kindle Paperwhite,j877,129.99,mobile_app,search,desktop,London,2025-03-11,2025-03-13
1186da93,44d18524-cf0e-45,2025-03-04,2025-03-10,PS5,a245,479.99,website,email,mobile,Manchester,2025-03-04,2025-03-10
73e88db6,1c405045-4a22-4a,2025-04-03,2025-04-09,Smartwatch,h301,249.99,website,social,mobile,,2025-04-03,2025-04-09
26f341c8,7df37378-9f6c-4a,2025-03-15,2025-03-21,MacBook Air,g770,1199.99,mobile_app,email,desktop,London,2025-03-15,2025-03-21
4838a888,05aa5eab-88f3-47,2025-01-27,2025-01-30,PS5,a245,479.99,website,social,mobile,Birmingham,2025-01-27,2025-01-30
4838a888,05aa5eab-88f3-47,2025-01-28,27-01-2025,iPhone 15,f521,899.99,mobile_app,email,desktop,London,2025-01-28,2025-01-27
4838a888,05aa5eab-88f3-47,2025-01-27,01-28-2025,Smartwatch,h301,249.99,mobile_app,direct,unknown,Glasgow,2025-01-27,2025-01-28
17172654,703c1286-b717-44,2025-05-10,2025-05-12,MacBook Air,g770,1199.99,mobile_app,affiliate,desktop,Birmingham,2025-05-10,2025-05-12
c9254bb5,3799a376-7e5b-4a,2025-02-10,2025-02-14,Google Pixel 8,i920,699.99,website,search,unknown,London,2025-02-10,2025-02-14
081fec82,5f13e10b-ff7a-48,2025-04-06,2025-04-10,PS5,a245,479.99,mobile_app,affiliate,desktop,Liverpool,2025-04-06,2025-04-10
4439940d,c02553ea-d7f2-46,2025-02-02,02-03-2025,PS5,a245,479.99,mobile_app,social,desktop,Manchester,2025-02-02,2025-02-03
e54c8739,8b0ea0b9-1246-44,2025-04-04,2025-04-06,Smartwatch,h301,249.99,website,affiliate,unknown,Glasgow,2025-04-04,2025-04-06
f97f4994,61af0e8e-d137-47,03-05-2025,05-06-2025,MacBook Air,g770,1199.99,website,email,mobile,Manchester,2025-05-03,2025-05-06
3f46057b,62821d61-3fbb-4f,2025-03-21,2025-03-20,Kindle Paperwhite,j877,129.99,mobile_app,social,mobile,Manchester,2025-03-21,2025-03-20
180dc855,32fd73c5-0894-41,2025-06-18,06-24-2025,MacBook Air,g770,1199.99,website,search,desktop,Manchester,2025-06-18,2025-06-24
f6121d2c,355cca9c-fb6b-41,2025-04-27,05-01-2025,Nintendo Switch,e682,299.99,mobile_app,affiliate,unknown,London,2025-04-27,2025-05-01
f6121d2c,355cca9c-fb6b-41,2025-04-27,2025-04-30,Google Pixel 8,i920,699.99,mobile_app,email,mobile,Glasgow,2025-04-27,2025-04-30
bea6450f,289ac251-52b4-44,2025-06-26,2025-07-02,Nintendo Switch,e682,299.99,website,email,unknown,London,2025-06-26,2025-07-02
4c7f03bb,1f44aa88-855b-4c,2025-02-22,2025-02-23,iPhone 15,f521,899.99,mobile_app,email,unknown,London,2025-02-22,2025-02-23
f9287d26,0d559b64-e334-4b,2025-05-18,2025-05-20,Steam Deck,c912,499.99,website,social,unknown,London,2025-05-18,2025-05-20
cb5d2b59,6f2537ce-a206-42,2025-04-26,2025-04-29,Steam Deck,c912,499.99,mobile_app,affiliate,unknown,Leicester,2025-04-26,2025-04-29
f80590f0,6553b15f-1ea1-4b,2025-03-12,2025-03-16,iPhone 15,f521,899.99,website,social,unknown,Manchester,2025-03-12,2025-03-16
27ad8d51,b0d515ab-c891-45,2025-04-05,2025-04-07,Steam Deck,c912,499.99,website,direct,desktop,Manchester,2025-04-05,2025-04-07
af9a1168,3fac4317-16e8-47,2025-02-12,2025-02-14,Kindle Paperwhite,j877,129.99,mobile_app,social,desktop,Sheffield,2025-02-12,2025-02-14
af9a1168,3fac4317-16e8-47,12-02-2025,2025-02-18,Google Pixel 8,i920,699.99,mobile_app,social,unknown,Manchester,2025-02-12,2025-02-18
0f5f9707,f83b1806-ee4c-4b,23-01-2025,2025-01-24,Smartwatch,h301,249.99,website,email,desktop,Manchester,2025-01-23,2025-01-24
0f5f9707,f83b1806-ee4c-4b,2025-01-23,2025-01-29,iPhone 15,f521,899.99,website,social,desktop,Glasgow,2025-01-23,2025-01-29
0f5f9707,f83b1806-ee4c-4b,2025-01-23,2025-01-29,Steam Deck,c912,499.99,mobile_app,search,desktop,London,2025-01-23,2025-01-29
1b7e0502,276732d3-a502-4c,12-01-2025,2025-01-14,Kindle Paperwhite,j877,129.99,website,affiliate,unknown,Manchester,2025-01-12,2025-01-14
a50784cb,5115d7ee-3b90-40,2025-06-12,2025-06-16,Xbox Series X,b104,499.99,website,social,unknown,Leeds,2025-06-12,2025-06-16
05776108,e44cbd41-ce36-49,2025-05-26,2025-05-28,Nintendo Switch,e682,299.99,website,affiliate,desktop,London,2025-05-26,2025-05-28
05776108,e44cbd41-ce36-49,2025-05-26,2025-05-27,Accessory,m001,24.99,mobile_app,affiliate,mobile,Manchester,2025-05-26,2025-05-27
0a1bebd3,b972393a-5bb0-4d,2025-04-24,2025-04-26,Kindle Paperwhite,j877,129.99,website,affiliate,,Glasgow,2025-04-24,2025-04-26
7d76ab58,8f1c3fa0-7000-40,2025-04-25,2025-04-30,Smartwatch,h301,249.99,website,affiliate,desktop,London,2025-04-25,2025-04-30
7d76ab58,8f1c3fa0-7000-40,2025-04-25,2025-04-28,MacBook Air,g770,1199.99,mobile_app,email,desktop,Manchester,2025-04-25,2025-04-28
77e8b762,8b2ab759-2fc6-44,07-05-2025,2025-05-12,Accessory,m001,24.99,website,email,desktop,Glasgow,2025-05-07,2025-05-12
290c4414,994316bb-d4d3-43,2025-04-09,2025-04-14,Nintendo Switch,e682,299.99,website,email,desktop,Manchester,2025-04-09,2025-04-14
8aa6b006,730ad7de-27af-4f,2025-05-05,2025-05-08,PS5,a245,479.99,website,social,desktop,Leeds,2025-05-05,2025-05-08
8aa6b006,730ad7de-27af-4f,2025-05-05,2025-05-10,iPhone 15,f521,899.99,website,social,desktop,Glasgow,2025-05-05,2025-05-10
bbd0fe6c,c6a28e4e-002f-4c,2025-04-15,2025-04-16,Kindle Paperwhite,j877,129.99,website,affiliate,unknown,Glasgow,2025-04-15,2025-04-16
9ec5405d,9ea6ed4a-04ca-43,2025-02-10,2025-02-14,Kindle Paperwhite,j877,129.99,website,affiliate,mobile,Manchester,2025-02-10,2025-02-14
d1ad3e51,10372a5c-b893-40,2025-01-15,2025-01-16,PS5,a245,479.99,website,direct,desktop,Liverpool,2025-01-15,2025-01-16
277529a2,aee7c7a5-8629-4f,2025-05-08,2025-05-13,Accessory,m001,24.99,mobile_app,social,unknown,Liverpool,2025-05-08,2025-05-13
277529a2,aee7c7a5-8629-4f,2025-05-08,2025-05-14,Smartwatch,h301,249.99,website,direct,desktop,Manchester,2025-05-08,2025-05-14
277529a2,aee7c7a5-8629-4f,2025-05-08,2025-05-11,Accessory,m001,24.99,mobile_app,social,desktop,Glasgow,2025-05-08,2025-05-11
18a440bd,68e8f311-5295-4a,2025-01-23,2025-01-28,Xbox Series X,b104,499.99,website,search,desktop,Glasgow,2025-01-23,2025-01-28
2dbb45bd,0b34fc84-1111-4e,2025-02-14,2025-02-19,Smartwatch,h301,249.99,website,email,mobile,Sheffield,2025-02-14,2025-02-19
2dbb45bd,0b34fc84-1111-4e,2025-02-14,2025-02-15,MacBook Air,g770,1199.99,website,direct,desktop,Manchester,2025-02-14,2025-02-15
2dbb45bd,0b34fc84-1111-4e,2025-02-14,2025-02-15,Google Pixel 8,i920,699.99,mobile_app,search,unknown,Manchester,2025-02-14,2025-02-15
08252b39,1b67f7bb-33bb-43,2025-02-24,2025-02-28,Steam Deck,c912,499.99,website,email,desktop,Glasgow,2025-02-24,2025-02-28
9fbc879e,637b3648-d617-49,2025-03-16,2025-03-17,Steam Deck,c912,499.99,website,social,mobile,Liverpool,2025-03-16,2025-03-17
b7c4b3ee,0c90e028-4185-40,2025-01-12,2025-01-14,Xbox Series X,b104,499.99,website,affiliate,unknown,Leicester,2025-01-12,2025-01-14
edabddab,ebc8f6b7-ee22-4f,14-05-2025,2025-05-17,iPhone 15,f521,899.99,website,social,mobile,Manchester,2025-05-14,2025-05-17
edabddab,ebc8f6b7-ee22-4f,2025-05-14,2025-05-19,iPhone 15,f521,899.99,mobile_app,affiliate,desktop,London,2025-05-14,2025-05-19
5c65a65c,77d2b94f-1478-4c,2025-04-11,04-16-2025,Nintendo Switch,e682,299.99,website,direct,desktop,Manchester,2025-04-11,2025-04-16
5c65a65c,77d2b94f-1478-4c,2025-04-11,2025-04-16,Smartwatch,h301,249.99,website,affiliate,desktop,Bristol,2025-04-11,2025-04-16
5c65a65c,77d2b94f-1478-4c,2025-04-11,2025-04-16,Smartwatch,h301,249.99,mobile_app,social,desktop,Manchester,2025-04-11,2025-04-16
cb53f0be,e3f342a8-f030-4f,2025-04-25,2025-04-28,Accessory,m001,24.99,website,affiliate,mobile,Manchester,2025-04-25,2025-04-28
bbfb1b71,9def57b4-d2da-43,2025-05-09,05-10-2025,Steam Deck,c912,499.99,website,social,desktop,London,2025-05-09,2025-05-10
84fcfcb0,13f39289-4dcc-40,2025-03-14,2025-03-16,MacBook Air,g770,1199.99,website,social,unknown,Leicester,2025-03-14,2025-03-16
317046b9,3b23feed-b9a4-4e,2025-06-06,06-07-2025,Smartwatch,h301,249.99,mobile_app,direct,desktop,Birmingham,2025-06-06,2025-06-07
8ef4d74b,91ed554a-3fae-4f,2025-03-17,13-03-2025,Kindle Paperwhite,j877,129.99,website,social,mobile,Manchester,2025-03-17,2025-03-13
9399ad15,bf00f56c-6a49-49,2025-04-18,2025-04-22,Xbox Series X,b104,499.99,website,email,mobile,Birmingham,2025-04-18,2025-04-22
1aa67474,b3da5808-756e-46,2025-04-12,2025-04-15,Steam Deck,c912,499.99,website,affiliate,unknown,Manchester,2025-04-12,2025-04-15
a854027e,8cca8963-2e2e-47,2025-03-11,03-12-2025,Kindle Paperwhite,j877,129.99,mobile_app,direct,desktop,Liverpool,2025-03-11,2025-03-12
e7094153,999413cc-ff99-47,2025-04-14,2025-04-18,Smartwatch,h301,249.99,mobile_app,direct,mobile,Liverpool,2025-04-14,2025-04-18
698f546d,ff31950a-fdd0-44,2025-03-19,2025-03-22,Steam Deck,c912,499.99,website,search,desktop,Birmingham,2025-03-19,2025-03-22
3d9ffe59,d37ee471-6e3b-45,2025-01-19,2025-01-24,Kindle Paperwhite,j877,129.99,website,affiliate,mobile,London,2025-01-19,2025-01-24
be9cafcf,60042231-36c3-4e,27-03-2025,2025-03-31,Google Pixel 8,i920,699.99,website,search,mobile,London,2025-03-27,2025-03-31
000cd21a,73d0b6c7-f62e-4f,2025-01-17,2025-01-20,Smartwatch,h301,249.99,website,social,unknown,Sheffield,2025-01-17,2025-01-20
2294fa0a,48d3d2ce-fba3-49,2025-04-08,2025-04-10,Steam Deck,c912,499.99,mobile_app,social,unknown,Glasgow,2025-04-08,2025-04-10
2294fa0a,48d3d2ce-fba3-49,2025-04-08,2025-04-13,Steam Deck,c912,499.99,website,search,desktop,London,2025-04-08,2025-04-13
36fea0b4,01ae7eb1-4d45-4e,2025-06-16,2025-06-17,MacBook Air,g770,1199.99,website,social,unknown,Glasgow,2025-06-16,2025-06-17
d284b528,c5828939-058e-48,2025-06-08,06-09-2025,Google Pixel 8,i920,699.99,mobile_app,search,mobile,Manchester,2025-06-08,2025-06-09
d284b528,c5828939-058e-48,2025-06-08,2025-06-14,Smartwatch,h301,249.99,website,social,mobile,Sheffield,2025-06-08,2025-06-14
9255273f,82e2b02d-8dbc-4e,2025-06-26,2025-06-25,Steam Deck,c912,499.99,website,social,desktop,London,2025-06-26,2025-06-25
9255273f,82e2b02d-8dbc-4e,2025-06-25,06-28-2025,Xbox Series X,b104,499.99,mobile_app,direct,unknown,London,2025-06-25,2025-06-28
43d643ed,75dacbbe-09a9-46,2025-04-11,2025-04-12,PS5,a245,479.99,mobile_app,email,desktop,London,2025-04-11,2025-04-12
4ce09ecb,3ff69f41-9508-48,2025-04-23,2025-04-28,Smartwatch,h301,249.99,website,social,mobile,Manchester,2025-04-23,2025-04-28
13c37b5d,91ae3d4c-6659-4d,27-02-2025,2025-03-05,Xbox Series X,b104,499.99,mobile_app,direct,mobile,Glasgow,2025-02-27,2025-03-05
e6267164,7b874b4a-cafb-44,08-04-2025,04-12-2025,Accessory,m001,24.99,website,affiliate,mobile,Manchester,2025-04-08,2025-04-12
a46acc9a,d1cbc092-9383-48,27-01-2025,2025-02-01,iPhone 15,f521,899.99,website,email,mobile,Manchester,2025-01-27,2025-02-01
c7b611cd,ceef7261-bb15-42,2025-04-21,2025-04-27,AirPods,d633,159.99,website,affiliate,unknown,,2025-04-21,2025-04-27
6f2e92b9,559a8f54-c559-4d,2025-04-23,2025-04-29,iPhone 15,f521,899.99,website,search,unknown,London,2025-04-23,2025-04-29
bf67de42,1edbbe71-de2a-4d,2025-01-09,2025-01-10,iPhone 15,f521,899.99,website,social,mobile,Manchester,2025-01-09,2025-01-10
bf67de42,1edbbe71-de2a-4d,2025-01-09,2025-01-14,Smartwatch,h301,249.99,website,email,mobile,London,2025-01-09,2025-01-14
a1d770ea,edbc36d8-9a30-40,2025-06-06,2025-06-12,Xbox Series X,b104,499.99,website,search,unknown,Manchester,2025-06-06,2025-06-12
909e21ba,863dfcd6-4e06-48,2025-01-03,2025-01-05,Steam Deck,c912,499.99,mobile_app,direct,unknown,,2025-01-03,2025-01-05
ac735be0,b2a0f778-809d-44,2025-01-18,2025-01-24,PS5,a245,479.99,mobile_app,search,unknown,Birmingham,2025-01-18,2025-01-24
9343e6ea,f89617fa-6493-45,2025-02-03,2025-02-09,Steam Deck,c912,499.99,website,email,mobile,Bristol,2025-02-03,2025-02-09
25e42403,6e935615-38da-4a,2025-01-11,2025-01-16,AirPods,d633,159.99,mobile_app,email,desktop,Glasgow,2025-01-11,2025-01-16
8c53b74c,79d19c4e-1521-4d,2025-04-23,2025-04-26,PS5,a245,479.99,mobile_app,social,mobile,London,2025-04-23,2025-04-26
b2a7a475,6605de3c-15c7-4c,2025-06-01,2025-06-06,Google Pixel 8,i920,699.99,website,social,unknown,London,2025-06-01,2025-06-06
65339cf0,7b1dbca3-2286-43,08-02-2025,2025-02-14,Google Pixel 8,i920,699.99,mobile_app,social,unknown,Manchester,2025-02-08,2025-02-14
86351a54,8fa8ae34-3233-40,2025-04-06,2025-04-12,iPhone 15,f521,899.99,website,direct,mobile,Glasgow,2025-04-06,2025-04-12
af4afcdd,44296ca2-1257-42,2025-05-11,2025-05-12,PS5,a245,479.99,mobile_app,direct,mobile,Manchester,2025-05-11,2025-05-12
5d822e3a,1ccec1ef-16ef-4c,2025-04-20,2025-04-21,PS5,a245,479.99,website,email,desktop,Glasgow,2025-04-20,2025-04-21
c509d558,5832c8de-521b-48,2025-03-15,2025-03-19,Xbox Series X,b104,499.99,website,direct,unknown,London,2025-03-15,2025-03-19
cd840a47,5987038a-fcd6-41,2025-03-26,2025-03-27,Accessory,m001,24.99,mobile_app,social,unknown,Sheffield,2025-03-26,2025-03-27
cd840a47,5987038a-fcd6-41,26-03-2025,2025-03-28,Google Pixel 8,i920,699.99,mobile_app,email,mobile,Manchester,2025-03-26,2025-03-28
3bc5f97f,70c23600-2554-4c,2025-05-23,2025-05-29,Smartwatch,h301,249.99,website,email,desktop,Birmingham,2025-05-23,2025-05-29
15f7ef61,27ef0a4b-5fb2-48,2025-05-13,2025-05-14,PS5,a245,479.99,website,search,unknown,Manchester,2025-05-13,2025-05-14
15f7ef61,27ef0a4b-5fb2-48,2025-05-13,2025-05-17,iPhone 15,f521,899.99,mobile_app,email,mobile,Birmingham,2025-05-13,2025-05-17
25ce2a21,3e3869e2-0df6-44,2025-02-03,2025-02-09,Kindle Paperwhite,j877,129.99,mobile_app,social,mobile,Manchester,2025-02-03,2025-02-09
cde55848,49a5baeb-d1f4-4c,21-05-2025,2025-05-23,Kindle Paperwhite,j877,129.99,mobile_app,direct,mobile,Manchester,2025-05-21,2025-05-23
bd717da3,789fed96-7337-4c,2025-01-04,2025-01-08,Steam Deck,c912,499.99,mobile_app,email,desktop,Glasgow,2025-01-04,2025-01-08
bd717da3,789fed96-7337-4c,04-01-2025,2025-01-07,Xbox Series X,b104,499.99,mobile_app,social,desktop,Birmingham,2025-01-04,2025-01-07
8c7e2904,8be27516-342c-43,2025-05-20,2025-05-22,Kindle Paperwhite,j877,129.99,mobile_app,direct,desktop,Glasgow,2025-05-20,2025-05-22
ab132032,fe07832a-badc-45,2025-06-07,2025-06-09,Accessory,m001,24.99,website,direct,desktop,Nottingham,2025-06-07,2025-06-09
4165964c,e7f2418a-953f-4f,2025-06-14,2025-06-17,Nintendo Switch,e682,299.99,website,social,mobile,London,2025-06-14,2025-06-17
4572b385,3360d115-48b5-4c,2025-02-18,02-20-2025,iPhone 15,f521,899.99,website,search,unknown,London,2025-02-18,2025-02-20
4572b385,3360d115-48b5-4c,2025-02-18,2025-02-24,Nintendo Switch,e682,299.99,mobile_app,email,desktop,Manchester,2025-02-18,2025-02-24
a90e319d,f1f71605-a79e-46,2025-06-26,2025-06-30,iPhone 15,f521,899.99,website,search,mobile,Glasgow,2025-06-26,2025-06-30
1b9ec5f9,e9b1c4a1-da22-4b,2025-04-26,2025-04-27,PS5,a245,479.99,mobile_app,social,desktop,Manchester,2025-04-26,2025-04-27
fad3b44c,e226a768-de0e-4c,2025-03-05,2025-03-08,Smartwatch,h301,249.99,website,,unknown,Manchester,2025-03-05,2025-03-08
7c12d198,b5ae2a56-fa03-4d,2025-02-15,2025-02-20,Google Pixel 8,i920,699.99,mobile_app,email,mobile,Bristol,2025-02-15,2025-02-20
f77fa3a7,168885c2-8814-4b,2025-05-15,2025-05-20,AirPods,d633,159.99,website,search,unknown,Leeds,2025-05-15,2025-05-20
f77fa3a7,168885c2-8814-4b,2025-05-15,2025-05-18,Smartwatch,h301,249.99,website,social,desktop,Bristol,2025-05-15,2025-05-18
ec19e4eb,b6646199-ed25-45,2025-02-06,2025-02-12,Xbox Series X,b104,499.99,website,email,desktop,Glasgow,2025-02-06,2025-02-12
ec19e4eb,b6646199-ed25-45,2025-02-06,2025-02-11,MacBook Air,g770,1199.99,website,social,mobile,Manchester,2025-02-06,2025-02-11
04b40ac9,7d6c3d2a-5564-41,2025-06-22,2025-06-25,PS5,a245,479.99,website,search,unknown,Manchester,2025-06-22,2025-06-25
04b40ac9,7d6c3d2a-5564-41,2025-06-22,2025-06-27,Steam Deck,c912,499.99,website,email,desktop,Manchester,2025-06-22,2025-06-27
fef97d57,5afa0fb3-5a16-49,2025-05-10,2025-05-11,Nintendo Switch,e682,299.99,mobile_app,affiliate,,Glasgow,2025-05-10,2025-05-11
41f74651,469ff562-8052-44,2025-05-10,05-12-2025,MacBook Air,g770,1199.99,mobile_app,email,unknown,Leeds,2025-05-10,2025-05-12
41f74651,469ff562-8052-44,2025-05-10,2025-05-15,Kindle Paperwhite,j877,129.99,website,email,mobile,Manchester,2025-05-10,2025-05-15
f1b2f143,fffcd743-e3f1-44,2025-06-25,07-01-2025,Xbox Series X,b104,499.99,mobile_app,email,mobile,Manchester,2025-06-25,2025-07-01
6491982b,39bfc9b6-47ba-48,2025-02-19,2025-02-20,iPhone 15,f521,899.99,mobile_app,email,mobile,London,2025-02-19,2025-02-20
ad9112c5,bada0c94-1679-4b,2025-02-14,2025-02-18,AirPods,d633,159.99,website,direct,unknown,London,2025-02-14,2025-02-18
92a97acd,afbffde4-a022-41,2025-04-07,2025-04-13,Smartwatch,h301,249.99,mobile_app,social,mobile,Leeds,2025-04-07,2025-04-13
72fcc072,4ff85111-f875-4f,2025-06-22,2025-06-28,Xbox Series X,b104,499.99,mobile_app,social,desktop,Liverpool,2025-06-22,2025-06-28
72fcc072,4ff85111-f875-4f,2025-06-22,2025-06-27,Kindle Paperwhite,j877,129.99,website,,desktop,Manchester,2025-06-22,2025-06-27
af1dcfb8,a7087280-34ee-4b,2025-04-24,2025-04-28,AirPods,d633,159.99,mobile_app,affiliate,unknown,Glasgow,2025-04-24,2025-04-28
e60d7a94,235b275b-dcd2-4b,13-04-2025,2025-04-14,MacBook Air,g770,1199.99,website,social,unknown,Manchester,2025-04-13,2025-04-14
c521ff2e,6e18b184-229f-48,2025-04-06,2025-04-10,AirPods,d633,159.99,website,search,mobile,Manchester,2025-04-06,2025-04-10
115c42cd,9099a283-eedb-4c,2025-05-10,2025-05-12,Kindle Paperwhite,j877,129.99,website,direct,mobile,Glasgow,2025-05-10,2025-05-12
d6eaf269,b82d40de-f2d7-4d,2025-04-09,2025-04-14,AirPods,d633,159.99,mobile_app,affiliate,mobile,London,2025-04-09,2025-04-14
f90fb6e4,078c3875-ba21-42,2025-05-16,2025-05-19,Kindle Paperwhite,j877,129.99,mobile_app,search,unknown,Liverpool,2025-05-16,2025-05-19
d25ad576,4da838b7-6947-4b,2025-01-20,2025-01-22,Smartwatch,h301,249.99,website,affiliate,desktop,London,2025-01-20,2025-01-22
301c6abf,bd03d33b-eee9-49,2025-06-17,2025-06-20,AirPods,d633,159.99,mobile_app,affiliate,unknown,London,2025-06-17,2025-06-20
9df034d3,06b4ed27-2f4b-4b,2025-04-22,2025-04-25,Accessory,m001,24.99,mobile_app,direct,mobile,Bristol,2025-04-22,2025-04-25
3b1d12cf,9cc3c1f5-9129-4c,2025-06-15,2025-06-17,Accessory,m001,24.99,website,affiliate,mobile,Liverpool,2025-06-15,2025-06-17
22538040,14588063-5bf8-4d,2025-04-15,2025-04-16,Smartwatch,h301,249.99,mobile_app,search,mobile,Liverpool,2025-04-15,2025-04-16
2f191516,7800e27a-9ace-43,2025-06-20,2025-06-24,Kindle Paperwhite,j877,129.99,mobile_app,social,unknown,Glasgow,2025-06-20,2025-06-24
39ed0800,794e0838-7dcf-40,2025-03-12,2025-03-15,PS5,a245,479.99,website,email,desktop,Glasgow,2025-03-12,2025-03-15
39ed0800,794e0838-7dcf-40,2025-03-12,2025-03-13,Kindle Paperwhite,j877,129.99,website,email,mobile,Manchester,2025-03-12,2025-03-13
39ed0800,794e0838-7dcf-40,2025-03-12,2025-03-15,Xbox Series X,b104,499.99,website,,mobile,Manchester,2025-03-12,2025-03-15
f3402dd3,f80443ee-c3b8-41,2025-01-25,2025-01-29,iPhone 15,f521,899.99,mobile_app,affiliate,mobile,,2025-01-25,2025-01-29
345e2eaf,abdce0da-be0b-4d,2025-02-17,2025-02-22,AirPods,d633,159.99,website,search,desktop,London,2025-02-17,2025-02-22
345e2eaf,abdce0da-be0b-4d,17-02-2025,2025-02-19,Accessory,m001,24.99,website,search,desktop,Liverpool,2025-02-17,2025-02-19
345e2eaf,abdce0da-be0b-4d,2025-02-17,2025-02-20,Google Pixel 8,i920,699.99,mobile_app,email,mobile,Glasgow,2025-02-17,2025-02-20
9df79a27,f4672866-ed56-42,2025-03-22,2025-03-28,Accessory,m001,24.99,mobile_app,affiliate,unknown,Manchester,2025-03-22,2025-03-28
6d744a0b,dde4f5c1-532c-4c,2025-04-17,2025-04-20,Kindle Paperwhite,j877,129.99,website,affiliate,desktop,Manchester,2025-04-17,2025-04-20
6d744a0b,dde4f5c1-532c-4c,2025-04-17,2025-04-20,Google Pixel 8,i920,699.99,mobile_app,social,mobile,London,2025-04-17,2025-04-20
b85f164b,9ba14c35-0ab5-40,2025-06-07,2025-06-09,iPhone 15,f521,899.99,website,direct,desktop,London,2025-06-07,2025-06-09
8941bdd3,f06b6c12-9c8b-45,2025-06-05,2025-06-07,Google Pixel 8,i920,699.99,website,search,unknown,Manchester,2025-06-05,2025-06-07
1bfc270c,b440b852-e033-40,2025-03-05,2025-03-10,Google Pixel 8,i920,699.99,website,social,mobile,Manchester,2025-03-05,2025-03-10
3ee79d31,e0b55615-d3b6-4f,2025-02-09,2025-02-10,PS5,a245,479.99,website,affiliate,mobile,Glasgow,2025-02-09,2025-02-10
632c817e,fbdc532e-6546-46,2025-03-02,2025-03-05,iPhone 15,f521,899.99,mobile_app,direct,mobile,Manchester,2025-03-02,2025-03-05
70869a45,f66c7331-a172-4e,2025-01-18,2025-01-23,Kindle Paperwhite,j877,129.99,mobile_app,direct,unknown,Birmingham,2025-01-18,2025-01-23
2a9edda7,c60fb252-4df7-42,2025-04-04,2025-04-05,AirPods,d633,159.99,website,direct,desktop,Glasgow,2025-04-04,2025-04-05
e7574997,eb45bc38-9cf6-4e,2025-03-01,2025-03-07,Xbox Series X,b104,499.99,website,email,desktop,Birmingham,2025-03-01,2025-03-07
802b1bf4,a566e884-d473-46,2025-01-06,2025-01-08,Steam Deck,c912,499.99,website,social,unknown,Manchester,2025-01-06,2025-01-08
8be15610,95dfe6cb-c75a-4c,2025-05-24,2025-05-25,PS5,a245,479.99,website,social,mobile,Manchester,2025-05-24,2025-05-25
74246baa,52ce55e3-69df-45,2025-05-13,2025-05-15,Nintendo Switch,e682,299.99,website,affiliate,unknown,Birmingham,2025-05-13,2025-05-15
171603b1,e552d0a8-b66f-45,2025-05-17,2025-05-22,Google Pixel 8,i920,699.99,website,social,desktop,Liverpool,2025-05-17,2025-05-22
29fb832c,a6091ad0-b114-44,2025-01-26,2025-01-27,AirPods,d633,159.99,website,email,unknown,Glasgow,2025-01-26,2025-01-27
29fb832c,a6091ad0-b114-44,26-01-2025,2025-01-27,Nintendo Switch,e682,299.99,website,search,desktop,Manchester,2025-01-26,2025-01-27
a25291f3,17584f23-1fa0-48,07-03-2025,2025-03-09,Kindle Paperwhite,j877,129.99,website,email,desktop,Leeds,2025-03-07,2025-03-09
a25291f3,17584f23-1fa0-48,2025-03-07,03-09-2025,PS5,a245,479.99,mobile_app,search,mobile,Manchester,2025-03-07,2025-03-09
f9a62522,b5103e9c-8618-44,20-06-2025,2025-06-22,iPhone 15,f521,899.99,website,search,,Liverpool,2025-06-20,2025-06-22
0b3d6dc9,28ef2f46-f323-42,2025-04-09,2025-04-10,PS5,a245,479.99,website,search,desktop,Manchester,2025-04-09,2025-04-10
dcd81a8b,55cf37ba-e989-45,2025-02-19,02-22-2025,Steam Deck,c912,499.99,website,search,desktop,Manchester,2025-02-19,2025-02-22
0d22af35,2504fd28-de6a-44,2025-01-08,2025-01-10,PS5,a245,479.99,mobile_app,email,unknown,London,2025-01-08,2025-01-10
0d22af35,2504fd28-de6a-44,2025-01-08,2025-01-10,Kindle Paperwhite,j877,129.99,mobile_app,affiliate,desktop,Manchester,2025-01-08,2025-01-10
49ed856e,baebe15d-4f3c-47,2025-01-19,2025-01-23,iPhone 15,f521,899.99,mobile_app,direct,unknown,London,2025-01-19,2025-01-23
00e78824,e606d7c2-1e18-44,2025-02-22,2025-02-26,Steam Deck,c912,499.99,website,email,desktop,Nottingham,2025-02-22,2025-02-26
7fa70485,03200c4e-40cb-41,2025-04-10,2025-04-11,Smartwatch,h301,249.99,website,social,mobile,Manchester,2025-04-10,2025-04-11
7fa70485,03200c4e-40cb-41,2025-04-10,2025-04-15,AirPods,d633,159.99,website,affiliate,mobile,Sheffield,2025-04-10,2025-04-15
37850b5c,9ba4d5a6-0178-4e,2025-03-17,2025-03-18,Smartwatch,h301,249.99,mobile_app,email,mobile,London,2025-03-17,2025-03-18
99e95433,74283491-79c8-42,2025-05-24,2025-05-30,Kindle Paperwhite,j877,129.99,mobile_app,social,desktop,Manchester,2025-05-24,2025-05-30
a0ee404f,e1d5c0dc-3ea5-45,2025-02-12,2025-02-16,Google Pixel 8,i920,699.99,mobile_app,social,desktop,Manchester,2025-02-12,2025-02-16
0e18ab96,3527bcee-d343-4f,21-01-2025,2025-01-25,PS5,a245,479.99,mobile_app,direct,desktop,Glasgow,2025-01-21,2025-01-25
0e18ab96,3527bcee-d343-4f,2025-01-21,2025-01-25,Accessory,m001,24.99,website,social,mobile,Manchester,2025-01-21,2025-01-25
93fde248,253741e4-0966-4d,2025-02-21,2025-02-27,Google Pixel 8,i920,699.99,website,affiliate,desktop,Manchester,2025-02-21,2025-02-27
93fde248,253741e4-0966-4d,2025-02-21,2025-02-25,MacBook Air,g770,1199.99,website,direct,desktop,London,2025-02-21,2025-02-25
93fde248,253741e4-0966-4d,2025-02-21,2025-02-23,iPhone 15,f521,899.99,mobile_app,direct,unknown,Glasgow,2025-02-21,2025-02-23
1be00f8e,54c3b22e-4c66-4a,04-01-2025,2025-01-05,MacBook Air,g770,1199.99,website,social,unknown,Sheffield,2025-01-04,2025-01-05
a9325ae1,294d43ed-2da1-4f,2025-05-23,2025-05-26,Smartwatch,h301,249.99,mobile_app,social,mobile,Leicester,2025-05-23,2025-05-26
a9325ae1,294d43ed-2da1-4f,2025-05-23,2025-05-29,Smartwatch,h301,249.99,mobile_app,social,unknown,Glasgow,2025-05-23,2025-05-29
f75efed8,92811c92-984f-43,2025-05-13,2025-05-15,AirPods,d633,159.99,mobile_app,affiliate,desktop,London,2025-05-13,2025-05-15
c4bd338e,5c3552b3-9437-42,19-02-2025,2025-02-23,AirPods,d633,159.99,mobile_app,direct,unknown,Birmingham,2025-02-19,2025-02-23
c2294116,e5c482ff-5e5a-40,2025-03-12,2025-03-13,Xbox Series X,b104,499.99,website,affiliate,desktop,Leeds,2025-03-12,2025-03-13
1f3cea1d,109efb40-8ceb-4c,2025-04-22,2025-04-28,Smartwatch,h301,249.99,website,direct,mobile,Manchester,2025-04-22,2025-04-28
35b86d0a,54470290-4640-4b,2025-05-06,2025-05-12,Kindle Paperwhite,j877,129.99,mobile_app,direct,mobile,London,2025-05-06,2025-05-12
fab6ad91,0ee52f63-9caf-4d,2025-03-07,2025-03-12,Kindle Paperwhite,j877,129.99,website,affiliate,unknown,Manchester,2025-03-07,2025-03-12
9ad2bb72,16718639-fcb8-4f,2025-04-04,2025-04-08,Google Pixel 8,i920,699.99,mobile_app,direct,mobile,Manchester,2025-04-04,2025-04-08
9ad2bb72,16718639-fcb8-4f,2025-04-04,2025-04-08,Accessory,m001,24.99,mobile_app,search,mobile,London,2025-04-04,2025-04-08
9ad2bb72,16718639-fcb8-4f,2025-04-04,2025-04-07,Google Pixel 8,i920,699.99,website,affiliate,mobile,Sheffield,2025-04-04,2025-04-07
d90949aa,b4f136fc-fc7c-4e,01-05-2025,2025-05-05,PS5,a245,479.99,mobile_app,email,mobile,Glasgow,2025-05-01,2025-05-05
ed56c714,933c8d00-8680-4a,2025-04-26,2025-04-30,Smartwatch,h301,249.99,website,affiliate,desktop,Leeds,2025-04-26,2025-04-30
7f6bf62c,7f13de67-9008-4d,01-04-2025,2025-04-07,Google Pixel 8,i920,699.99,mobile_app,direct,mobile,Sheffield,2025-04-01,2025-04-07
4a5d6cea,e237c877-2e0e-46,18-05-2025,2025-05-20,MacBook Air,g770,1199.99,mobile_app,social,mobile,Bristol,2025-05-18,2025-05-20
4a5d6cea,e237c877-2e0e-46,18-05-2025,2025-05-23,PS5,a245,479.99,mobile_app,search,unknown,Liverpool,2025-05-18,2025-05-23
cbf6aa23,1e42d2b8-0067-4b,2025-04-06,2025-04-11,Google Pixel 8,i920,699.99,mobile_app,social,unknown,London,2025-04-06,2025-04-11
6a25542e,3513a238-d91b-4a,2025-04-04,2025-04-09,Xbox Series X,b104,499.99,website,social,mobile,Glasgow,2025-04-04,2025-04-09
365bc763,5982aa44-5573-48,2025-03-19,2025-03-24,Smartwatch,h301,249.99,mobile_app,,unknown,Manchester,2025-03-19,2025-03-24
115db44f,b0a4f557-3381-40,2025-04-24,2025-04-27,iPhone 15,f521,899.99,mobile_app,affiliate,desktop,Glasgow,2025-04-24,2025-04-27
1d2467e2,8ccc617e-81b6-49,17-05-2025,2025-05-18,Kindle Paperwhite,j877,129.99,website,email,mobile,Manchester,2025-05-17,2025-05-18
f5c9f459,65637d1f-5763-49,2025-04-04,2025-04-05,Kindle Paperwhite,j877,129.99,mobile_app,social,desktop,Glasgow,2025-04-04,2025-04-05
ec1a86d3,31ab0158-2cf6-47,2025-02-22,2025-02-25,MacBook Air,g770,1199.99,mobile_app,social,mobile,Manchester,2025-02-22,2025-02-25
22c0c475,7978dc84-ea89-49,2025-05-25,2025-05-31,Nintendo Switch,e682,299.99,website,direct,desktop,Glasgow,2025-05-25,2025-05-31
e55b93ad,75eb0e8f-a090-46,13-03-2025,2025-03-16,Accessory,m001,24.99,website,affiliate,mobile,Glasgow,2025-03-13,2025-03-16
0e5779ec,d06d3943-c8b3-41,2025-04-24,2025-04-27,PS5,a245,479.99,website,affiliate,unknown,Bristol,2025-04-24,2025-04-27
8e2017e1,90a014ab-4ca1-4a,2025-04-24,2025-04-25,iPhone 15,f521,899.99,mobile_app,social,unknown,London,2025-04-24,2025-04-25
ea8b31f5,93d054e4-3550-40,2025-02-16,2025-02-20,Google Pixel 8,i920,699.99,mobile_app,affiliate,unknown,Glasgow,2025-02-16,2025-02-20
ea8b31f5,93d054e4-3550-40,2025-02-16,2025-02-21,Smartwatch,h301,249.99,website,email,mobile,Birmingham,2025-02-16,2025-02-21
d73aae7b,10f35676-5a85-4c,2025-03-24,2025-03-28,Kindle Paperwhite,j877,129.99,mobile_app,search,desktop,Manchester,2025-03-24,2025-03-28
2a7cf9e9,600fc79c-fbce-40,2025-04-20,2025-04-21,Smartwatch,h301,249.99,website,email,mobile,Bristol,2025-04-20,2025-04-21
2a7cf9e9,600fc79c-fbce-40,2025-04-20,2025-04-26,Google Pixel 8,i920,699.99,mobile_app,direct,unknown,London,2025-04-20,2025-04-26
c847b130,2ff8107a-63ba-4d,2025-05-04,2025-05-07,AirPods,d633,159.99,mobile_app,direct,mobile,Sheffield,2025-05-04,2025-05-07
4580dac2,db9a0eb7-b48c-43,2025-04-11,04-12-2025,Accessory,m001,24.99,website,email,mobile,Manchester,2025-04-11,2025-04-12
d4575305,e0864418-7f3e-45,2025-04-05,2025-04-08,Nintendo Switch,e682,299.99,mobile_app,direct,unknown,Liverpool,2025-04-05,2025-04-08
5fcc997d,866cfb2b-3754-41,2025-04-26,2025-05-02,PS5,a245,479.99,website,search,mobile,London,2025-04-26,2025-05-02
8188de48,33bcb8a9-c71d-45,21-03-2025,2025-03-22,AirPods,d633,159.99,mobile_app,social,desktop,Manchester,2025-03-21,2025-03-22
8188de48,33bcb8a9-c71d-45,2025-03-21,2025-03-22,iPhone 15,f521,899.99,mobile_app,search,mobile,Bristol,2025-03-21,2025-03-22
8188de48,33bcb8a9-c71d-45,2025-03-21,2025-03-27,MacBook Air,g770,1199.99,mobile_app,direct,mobile,Glasgow,2025-03-21,2025-03-27
5711d5fd,e7ab2ef7-7b8f-40,2025-03-24,2025-03-27,MacBook Air,g770,1199.99,mobile_app,search,desktop,London,2025-03-24,2025-03-27
53cc6b95,dfb68a5f-bb81-41,2025-05-03,2025-05-09,Nintendo Switch,e682,299.99,website,search,,Leicester,2025-05-03,2025-05-09
84222f58,192703a7-df2e-47,2025-04-14,2025-04-20,Steam Deck,c912,499.99,mobile_app,email,unknown,Birmingham,2025-04-14,2025-04-20
84222f58,192703a7-df2e-47,2025-04-14,2025-04-19,Google Pixel 8,i920,699.99,mobile_app,search,unknown,Leeds,2025-04-14,2025-04-19
6338fb29,3487246c-21f9-40,2025-03-17,2025-03-18,Accessory,m001,24.99,website,email,mobile,Manchester,2025-03-17,2025-03-18
6338fb29,3487246c-21f9-40,2025-03-17,2025-03-19,Xbox Series X,b104,499.99,website,email,mobile,Manchester,2025-03-17,2025-03-19
0b458c23,1da76d69-85b8-44,2025-04-07,2025-04-10,MacBook Air,g770,1199.99,website,,,London,2025-04-07,2025-04-10
e3a1af97,df3334c6-9823-4b,2025-02-09,2025-02-12,AirPods,d633,159.99,website,email,unknown,Manchester,2025-02-09,2025-02-12
05c14422,c4246277-8544-44,01-04-2025,2025-04-03,Kindle Paperwhite,j877,129.99,mobile_app,direct,desktop,Birmingham,2025-04-01,2025-04-03
33579b27,a38bbaa4-4fe8-48,2025-02-20,02-22-2025,Xbox Series X,b104,499.99,website,direct,mobile,Glasgow,2025-02-20,2025-02-22
abcec90f,88433a38-46d2-41,2025-04-12,2025-04-16,Smartwatch,h301,249.99,mobile_app,social,unknown,London,2025-04-12,2025-04-16
f5530567,2851a8be-2639-42,2025-04-13,2025-04-15,Nintendo Switch,e682,299.99,website,email,desktop,Glasgow,2025-04-13,2025-04-15
f5530567,2851a8be-2639-42,13-04-2025,2025-04-16,Nintendo Switch,e682,299.99,mobile_app,search,desktop,Birmingham,2025-04-13,2025-04-16
8ca33a54,1a354475-8399-4a,2025-04-16,2025-04-17,Accessory,m001,24.99,mobile_app,affiliate,desktop,Manchester,2025-04-16,2025-04-17
92f71993,f17aa7a9-243d-41,2025-06-15,2025-06-18,PS5,a245,479.99,mobile_app,affiliate,mobile,London,2025-06-15,2025-06-18
8a6342ca,4fb67094-123c-49,02-02-2025,2025-02-08,iPhone 15,f521,899.99,website,social,,Manchester,2025-02-02,2025-02-08
0ceaaf73,076c108d-214c-47,2025-04-12,2025-04-14,Xbox Series X,b104,499.99,website,search,unknown,Birmingham,2025-04-12,2025-04-14
b465c027,160beed4-0dc5-44,2025-03-19,2025-03-20,Google Pixel 8,i920,699.99,mobile_app,social,desktop,London,2025-03-19,2025-03-20
b465c027,160beed4-0dc5-44,2025-03-19,2025-03-24,Steam Deck,c912,499.99,website,email,mobile,Glasgow,2025-03-19,2025-03-24
7222534d,a124fdb2-97be-4f,2025-05-22,05-28-2025,Kindle Paperwhite,j877,129.99,mobile_app,direct,mobile,Manchester,2025-05-22,2025-05-28
c226ab53,5513b74f-4ffc-4c,2025-04-21,2025-04-23,Steam Deck,c912,499.99,website,direct,desktop,London,2025-04-21,2025-04-23
c226ab53,5513b74f-4ffc-4c,2025-04-21,2025-04-25,AirPods,d633,159.99,mobile_app,email,unknown,London,2025-04-21,2025-04-25
c3b1927b,141b9098-8892-47,2025-03-27,2025-03-31,Nintendo Switch,e682,299.99,mobile_app,affiliate,mobile,Liverpool,2025-03-27,2025-03-31
c3b1927b,141b9098-8892-47,2025-03-27,2025-03-31,Google Pixel 8,09i2,699.99,mobile_app,direct,mobile,Manchester,2025-03-27,2025-03-31
b2d7692a,17c95aaa-21bd-45,2025-04-15,04-18-2025,Xbox Series X,b104,499.99,mobile_app,email,mobile,London,2025-04-15,2025-04-18
c438eae0,4f75d45a-74a1-4a,2025-04-05,2025-04-11,Nintendo Switch,e682,299.99,website,affiliate,unknown,Manchester,2025-04-05,2025-04-11
e54ca6ca,f28bf846-3b50-4f,2025-03-26,2025-03-28,Accessory,m001,24.99,mobile_app,search,mobile,Manchester,2025-03-26,2025-03-28
ead1d758,5d0b042d-e9b1-4c,2025-04-08,2025-04-14,AirPods,d633,159.99,mobile_app,affiliate,unknown,Bristol,2025-04-08,2025-04-14
7ccd3dc0,dc5cd673-c9ed-46,2025-03-23,2025-03-27,Steam Deck,c912,499.99,mobile_app,affiliate,mobile,Birmingham,2025-03-23,2025-03-27
d8842354,1ce62a9f-79af-43,2025-04-14,2025-04-17,AirPods,d633,159.99,website,direct,mobile,Glasgow,2025-04-14,2025-04-17
d8842354,1ce62a9f-79af-43,2025-04-14,04-16-2025,Steam Deck,c912,499.99,mobile_app,email,unknown,Liverpool,2025-04-14,2025-04-16
8208fd42,593edc83-c497-40,2025-05-19,2025-05-20,MacBook Air,g770,1199.99,mobile_app,affiliate,mobile,Glasgow,2025-05-19,2025-05-20
8e5fd65f,b6da99cd-d14b-45,2025-02-02,2025-02-08,Smartwatch,h301,249.99,mobile_app,email,unknown,London,2025-02-02,2025-02-08
972d5d57,4d579d00-cadc-41,05-06-2025,2025-06-06,MacBook Air,g770,1199.99,website,email,unknown,Manchester,2025-06-05,2025-06-06
7b7ce7cc,3e628981-9ef1-47,2025-04-06,2025-04-09,PS5,a245,479.99,mobile_app,search,unknown,Manchester,2025-04-06,2025-04-09
6e5fbf71,354f184e-5739-4b,2025-04-12,2025-04-18,Google Pixel 8,i920,699.99,mobile_app,social,unknown,Glasgow,2025-04-12,2025-04-18
b1b2b5f8,9134c0b7-6f73-47,2025-03-21,2025-03-22,Nintendo Switch,e682,299.99,website,social,unknown,Birmingham,2025-03-21,2025-03-22
b63fa809,ab6b3f08-a9a0-44,2025-02-04,2025-02-05,Xbox Series X,b104,499.99,mobile_app,direct,unknown,Manchester,2025-02-04,2025-02-05
b63fa809,ab6b3f08-a9a0-44,2025-02-04,2025-02-07,AirPods,d336,159.99,website,affiliate,desktop,,2025-02-04,2025-02-07
534bfa86,1d444351-7c93-4d,2025-03-21,03-26-2025,Steam Deck,c912,499.99,website,search,unknown,Leeds,2025-03-21,2025-03-26
67e2189b,71f9b0e2-d270-4a,2025-01-20,2025-01-23,MacBook Air,g770,1199.99,mobile_app,social,unknown,Bristol,2025-01-20,2025-01-23
d1e2b878,af7d7f21-1bd6-40,2025-03-06,03-09-2025,Xbox Series X,b104,499.99,website,search,mobile,Liverpool,2025-03-06,2025-03-09
37b567b4,a51e01ad-7e8a-40,10-03-2025,2025-03-12,AirPods,d633,159.99,website,social,mobile,Bristol,2025-03-10,2025-03-12
37b567b4,a51e01ad-7e8a-40,2025-03-14,2025-03-10,Xbox Series X,b104,499.99,mobile_app,search,desktop,Manchester,2025-03-14,2025-03-10
cf51a203,94ad345a-e323-42,2025-04-24,04-25-2025,Nintendo Switch,e682,299.99,website,affiliate,mobile,London,2025-04-24,2025-04-25
4a9ff50e,a92f85fe-258f-4a,2025-03-06,2025-03-09,Steam Deck,c912,499.99,website,affiliate,mobile,Glasgow,2025-03-06,2025-03-09
e09ef2a3,7279101c-93f3-40,27-04-2025,2025-05-01,Kindle Paperwhite,j877,129.99,mobile_app,direct,desktop,Leeds,2025-04-27,2025-05-01
eb22ec1d,cb5a4d77-91fd-42,2025-04-12,2025-04-14,iPhone 15,f521,899.99,website,affiliate,unknown,Manchester,2025-04-12,2025-04-14
eb22ec1d,cb5a4d77-91fd-42,2025-04-12,2025-04-16,Google Pixel 8,i920,699.99,mobile_app,social,desktop,Manchester,2025-04-12,2025-04-16
fd8398c3,b7c12a4c-6f4a-45,2025-05-10,2025-05-16,Steam Deck,c912,499.99,website,direct,mobile,Glasgow,2025-05-10,2025-05-16
d8feb8de,9c8aa872-0214-4a,2025-01-20,2025-01-26,AirPods,d633,159.99,mobile_app,social,desktop,London,2025-01-20,2025-01-26
f7c8435f,0ffa2366-4b4f-4f,07-04-2025,2025-04-09,MacBook Air,g770,1199.99,website,email,unknown,London,2025-04-07,2025-04-09
1c153057,8f5e248e-b40f-44,2025-02-01,02-03-2025,Accessory,m001,24.99,mobile_app,direct,mobile,London,2025-02-01,2025-02-03
1c153057,8f5e248e-b40f-44,2025-02-01,2025-02-02,Xbox Series X,b104,499.99,mobile_app,email,desktop,Glasgow,2025-02-01,2025-02-02
9714fadc,07fbb920-dd9d-4e,18-03-2025,2025-03-22,Kindle Paperwhite,j877,129.99,website,email,unknown,London,2025-03-18,2025-03-22
9714fadc,07fbb920-dd9d-4e,2025-03-18,2025-03-24,Accessory,m001,24.99,mobile_app,affiliate,desktop,London,2025-03-18,2025-03-24
6f689d65,b636cc4c-5170-4a,2025-03-10,2025-03-12,Smartwatch,h301,249.99,mobile_app,social,unknown,London,2025-03-10,2025-03-12
8e301bcc,2c649adf-a998-48,2025-05-26,2025-06-01,Steam Deck,c912,499.99,mobile_app,social,unknown,Liverpool,2025-05-26,2025-06-01
8e301bcc,2c649adf-a998-48,2025-05-26,2025-05-29,Kindle Paperwhite,j877,129.99,website,affiliate,unknown,Glasgow,2025-05-26,2025-05-29
8e301bcc,2c649adf-a998-48,2025-05-26,2025-05-27,Nintendo Switch,e682,299.99,mobile_app,direct,mobile,Birmingham,2025-05-26,2025-05-27
49d93a08,5c3bd3b5-ecaa-4a,2025-04-05,2025-04-10,iPhone 15,f521,899.99,website,,mobile,London,2025-04-05,2025-04-10
a5fcd671,2023fd4b-ab89-43,2025-02-16,2025-02-21,Google Pixel 8,i920,699.99,mobile_app,email,,London,2025-02-16,2025-02-21
f997f697,e288109d-b8a9-40,2025-01-08,2025-01-11,Accessory,m001,24.99,website,search,desktop,Manchester,2025-01-08,2025-01-11
f997f697,e288109d-b8a9-40,2025-01-08,2025-01-10,Kindle Paperwhite,j877,129.99,mobile_app,direct,unknown,Glasgow,2025-01-08,2025-01-10
dc32f8a0,2320de16-15ac-40,2025-01-19,01-22-2025,Smartwatch,h301,249.99,mobile_app,direct,desktop,London,2025-01-19,2025-01-22
9f8d367d,b2051cec-c9f7-46,2025-04-26,2025-05-02,iPhone 15,f521,899.99,mobile_app,direct,mobile,Leeds,2025-04-26,2025-05-02
9f8d367d,b2051cec-c9f7-46,2025-04-26,2025-04-29,PS5,a245,479.99,website,direct,mobile,Bristol,2025-04-26,2025-04-29
627ca9f7,6c936f69-8269-44,2025-04-05,2025-04-11,AirPods,d633,159.99,mobile_app,social,mobile,Glasgow,2025-04-05,2025-04-11
7f8736f1,6cbdd931-2f90-40,2025-04-26,2025-05-01,AirPods,d633,159.99,mobile_app,search,mobile,Liverpool,2025-04-26,2025-05-01
ed3353fc,b64e26cf-3c9b-45,2025-01-09,01-11-2025,MacBook Air,g770,1199.99,mobile_app,social,desktop,London,2025-01-09,2025-01-11
7bb775d4,0890f506-5df1-4f,2025-04-10,2025-04-16,Google Pixel 8,i920,699.99,mobile_app,affiliate,desktop,Birmingham,2025-04-10,2025-04-16
7bb775d4,0890f506-5df1-4f,2025-04-10,2025-04-11,Xbox Series X,b104,499.99,website,direct,desktop,London,2025-04-10,2025-04-11
147f0413,948c7eb4-1cf8-47,2025-05-24,2025-05-27,Smartwatch,h301,249.99,website,social,mobile,Bristol,2025-05-24,2025-05-27
c02627d1,86c2ad8f-bb36-47,2025-04-15,2025-04-19,PS5,a245,479.99,website,social,mobile,Manchester,2025-04-15,2025-04-19
c02627d1,86c2ad8f-bb36-47,2025-04-15,2025-04-19,Google Pixel 8,i920,699.99,mobile_app,social,desktop,Leeds,2025-04-15,2025-04-19
9c2d9672,8456ce4f-7706-41,2025-02-26,2025-02-27,Xbox Series X,b104,499.99,mobile_app,affiliate,desktop,Sheffield,2025-02-26,2025-02-27
ab310bfe,a1731ed8-78f2-46,2025-04-13,2025-04-15,AirPods,d633,159.99,website,search,mobile,Manchester,2025-04-13,2025-04-15
ab310bfe,a1731ed8-78f2-46,13-04-2025,2025-04-19,Kindle Paperwhite,j877,129.99,website,search,desktop,Leicester,2025-04-13,2025-04-19
ab310bfe,a1731ed8-78f2-46,2025-04-13,2025-04-18,Google Pixel 8,i920,699.99,website,social,desktop,Manchester,2025-04-13,2025-04-18
9cf021b8,8a08d40e-a239-4a,2025-02-04,2025-02-08,Steam Deck,c912,499.99,website,email,desktop,Liverpool,2025-02-04,2025-02-08
743b9f71,88f7f097-57f2-44,2025-03-12,2025-03-18,AirPods,d633,159.99,website,social,mobile,London,2025-03-12,2025-03-18
743b9f71,88f7f097-57f2-44,2025-03-12,2025-03-13,Kindle Paperwhite,j877,129.99,mobile_app,direct,desktop,Leeds,2025-03-12,2025-03-13
5a589b67,92ef63c1-781f-4d,2025-01-12,2025-01-16,PS5,a245,479.99,mobile_app,social,unknown,London,2025-01-12,2025-01-16
5a589b67,92ef63c1-781f-4d,2025-01-12,2025-01-17,AirPods,d633,159.99,website,email,desktop,Glasgow,2025-01-12,2025-01-17
b1eedf64,4b6c14e4-cc58-4b,2025-02-02,2025-02-07,Accessory,m001,24.99,mobile_app,email,unknown,Sheffield,2025-02-02,2025-02-07
42ac66dc,4dd7962b-bfda-45,2025-06-16,2025-06-18,Kindle Paperwhite,j877,129.99,website,affiliate,unknown,Leeds,2025-06-16,2025-06-18
42ac66dc,4dd7962b-bfda-45,2025-06-16,06-19-2025,AirPods,d633,159.99,website,affiliate,unknown,Manchester,2025-06-16,2025-06-19
a8049463,94010dfe-7921-4c,07-04-2025,2025-04-11,Kindle Paperwhite,j877,129.99,website,,mobile,Birmingham,2025-04-07,2025-04-11
7c193e6f,bcc4f0db-cf13-4b,2025-06-10,2025-06-12,Xbox Series X,b104,499.99,mobile_app,,desktop,Manchester,2025-06-10,2025-06-12
7c193e6f,bcc4f0db-cf13-4b,10-06-2025,2025-06-12,Steam Deck,c912,499.99,mobile_app,social,mobile,Manchester,2025-06-10,2025-06-12
408669bb,13ad3ead-816e-4f,2025-03-22,2025-03-28,Accessory,m001,24.99,website,affiliate,,London,2025-03-22,2025-03-28
bdce4d4d,4674a0eb-47ed-46,2025-06-18,2025-06-22,Smartwatch,h301,249.99,mobile_app,search,desktop,Manchester,2025-06-18,2025-06-22
a8be6c80,e8fe6095-2cb3-4e,2025-03-02,03-08-2025,iPhone 15,f521,899.99,website,email,unknown,,2025-03-02,2025-03-08
3c775558,2ce6f908-cece-45,2025-05-18,2025-05-22,Steam Deck,c912,499.99,mobile_app,social,mobile,Birmingham,2025-05-18,2025-05-22
fbec1ed8,8702f4ad-cca3-44,2025-04-02,2025-04-07,AirPods,d633,159.99,mobile_app,affiliate,mobile,Leeds,2025-04-02,2025-04-07
d66de2a1,987593c3-2523-42,2025-04-13,2025-04-18,iPhone 15,f521,899.99,website,social,unknown,Manchester,2025-04-13,2025-04-18
a9217ddc,69b6f3b7-fe5b-4f,2025-06-20,2025-06-21,MacBook Air,g770,1199.99,website,search,mobile,London,2025-06-20,2025-06-21
d7825ea3,2ad3136f-a338-47,26-02-2025,2025-03-04,Smartwatch,h301,249.99,website,direct,mobile,Manchester,2025-02-26,2025-03-04
0d722918,43af6c46-a46b-49,2025-05-14,2025-05-20,Google Pixel 8,i920,699.99,website,email,mobile,Bristol,2025-05-14,2025-05-20
0d722918,43af6c46-a46b-49,14-05-2025,2025-05-15,MacBook Air,g770,1199.99,mobile_app,email,desktop,Manchester,2025-05-14,2025-05-15
0d722918,43af6c46-a46b-49,2025-05-14,2025-05-20,Xbox Series X,b104,499.99,mobile_app,direct,unknown,Glasgow,2025-05-14,2025-05-20
f2c0a0cf,79ea5621-6614-43,2025-03-17,2025-03-20,MacBook Air,g770,1199.99,website,search,desktop,London,2025-03-17,2025-03-20
63dba8c8,3bd13a43-8853-49,17-02-2025,2025-02-22,Nintendo Switch,e682,299.99,website,search,mobile,Birmingham,2025-02-17,2025-02-22
49ee4969,87cb0e2a-2528-4a,2025-01-15,2025-01-16,MacBook Air,g770,1199.99,mobile_app,search,mobile,Nottingham,2025-01-15,2025-01-16
87beb021,61cb0527-72e5-48,2025-04-24,2025-04-27,iPhone 15,f521,899.99,website,search,desktop,London,2025-04-24,2025-04-27
5a947a40,18ecde2b-0a80-41,2025-04-13,2025-04-19,PS5,a245,479.99,mobile_app,direct,desktop,Liverpool,2025-04-13,2025-04-19
45c87f41,9c48c830-6e89-44,2025-04-12,2025-04-13,MacBook Air,g770,1199.99,website,social,unknown,London,2025-04-12,2025-04-13
958c9cfd,cd649aff-445f-4d,2025-04-18,04-21-2025,AirPods,d633,159.99,mobile_app,social,unknown,Liverpool,2025-04-18,2025-04-21
958c9cfd,cd649aff-445f-4d,2025-04-18,2025-04-21,AirPods,33d6,159.99,website,direct,desktop,Glasgow,2025-04-18,2025-04-21
ac00f929,acdfe0ff-c5ed-49,2025-04-24,2025-04-30,PS5,a425,479.99,mobile_app,affiliate,mobile,Birmingham,2025-04-24,2025-04-30
fe43541a,851b9860-31e6-46,2025-02-22,2025-02-23,Google Pixel 8,i920,699.99,website,social,desktop,Glasgow,2025-02-22,2025-02-23
fe43541a,851b9860-31e6-46,2025-02-22,2025-02-24,Nintendo Switch,e682,299.99,mobile_app,social,unknown,Manchester,2025-02-22,2025-02-24
11654cb3,02b53d3d-8c30-46,2025-04-15,04-21-2025,MacBook Air,g770,1199.99,mobile_app,email,unknown,Glasgow,2025-04-15,2025-04-21
11654cb3,02b53d3d-8c30-46,2025-04-15,2025-04-18,Kindle Paperwhite,j877,129.99,mobile_app,email,desktop,Liverpool,2025-04-15,2025-04-18
11654cb3,02b53d3d-8c30-46,15-04-2025,2025-04-17,Xbox Series X,b104,499.99,website,direct,desktop,Birmingham,2025-04-15,2025-04-17
59fcfaeb,8677b81d-1902-49,2025-02-04,2025-02-10,Nintendo Switch,e682,299.99,website,affiliate,desktop,London,2025-02-04,2025-02-10
9e90d107,407c4370-4886-47,07-04-2025,2025-04-13,Smartwatch,h301,249.99,website,direct,mobile,Manchester,2025-04-07,2025-04-13
9e90d107,407c4370-4886-47,2025-04-07,2025-04-12,Accessory,m001,24.99,website,affiliate,mobile,Manchester,2025-04-07,2025-04-12
3781d306,98197749-f041-44,2025-05-23,2025-05-25,Smartwatch,h301,249.99,mobile_app,social,desktop,Leicester,2025-05-23,2025-05-25
161d6acf,1f2da344-a359-46,2025-02-05,2025-02-07,PS5,a245,479.99,website,social,mobile,London,2025-02-05,2025-02-07
a5dd2836,603ecfef-2141-4a,2025-03-19,2025-03-20,Smartwatch,h301,249.99,mobile_app,search,desktop,Glasgow,2025-03-19,2025-03-20
2f2bdc13,2f4cfefb-f798-48,2025-06-14,2025-06-17,Steam Deck,c912,499.99,mobile_app,affiliate,mobile,Manchester,2025-06-14,2025-06-17
7414e3e1,a9151364-778a-46,2025-01-05,2025-01-06,Nintendo Switch,e682,299.99,mobile_app,social,mobile,Manchester,2025-01-05,2025-01-06
aae6787e,c4f4b844-46c1-42,2025-03-08,2025-03-13,Kindle Paperwhite,j877,129.99,mobile_app,affiliate,mobile,London,2025-03-08,2025-03-13
46fc4ff2,41e0cfaf-52ca-4c,2025-05-01,2025-05-05,MacBook Air,g770,1199.99,mobile_app,direct,unknown,Manchester,2025-05-01,2025-05-05
421becca,637aa999-61ff-4d,2025-04-11,2025-04-16,Nintendo Switch,e682,299.99,website,social,unknown,Glasgow,2025-04-11,2025-04-16
fabb6609,2d8cc973-43c1-43,06-03-2025,2025-03-11,iPhone 15,f521,899.99,website,email,unknown,Bristol,2025-03-06,2025-03-11
1bc2197e,6483b0e7-9c3c-4e,2025-04-16,2025-04-20,MacBook Air,g770,1199.99,website,social,unknown,Nottingham,2025-04-16,2025-04-20
1bc2197e,6483b0e7-9c3c-4e,16-04-2025,2025-04-19,Accessory,m001,24.99,mobile_app,social,desktop,Glasgow,2025-04-16,2025-04-19
1b332e43,6e66a273-c4ca-40,2025-03-05,2025-03-08,Xbox Series X,b104,499.99,website,social,mobile,Manchester,2025-03-05,2025-03-08
12068ad6,424d9430-b724-49,2025-03-19,2025-03-21,Smartwatch,h301,249.99,website,search,unknown,,2025-03-19,2025-03-21
7f695b97,c6f903cf-4027-45,2025-01-21,2025-01-26,iPhone 15,f521,899.99,mobile_app,direct,mobile,London,2025-01-21,2025-01-26
7f695b97,c6f903cf-4027-45,2025-01-21,01-25-2025,MacBook Air,g770,1199.99,mobile_app,social,desktop,London,2025-01-21,2025-01-25
7f695b97,c6f903cf-4027-45,2025-01-21,2025-01-23,Kindle Paperwhite,j877,129.99,mobile_app,affiliate,unknown,,2025-01-21,2025-01-23
63f6bf77,0038dc84-a3ed-43,2025-01-20,2025-01-22,Smartwatch,h301,249.99,website,direct,desktop,London,2025-01-20,2025-01-22
00f2baa4,546fcba3-b336-41,2025-03-23,2025-03-27,Kindle Paperwhite,j877,129.99,website,social,mobile,Birmingham,2025-03-23,2025-03-27
6766d37b,c55fa445-f09e-43,2025-02-17,2025-02-19,AirPods,d633,159.99,website,search,desktop,Bristol,2025-02-17,2025-02-19
39d11950,cff14c0e-c7eb-4d,2025-05-19,2025-05-22,Nintendo Switch,e682,299.99,mobile_app,email,unknown,Birmingham,2025-05-19,2025-05-22
1f0733df,b0736dd1-f443-46,2025-04-27,04-29-2025,Xbox Series X,b104,499.99,website,affiliate,mobile,Glasgow,2025-04-27,2025-04-29
4d862412,fdd99681-ef5e-4c,2025-02-04,2025-02-05,MacBook Air,g770,1199.99,website,affiliate,unknown,Birmingham,2025-02-04,2025-02-05
5d87edd2,ff3c6d4e-a1dc-4c,22-05-2025,2025-05-26,Steam Deck,c912,499.99,mobile_app,email,mobile,Glasgow,2025-05-22,2025-05-26
c2ad0d97,570e5af5-f5ff-47,2025-03-13,2025-03-18,Nintendo Switch,e682,299.99,mobile_app,direct,unknown,Manchester,2025-03-13,2025-03-18
f7aeede8,33ffb402-a5d5-4b,2025-01-04,01-09-2025,Google Pixel 8,i920,699.99,website,affiliate,mobile,Glasgow,2025-01-04,2025-01-09
1b552618,4c82c445-30e5-45,2025-04-14,2025-04-15,Smartwatch,h301,249.99,website,search,unknown,,2025-04-14,2025-04-15
701fb3ea,7c8b7f1e-5bf8-49,18-04-2025,2025-04-23,PS5,a245,479.99,website,search,desktop,London,2025-04-18,2025-04-23
ff12fe28,092385fe-23d3-4d,2025-02-17,2025-02-23,Xbox Series X,b104,499.99,website,direct,mobile,Bristol,2025-02-17,2025-02-23
ff12fe28,092385fe-23d3-4d,2025-02-23,2025-02-17,Xbox Series X,b104,499.99,mobile_app,social,unknown,Manchester,2025-02-23,2025-02-17
a4b65cfa,638644e0-7d3e-48,2025-01-03,01-09-2025,Smartwatch,h301,249.99,website,direct,unknown,Glasgow,2025-01-03,2025-01-09
f7716700,f7073712-88b0-4b,2025-05-01,2025-05-04,iPhone 15,f521,899.99,website,affiliate,desktop,Manchester,2025-05-01,2025-05-04
b8943df8,56db638a-097b-41,2025-02-27,2025-03-03,Smartwatch,h301,249.99,website,direct,mobile,Manchester,2025-02-27,2025-03-03
b8943df8,56db638a-097b-41,2025-02-27,2025-03-02,iPhone 15,f521,899.99,website,affiliate,mobile,Glasgow,2025-02-27,2025-03-02
85eb2b3f,36308a60-1e41-42,2025-03-14,2025-03-20,iPhone 15,f521,899.99,mobile_app,email,unknown,Manchester,2025-03-14,2025-03-20
bdb58d06,dec56dc3-ad96-42,2025-04-17,2025-04-19,Accessory,m001,24.99,website,search,mobile,Glasgow,2025-04-17,2025-04-19
7d283421,1270c935-ecc0-4a,2025-04-02,2025-04-04,Steam Deck,c912,499.99,mobile_app,social,mobile,London,2025-04-02,2025-04-04
7d283421,1270c935-ecc0-4a,2025-04-02,04-07-2025,Smartwatch,h301,249.99,mobile_app,affiliate,mobile,Manchester,2025-04-02,2025-04-07
3e20718a,e83cdff9-78a1-49,2025-03-27,2025-03-28,Xbox Series X,b104,499.99,website,affiliate,mobile,Birmingham,2025-03-27,2025-03-28
e797f3ae,03ad702e-216a-4b,2025-04-18,2025-04-22,iPhone 15,f521,899.99,website,social,desktop,Manchester,2025-04-18,2025-04-22
d5d9a385,18e824e9-cb2f-4b,2025-05-20,2025-05-21,MacBook Air,g770,1199.99,website,search,desktop,London,2025-05-20,2025-05-21
98507072,d145bd7f-d15b-4a,2025-02-14,2025-02-20,Accessory,m001,24.99,mobile_app,social,mobile,Birmingham,2025-02-14,2025-02-20
98507072,d145bd7f-d15b-4a,2025-02-14,2025-02-20,Accessory,m001,24.99,mobile_app,email,mobile,London,2025-02-14,2025-02-20
565c1e3f,1027fbf7-3877-40,2025-01-04,2025-01-07,Nintendo Switch,e682,299.99,website,social,mobile,Liverpool,2025-01-04,2025-01-07
1eece891,bce8e033-fb70-4b,2025-04-12,2025-04-14,Accessory,m001,24.99,mobile_app,email,unknown,Sheffield,2025-04-12,2025-04-14
f6f61488,8bbf1b30-9372-42,2025-01-12,2025-01-14,MacBook Air,g770,1199.99,mobile_app,affiliate,desktop,Glasgow,2025-01-12,2025-01-14
102f4f5c,0bab8f53-c3a4-40,2025-04-12,2025-04-15,Google Pixel 8,i920,699.99,mobile_app,direct,unknown,Leicester,2025-04-12,2025-04-15
102f4f5c,0bab8f53-c3a4-40,2025-04-12,2025-04-15,Google Pixel 8,i920,699.99,website,affiliate,unknown,Manchester,2025-04-12,2025-04-15
5eb38ef5,c1eecd7a-2428-48,2025-04-27,2025-04-30,Google Pixel 8,i920,699.99,mobile_app,direct,desktop,Manchester,2025-04-27,2025-04-30
22249813,3e5f7e23-704c-49,2025-01-06,2025-01-11,Nintendo Switch,e682,299.99,mobile_app,direct,mobile,,2025-01-06,2025-01-11
28628b4e,a1d78199-d8ed-46,2025-03-15,2025-03-20,MacBook Air,g770,1199.99,website,affiliate,mobile,Manchester,2025-03-15,2025-03-20
ed174fdd,14aa3ca3-7ca9-46,2025-04-03,2025-04-09,AirPods,d633,159.99,mobile_app,affiliate,,Sheffield,2025-04-03,2025-04-09
ed174fdd,14aa3ca3-7ca9-46,03-04-2025,2025-04-04,Accessory,m001,24.99,mobile_app,email,unknown,Birmingham,2025-04-03,2025-04-04
b189727f,97feb937-a6d9-47,2025-01-16,2025-01-20,Nintendo Switch,e682,299.99,mobile_app,direct,unknown,Manchester,2025-01-16,2025-01-20
24a167fd,79dbf407-c5c6-4b,2025-05-10,2025-05-15,Kindle Paperwhite,j877,129.99,website,email,mobile,London,2025-05-10,2025-05-15
2caf3d2f,734eab10-85e9-45,2025-02-05,02-11-2025,AirPods,d633,159.99,website,social,unknown,Birmingham,2025-02-05,2025-02-11
9caf4bfe,98a547b2-09a1-4b,2025-04-21,2025-04-22,Steam Deck,c912,499.99,mobile_app,search,unknown,London,2025-04-21,2025-04-22
6b358d15,d3946dc7-a08f-41,2025-06-03,2025-06-06,Steam Deck,c912,499.99,mobile_app,affiliate,desktop,London,2025-06-03,2025-06-06
6b358d15,d3946dc7-a08f-41,2025-06-07,2025-06-03,MacBook Air,g770,1199.99,website,affiliate,desktop,London,2025-06-07,2025-06-03
6b358d15,d3946dc7-a08f-41,2025-06-03,2025-06-05,MacBook Air,g770,1199.99,mobile_app,,mobile,Birmingham,2025-06-03,2025-06-05
fa0f01a4,31208bde-3c52-46,2025-02-25,2025-02-28,PS5,a245,479.99,mobile_app,search,unknown,Leeds,2025-02-25,2025-02-28
81ee30e4,dcdbf14e-5ca5-40,2025-05-27,2025-05-31,Google Pixel 8,i920,699.99,mobile_app,search,mobile,Glasgow,2025-05-27,2025-05-31
81ee30e4,dcdbf14e-5ca5-40,2025-05-27,2025-05-31,Accessory,m001,24.99,mobile_app,social,unknown,Manchester,2025-05-27,2025-05-31
0d95ee72,a05ff5e6-c534-4e,02-04-2025,04-04-2025,MacBook Air,g770,1199.99,website,search,desktop,Manchester,2025-04-02,2025-04-04
e9570a2a,26331cc6-cbee-43,2025-03-11,2025-03-17,Smartwatch,h301,249.99,mobile_app,direct,unknown,Liverpool,2025-03-11,2025-03-17
0dd4c0e6,28e60130-2d23-4e,2025-02-03,2025-02-08,Google Pixel 8,i920,699.99,website,direct,mobile,London,2025-02-03,2025-02-08
9de7df7b,35a7ac9b-48f9-4d,2025-04-20,2025-04-21,Smartwatch,h301,249.99,website,search,mobile,Liverpool,2025-04-20,2025-04-21
0d6dcb42,74017bb3-c227-47,2025-01-13,2025-01-18,PS5,a245,479.99,mobile_app,affiliate,desktop,Glasgow,2025-01-13,2025-01-18
83d0bae7,2875ad5d-2d06-48,2025-02-08,2025-02-13,iPhone 15,f521,899.99,mobile_app,affiliate,unknown,London,2025-02-08,2025-02-13
83d0bae7,2875ad5d-2d06-48,2025-02-08,2025-02-09,Xbox Series X,b104,499.99,mobile_app,email,mobile,Glasgow,2025-02-08,2025-02-09
946b4482,3c3c9c08-e523-48,2025-03-01,2025-02-26,AirPods,d633,159.99,mobile_app,affiliate,desktop,Glasgow,2025-03-01,2025-02-26
3ae56c8d,bf4113cb-32e1-4f,2025-04-10,2025-04-15,Xbox Series X,b104,499.99,mobile_app,affiliate,mobile,Birmingham,2025-04-10,2025-04-15
3ae56c8d,bf4113cb-32e1-4f,10-04-2025,2025-04-12,AirPods,d633,159.99,website,social,desktop,London,2025-04-10,2025-04-12
699fdb02,3a4fece7-537d-46,2025-03-13,2025-03-18,PS5,a245,479.99,mobile_app,affiliate,desktop,London,2025-03-13,2025-03-18
95c89b2d,e43081aa-6022-43,2025-04-25,2025-04-29,MacBook Air,g770,1199.99,mobile_app,search,mobile,Manchester,2025-04-25,2025-04-29
9c03d65c,6f94da50-e3f7-43,2025-04-07,04-11-2025,iPhone 15,f521,899.99,mobile_app,search,desktop,Bristol,2025-04-07,2025-04-11
31b42308,5f9cb7e0-6328-44,2025-04-27,05-02-2025,Xbox Series X,b104,499.99,mobile_app,,unknown,Glasgow,2025-04-27,2025-05-02
31b42308,5f9cb7e0-6328-44,2025-04-27,2025-04-29,Smartwatch,h301,249.99,mobile_app,affiliate,unknown,London,2025-04-27,2025-04-29
083759f8,450ab36d-f9be-47,2025-04-15,2025-04-20,Accessory,m001,24.99,mobile_app,social,desktop,Glasgow,2025-04-15,2025-04-20
083759f8,450ab36d-f9be-47,2025-04-15,2025-04-18,MacBook Air,g770,1199.99,website,social,unknown,Liverpool,2025-04-15,2025-04-18
772d416d,47d5ac92-0f45-45,2025-04-22,2025-04-28,AirPods,d633,159.99,website,direct,unknown,Leeds,2025-04-22,2025-04-28
4b8fb475,c2a59d7b-2bd3-49,2025-05-22,2025-05-27,Nintendo Switch,e682,299.99,mobile_app,search,unknown,Manchester,2025-05-22,2025-05-27
e7d3f770,cb68a34e-ca1f-4f,2025-03-10,2025-03-16,PS5,a245,479.99,website,direct,unknown,Manchester,2025-03-10,2025-03-16
6964eb16,8d8164b0-f85a-42,2025-06-23,2025-06-28,Google Pixel 8,i920,699.99,website,search,unknown,Manchester,2025-06-23,2025-06-28
7936931e,dcb913b4-7d3d-46,2025-02-02,2025-02-06,Steam Deck,c912,499.99,website,affiliate,unknown,Glasgow,2025-02-02,2025-02-06
df629d0c,03b68657-4777-4e,2025-01-23,2025-01-25,Google Pixel 8,i920,699.99,website,email,desktop,London,2025-01-23,2025-01-25
ed6f4ee3,6f2aec8a-53c9-4a,2025-04-27,2025-05-03,Steam Deck,c912,499.99,mobile_app,affiliate,unknown,London,2025-04-27,2025-05-03
6af31899,e9ebd446-2622-40,2025-02-07,2025-02-10,Kindle Paperwhite,j877,129.99,mobile_app,search,desktop,Manchester,2025-02-07,2025-02-10
81145252,fdc419b2-0a41-49,2025-03-23,2025-03-24,Smartwatch,h301,249.99,mobile_app,social,desktop,Liverpool,2025-03-23,2025-03-24
b257e257,64f22a7c-87f7-47,2025-04-16,2025-04-17,MacBook Air,g770,1199.99,mobile_app,social,mobile,Manchester,2025-04-16,2025-04-17
b257e257,64f22a7c-87f7-47,2025-04-16,04-17-2025,PS5,a245,479.99,website,search,desktop,Birmingham,2025-04-16,2025-04-17
b257e257,64f22a7c-87f7-47,2025-04-16,2025-04-18,AirPods,d633,159.99,website,email,desktop,London,2025-04-16,2025-04-18
c0c9c3ed,7ecb002e-73d3-42,04-03-2025,2025-03-07,Xbox Series X,b104,499.99,mobile_app,direct,desktop,London,2025-03-04,2025-03-07
5bc07988,68181f5b-bb56-48,2025-04-11,2025-04-14,Kindle Paperwhite,j877,129.99,website,affiliate,unknown,Manchester,2025-04-11,2025-04-14
5bc07988,68181f5b-bb56-48,2025-04-11,2025-04-14,Nintendo Switch,e682,299.99,mobile_app,affiliate,mobile,Birmingham,2025-04-11,2025-04-14
ab45eaf0,ffbb4bcc-a5cb-4f,2025-05-06,2025-05-10,Xbox Series X,b104,499.99,mobile_app,,mobile,Nottingham,2025-05-06,2025-05-10
956abfdf,75938f5a-b40b-43,18-05-2025,2025-05-19,PS5,a245,479.99,website,direct,unknown,Liverpool,2025-05-18,2025-05-19
b400a5e1,76b90472-7470-42,2025-04-07,2025-04-09,Kindle Paperwhite,j877,129.99,mobile_app,search,unknown,Leeds,2025-04-07,2025-04-09
b432ece9,df1e04cb-ca34-4e,2025-04-19,2025-04-20,MacBook Air,g770,1199.99,mobile_app,affiliate,mobile,Manchester,2025-04-19,2025-04-20
b432ece9,df1e04cb-ca34-4e,2025-04-19,2025-04-24,Smartwatch,h301,249.99,mobile_app,affiliate,mobile,Manchester,2025-04-19,2025-04-24
b0d508a9,a0970ff4-dc42-49,2025-05-09,2025-05-13,Nintendo Switch,e682,299.99,website,affiliate,mobile,London,2025-05-09,2025-05-13
b2b3bb39,4bed523c-085f-44,2025-06-10,06-15-2025,Google Pixel 8,i920,699.99,website,direct,unknown,London,2025-06-10,2025-06-15
af4637b3,93423b4f-8add-46,2025-06-15,06-17-2025,Accessory,m001,24.99,mobile_app,,mobile,Nottingham,2025-06-15,2025-06-17
83c5c510,55f01600-e17f-44,2025-04-14,2025-04-15,Smartwatch,h301,249.99,website,direct,mobile,Leeds,2025-04-14,2025-04-15
620956a8,5d2e7b90-acb6-4e,2025-04-12,2025-04-14,Google Pixel 8,i920,699.99,website,search,mobile,Manchester,2025-04-12,2025-04-14
a5eea4a2,0a76bd91-9e7f-47,2025-04-16,2025-04-20,Google Pixel 8,i920,699.99,website,affiliate,mobile,Manchester,2025-04-16,2025-04-20
236e9007,8f8dd995-1127-4c,2025-05-13,2025-05-16,Kindle Paperwhite,j877,129.99,website,affiliate,desktop,London,2025-05-13,2025-05-16
bcc4f087,8a257159-3d17-48,2025-01-22,2025-01-25,Smartwatch,h301,249.99,mobile_app,social,mobile,Birmingham,2025-01-22,2025-01-25
c0cffa73,df02774d-9482-44,2025-04-06,2025-04-08,Accessory,m001,24.99,mobile_app,affiliate,desktop,Liverpool,2025-04-06,2025-04-08
80e9b300,5209eaab-39b6-41,2025-02-21,2025-02-26,Google Pixel 8,i920,699.99,website,email,desktop,Birmingham,2025-02-21,2025-02-26
80e9b300,5209eaab-39b6-41,2025-02-21,2025-02-27,MacBook Air,g770,1199.99,website,direct,unknown,London,2025-02-21,2025-02-27
73d12f3e,0df1172a-46f2-4f,2025-04-21,2025-04-24,Google Pixel 8,i920,699.99,mobile_app,direct,unknown,Leeds,2025-04-21,2025-04-24
882ae449,d45e087f-86d4-4b,2025-05-18,2025-05-21,Google Pixel 8,i920,699.99,mobile_app,email,unknown,London,2025-05-18,2025-05-21
5e3ece60,e6426f0b-8869-47,2025-01-26,2025-01-29,Smartwatch,h301,249.99,website,email,mobile,Leeds,2025-01-26,2025-01-29
e214d458,b177116d-f203-46,2025-05-13,2025-05-17,Steam Deck,c912,499.99,mobile_app,affiliate,unknown,Manchester,2025-05-13,2025-05-17
6403c4bc,e24c724b-e453-44,2025-04-08,2025-04-14,Xbox Series X,b104,499.99,website,search,mobile,Manchester,2025-04-08,2025-04-14
2a2e1e6a,f5504c52-49d2-4a,2025-01-14,2025-01-15,Nintendo Switch,e682,299.99,website,social,unknown,Leicester,2025-01-14,2025-01-15
344a21b7,25e050f6-b273-49,2025-03-27,03-31-2025,Smartwatch,h301,249.99,website,affiliate,unknown,London,2025-03-27,2025-03-31
aeb1fcd3,05cf079e-a095-4c,2025-04-11,2025-04-17,Nintendo Switch,e682,299.99,mobile_app,affiliate,mobile,Liverpool,2025-04-11,2025-04-17
bcda835f,7951d52b-21cc-4b,10-04-2025,2025-04-15,MacBook Air,g770,1199.99,mobile_app,social,desktop,Manchester,2025-04-10,2025-04-15
cd4f2875,3066478c-4aa0-48,14-02-2025,2025-02-15,Nintendo Switch,e682,299.99,mobile_app,email,desktop,London,2025-02-14,2025-02-15
9425fc3a,8505d91d-f28b-4f,2025-04-23,2025-04-24,Smartwatch,h301,249.99,website,,mobile,Glasgow,2025-04-23,2025-04-24
9425fc3a,8505d91d-f28b-4f,2025-04-23,2025-04-29,Accessory,m001,24.99,mobile_app,direct,desktop,Manchester,2025-04-23,2025-04-29
aa757eeb,c96d525e-a563-4c,2025-05-26,2025-06-01,Kindle Paperwhite,j877,129.99,mobile_app,direct,desktop,Glasgow,2025-05-26,2025-06-01
913767ab,8c68720e-d787-46,2025-04-23,2025-04-26,Smartwatch,h301,249.99,website,email,mobile,Leeds,2025-04-23,2025-04-26
913767ab,8c68720e-d787-46,2025-04-23,2025-04-25,Kindle Paperwhite,j877,129.99,website,direct,unknown,Birmingham,2025-04-23,2025-04-25
3a0e618f,4e7674e9-ca12-4a,2025-06-20,2025-06-21,MacBook Air,g770,1199.99,mobile_app,search,unknown,Glasgow,2025-06-20,2025-06-21
25f98046,49c3f48b-f881-4f,2025-06-20,06-22-2025,Smartwatch,h301,249.99,website,search,unknown,Sheffield,2025-06-20,2025-06-22
29298691,f4ca6e70-74b7-49,23-05-2025,2025-05-28,Accessory,m001,24.99,website,affiliate,unknown,Manchester,2025-05-23,2025-05-28
b546c5c0,2ea9ef6c-4905-4b,2025-04-26,05-02-2025,Xbox Series X,b104,499.99,website,direct,mobile,Glasgow,2025-04-26,2025-05-02
1dee4b6d,cb618d75-aa96-4d,2025-06-24,2025-06-26,Kindle Paperwhite,j877,129.99,mobile_app,direct,unknown,Glasgow,2025-06-24,2025-06-26
5ea2d56b,931414e8-510e-44,2025-02-17,2025-02-23,Nintendo Switch,e682,299.99,mobile_app,search,mobile,Manchester,2025-02-17,2025-02-23
5ea2d56b,931414e8-510e-44,2025-02-17,2025-02-21,Nintendo Switch,e682,299.99,website,email,mobile,Bristol,2025-02-17,2025-02-21
fa5fafdb,b506c24d-8fff-49,2025-03-01,2025-03-04,MacBook Air,g770,1199.99,website,search,mobile,Leeds,2025-03-01,2025-03-04
889cd33d,72cc3fc5-5f77-4a,2025-03-03,2025-03-06,Smartwatch,h301,249.99,website,direct,desktop,Manchester,2025-03-03,2025-03-06
c4bd9b59,06617f95-eba1-4f,2025-06-09,2025-06-13,AirPods,d633,159.99,mobile_app,email,desktop,,2025-06-09,2025-06-13
f85bc2d3,ed850a6d-7542-48,2025-02-03,2025-02-05,MacBook Air,g770,1199.99,mobile_app,affiliate,unknown,Manchester,2025-02-03,2025-02-05
4ba99d78,81e58eee-f9c0-4d,16-02-2025,2025-02-22,Nintendo Switch,e682,299.99,website,,desktop,Birmingham,2025-02-16,2025-02-22
4ba99d78,81e58eee-f9c0-4d,2025-02-16,2025-02-18,Steam Deck,c912,499.99,website,email,mobile,Bristol,2025-02-16,2025-02-18
fe7b178d,f83811c5-4a32-4d,18-06-2025,2025-06-24,PS5,a245,479.99,website,affiliate,mobile,Birmingham,2025-06-18,2025-06-24
ec1b55dd,ccb1063d-25a7-43,2025-04-25,2025-04-24,MacBook Air,g770,1199.99,mobile_app,email,desktop,Manchester,2025-04-25,2025-04-24
0a42be3f,1cc0b764-b06b-4f,23-03-2025,2025-03-27,PS5,a245,479.99,website,email,desktop,Manchester,2025-03-23,2025-03-27
0a42be3f,1cc0b764-b06b-4f,2025-03-23,2025-03-28,iPhone 15,f521,899.99,website,affiliate,unknown,London,2025-03-23,2025-03-28
9e15ebcc,1deb979d-8d0b-46,2025-02-22,2025-02-26,Kindle Paperwhite,j877,129.99,website,social,unknown,London,2025-02-22,2025-02-26
9e15ebcc,1deb979d-8d0b-46,22-02-2025,2025-02-23,PS5,a245,479.99,website,affiliate,mobile,Birmingham,2025-02-22,2025-02-23
9bafcc20,5b7e24ca-722b-44,2025-04-04,2025-04-10,iPhone 15,f521,899.99,website,direct,desktop,Bristol,2025-04-04,2025-04-10
9bafcc20,5b7e24ca-722b-44,2025-04-04,2025-04-05,Smartwatch,h301,249.99,mobile_app,search,unknown,Liverpool,2025-04-04,2025-04-05
c4605896,86c45e42-955b-43,2025-04-22,2025-04-23,MacBook Air,g770,1199.99,website,affiliate,unknown,Manchester,2025-04-22,2025-04-23
ad5406bc,15661feb-05c5-4f,2025-01-15,2025-01-18,Nintendo Switch,e682,299.99,mobile_app,social,desktop,Manchester,2025-01-15,2025-01-18
7d8f2350,f9d09e26-165e-45,2025-04-16,2025-04-20,Kindle Paperwhite,j877,129.99,website,search,unknown,Glasgow,2025-04-16,2025-04-20
aab133ba,82f552c8-9ae6-41,2025-03-17,2025-03-18,Kindle Paperwhite,j877,129.99,mobile_app,social,mobile,Manchester,2025-03-17,2025-03-18
62d846d0,b74966cb-25df-48,2025-04-27,2025-05-02,MacBook Air,g770,1199.99,website,email,unknown,Birmingham,2025-04-27,2025-05-02
72114575,584cb0f7-48de-48,2025-02-19,2025-02-20,Accessory,00m1,24.99,mobile_app,search,mobile,Leeds,2025-02-19,2025-02-20
bdd4c1f2,3737cc38-166c-4d,2025-05-05,05-07-2025,Kindle Paperwhite,j877,129.99,website,affiliate,desktop,Leeds,2025-05-05,2025-05-07
ba5e4066,7147f758-cdbe-45,2025-04-14,2025-04-20,Kindle Paperwhite,j877,129.99,website,search,desktop,London,2025-04-14,2025-04-20
d5e4157d,ba85e403-6c80-44,2025-05-10,2025-05-12,Kindle Paperwhite,j877,129.99,mobile_app,email,mobile,London,2025-05-10,2025-05-12
fd06a179,24c58b47-1609-44,2025-06-10,2025-06-16,Smartwatch,h301,249.99,mobile_app,direct,desktop,Birmingham,2025-06-10,2025-06-16
fd06a179,24c58b47-1609-44,2025-06-10,2025-06-11,Xbox Series X,b104,499.99,website,direct,mobile,Manchester,2025-06-10,2025-06-11
9736bb4f,55dddf38-fc94-44,2025-02-25,2025-03-01,Kindle Paperwhite,j877,129.99,mobile_app,email,unknown,Manchester,2025-02-25,2025-03-01
45f8e14d,01b1c626-16a4-4b,2025-03-06,2025-03-08,Google Pixel 8,i920,699.99,website,social,mobile,Birmingham,2025-03-06,2025-03-08
ea350f17,764d7e7c-8e49-40,2025-03-18,2025-03-21,Kindle Paperwhite,j877,129.99,mobile_app,email,desktop,London,2025-03-18,2025-03-21
7d9704fe,d5108bc0-2f9e-4d,2025-05-11,2025-05-16,Google Pixel 8,i920,699.99,website,affiliate,desktop,Birmingham,2025-05-11,2025-05-16
7e7d5e88,4d4f6814-d385-42,2025-04-06,2025-04-11,Google Pixel 8,i920,699.99,website,social,mobile,Manchester,2025-04-06,2025-04-11
276e1d67,397a284f-76a4-47,2025-02-26,2025-02-28,Steam Deck,c912,499.99,website,affiliate,mobile,Manchester,2025-02-26,2025-02-28
276e1d67,397a284f-76a4-47,2025-02-26,2025-03-04,Steam Deck,c912,499.99,mobile_app,social,unknown,Leeds,2025-02-26,2025-03-04
1fca0f16,a3fb6d0b-f4be-48,2025-03-01,2025-03-06,iPhone 15,f521,899.99,mobile_app,search,mobile,Nottingham,2025-03-01,2025-03-06
e8239943,49a5fd0d-e487-4a,2025-04-12,2025-04-15,MacBook Air,g770,1199.99,website,affiliate,mobile,Glasgow,2025-04-12,2025-04-15
e8239943,49a5fd0d-e487-4a,2025-04-12,2025-04-16,Nintendo Switch,e682,299.99,website,affiliate,unknown,Leicester,2025-04-12,2025-04-16
7e388a19,07480379-3ea7-44,2025-01-01,2025-01-07,Steam Deck,c912,499.99,website,social,unknown,London,2025-01-01,2025-01-07
7b011fdd,9950f11a-1114-40,2025-03-03,2025-03-05,Steam Deck,c912,499.99,mobile_app,email,unknown,Manchester,2025-03-03,2025-03-05
f9690579,42067d80-de4b-4b,2025-01-02,2025-01-04,MacBook Air,g770,1199.99,mobile_app,direct,desktop,Leicester,2025-01-02,2025-01-04
047dd583,5f8a2e3c-1e9d-49,2025-03-13,2025-03-14,iPhone 15,f521,899.99,website,email,desktop,Bristol,2025-03-13,2025-03-14
7606fa34,94e74f26-29b0-4b,2025-01-02,2025-01-03,Google Pixel 8,i920,699.99,website,email,mobile,Manchester,2025-01-02,2025-01-03
5c75352c,5b7d9d2d-22af-45,2025-02-12,2025-02-18,Steam Deck,c912,499.99,mobile_app,affiliate,desktop,Leeds,2025-02-12,2025-02-18
4aaa7f99,f4852088-e97f-40,2025-03-05,2025-03-07,Steam Deck,c912,499.99,mobile_app,direct,desktop,London,2025-03-05,2025-03-07
a0c69223,13aae9c8-efb2-48,2025-04-11,04-17-2025,AirPods,d633,159.99,website,email,unknown,London,2025-04-11,2025-04-17
52965cf3,99487f82-1831-48,2025-04-06,04-08-2025,Steam Deck,c912,499.99,website,affiliate,desktop,Glasgow,2025-04-06,2025-04-08
52965cf3,99487f82-1831-48,06-04-2025,2025-04-07,AirPods,d633,159.99,website,direct,mobile,London,2025-04-06,2025-04-07
457e55cb,d85195ac-d3aa-4b,2025-04-24,04-25-2025,Accessory,m001,24.99,mobile_app,direct,mobile,London,2025-04-24,2025-04-25
5a0461c9,5cce495d-b037-4c,2025-04-10,2025-04-12,Smartwatch,h301,249.99,mobile_app,email,unknown,Leeds,2025-04-10,2025-04-12
5a0461c9,5cce495d-b037-4c,2025-04-10,2025-04-15,Xbox Series X,b104,499.99,mobile_app,affiliate,desktop,Birmingham,2025-04-10,2025-04-15
c75ff368,230f1e69-034d-42,2025-06-18,2025-06-20,Xbox Series X,b104,499.99,website,direct,unknown,Manchester,2025-06-18,2025-06-20
37c6bc5d,ebc095f5-571e-42,2025-01-22,2025-01-28,MacBook Air,g770,1199.99,mobile_app,email,unknown,London,2025-01-22,2025-01-28
8f040721,d4e20134-389a-44,2025-03-08,2025-03-14,MacBook Air,g770,1199.99,website,affiliate,unknown,Bristol,2025-03-08,2025-03-14
b6697d0a,f3d6b9f2-d4d7-40,2025-02-08,2025-02-10,Kindle Paperwhite,j877,129.99,mobile_app,direct,mobile,Liverpool,2025-02-08,2025-02-10
b6697d0a,f3d6b9f2-d4d7-40,2025-02-08,2025-02-09,Steam Deck,c912,499.99,mobile_app,direct,unknown,London,2025-02-08,2025-02-09
b6697d0a,f3d6b9f2-d4d7-40,2025-02-08,2025-02-12,Kindle Paperwhite,j877,129.99,website,affiliate,mobile,Leeds,2025-02-08,2025-02-12
ea8104ad,cd75e6de-c19d-41,2025-01-08,2025-01-13,Accessory,m001,24.99,website,direct,unknown,Glasgow,2025-01-08,2025-01-13
592448ee,21986e3c-d19f-4f,2025-04-18,2025-04-24,MacBook Air,g770,1199.99,mobile_app,social,unknown,Manchester,2025-04-18,2025-04-24
fcd2280e,23966b83-5cd1-4b,2025-04-19,2025-04-21,Smartwatch,h301,249.99,mobile_app,email,unknown,Liverpool,2025-04-19,2025-04-21
4dffc9aa,f859396d-c37a-4a,2025-06-07,2025-06-13,Smartwatch,h301,249.99,mobile_app,social,mobile,Glasgow,2025-06-07,2025-06-13
b1b9fd9d,1e5c5da8-d087-4d,21-02-2025,2025-02-25,Kindle Paperwhite,j877,129.99,website,direct,desktop,Liverpool,2025-02-21,2025-02-25
fb29ff36,4eb39f63-3a00-48,2025-02-13,2025-02-17,Steam Deck,c912,499.99,website,social,desktop,Manchester,2025-02-13,2025-02-17
04d07f29,c355853e-b0d9-45,2025-01-18,2025-01-22,AirPods,d633,159.99,mobile_app,search,desktop,Manchester,2025-01-18,2025-01-22
08651a6e,6e663c0a-c1e0-44,07-03-2025,2025-03-10,iPhone 15,f521,899.99,website,direct,desktop,Glasgow,2025-03-07,2025-03-10
e8956041,97da64cb-8373-4f,2025-02-02,02-06-2025,AirPods,d633,159.99,mobile_app,direct,unknown,Bristol,2025-02-02,2025-02-06
18b475b1,4d38a8d0-10f5-46,2025-04-24,2025-04-28,Nintendo Switch,e682,299.99,mobile_app,social,mobile,Glasgow,2025-04-24,2025-04-28
18b475b1,4d38a8d0-10f5-46,2025-04-24,2025-04-28,Smartwatch,h301,249.99,mobile_app,email,mobile,Birmingham,2025-04-24,2025-04-28
3334cd07,9a0f09e9-eb8b-4c,2025-01-26,2025-01-29,iPhone 15,f521,899.99,mobile_app,affiliate,desktop,Bristol,2025-01-26,2025-01-29
bf06d520,077d8688-59fe-4c,2025-06-07,2025-06-09,Smartwatch,h301,249.99,mobile_app,affiliate,mobile,Sheffield,2025-06-07,2025-06-09
daea544a,946a95a6-f2e4-41,2025-05-16,2025-05-19,PS5,a245,479.99,website,email,desktop,London,2025-05-16,2025-05-19
117e894e,9ceab67b-ba82-45,2025-04-09,2025-04-10,PS5,a245,479.99,website,email,desktop,Manchester,2025-04-09,2025-04-10
b73f6e64,c363f61f-9400-41,2025-01-20,2025-01-22,Google Pixel 8,i920,699.99,mobile_app,direct,unknown,London,2025-01-20,2025-01-22
011bb348,2bf95861-4827-44,2025-04-02,2025-04-05,iPhone 15,f521,899.99,mobile_app,email,desktop,Manchester,2025-04-02,2025-04-05
011bb348,2bf95861-4827-44,2025-04-02,04-04-2025,Kindle Paperwhite,j877,129.99,mobile_app,affiliate,mobile,London,2025-04-02,2025-04-04
d9ee9678,ec9a799e-1943-47,2025-05-23,2025-05-26,AirPods,d633,159.99,mobile_app,social,unknown,London,2025-05-23,2025-05-26
ac6c2e1b,b2b8d698-5dd0-45,2025-01-07,2025-01-08,Accessory,m001,24.99,mobile_app,search,desktop,London,2025-01-07,2025-01-08
6c914882,d5b1a96a-2e4c-46,2025-06-25,2025-06-27,MacBook Air,g770,1199.99,website,direct,mobile,Birmingham,2025-06-25,2025-06-27
6c914882,d5b1a96a-2e4c-46,2025-06-25,2025-06-30,Steam Deck,c912,499.99,mobile_app,social,,Leeds,2025-06-25,2025-06-30
6c914882,d5b1a96a-2e4c-46,2025-06-25,2025-06-28,PS5,a245,479.99,website,social,unknown,Birmingham,2025-06-25,2025-06-28
5074ac13,685707ac-3a40-4e,2025-05-13,2025-05-15,MacBook Air,g770,1199.99,mobile_app,social,unknown,Glasgow,2025-05-13,2025-05-15
5c7ae8ef,850cddfd-1c3d-4e,2025-03-24,2025-03-27,Nintendo Switch,e682,299.99,website,search,desktop,London,2025-03-24,2025-03-27
7e63f654,b8ddf15d-8ea0-45,2025-04-14,2025-04-20,AirPods,d633,159.99,website,social,unknown,Liverpool,2025-04-14,2025-04-20
afe2487f,74fa65ce-489a-42,10-01-2025,2025-01-13,iPhone 15,f521,899.99,website,social,mobile,Bristol,2025-01-10,2025-01-13
fc267da6,39d2d74a-71a7-47,2025-01-19,2025-01-23,Accessory,m001,24.99,mobile_app,email,unknown,London,2025-01-19,2025-01-23
cd6c78dd,db558642-3054-46,2025-04-19,2025-04-24,Nintendo Switch,e682,299.99,website,direct,desktop,London,2025-04-19,2025-04-24
ac95adb1,5e10a3a0-addb-49,2025-04-25,2025-04-30,iPhone 15,f521,899.99,mobile_app,social,desktop,Manchester,2025-04-25,2025-04-30
ac95adb1,5e10a3a0-addb-49,2025-04-25,2025-04-26,MacBook Air,g770,1199.99,mobile_app,direct,mobile,Manchester,2025-04-25,2025-04-26
ac95adb1,5e10a3a0-addb-49,2025-04-25,2025-04-28,PS5,a245,479.99,mobile_app,email,desktop,Glasgow,2025-04-25,2025-04-28
ad3053ce,65787d0c-1aec-4b,2025-04-21,2025-04-22,Xbox Series X,b104,499.99,website,affiliate,unknown,Leeds,2025-04-21,2025-04-22
ad3053ce,65787d0c-1aec-4b,2025-04-21,2025-04-25,Kindle Paperwhite,j877,129.99,website,direct,desktop,London,2025-04-21,2025-04-25
fa42156e,65125d2e-24b3-4c,12-03-2025,2025-03-16,PS5,a245,479.99,mobile_app,direct,desktop,Glasgow,2025-03-12,2025-03-16
fa42156e,65125d2e-24b3-4c,2025-03-12,2025-03-18,AirPods,d633,159.99,website,social,desktop,Bristol,2025-03-12,2025-03-18
5d1c1906,e476231a-ecdf-43,2025-01-20,2025-01-25,iPhone 15,f521,899.99,website,direct,mobile,Manchester,2025-01-20,2025-01-25
5d1c1906,e476231a-ecdf-43,2025-01-20,2025-01-24,MacBook Air,g770,1199.99,website,affiliate,desktop,Leeds,2025-01-20,2025-01-24
677f7c73,334477eb-56b0-40,2025-04-23,2025-04-27,Google Pixel 8,i920,699.99,mobile_app,affiliate,mobile,Liverpool,2025-04-23,2025-04-27
c3cb0c28,6cb96a2c-d68e-41,2025-06-03,2025-06-05,Steam Deck,c912,499.99,website,email,mobile,Glasgow,2025-06-03,2025-06-05
cd0d4d73,97f971d5-94f8-4e,07-06-2025,2025-06-11,Accessory,m001,24.99,website,search,unknown,Glasgow,2025-06-07,2025-06-11
f33c4c36,5b29317a-6675-45,2025-06-11,2025-06-16,AirPods,d633,159.99,website,search,unknown,Manchester,2025-06-11,2025-06-16
7462f144,82ec0fc3-7c0a-48,2025-04-03,2025-04-07,Accessory,m001,24.99,mobile_app,direct,desktop,Manchester,2025-04-03,2025-04-07
f14152c7,7d457a09-402d-45,2025-03-20,2025-03-24,Xbox Series X,b104,499.99,website,social,unknown,Glasgow,2025-03-20,2025-03-24
7f85c4e7,bce05a63-197f-4b,2025-04-06,2025-04-11,Steam Deck,c912,499.99,mobile_app,search,mobile,Birmingham,2025-04-06,2025-04-11
53b3618b,2dd93719-f8d9-4f,26-05-2025,05-30-2025,Smartwatch,h301,249.99,website,affiliate,mobile,Glasgow,2025-05-26,2025-05-30
a93c9413,9f8c2c51-9f39-46,2025-04-19,2025-04-23,Accessory,m001,24.99,mobile_app,email,mobile,Liverpool,2025-04-19,2025-04-23
4b26f0a3,7e000029-c47f-4b,25-04-2025,2025-04-27,Kindle Paperwhite,j877,129.99,mobile_app,direct,desktop,Nottingham,2025-04-25,2025-04-27
cf3a2f8d,813a3aa5-7d81-4c,2025-01-22,2025-01-28,Kindle Paperwhite,j877,129.99,mobile_app,social,mobile,Manchester,2025-01-22,2025-01-28
fd9f45f4,04860bee-8bef-4a,2025-01-21,2025-01-23,Accessory,m001,24.99,website,social,unknown,Sheffield,2025-01-21,2025-01-23
da55f825,1e7f92ad-ea39-43,2025-04-01,2025-04-03,Nintendo Switch,e682,299.99,website,email,unknown,Manchester,2025-04-01,2025-04-03
a8cf2936,09360f02-75ac-48,2025-04-18,2025-04-21,Google Pixel 8,i920,699.99,website,direct,mobile,Manchester,2025-04-18,2025-04-21
6e411e23,e27bb6c4-4d94-44,2025-01-25,2025-01-30,MacBook Air,g770,1199.99,website,email,desktop,Manchester,2025-01-25,2025-01-30
91a07ef2,639ac771-b739-42,2025-02-15,2025-02-20,PS5,a245,479.99,mobile_app,social,mobile,London,2025-02-15,2025-02-20
78460474,8dc4c81f-a8fa-49,2025-01-18,2025-01-21,Xbox Series X,b104,499.99,website,search,desktop,Glasgow,2025-01-18,2025-01-21
436d977b,2803feb5-dab6-47,04-05-2025,2025-05-05,Smartwatch,h301,249.99,website,social,mobile,Manchester,2025-05-04,2025-05-05
c4376d89,60b759a9-f88a-4c,2025-03-10,2025-03-16,iPhone 15,f521,899.99,mobile_app,direct,mobile,Liverpool,2025-03-10,2025-03-16
20d1968f,0fb97b5d-520b-48,2025-05-26,2025-05-27,Nintendo Switch,e682,299.99,mobile_app,affiliate,unknown,Manchester,2025-05-26,2025-05-27
c3e3c148,cf3ee4aa-594f-4d,2025-04-26,2025-04-29,Xbox Series X,b104,499.99,mobile_app,social,mobile,Birmingham,2025-04-26,2025-04-29
fdf02450,616d41c8-575c-46,2025-01-17,2025-01-18,PS5,a245,479.99,website,social,desktop,Manchester,2025-01-17,2025-01-18
fdf02450,616d41c8-575c-46,2025-01-17,2025-01-20,Smartwatch,h301,249.99,website,direct,desktop,Manchester,2025-01-17,2025-01-20
3c10316d,0e737523-59ec-48,2025-03-26,2025-03-27,Kindle Paperwhite,j877,129.99,website,email,desktop,Glasgow,2025-03-26,2025-03-27
de72d970,15bebdd0-97b0-47,2025-05-07,2025-05-13,Google Pixel 8,i920,699.99,mobile_app,direct,desktop,London,2025-05-07,2025-05-13
0991946d,2b76a718-566c-43,2025-03-01,2025-03-02,Accessory,m001,24.99,mobile_app,direct,mobile,Liverpool,2025-03-01,2025-03-02
0991946d,2b76a718-566c-43,2025-03-01,03-03-2025,iPhone 15,f521,899.99,website,affiliate,unknown,London,2025-03-01,2025-03-03
6bd1f826,6c27316b-dd05-48,17-04-2025,2025-04-19,Google Pixel 8,i920,699.99,mobile_app,affiliate,unknown,Bristol,2025-04-17,2025-04-19
51071545,783e40ab-b22a-45,2025-04-02,2025-04-08,Google Pixel 8,i920,699.99,website,social,unknown,London,2025-04-02,2025-04-08
51071545,783e40ab-b22a-45,2025-04-02,2025-04-06,AirPods,d633,159.99,website,search,desktop,Manchester,2025-04-02,2025-04-06
7d05121c,528a34f3-63ea-40,2025-06-27,2025-07-01,Nintendo Switch,e682,299.99,website,direct,mobile,Leeds,2025-06-27,2025-07-01
cfbba84a,34b6685d-acd4-48,2025-03-17,2025-03-19,Steam Deck,c912,499.99,website,affiliate,mobile,Manchester,2025-03-17,2025-03-19
f82c6ad8,2aa814da-56ec-4e,2025-04-08,2025-04-09,Nintendo Switch,e682,299.99,mobile_app,direct,unknown,Manchester,2025-04-08,2025-04-09
13483fb3,a2ac7896-7f38-4a,2025-04-11,2025-04-12,Accessory,m001,24.99,website,affiliate,unknown,London,2025-04-11,2025-04-12
4c1d2e43,36cdf42f-892c-4b,2025-02-24,2025-03-02,Xbox Series X,b104,499.99,website,affiliate,,London,2025-02-24,2025-03-02
f53ba020,cdfa76af-66eb-43,2025-01-21,2025-01-22,Google Pixel 8,i920,699.99,mobile_app,email,unknown,Manchester,2025-01-21,2025-01-22
45fb3e8a,94047909-d81c-41,2025-05-01,05-03-2025,Accessory,m001,24.99,website,search,mobile,Birmingham,2025-05-01,2025-05-03
58e9bbad,87f3c9a4-cd1a-41,2025-06-15,2025-06-16,MacBook Air,g770,1199.99,website,direct,desktop,Manchester,2025-06-15,2025-06-16
58e9bbad,87f3c9a4-cd1a-41,15-06-2025,2025-06-18,iPhone 15,f521,899.99,website,affiliate,mobile,Liverpool,2025-06-15,2025-06-18
4cc6d67e,d2e08e57-a6cb-4d,2025-05-14,2025-05-17,Accessory,m001,24.99,website,social,desktop,Liverpool,2025-05-14,2025-05-17
4052e3a5,5037e669-8a3a-41,10-02-2025,2025-02-12,Smartwatch,h301,249.99,website,email,unknown,Manchester,2025-02-10,2025-02-12
e182701b,abeb5f49-7406-4a,2025-02-26,2025-03-01,Kindle Paperwhite,j877,129.99,website,affiliate,desktop,Manchester,2025-02-26,2025-03-01
7fcbcf31,84274378-b40d-4a,2025-06-25,2025-06-28,MacBook Air,g770,1199.99,mobile_app,affiliate,unknown,London,2025-06-25,2025-06-28
7fcbcf31,84274378-b40d-4a,25-06-2025,2025-06-30,Google Pixel 8,i920,699.99,website,email,desktop,Manchester,2025-06-25,2025-06-30
4497734d,d2eba277-f64d-4d,2025-06-09,2025-06-12,Kindle Paperwhite,j877,129.99,mobile_app,direct,mobile,Birmingham,2025-06-09,2025-06-12
e8266484,cf1643a0-8860-4b,2025-02-10,02-16-2025,Xbox Series X,b104,499.99,mobile_app,social,desktop,Glasgow,2025-02-10,2025-02-16
e8266484,cf1643a0-8860-4b,2025-02-10,2025-02-11,iPhone 15,f521,899.99,mobile_app,social,unknown,Manchester,2025-02-10,2025-02-11
e8266484,cf1643a0-8860-4b,2025-02-10,02-16-2025,Accessory,m001,24.99,website,search,unknown,Manchester,2025-02-10,2025-02-16
335dab46,ba0371f9-90ed-41,2025-05-17,2025-05-19,Nintendo Switch,e682,299.99,website,search,desktop,Leeds,2025-05-17,2025-05-19
c3f9c78c,3d8925a9-25d2-47,2025-03-14,2025-03-12,AirPods,d633,159.99,mobile_app,direct,unknown,Glasgow,2025-03-14,2025-03-12
e94053af,6906d118-6f75-43,2025-02-18,2025-02-19,PS5,a245,479.99,website,email,mobile,Manchester,2025-02-18,2025-02-19
497bc13b,d8914adf-341c-41,2025-04-20,04-22-2025,AirPods,d633,159.99,website,social,desktop,London,2025-04-20,2025-04-22
3d0d3ffd,afd5b90b-41a6-4c,2025-04-26,2025-04-27,Accessory,m001,24.99,website,search,mobile,Glasgow,2025-04-26,2025-04-27
3d0d3ffd,afd5b90b-41a6-4c,2025-04-26,04-28-2025,iPhone 15,f521,899.99,mobile_app,email,unknown,London,2025-04-26,2025-04-28
4f7f963e,07179ef3-3121-48,2025-04-11,2025-04-16,Nintendo Switch,e682,299.99,mobile_app,email,desktop,Leeds,2025-04-11,2025-04-16
4f7f963e,07179ef3-3121-48,2025-04-11,04-17-2025,Steam Deck,c912,499.99,mobile_app,email,desktop,Manchester,2025-04-11,2025-04-17
4f7f963e,07179ef3-3121-48,2025-04-11,04-16-2025,Steam Deck,c912,499.99,website,direct,unknown,Glasgow,2025-04-11,2025-04-16
e7d90c1b,fdc56285-8f50-41,2025-04-03,2025-04-08,Steam Deck,c912,499.99,mobile_app,search,mobile,Manchester,2025-04-03,2025-04-08
ca27cd69,45d07382-28cb-47,2025-02-07,2025-02-11,Xbox Series X,b104,499.99,website,affiliate,mobile,Manchester,2025-02-07,2025-02-11
0acfbd89,8cfb137c-a89e-44,2025-01-21,2025-01-23,PS5,a245,479.99,website,direct,desktop,Birmingham,2025-01-21,2025-01-23
e581620f,c840789b-7c60-43,2025-04-21,04-22-2025,Xbox Series X,b104,499.99,website,search,unknown,Manchester,2025-04-21,2025-04-22
e581620f,c840789b-7c60-43,2025-04-21,2025-04-23,Steam Deck,c912,499.99,website,social,unknown,London,2025-04-21,2025-04-23
e581620f,c840789b-7c60-43,2025-04-21,2025-04-24,Smartwatch,h301,249.99,website,direct,desktop,Manchester,2025-04-21,2025-04-24
f480ada5,4c485cfc-9a02-40,2025-02-14,02-16-2025,MacBook Air,g770,1199.99,website,email,mobile,London,2025-02-14,2025-02-16
659ae9f2,abf2b369-5d0a-46,2025-04-21,2025-04-25,Kindle Paperwhite,j877,129.99,website,email,mobile,,2025-04-21,2025-04-25
922b4fb2,d7be7b4f-b967-4d,2025-04-17,2025-04-20,PS5,a245,479.99,mobile_app,social,desktop,Liverpool,2025-04-17,2025-04-20
9496634f,1ee26f39-eed4-4b,2025-04-03,2025-04-07,Smartwatch,h301,249.99,mobile_app,search,unknown,Bristol,2025-04-03,2025-04-07
171a8b65,867772d3-ee7a-4d,2025-03-15,2025-03-17,MacBook Air,g770,1199.99,mobile_app,affiliate,mobile,Glasgow,2025-03-15,2025-03-17
d513da02,c5efd670-1f4d-48,2025-01-14,2025-01-15,MacBook Air,g770,1199.99,mobile_app,search,unknown,Manchester,2025-01-14,2025-01-15
ef7cef26,ce4ba2bb-63d3-4e,2025-05-19,2025-05-24,Xbox Series X,b104,499.99,website,email,mobile,Manchester,2025-05-19,2025-05-24
ef7cef26,ce4ba2bb-63d3-4e,2025-05-19,2025-05-22,Smartwatch,h301,249.99,mobile_app,email,mobile,Manchester,2025-05-19,2025-05-22
4648bbe8,1b5829c9-24ef-45,06-01-2025,2025-01-11,Google Pixel 8,i920,699.99,mobile_app,affiliate,mobile,Leeds,2025-01-06,2025-01-11
88917cf5,dce70289-411a-41,2025-04-22,2025-04-28,Xbox Series X,b104,499.99,mobile_app,direct,desktop,Manchester,2025-04-22,2025-04-28
88917cf5,dce70289-411a-41,2025-04-22,2025-04-23,Steam Deck,c912,499.99,website,search,unknown,Bristol,2025-04-22,2025-04-23
79900a27,1ceb08fe-f2de-47,08-06-2025,2025-06-12,iPhone 15,f521,899.99,mobile_app,social,mobile,Birmingham,2025-06-08,2025-06-12
2518ec09,47198f5c-f69b-45,22-06-2025,2025-06-26,iPhone 15,f521,899.99,mobile_app,email,unknown,Manchester,2025-06-22,2025-06-26
a538c6a7,5e24296e-b736-4a,27-06-2025,2025-06-28,Kindle Paperwhite,j877,129.99,mobile_app,affiliate,desktop,London,2025-06-27,2025-06-28
a538c6a7,5e24296e-b736-4a,2025-06-27,2025-07-02,MacBook Air,g770,1199.99,website,direct,mobile,London,2025-06-27,2025-07-02
cc876b1c,08e94548-9b16-4c,2025-04-13,2025-04-19,AirPods,d633,159.99,mobile_app,search,unknown,Birmingham,2025-04-13,2025-04-19
40c37cbc,eade7b17-b0d0-40,2025-06-01,2025-06-07,Smartwatch,h301,249.99,mobile_app,affiliate,unknown,Leeds,2025-06-01,2025-06-07
e7354db2,a3922a4e-4f2c-48,2025-03-15,2025-03-19,MacBook Air,g770,1199.99,website,direct,mobile,Manchester,2025-03-15,2025-03-19
71414f58,88efe82b-1f3e-4a,2025-03-08,2025-03-11,Nintendo Switch,e682,299.99,website,direct,mobile,Manchester,2025-03-08,2025-03-11
71414f58,88efe82b-1f3e-4a,08-03-2025,2025-03-12,Kindle Paperwhite,j877,129.99,website,email,desktop,London,2025-03-08,2025-03-12
eafd3e7b,f5f3943a-e8e7-40,2025-04-18,2025-04-23,Kindle Paperwhite,j877,129.99,website,affiliate,desktop,Sheffield,2025-04-18,2025-04-23
4c23e844,efb2d33c-171a-45,2025-03-25,2025-03-31,PS5,a245,479.99,mobile_app,social,unknown,Glasgow,2025-03-25,2025-03-31
5132fe68,2904a6d6-e3e7-45,2025-04-15,2025-04-16,Kindle Paperwhite,j877,129.99,website,social,desktop,London,2025-04-15,2025-04-16
5132fe68,2904a6d6-e3e7-45,2025-04-15,2025-04-18,MacBook Air,g770,1199.99,mobile_app,search,unknown,Liverpool,2025-04-15,2025-04-18
462741ec,a4f954fc-c449-41,2025-04-03,2025-04-07,Accessory,m001,24.99,mobile_app,social,unknown,London,2025-04-03,2025-04-07
bca83a82,c78a7900-d2bd-46,2025-02-02,2025-02-03,PS5,a245,479.99,mobile_app,direct,mobile,Glasgow,2025-02-02,2025-02-03
eb25d7e7,552d4865-d756-4d,2025-05-18,2025-05-24,Steam Deck,c912,499.99,mobile_app,email,desktop,Manchester,2025-05-18,2025-05-24
10fd7164,290c42f8-d30b-4f,2025-01-14,2025-01-18,Xbox Series X,b104,499.99,website,affiliate,desktop,Manchester,2025-01-14,2025-01-18
53a71719,baaeebf8-9a24-45,2025-02-16,02-21-2025,MacBook Air,g770,1199.99,mobile_app,email,unknown,London,2025-02-16,2025-02-21
2f098f4d,c310d2a2-0700-47,2025-03-19,2025-03-21,MacBook Air,g770,1199.99,website,email,desktop,Glasgow,2025-03-19,2025-03-21
333822d1,a41f0d38-ca80-4d,2025-05-01,2025-05-03,Xbox Series X,b104,499.99,mobile_app,direct,unknown,Bristol,2025-05-01,2025-05-03
3fe604f4,93683dd6-5050-42,2025-04-05,2025-04-09,PS5,a245,479.99,website,direct,desktop,Nottingham,2025-04-05,2025-04-09
214dc588,c481ea69-f83b-40,22-04-2025,2025-04-28,Nintendo Switch,e682,299.99,website,direct,mobile,Liverpool,2025-04-22,2025-04-28
214dc588,c481ea69-f83b-40,2025-04-22,2025-04-26,MacBook Air,g770,1199.99,website,,desktop,London,2025-04-22,2025-04-26
7394d796,690a7b80-af8d-48,2025-06-02,2025-06-03,AirPods,d633,159.99,mobile_app,affiliate,mobile,Bristol,2025-06-02,2025-06-03
7394d796,690a7b80-af8d-48,2025-06-02,2025-06-05,PS5,a245,479.99,website,search,desktop,Manchester,2025-06-02,2025-06-05
97d02f8f,222db2cf-bc34-4d,2025-04-23,2025-04-27,Smartwatch,h301,249.99,website,affiliate,desktop,Leeds,2025-04-23,2025-04-27
5e1b015f,4823debe-ccad-49,2025-04-06,2025-04-07,AirPods,d633,159.99,website,affiliate,desktop,Manchester,2025-04-06,2025-04-07
92051da0,60980b94-e05b-48,2025-04-27,2025-04-28,Google Pixel 8,i920,699.99,mobile_app,search,unknown,Manchester,2025-04-27,2025-04-28
92051da0,60980b94-e05b-48,2025-04-27,2025-05-01,AirPods,d633,159.99,mobile_app,email,unknown,London,2025-04-27,2025-05-01
9cac3d21,05e15e2f-f2b7-49,2025-02-17,2025-02-20,MacBook Air,g770,1199.99,mobile_app,email,mobile,London,2025-02-17,2025-02-20
430438b5,16c72b1a-e826-4a,2025-04-24,2025-04-27,Steam Deck,c912,499.99,mobile_app,social,unknown,Birmingham,2025-04-24,2025-04-27
430438b5,16c72b1a-e826-4a,2025-04-24,2025-04-27,Nintendo Switch,e682,299.99,mobile_app,affiliate,desktop,Nottingham,2025-04-24,2025-04-27
430438b5,16c72b1a-e826-4a,2025-04-24,2025-04-30,Smartwatch,h301,249.99,mobile_app,direct,desktop,Birmingham,2025-04-24,2025-04-30
99b3568d,0cbe938d-2b33-47,2025-04-03,2025-04-04,Kindle Paperwhite,j877,129.99,mobile_app,direct,mobile,London,2025-04-03,2025-04-04
99b3568d,0cbe938d-2b33-47,2025-04-03,2025-04-08,Smartwatch,h301,249.99,mobile_app,search,mobile,Manchester,2025-04-03,2025-04-08
99b3568d,0cbe938d-2b33-47,2025-04-03,2025-04-05,Accessory,m001,24.99,website,email,desktop,Birmingham,2025-04-03,2025-04-05
9136d4ad,f541a44e-16cc-48,2025-05-08,2025-05-11,Accessory,m001,24.99,website,email,unknown,,2025-05-08,2025-05-11
eda413c6,869d4cb7-b7f5-45,2025-02-08,2025-02-10,Smartwatch,h301,249.99,mobile_app,social,unknown,London,2025-02-08,2025-02-10
340155bd,7e808d05-ac71-45,2025-03-15,2025-03-16,Kindle Paperwhite,j877,129.99,mobile_app,social,mobile,Leeds,2025-03-15,2025-03-16
bf16e3e9,d03bcbfc-dca7-42,2025-04-20,2025-04-26,Accessory,m001,24.99,website,social,mobile,Birmingham,2025-04-20,2025-04-26
372f5f47,6e6a3d5b-2154-4e,2025-03-17,2025-03-19,Kindle Paperwhite,j877,129.99,website,search,unknown,Birmingham,2025-03-17,2025-03-19
2e2cb850,ba098a27-4870-4a,2025-04-10,2025-04-11,Google Pixel 8,i920,699.99,website,social,desktop,Birmingham,2025-04-10,2025-04-11
3c48c936,075dacd4-255c-42,2025-03-20,2025-03-26,AirPods,d633,159.99,mobile_app,direct,mobile,London,2025-03-20,2025-03-26
a5b13afd,3f91c419-e846-49,2025-02-17,2025-02-21,PS5,a245,479.99,website,direct,desktop,London,2025-02-17,2025-02-21
f9723977,7808a004-02a4-48,2025-05-17,2025-05-23,Xbox Series X,b104,499.99,website,affiliate,mobile,Manchester,2025-05-17,2025-05-23
6c5ccba7,3653e588-afd5-4f,2025-04-07,2025-04-09,Nintendo Switch,e682,299.99,mobile_app,social,mobile,London,2025-04-07,2025-04-09
0d574085,12b3c5eb-4198-40,2025-02-01,2025-02-07,Steam Deck,c912,499.99,mobile_app,social,unknown,Manchester,2025-02-01,2025-02-07
9b3b5b4c,788f06ed-3c1e-41,2025-03-24,2025-03-30,PS5,a245,479.99,website,search,unknown,Manchester,2025-03-24,2025-03-30
cf5285f7,cd602879-f79b-40,2025-04-23,2025-04-24,Smartwatch,h301,249.99,mobile_app,direct,unknown,London,2025-04-23,2025-04-24
fa3f012e,8129aa0c-40ef-48,2025-03-11,2025-03-12,Kindle Paperwhite,j877,129.99,mobile_app,social,unknown,Birmingham,2025-03-11,2025-03-12
0a872ac2,21da5db1-5ef3-41,2025-06-07,2025-06-13,MacBook Air,g770,1199.99,mobile_app,direct,desktop,Glasgow,2025-06-07,2025-06-13
56d44952,2b7c5ee3-42a2-49,2025-04-10,2025-04-11,AirPods,d633,159.99,mobile_app,affiliate,desktop,London,2025-04-10,2025-04-11
6ed47a6d,16f32b93-21c5-4a,2025-06-02,2025-06-05,PS5,a245,479.99,website,affiliate,unknown,Sheffield,2025-06-02,2025-06-05
7fcc4456,50326fe6-1de9-4c,2025-01-24,2025-01-26,iPhone 15,f521,899.99,mobile_app,social,unknown,Bristol,2025-01-24,2025-01-26
6e1a1e1b,47efa886-d5b5-47,2025-04-18,2025-04-21,Nintendo Switch,e682,299.99,website,search,unknown,Glasgow,2025-04-18,2025-04-21
ed3d5159,4362262d-e07e-47,2025-02-15,2025-02-19,Steam Deck,c912,499.99,mobile_app,email,mobile,Manchester,2025-02-15,2025-02-19
bca37653,6f8ef978-5021-41,2025-04-23,2025-04-25,Accessory,m001,24.99,website,affiliate,mobile,Sheffield,2025-04-23,2025-04-25
bca37653,6f8ef978-5021-41,2025-04-23,2025-04-28,Nintendo Switch,e682,299.99,mobile_app,email,desktop,Bristol,2025-04-23,2025-04-28
ec4014c6,f33685da-c380-4b,2025-01-21,2025-01-23,AirPods,d633,159.99,mobile_app,social,desktop,Glasgow,2025-01-21,2025-01-23
0df81d2b,70a32883-cc58-48,2025-01-22,2025-01-25,Kindle Paperwhite,j877,129.99,website,affiliate,unknown,Glasgow,2025-01-22,2025-01-25
0df81d2b,70a32883-cc58-48,2025-01-22,2025-01-25,iPhone 15,f521,899.99,website,email,unknown,Glasgow,2025-01-22,2025-01-25
7796048f,7862246c-092e-44,2025-02-07,2025-02-11,Kindle Paperwhite,j877,129.99,website,social,mobile,Birmingham,2025-02-07,2025-02-11
71076f2e,e52a33e6-fec5-4a,2025-06-07,2025-06-08,MacBook Air,g770,1199.99,mobile_app,direct,unknown,London,2025-06-07,2025-06-08
1ccc33c1,8f942977-b582-4f,2025-01-17,2025-01-23,Steam Deck,c912,499.99,website,affiliate,desktop,Birmingham,2025-01-17,2025-01-23
3427e466,25e6d919-ddeb-4d,2025-02-12,2025-02-18,Smartwatch,h301,249.99,mobile_app,email,unknown,London,2025-02-12,2025-02-18
d294100f,d5bf85f3-2e3f-47,2025-03-23,2025-03-24,Xbox Series X,b104,499.99,mobile_app,email,mobile,Bristol,2025-03-23,2025-03-24
ff7d39f7,a9c3640d-e411-49,2025-04-18,2025-04-22,Accessory,m001,24.99,mobile_app,social,mobile,Liverpool,2025-04-18,2025-04-22
eba0330c,c4502052-86a8-42,2025-05-24,2025-05-29,PS5,a245,479.99,mobile_app,email,unknown,Manchester,2025-05-24,2025-05-29
5422ea97,7f843004-c4ac-41,2025-03-04,2025-03-10,Steam Deck,c912,499.99,mobile_app,affiliate,desktop,Manchester,2025-03-04,2025-03-10
5fa18468,fb38bc6c-ae6a-4c,17-05-2025,2025-05-22,iPhone 15,f521,899.99,website,email,mobile,Manchester,2025-05-17,2025-05-22
076451d3,1b2765f6-f383-44,2025-05-25,2025-05-27,Accessory,m001,24.99,website,social,unknown,Birmingham,2025-05-25,2025-05-27
a0dbfca2,b52c4358-d4a8-44,12-02-2025,2025-02-15,Smartwatch,h301,249.99,website,direct,desktop,London,2025-02-12,2025-02-15
a0dbfca2,b52c4358-d4a8-44,2025-02-12,2025-02-18,Steam Deck,c912,499.99,website,email,unknown,,2025-02-12,2025-02-18
0b398e89,a87319fe-981d-45,05-03-2025,03-06-2025,Kindle Paperwhite,j877,129.99,website,social,mobile,Sheffield,2025-03-05,2025-03-06
fff446b9,73fe7e1d-f36d-4b,2025-02-26,2025-02-28,Accessory,m001,24.99,website,affiliate,mobile,Manchester,2025-02-26,2025-02-28
fff446b9,73fe7e1d-f36d-4b,2025-02-26,2025-02-28,Smartwatch,h301,249.99,website,affiliate,unknown,Birmingham,2025-02-26,2025-02-28
dcffd7b6,cc0a628b-f518-49,2025-04-21,04-24-2025,Accessory,m001,24.99,mobile_app,direct,unknown,Leeds,2025-04-21,2025-04-24
be69ad39,486fac8f-a4c5-4a,2025-04-09,2025-04-11,MacBook Air,g770,1199.99,website,affiliate,desktop,Sheffield,2025-04-09,2025-04-11
41526bff,9a2fc701-f3af-4b,2025-04-22,2025-04-26,MacBook Air,g770,1199.99,mobile_app,search,desktop,Manchester,2025-04-22,2025-04-26
41526bff,9a2fc701-f3af-4b,2025-04-22,2025-04-28,Accessory,m001,24.99,mobile_app,affiliate,mobile,Birmingham,2025-04-22,2025-04-28
054046cc,c5583a17-f70d-48,2025-04-18,2025-04-22,Accessory,m001,24.99,mobile_app,,mobile,Leicester,2025-04-18,2025-04-22
a5accd5a,6374ed14-29b6-4b,2025-03-27,2025-03-28,Nintendo Switch,e682,299.99,website,affiliate,desktop,Glasgow,2025-03-27,2025-03-28
cd14eacb,27755e9d-a770-42,2025-06-17,2025-06-23,Smartwatch,h301,249.99,website,affiliate,unknown,Manchester,2025-06-17,2025-06-23
cd14eacb,27755e9d-a770-42,2025-06-17,2025-06-22,Kindle Paperwhite,j877,129.99,mobile_app,email,unknown,Glasgow,2025-06-17,2025-06-22
9a7fde23,ebf484d0-ce6d-49,2025-01-03,2025-01-08,PS5,a245,479.99,website,social,mobile,Manchester,2025-01-03,2025-01-08
332ac35a,189ac35d-aa5f-49,2025-06-12,2025-06-18,Accessory,m001,24.99,mobile_app,email,unknown,Bristol,2025-06-12,2025-06-18
99afee64,6359d5ce-e2aa-4d,2025-04-18,2025-04-19,Xbox Series X,b104,499.99,mobile_app,affiliate,unknown,Liverpool,2025-04-18,2025-04-19
99afee64,6359d5ce-e2aa-4d,2025-04-18,2025-04-20,Google Pixel 8,i920,699.99,mobile_app,affiliate,mobile,London,2025-04-18,2025-04-20
2fb50401,6c2b5781-c1a9-4e,23-06-2025,2025-06-28,Google Pixel 8,i920,699.99,mobile_app,affiliate,unknown,Manchester,2025-06-23,2025-06-28
f9285706,17cb67b8-6d0f-44,2025-05-09,2025-05-14,Kindle Paperwhite,j877,129.99,website,direct,unknown,Birmingham,2025-05-09,2025-05-14
ee403b9f,a5c9cf20-3967-46,2025-04-08,04-10-2025,PS5,a245,479.99,website,affiliate,unknown,Glasgow,2025-04-08,2025-04-10
ee403b9f,a5c9cf20-3967-46,2025-04-08,2025-04-11,Smartwatch,h301,249.99,website,affiliate,desktop,Birmingham,2025-04-08,2025-04-11
77dd362b,a5b09024-a12a-41,2025-04-21,2025-04-23,Kindle Paperwhite,j877,129.99,website,,unknown,,2025-04-21,2025-04-23
fbf3a106,cd320878-e83e-43,2025-02-08,2025-02-09,AirPods,d633,159.99,website,affiliate,unknown,Manchester,2025-02-08,2025-02-09
6d7fd4e2,4ce794d7-e724-41,2025-05-17,2025-05-20,AirPods,d633,159.99,website,social,unknown,London,2025-05-17,2025-05-20
836f224b,8d0df6f6-0c37-4b,2025-04-23,2025-04-25,Nintendo Switch,e682,299.99,mobile_app,affiliate,unknown,Manchester,2025-04-23,2025-04-25
b8663c7c,69bba3c4-6cc7-41,2025-02-24,03-02-2025,AirPods,d633,159.99,mobile_app,direct,unknown,London,2025-02-24,2025-03-02
b8663c7c,69bba3c4-6cc7-41,2025-02-24,2025-03-02,Smartwatch,h301,249.99,mobile_app,search,mobile,Manchester,2025-02-24,2025-03-02
b8663c7c,69bba3c4-6cc7-41,2025-02-24,03-01-2025,Kindle Paperwhite,j877,129.99,website,affiliate,unknown,Glasgow,2025-02-24,2025-03-01
c4c608eb,5aff4594-40dd-48,2025-04-07,2025-04-09,Nintendo Switch,e682,299.99,website,,,London,2025-04-07,2025-04-09
c4c608eb,5aff4594-40dd-48,2025-04-07,2025-04-09,AirPods,d633,159.99,website,search,unknown,Manchester,2025-04-07,2025-04-09
c4c608eb,5aff4594-40dd-48,2025-04-07,2025-04-12,Steam Deck,c912,499.99,mobile_app,email,desktop,Manchester,2025-04-07,2025-04-12
c942e6e8,bd9277a4-1d2a-40,2025-05-25,2025-05-29,Kindle Paperwhite,j877,129.99,website,search,mobile,London,2025-05-25,2025-05-29
c942e6e8,bd9277a4-1d2a-40,2025-05-25,2025-05-29,AirPods,d633,159.99,website,social,mobile,London,2025-05-25,2025-05-29
b4522738,0b961346-6498-4a,2025-02-01,2025-02-04,PS5,a245,479.99,mobile_app,direct,unknown,Liverpool,2025-02-01,2025-02-04
b4522738,0b961346-6498-4a,2025-02-01,2025-02-02,Steam Deck,c912,499.99,mobile_app,direct,unknown,Leeds,2025-02-01,2025-02-02
732fc932,b95e44e3-9653-49,2025-02-13,2025-02-18,iPhone 15,f521,899.99,website,social,desktop,Birmingham,2025-02-13,2025-02-18
cf5c8dd3,5761b099-43db-4a,2025-04-02,2025-04-06,iPhone 15,f521,899.99,mobile_app,affiliate,unknown,Manchester,2025-04-02,2025-04-06
4262a48c,140642a8-2f61-43,2025-05-16,05-17-2025,Steam Deck,c912,499.99,mobile_app,affiliate,unknown,Birmingham,2025-05-16,2025-05-17
651a6277,6f0d7229-1b38-4c,2025-04-19,2025-04-25,PS5,a245,479.99,mobile_app,affiliate,,Manchester,2025-04-19,2025-04-25
651a6277,6f0d7229-1b38-4c,2025-04-19,2025-04-20,Accessory,m001,24.99,mobile_app,,mobile,London,2025-04-19,2025-04-20
67b41520,a7e29299-2bf6-49,2025-02-11,2025-02-13,Xbox Series X,b104,499.99,mobile_app,affiliate,desktop,Bristol,2025-02-11,2025-02-13
67b41520,a7e29299-2bf6-49,2025-02-11,2025-02-13,MacBook Air,g770,1199.99,mobile_app,affiliate,desktop,Manchester,2025-02-11,2025-02-13
4d844cb6,be86f5d0-f73e-4b,2025-02-06,02-11-2025,Xbox Series X,b104,499.99,mobile_app,search,mobile,Glasgow,2025-02-06,2025-02-11
f69072cf,9de2fd3f-f952-41,04-04-2025,2025-04-09,PS5,a245,479.99,mobile_app,search,,Manchester,2025-04-04,2025-04-09
2296d3f6,cdfcef75-651e-49,2025-06-07,2025-06-10,Google Pixel 8,i920,699.99,website,affiliate,desktop,Nottingham,2025-06-07,2025-06-10
2296d3f6,cdfcef75-651e-49,2025-06-07,2025-06-11,iPhone 15,f521,899.99,website,email,unknown,Birmingham,2025-06-07,2025-06-11
302f420e,d0e34b2b-1ca6-4c,2025-02-10,02-15-2025,Accessory,m001,24.99,mobile_app,social,unknown,London,2025-02-10,2025-02-15
3de54ee2,7b2a7f10-3590-40,2025-04-20,2025-04-23,Xbox Series X,b104,499.99,website,search,unknown,London,2025-04-20,2025-04-23
160a3a13,dbb24c33-a045-49,2025-01-27,2025-02-02,Xbox Series X,b104,499.99,website,direct,mobile,Glasgow,2025-01-27,2025-02-02
1dd03ecd,25ee2f0f-76a3-4e,2025-03-26,2025-04-01,Kindle Paperwhite,j877,129.99,mobile_app,affiliate,unknown,Manchester,2025-03-26,2025-04-01
7c2c0791,bd20c36a-2705-44,2025-02-23,2025-02-26,Accessory,m001,24.99,website,search,mobile,Birmingham,2025-02-23,2025-02-26
4b7a123e,73137fa5-dc1b-4e,2025-05-21,2025-05-23,Smartwatch,h301,249.99,mobile_app,email,mobile,Glasgow,2025-05-21,2025-05-23
1a482803,6448a3d5-d576-41,2025-03-23,2025-03-26,Google Pixel 8,i920,699.99,mobile_app,social,unknown,Glasgow,2025-03-23,2025-03-26
7ee667de,6e89a7a8-b68d-40,2025-02-17,2025-02-20,Steam Deck,c912,499.99,website,email,mobile,Manchester,2025-02-17,2025-02-20
0979f5d3,bb27f6bc-9888-40,2025-06-20,2025-06-21,iPhone 15,f521,899.99,website,affiliate,unknown,London,2025-06-20,2025-06-21
ef6e9295,836b47c3-7c71-4c,2025-04-19,2025-04-20,Steam Deck,c912,499.99,website,search,desktop,Sheffield,2025-04-19,2025-04-20
ef6e9295,836b47c3-7c71-4c,2025-04-19,2025-04-25,PS5,a245,479.99,mobile_app,search,mobile,Birmingham,2025-04-19,2025-04-25
0f8a579c,de1d4653-d112-4b,2025-04-14,2025-04-18,Nintendo Switch,e682,299.99,website,social,mobile,London,2025-04-14,2025-04-18
4491be40,938f2b90-6c08-4d,2025-03-13,2025-03-19,Google Pixel 8,i920,699.99,website,social,desktop,Leeds,2025-03-13,2025-03-19
9f690cde,e39eb7c2-6ac9-45,2025-03-15,2025-03-17,Kindle Paperwhite,j877,129.99,website,social,unknown,Glasgow,2025-03-15,2025-03-17
294d25fc,72c573e9-58c5-48,2025-03-14,2025-03-20,Google Pixel 8,i920,699.99,mobile_app,direct,unknown,Manchester,2025-03-14,2025-03-20
81f46dfd,78202426-3134-4a,2025-06-08,2025-06-13,Accessory,m001,24.99,website,search,mobile,Glasgow,2025-06-08,2025-06-13
81f46dfd,78202426-3134-4a,2025-06-08,2025-06-14,Xbox Series X,b104,499.99,website,direct,desktop,Glasgow,2025-06-08,2025-06-14
da7bf28b,af5a7636-e8b8-42,2025-05-25,2025-05-27,iPhone 15,f521,899.99,mobile_app,affiliate,mobile,London,2025-05-25,2025-05-27
b9163357,77ed78d9-a82e-48,2025-05-04,2025-05-08,Smartwatch,h301,249.99,website,email,desktop,Sheffield,2025-05-04,2025-05-08
a70a409d,6ab76840-f5b5-4c,2025-05-26,2025-06-01,iPhone 15,f521,899.99,website,search,desktop,Glasgow,2025-05-26,2025-06-01
297a8503,78ea47e2-cbc4-4d,18-04-2025,2025-04-21,AirPods,d633,159.99,mobile_app,email,mobile,Birmingham,2025-04-18,2025-04-21
7b9ea9eb,b0d18df1-484f-4d,2025-03-26,2025-03-27,Steam Deck,c912,499.99,mobile_app,direct,mobile,Manchester,2025-03-26,2025-03-27
cb21aa80,2804335a-3311-45,2025-04-06,2025-04-11,Accessory,m001,24.99,website,social,unknown,Glasgow,2025-04-06,2025-04-11
8e8c71d8,7e64c44f-fe67-47,2025-05-04,2025-05-05,Smartwatch,h301,249.99,mobile_app,affiliate,unknown,London,2025-05-04,2025-05-05
ad4b24ec,5bd972c7-04a4-44,2025-03-18,2025-03-21,Smartwatch,h301,249.99,mobile_app,email,desktop,Birmingham,2025-03-18,2025-03-21
ce8b76a2,dc05ae03-d3f4-41,01-02-2025,2025-02-04,Nintendo Switch,e682,299.99,website,social,mobile,Bristol,2025-02-01,2025-02-04
8fde042a,1d2d1771-6e3d-44,2025-01-09,2025-01-10,Nintendo Switch,e682,299.99,mobile_app,social,desktop,Bristol,2025-01-09,2025-01-10
8fde042a,1d2d1771-6e3d-44,2025-01-09,2025-01-14,PS5,a245,479.99,website,social,desktop,Glasgow,2025-01-09,2025-01-14
c4f5b03e,fe60afde-4200-41,2025-03-06,2025-03-07,Smartwatch,h301,249.99,website,email,desktop,Manchester,2025-03-06,2025-03-07
da78f4c5,8e990457-e0b1-47,2025-04-24,2025-04-28,Smartwatch,h301,249.99,mobile_app,email,mobile,Manchester,2025-04-24,2025-04-28
0ce87570,9ab2b735-83f0-4e,2025-05-10,05-12-2025,MacBook Air,g770,1199.99,mobile_app,affiliate,mobile,Manchester,2025-05-10,2025-05-12
c179c596,cc8a6796-7015-49,2025-03-15,2025-03-19,Accessory,m001,24.99,website,direct,mobile,Liverpool,2025-03-15,2025-03-19
c179c596,cc8a6796-7015-49,2025-03-15,2025-03-16,MacBook Air,g770,1199.99,mobile_app,direct,desktop,London,2025-03-15,2025-03-16
dbbf46ed,c81a5f0f-1b1b-4a,2025-02-02,2025-02-05,Steam Deck,c912,499.99,website,direct,mobile,Glasgow,2025-02-02,2025-02-05
2ac38bd3,8ffe38c9-d2d8-4e,2025-01-05,2025-01-11,MacBook Air,g770,1199.99,mobile_app,affiliate,desktop,London,2025-01-05,2025-01-11
ba751921,34943114-def1-4d,2025-03-02,2025-03-04,Accessory,m001,24.99,mobile_app,email,desktop,London,2025-03-02,2025-03-04
ded89c47,c3101e2e-7107-41,04-03-2025,2025-03-08,MacBook Air,g770,1199.99,mobile_app,direct,mobile,London,2025-03-04,2025-03-08
ded89c47,c3101e2e-7107-41,2025-03-04,03-09-2025,MacBook Air,g770,1199.99,mobile_app,direct,desktop,Birmingham,2025-03-04,2025-03-09
1f7bd82f,5d1ddcb7-a5a7-42,2025-02-01,2025-02-02,PS5,a245,479.99,website,direct,mobile,Glasgow,2025-02-01,2025-02-02
01afb939,f83a1bce-7069-49,2025-01-23,2025-01-24,Google Pixel 8,i920,699.99,website,affiliate,unknown,Liverpool,2025-01-23,2025-01-24
01afb939,f83a1bce-7069-49,2025-01-23,2025-01-27,iPhone 15,f521,899.99,website,social,mobile,Glasgow,2025-01-23,2025-01-27
2bd7d038,7942000a-cf24-44,2025-04-16,2025-04-19,AirPods,d633,159.99,mobile_app,affiliate,mobile,Manchester,2025-04-16,2025-04-19
a1230193,b717548d-5f57-4d,03-05-2025,2025-05-08,Steam Deck,c912,499.99,website,search,desktop,London,2025-05-03,2025-05-08
a1230193,b717548d-5f57-4d,2025-05-03,2025-05-06,Steam Deck,c912,499.99,website,email,unknown,Birmingham,2025-05-03,2025-05-06
c986f893,c0d2201b-26cf-4e,2025-03-11,2025-03-17,Steam Deck,c912,499.99,mobile_app,direct,mobile,Manchester,2025-03-11,2025-03-17
e5e79add,6dc75587-cd40-46,2025-05-12,2025-05-18,PS5,a245,479.99,website,direct,unknown,Birmingham,2025-05-12,2025-05-18
e5e79add,6dc75587-cd40-46,2025-05-12,2025-05-18,Accessory,m001,24.99,website,direct,desktop,Leeds,2025-05-12,2025-05-18
f198f62e,8422c0cf-da36-43,2025-04-19,2025-04-23,Xbox Series X,b104,499.99,website,email,desktop,London,2025-04-19,2025-04-23
8470f6c8,c528ac36-2545-43,2025-03-17,2025-03-21,Xbox Series X,b104,499.99,website,search,desktop,Glasgow,2025-03-17,2025-03-21
c5ba36af,569b111f-15b4-46,2025-03-09,2025-03-10,PS5,a245,479.99,mobile_app,social,unknown,London,2025-03-09,2025-03-10
ec2a322b,64ad1905-0fbc-43,2025-05-20,2025-05-26,AirPods,d633,159.99,website,direct,,Glasgow,2025-05-20,2025-05-26
ec2a322b,64ad1905-0fbc-43,2025-05-20,2025-05-24,MacBook Air,g770,1199.99,website,search,mobile,Birmingham,2025-05-20,2025-05-24
fae45d7c,93162f53-e70a-48,2025-01-09,2025-01-10,Accessory,m001,24.99,mobile_app,affiliate,mobile,London,2025-01-09,2025-01-10
fae45d7c,93162f53-e70a-48,2025-01-09,2025-01-12,iPhone 15,f521,899.99,mobile_app,social,desktop,,2025-01-09,2025-01-12
6b579789,e0354d75-a90d-45,2025-01-06,2025-01-07,iPhone 15,f521,899.99,website,affiliate,desktop,Manchester,2025-01-06,2025-01-07
b8b791b0,b366ffd1-ae4d-4a,2025-02-05,2025-02-11,Nintendo Switch,e682,299.99,mobile_app,direct,mobile,Glasgow,2025-02-05,2025-02-11
e67410de,581ab26c-e8c3-4a,2025-05-22,2025-05-25,Smartwatch,h301,249.99,website,social,desktop,London,2025-05-22,2025-05-25
e67410de,581ab26c-e8c3-4a,2025-05-22,2025-05-26,AirPods,d633,159.99,mobile_app,email,mobile,Glasgow,2025-05-22,2025-05-26
a4d546e1,2598bc54-eba2-46,2025-03-01,2025-03-02,PS5,a245,479.99,website,search,desktop,Liverpool,2025-03-01,2025-03-02
71305648,9fd60922-8b5f-44,2025-01-11,2025-01-14,iPhone 15,f521,899.99,mobile_app,search,unknown,Sheffield,2025-01-11,2025-01-14
c680a2e5,cfd42949-e33e-49,04-02-2025,2025-02-07,Kindle Paperwhite,j877,129.99,website,email,desktop,,2025-02-04,2025-02-07
63d69dd8,15936f42-4d31-49,24-05-2025,05-28-2025,Kindle Paperwhite,j877,129.99,website,affiliate,,Sheffield,2025-05-24,2025-05-28
8a713a73,e13f8740-bd74-4f,2025-01-03,2025-01-09,Accessory,m001,24.99,website,affiliate,unknown,Liverpool,2025-01-03,2025-01-09
5738b277,82fce908-17c3-45,2025-06-21,2025-06-23,Accessory,m001,24.99,website,social,desktop,London,2025-06-21,2025-06-23
8a39068b,05fef7bc-28f7-4d,2025-06-05,2025-06-10,PS5,a245,479.99,mobile_app,email,unknown,London,2025-06-05,2025-06-10
6c3912ef,d50cf57e-3dc8-41,2025-03-07,2025-03-09,Smartwatch,h301,249.99,website,affiliate,desktop,Manchester,2025-03-07,2025-03-09
427f6635,bb63721d-1c45-4b,2025-02-06,2025-02-10,Steam Deck,c912,499.99,mobile_app,search,mobile,Glasgow,2025-02-06,2025-02-10
427f6635,bb63721d-1c45-4b,2025-02-06,2025-02-10,iPhone 15,f521,899.99,website,social,desktop,Leicester,2025-02-06,2025-02-10
427f6635,bb63721d-1c45-4b,06-02-2025,2025-02-10,Smartwatch,h301,249.99,website,direct,unknown,London,2025-02-06,2025-02-10
f0fbdb65,1fb235c4-5abe-43,2025-02-06,02-12-2025,AirPods,d633,159.99,website,email,desktop,Manchester,2025-02-06,2025-02-12
56c76990,928b1e4b-4c47-4d,2025-04-26,2025-04-27,Kindle Paperwhite,j877,129.99,website,social,mobile,Nottingham,2025-04-26,2025-04-27
56c76990,928b1e4b-4c47-4d,2025-04-26,2025-05-01,Accessory,m001,24.99,website,,mobile,,2025-04-26,2025-05-01
56c76990,928b1e4b-4c47-4d,2025-04-26,2025-04-30,Google Pixel 8,i920,699.99,mobile_app,social,unknown,Bristol,2025-04-26,2025-04-30
b6f31d02,beea002a-ce2d-41,04-01-2025,2025-01-06,AirPods,d633,159.99,website,affiliate,desktop,Glasgow,2025-01-04,2025-01-06
3bdccce0,aa5f8dfc-a0b3-4a,08-03-2025,2025-03-10,Kindle Paperwhite,j877,129.99,website,search,mobile,Manchester,2025-03-08,2025-03-10
92a0c677,aabb6cac-48d7-41,2025-03-10,2025-03-16,Google Pixel 8,i920,699.99,mobile_app,email,desktop,Manchester,2025-03-10,2025-03-16
1af026df,60aeb372-b6df-44,2025-04-01,2025-04-07,AirPods,d633,159.99,mobile_app,search,desktop,Glasgow,2025-04-01,2025-04-07
744da236,314b4d36-9516-43,2025-03-23,03-25-2025,Xbox Series X,b104,499.99,website,search,desktop,Sheffield,2025-03-23,2025-03-25
179d9ae3,6cfa28cf-b62e-41,2025-05-02,2025-05-03,AirPods,d633,159.99,website,email,desktop,London,2025-05-02,2025-05-03
179d9ae3,6cfa28cf-b62e-41,02-05-2025,2025-05-03,AirPods,d633,159.99,website,direct,unknown,London,2025-05-02,2025-05-03
13fc927f,214bd473-e375-48,2025-01-05,2025-01-06,PS5,a245,479.99,mobile_app,search,mobile,London,2025-01-05,2025-01-06
c7610e83,671adde5-86b8-4f,2025-06-16,2025-06-17,iPhone 15,f521,899.99,mobile_app,direct,mobile,Manchester,2025-06-16,2025-06-17
ff1b654d,9594eea8-4381-4e,2025-01-14,2025-01-17,Kindle Paperwhite,j877,129.99,mobile_app,affiliate,unknown,Manchester,2025-01-14,2025-01-17
6abb6c41,f2a45575-ee58-49,2025-04-27,04-30-2025,Nintendo Switch,e682,299.99,website,email,desktop,Leeds,2025-04-27,2025-04-30
752caa97,817b2f21-24f3-4f,08-06-2025,2025-06-09,AirPods,d633,159.99,website,social,unknown,London,2025-06-08,2025-06-09
752caa97,817b2f21-24f3-4f,2025-06-08,2025-06-14,AirPods,d633,159.99,website,social,desktop,London,2025-06-08,2025-06-14
b1c8d50a,83601fb5-b45b-4a,2025-01-17,2025-01-20,iPhone 15,f521,899.99,website,search,unknown,Birmingham,2025-01-17,2025-01-20
b1c8d50a,83601fb5-b45b-4a,2025-01-17,2025-01-19,MacBook Air,g770,1199.99,mobile_app,direct,unknown,Leeds,2025-01-17,2025-01-19
8f1c5f8c,0858f527-792d-44,01-07-2025,04-01-2025,MacBook Air,g770,1199.99,website,social,desktop,Sheffield,2025-01-07,2025-04-01
1c3efda4,1e6773d7-f3aa-47,2025-04-23,2025-04-25,Smartwatch,h301,249.99,mobile_app,direct,desktop,Leeds,2025-04-23,2025-04-25
1c3efda4,1e6773d7-f3aa-47,2025-04-23,2025-04-28,Steam Deck,c912,499.99,mobile_app,direct,unknown,Sheffield,2025-04-23,2025-04-28
1e245a97,4a229ba5-925f-4c,2025-04-18,2025-04-19,AirPods,d633,159.99,mobile_app,direct,desktop,Leeds,2025-04-18,2025-04-19
1e245a97,4a229ba5-925f-4c,2025-04-18,04-24-2025,MacBook Air,g770,1199.99,website,affiliate,desktop,Manchester,2025-04-18,2025-04-24
07298d47,5fdc9844-fdb3-4e,2025-04-21,2025-04-25,PS5,a245,479.99,website,social,unknown,London,2025-04-21,2025-04-25
efd37a6d,c8a6a005-2463-46,2025-03-12,2025-03-13,MacBook Air,g770,1199.99,website,affiliate,unknown,Bristol,2025-03-12,2025-03-13
efd37a6d,c8a6a005-2463-46,2025-03-12,2025-03-16,PS5,a245,479.99,mobile_app,affiliate,desktop,Bristol,2025-03-12,2025-03-16
bd5a6112,48924bd6-e399-40,2025-03-27,2025-04-02,Nintendo Switch,e682,299.99,website,direct,desktop,Birmingham,2025-03-27,2025-04-02
0b704f97,8c2b678e-1f50-41,2025-04-18,2025-04-21,PS5,a245,479.99,website,search,desktop,Manchester,2025-04-18,2025-04-21
567b9583,4f489f45-92b4-40,2025-01-09,2025-01-10,Nintendo Switch,e682,299.99,mobile_app,affiliate,desktop,London,2025-01-09,2025-01-10
21ffcf72,d59f2b69-79a8-43,2025-03-06,03-10-2025,Xbox Series X,b104,499.99,mobile_app,direct,mobile,Manchester,2025-03-06,2025-03-10
21ffcf72,d59f2b69-79a8-43,06-03-2025,2025-03-10,iPhone 15,f521,899.99,website,direct,,Manchester,2025-03-06,2025-03-10
aacefa98,a2ef0f53-8138-44,2025-06-19,2025-06-25,Google Pixel 8,i920,699.99,mobile_app,search,desktop,Manchester,2025-06-19,2025-06-25
aacefa98,a2ef0f53-8138-44,2025-06-19,2025-06-20,Nintendo Switch,62e8,299.99,website,search,mobile,London,2025-06-19,2025-06-20
9ff0f466,ba554e35-ddc8-42,2025-03-08,2025-03-13,PS5,a245,479.99,mobile_app,direct,desktop,Glasgow,2025-03-08,2025-03-13
56c890a5,6321d753-68dd-46,2025-02-25,2025-02-26,Steam Deck,c912,499.99,website,social,mobile,Sheffield,2025-02-25,2025-02-26
47020de0,aba23511-f544-42,2025-04-23,2025-04-26,Xbox Series X,b104,499.99,mobile_app,direct,unknown,Birmingham,2025-04-23,2025-04-26
a14ed649,2a65bae3-ddaf-42,2025-03-09,2025-03-15,MacBook Air,g770,1199.99,website,social,desktop,Sheffield,2025-03-09,2025-03-15
a4d78f64,4f10aae3-b518-47,2025-01-21,2025-01-23,PS5,a245,479.99,website,email,mobile,London,2025-01-21,2025-01-23
c1f31143,f485e944-3142-40,2025-03-16,2025-03-21,PS5,a245,479.99,mobile_app,affiliate,mobile,Manchester,2025-03-16,2025-03-21
80acefb5,8591a818-91fb-49,2025-05-05,2025-05-06,PS5,a245,479.99,website,direct,mobile,Leeds,2025-05-05,2025-05-06
f65e52fd,a8835c66-1eca-40,2025-03-03,2025-03-06,Google Pixel 8,i920,699.99,website,social,desktop,Liverpool,2025-03-03,2025-03-06
d6c34b19,34afa2e1-c968-48,2025-06-12,2025-06-18,Accessory,m001,24.99,mobile_app,search,mobile,London,2025-06-12,2025-06-18
5207c6cc,15ab7cd2-71b9-45,2025-04-09,2025-04-10,iPhone 15,f521,899.99,mobile_app,social,unknown,Bristol,2025-04-09,2025-04-10
57076494,7dd12d57-0b84-4c,2025-03-02,2025-03-05,iPhone 15,f521,899.99,website,affiliate,desktop,Glasgow,2025-03-02,2025-03-05
57076494,7dd12d57-0b84-4c,2025-03-02,2025-03-04,Accessory,m001,24.99,mobile_app,direct,mobile,Manchester,2025-03-02,2025-03-04
61cb78c3,06289878-6a39-46,18-05-2025,05-24-2025,Smartwatch,h301,249.99,mobile_app,affiliate,desktop,London,2025-05-18,2025-05-24
490ccf97,fad34352-1d59-49,08-02-2025,2025-02-12,Kindle Paperwhite,j877,129.99,mobile_app,direct,desktop,Glasgow,2025-02-08,2025-02-12
f3c1114d,c4af9dc9-416c-45,2025-01-17,2025-01-19,iPhone 15,f521,899.99,website,social,mobile,London,2025-01-17,2025-01-19
2e740569,0f14f86c-2b50-4a,2025-03-21,2025-03-25,iPhone 15,f521,899.99,mobile_app,social,unknown,Manchester,2025-03-21,2025-03-25
2e740569,0f14f86c-2b50-4a,2025-03-21,2025-03-26,MacBook Air,g770,1199.99,mobile_app,direct,unknown,Manchester,2025-03-21,2025-03-26
24784b7d,4c4b52aa-0ef9-49,2025-04-14,2025-04-18,Steam Deck,c912,499.99,mobile_app,search,mobile,Manchester,2025-04-14,2025-04-18
24784b7d,4c4b52aa-0ef9-49,2025-04-14,2025-04-19,Google Pixel 8,i920,699.99,mobile_app,search,unknown,London,2025-04-14,2025-04-19
e645bb00,4207fb51-52ff-4f,15-04-2025,2025-04-19,Steam Deck,c912,499.99,website,search,unknown,Leeds,2025-04-15,2025-04-19
e645bb00,4207fb51-52ff-4f,2025-04-15,2025-04-20,MacBook Air,g770,1199.99,website,affiliate,desktop,Liverpool,2025-04-15,2025-04-20
3c8aae87,3d57ee27-33da-4f,2025-05-04,2025-05-05,iPhone 15,f521,899.99,website,affiliate,mobile,Glasgow,2025-05-04,2025-05-05
44f00717,8121c051-c09c-41,09-03-2025,2025-03-13,Google Pixel 8,i920,699.99,website,affiliate,desktop,Birmingham,2025-03-09,2025-03-13
0766699f,8d9957fa-76fe-4c,2025-03-13,2025-03-16,iPhone 15,f521,899.99,website,email,mobile,Glasgow,2025-03-13,2025-03-16
8dd7e052,e9ea8b10-3bd6-4a,2025-01-17,2025-01-22,Xbox Series X,b104,499.99,mobile_app,direct,desktop,London,2025-01-17,2025-01-22
a6cc0a57,19fc8579-acd3-4f,2025-05-10,2025-05-11,Steam Deck,c912,499.99,website,affiliate,unknown,Leeds,2025-05-10,2025-05-11
d8a5aa52,91788bdd-4dfb-4b,2025-04-14,04-18-2025,Xbox Series X,b104,499.99,website,social,mobile,Birmingham,2025-04-14,2025-04-18
8a5a4272,c86aed73-3415-40,2025-04-17,2025-04-23,Nintendo Switch,e682,299.99,website,search,desktop,Bristol,2025-04-17,2025-04-23
f61b2bfd,3ec2e72a-c832-43,2025-04-15,2025-04-20,Smartwatch,h301,249.99,website,affiliate,desktop,Manchester,2025-04-15,2025-04-20
f60b9881,0ab2e2ca-73a5-4d,2025-04-08,2025-04-10,iPhone 15,f521,899.99,website,direct,desktop,Manchester,2025-04-08,2025-04-10
f60b9881,0ab2e2ca-73a5-4d,2025-04-08,2025-04-13,Nintendo Switch,e682,299.99,mobile_app,direct,desktop,London,2025-04-08,2025-04-13
0f67a174,a72edd5f-4a0c-40,2025-04-27,2025-05-03,Smartwatch,0h31,249.99,website,search,unknown,Birmingham,2025-04-27,2025-05-03
0f67a174,a72edd5f-4a0c-40,2025-04-27,2025-05-01,AirPods,d633,159.99,mobile_app,email,mobile,Birmingham,2025-04-27,2025-05-01
ae1455f4,45f72e6c-7b70-4f,2025-04-01,2025-04-07,Accessory,m001,24.99,website,email,desktop,Nottingham,2025-04-01,2025-04-07
ae1455f4,45f72e6c-7b70-4f,2025-04-01,2025-04-02,Xbox Series X,b104,499.99,website,search,desktop,Sheffield,2025-04-01,2025-04-02
ae1455f4,45f72e6c-7b70-4f,2025-04-01,2025-04-03,Google Pixel 8,i920,699.99,website,social,mobile,Liverpool,2025-04-01,2025-04-03
d7371450,d7aa0f83-59f6-46,2025-04-01,04-05-2025,Accessory,m001,24.99,mobile_app,search,unknown,Liverpool,2025-04-01,2025-04-05
11e74656,29529420-0ba4-43,2025-01-10,2025-01-16,AirPods,d633,159.99,website,social,desktop,Glasgow,2025-01-10,2025-01-16
b99e6f7b,b2cc4372-6532-43,2025-03-22,2025-03-23,AirPods,d633,159.99,mobile_app,direct,unknown,London,2025-03-22,2025-03-23
813be64b,e0d6e969-478a-44,2025-03-20,2025-03-24,Steam Deck,c912,499.99,website,direct,mobile,Leeds,2025-03-20,2025-03-24
a29a7e5f,e2495790-517c-4d,2025-02-20,2025-02-26,Xbox Series X,b104,499.99,website,social,mobile,Birmingham,2025-02-20,2025-02-26
a98afcb0,b52f5f46-c0b0-4d,25-03-2025,2025-03-31,iPhone 15,f521,899.99,mobile_app,social,desktop,London,2025-03-25,2025-03-31
5415c636,35eb728f-5775-4d,2025-04-16,2025-04-19,Nintendo Switch,e682,299.99,mobile_app,direct,mobile,London,2025-04-16,2025-04-19
9bd972ca,223bd9be-b11c-42,2025-05-01,2025-05-02,PS5,a245,479.99,website,email,unknown,Manchester,2025-05-01,2025-05-02
9bd972ca,223bd9be-b11c-42,2025-05-01,2025-05-02,iPhone 15,f521,899.99,website,email,desktop,Manchester,2025-05-01,2025-05-02
8e484bc0,0273be68-e6c5-49,2025-04-09,2025-04-10,Google Pixel 8,i920,699.99,website,direct,unknown,London,2025-04-09,2025-04-10
8e484bc0,0273be68-e6c5-49,2025-04-09,2025-04-12,Nintendo Switch,e682,299.99,website,search,desktop,Birmingham,2025-04-09,2025-04-12
14c62aba,7d2d93e8-b40b-42,2025-02-25,2025-02-26,Accessory,m001,24.99,website,email,desktop,Manchester,2025-02-25,2025-02-26
14c62aba,7d2d93e8-b40b-42,2025-02-25,2025-03-02,Kindle Paperwhite,j877,129.99,website,search,mobile,Liverpool,2025-02-25,2025-03-02
e47f9c7e,a6b96653-a62b-4d,2025-03-15,2025-03-16,Nintendo Switch,e682,299.99,mobile_app,affiliate,mobile,Glasgow,2025-03-15,2025-03-16
e47f9c7e,a6b96653-a62b-4d,2025-03-15,2025-03-18,Nintendo Switch,e682,299.99,mobile_app,social,unknown,Manchester,2025-03-15,2025-03-18
f8d78cbc,71f71add-abee-45,03-02-2025,2025-02-06,Steam Deck,c912,499.99,mobile_app,email,desktop,Manchester,2025-02-03,2025-02-06
d6d24227,99ef827f-d3d4-4d,2025-04-23,2025-04-24,Accessory,m001,24.99,mobile_app,social,unknown,Glasgow,2025-04-23,2025-04-24
5ed7d1a6,fbda05ae-b270-41,27-02-2025,2025-02-28,Google Pixel 8,i920,699.99,website,affiliate,unknown,London,2025-02-27,2025-02-28
5ed7d1a6,fbda05ae-b270-41,2025-02-27,03-03-2025,MacBook Air,g770,1199.99,website,email,desktop,,2025-02-27,2025-03-03
c227e0f2,0265a223-71cf-47,2025-05-19,2025-05-25,Xbox Series X,b104,499.99,mobile_app,affiliate,unknown,Leeds,2025-05-19,2025-05-25
d0f7c7b0,b58dfc59-ebe0-48,2025-04-11,2025-04-17,PS5,a245,479.99,website,direct,unknown,Birmingham,2025-04-11,2025-04-17
fae91634,cef44098-4d9d-4b,2025-01-19,2025-01-21,Accessory,m001,24.99,website,search,unknown,Birmingham,2025-01-19,2025-01-21
b43c7851,096b7724-5ced-43,2025-04-09,2025-04-15,Kindle Paperwhite,j877,129.99,mobile_app,social,desktop,London,2025-04-09,2025-04-15
a3708c7f,01d3a033-3586-4e,2025-06-12,2025-06-15,iPhone 15,f521,899.99,mobile_app,search,mobile,Manchester,2025-06-12,2025-06-15
a3708c7f,01d3a033-3586-4e,2025-06-12,2025-06-18,Nintendo Switch,e682,299.99,mobile_app,direct,desktop,Liverpool,2025-06-12,2025-06-18
2ba46308,47003fcf-deb2-44,2025-04-11,2025-04-16,Kindle Paperwhite,j877,129.99,website,direct,unknown,Glasgow,2025-04-11,2025-04-16
9a5c68ad,bd22f7fc-a8eb-4b,2025-06-25,06-29-2025,Accessory,m001,24.99,website,affiliate,desktop,Birmingham,2025-06-25,2025-06-29
209f4ff2,9691f45d-10bb-49,2025-05-17,2025-05-22,AirPods,d633,159.99,website,social,desktop,Glasgow,2025-05-17,2025-05-22
209f4ff2,9691f45d-10bb-49,2025-05-17,2025-05-20,Smartwatch,h301,249.99,website,email,desktop,Liverpool,2025-05-17,2025-05-20
ba991da0,db00ab4c-91e5-4e,2025-06-23,2025-06-26,PS5,a245,479.99,mobile_app,email,desktop,London,2025-06-23,2025-06-26
f845846e,d900b745-311d-4e,2025-05-02,2025-05-04,PS5,a245,479.99,mobile_app,email,mobile,Manchester,2025-05-02,2025-05-04
e212f7e1,9d4d0658-886e-4a,2025-06-16,06-20-2025,AirPods,d633,159.99,website,affiliate,unknown,,2025-06-16,2025-06-20
e212f7e1,9d4d0658-886e-4a,16-06-2025,2025-06-17,Smartwatch,h301,249.99,mobile_app,email,mobile,London,2025-06-16,2025-06-17
a6685e80,6d575fd1-f019-45,2025-04-15,2025-04-20,MacBook Air,g770,1199.99,website,social,mobile,Glasgow,2025-04-15,2025-04-20
682904ca,52b0147b-f052-48,2025-04-27,2025-05-02,Google Pixel 8,i920,699.99,mobile_app,email,desktop,Bristol,2025-04-27,2025-05-02
846af2e6,84aeffbe-ae1f-49,23-01-2025,2025-01-27,Accessory,m001,24.99,mobile_app,email,unknown,Glasgow,2025-01-23,2025-01-27
eb1bb47f,b8a1e477-e240-40,2025-04-01,2025-04-06,Nintendo Switch,e682,299.99,website,direct,unknown,Manchester,2025-04-01,2025-04-06
55af47da,50f53bd8-72e8-46,2025-05-26,2025-05-27,Google Pixel 8,i920,699.99,website,affiliate,mobile,Birmingham,2025-05-26,2025-05-27
55af47da,50f53bd8-72e8-46,2025-05-26,2025-05-28,MacBook Air,g770,1199.99,mobile_app,affiliate,desktop,London,2025-05-26,2025-05-28
39c2c1a2,cec3a6f4-9262-45,2025-03-02,2025-03-06,MacBook Air,g770,1199.99,website,email,mobile,Glasgow,2025-03-02,2025-03-06
39c2c1a2,cec3a6f4-9262-45,2025-03-02,2025-03-08,Smartwatch,h301,249.99,mobile_app,affiliate,desktop,Manchester,2025-03-02,2025-03-08
326684ff,f530c98d-6c7f-4b,2025-04-15,2025-04-21,Xbox Series X,b104,499.99,website,social,,Manchester,2025-04-15,2025-04-21
0722ab3c,10168d65-4f90-49,2025-04-01,2025-04-05,Steam Deck,c912,499.99,mobile_app,affiliate,mobile,Manchester,2025-04-01,2025-04-05
0722ab3c,10168d65-4f90-49,2025-04-01,2025-04-06,iPhone 15,f521,899.99,mobile_app,direct,unknown,London,2025-04-01,2025-04-06
0722ab3c,10168d65-4f90-49,2025-04-01,2025-04-02,Smartwatch,h301,249.99,mobile_app,social,desktop,Glasgow,2025-04-01,2025-04-02
ef60250e,062667fc-cedc-45,2025-01-06,2025-01-08,Google Pixel 8,i920,699.99,mobile_app,direct,unknown,London,2025-01-06,2025-01-08
ef60250e,062667fc-cedc-45,2025-01-06,2025-01-09,Steam Deck,c912,499.99,website,search,mobile,Nottingham,2025-01-06,2025-01-09
f574175b,3f4574d4-401a-45,2025-06-23,2025-06-26,Nintendo Switch,e682,299.99,mobile_app,social,desktop,Glasgow,2025-06-23,2025-06-26
3c9b3b84,d25697ad-0def-4f,2025-01-26,2025-01-28,Nintendo Switch,e682,299.99,website,social,mobile,Birmingham,2025-01-26,2025-01-28
187de0c5,9997496b-c697-44,2025-06-05,2025-06-11,AirPods,d633,159.99,website,affiliate,desktop,Bristol,2025-06-05,2025-06-11
eaadcb2f,1ff49f0a-9435-4c,20-02-2025,2025-02-23,PS5,a245,479.99,mobile_app,affiliate,mobile,Leeds,2025-02-20,2025-02-23
c85b811b,e3dc8702-5033-44,07-03-2025,2025-03-11,Smartwatch,h301,249.99,website,email,desktop,Birmingham,2025-03-07,2025-03-11
9c595e03,cd693dab-eb4b-4c,2025-06-08,2025-06-09,Nintendo Switch,e682,299.99,mobile_app,email,mobile,,2025-06-08,2025-06-09
0d5d2f64,1a115f59-10d7-41,2025-03-01,2025-03-03,Xbox Series X,b104,499.99,mobile_app,social,mobile,Manchester,2025-03-01,2025-03-03
0d5d2f64,1a115f59-10d7-41,2025-03-01,2025-03-06,Smartwatch,h301,249.99,website,social,mobile,,2025-03-01,2025-03-06
693e5fcf,66d4b394-61a7-41,2025-06-07,2025-06-11,Kindle Paperwhite,j877,129.99,website,search,unknown,Bristol,2025-06-07,2025-06-11
7412c272,c997f2fa-997d-4d,2025-04-23,2025-04-24,Steam Deck,c912,499.99,website,email,unknown,Glasgow,2025-04-23,2025-04-24
19ed59a5,6d98567e-cb8f-49,2025-05-09,2025-05-10,iPhone 15,f521,899.99,website,social,desktop,Leicester,2025-05-09,2025-05-10
84681060,acffa99f-f005-4f,2025-05-03,2025-05-06,Smartwatch,h301,249.99,website,social,mobile,Manchester,2025-05-03,2025-05-06
b69aca1e,1ba651ed-3146-44,2025-02-25,2025-03-03,Google Pixel 8,i920,699.99,website,social,desktop,Birmingham,2025-02-25,2025-03-03
b69aca1e,1ba651ed-3146-44,2025-02-25,2025-03-01,Accessory,m001,24.99,website,affiliate,desktop,Leeds,2025-02-25,2025-03-01
204054fb,d73d52ba-ca17-41,2025-03-01,2025-03-05,Steam Deck,c912,499.99,website,search,mobile,London,2025-03-01,2025-03-05
9ef01577,5afaeb32-419b-47,2025-02-21,2025-02-24,Steam Deck,c912,499.99,website,direct,unknown,Bristol,2025-02-21,2025-02-24
20afaf9e,233e84ac-3e3f-4d,2025-05-11,2025-05-12,Kindle Paperwhite,j877,129.99,mobile_app,email,desktop,London,2025-05-11,2025-05-12
5b951652,835c3541-6f93-4e,20-03-2025,2025-03-23,AirPods,d633,159.99,website,social,unknown,Birmingham,2025-03-20,2025-03-23
7832b59c,8a8864c7-e29d-47,2025-04-23,2025-04-27,Smartwatch,h301,249.99,mobile_app,email,mobile,London,2025-04-23,2025-04-27
8486b704,4a832ab5-57c8-40,2025-04-27,2025-05-01,Google Pixel 8,i920,699.99,mobile_app,affiliate,desktop,London,2025-04-27,2025-05-01
d1b60755,250487e4-ada5-47,13-02-2025,2025-02-17,Smartwatch,h301,249.99,mobile_app,direct,unknown,Leeds,2025-02-13,2025-02-17
f9fc9c3f,0dfabe46-dbd3-48,2025-05-26,2025-05-28,Kindle Paperwhite,j877,129.99,mobile_app,social,mobile,Manchester,2025-05-26,2025-05-28
30799b56,3385db3b-e893-48,2025-06-24,2025-06-30,Accessory,m001,24.99,mobile_app,email,,London,2025-06-24,2025-06-30
b1420898,b11c7dff-b1dd-44,2025-03-04,2025-03-05,Kindle Paperwhite,j877,129.99,website,affiliate,desktop,London,2025-03-04,2025-03-05
4cb4a7f6,90ebba12-9412-4a,2025-05-10,2025-05-11,Accessory,m001,24.99,mobile_app,affiliate,mobile,London,2025-05-10,2025-05-11
4cb4a7f6,90ebba12-9412-4a,2025-05-10,2025-05-15,Kindle Paperwhite,j877,129.99,website,social,unknown,London,2025-05-10,2025-05-15
e9195919,1ad74fd4-298b-4e,2025-02-06,2025-02-07,Kindle Paperwhite,j877,129.99,mobile_app,social,desktop,Glasgow,2025-02-06,2025-02-07
b176e71f,eb821435-382a-4b,2025-04-22,2025-04-26,Steam Deck,c912,499.99,mobile_app,affiliate,desktop,Leeds,2025-04-22,2025-04-26
c4b27b21,36903edb-9fb9-48,2025-05-04,2025-05-05,Smartwatch,h301,249.99,mobile_app,social,mobile,Manchester,2025-05-04,2025-05-05
c4b27b21,36903edb-9fb9-48,2025-05-04,2025-05-10,Accessory,m001,24.99,mobile_app,affiliate,mobile,Leeds,2025-05-04,2025-05-10
667ae277,cea95510-54de-4c,24-06-2025,2025-06-29,Steam Deck,c912,499.99,mobile_app,email,unknown,Glasgow,2025-06-24,2025-06-29
667ae277,cea95510-54de-4c,24-06-2025,2025-06-27,AirPods,d633,159.99,mobile_app,direct,desktop,Liverpool,2025-06-24,2025-06-27
5b9e75f4,01b8c14a-fd68-45,2025-06-19,2025-06-20,MacBook Air,g770,1199.99,website,affiliate,desktop,Manchester,2025-06-19,2025-06-20
a19f2485,247474b3-1d7d-4b,2025-03-25,2025-03-20,iPhone 15,f521,899.99,mobile_app,email,desktop,Leeds,2025-03-25,2025-03-20
32f9b771,5c230306-c3f9-44,2025-02-16,2025-02-20,Kindle Paperwhite,j877,129.99,website,search,mobile,Manchester,2025-02-16,2025-02-20
2c9de90a,380cc838-2c94-4f,27-05-2025,2025-06-01,Steam Deck,c912,499.99,mobile_app,affiliate,unknown,Glasgow,2025-05-27,2025-06-01
2c9de90a,380cc838-2c94-4f,2025-05-27,2025-05-29,MacBook Air,g770,1199.99,mobile_app,direct,mobile,Birmingham,2025-05-27,2025-05-29
2d1368f3,3ef7839f-8df4-49,2025-06-25,2025-06-30,iPhone 15,f521,899.99,website,social,desktop,Nottingham,2025-06-25,2025-06-30
2d1368f3,3ef7839f-8df4-49,2025-07-01,2025-06-25,PS5,a245,479.99,website,search,desktop,London,2025-01-07,2025-06-25
23226464,19e79a3d-e920-4a,2025-06-24,2025-06-29,Accessory,m001,24.99,mobile_app,email,unknown,Liverpool,2025-06-24,2025-06-29
35d21dea,e2901d96-c993-48,2025-04-24,2025-04-27,Xbox Series X,b104,499.99,website,,desktop,London,2025-04-24,2025-04-27
2bde3c78,5ea0c503-3d7a-47,2025-03-10,2025-03-14,Nintendo Switch,e682,299.99,website,search,desktop,Glasgow,2025-03-10,2025-03-14
6f082598,cc8cc291-fa23-48,2025-04-03,2025-04-08,Nintendo Switch,e682,299.99,website,search,mobile,Birmingham,2025-04-03,2025-04-08
217bc29e,1e559419-10bc-44,2025-05-02,2025-05-08,Nintendo Switch,e682,299.99,website,social,unknown,Leeds,2025-05-02,2025-05-08
516546ca,8855817d-3112-46,2025-01-18,2025-01-21,Accessory,m001,24.99,website,direct,unknown,Birmingham,2025-01-18,2025-01-21
516546ca,8855817d-3112-46,2025-01-18,2025-01-21,Steam Deck,c912,499.99,website,search,desktop,Liverpool,2025-01-18,2025-01-21
c3595dc2,a2da43a7-fa1b-46,2025-04-15,2025-04-18,MacBook Air,g770,1199.99,website,email,desktop,Manchester,2025-04-15,2025-04-18
26087b53,dabc47ce-3068-4f,2025-05-01,2025-05-07,Xbox Series X,b104,499.99,website,search,desktop,Liverpool,2025-05-01,2025-05-07
26087b53,dabc47ce-3068-4f,01-05-2025,2025-05-05,PS5,a245,479.99,website,affiliate,desktop,Bristol,2025-05-01,2025-05-05
205f9619,a1243bea-0da2-41,2025-03-17,2025-03-20,AirPods,d633,159.99,website,affiliate,desktop,Manchester,2025-03-17,2025-03-20
ba303cce,95866982-f7e8-48,2025-04-13,2025-04-16,Smartwatch,h301,249.99,website,social,desktop,Leeds,2025-04-13,2025-04-16
2adcecb5,ca7ecb33-787d-46,2025-05-06,2025-05-07,Smartwatch,h301,249.99,mobile_app,affiliate,mobile,Manchester,2025-05-06,2025-05-07
5fcfe711,e1e669e5-c055-49,2025-01-15,2025-01-16,Accessory,m001,24.99,website,social,mobile,Manchester,2025-01-15,2025-01-16
5fcfe711,e1e669e5-c055-49,2025-01-15,2025-01-21,iPhone 15,f521,899.99,mobile_app,,desktop,London,2025-01-15,2025-01-21
868592d2,2dd2d8c0-76da-48,2025-05-26,2025-05-27,AirPods,d633,159.99,website,search,unknown,Nottingham,2025-05-26,2025-05-27
94c8a69d,f4ac27ef-b734-44,2025-01-16,2025-01-17,Kindle Paperwhite,j877,129.99,website,email,mobile,Manchester,2025-01-16,2025-01-17
350b0860,ca665da6-ebd2-4b,2025-03-13,03-18-2025,Smartwatch,h301,249.99,website,direct,unknown,Leeds,2025-03-13,2025-03-18
37f5c238,73bb84e5-33f7-47,2025-04-26,2025-04-27,AirPods,d633,159.99,website,search,desktop,Manchester,2025-04-26,2025-04-27
d7a998ea,6088825e-e382-4d,2025-04-09,2025-04-10,Google Pixel 8,i920,699.99,website,direct,mobile,Glasgow,2025-04-09,2025-04-10
d7a998ea,6088825e-e382-4d,2025-04-09,2025-04-11,PS5,a245,479.99,website,email,,Glasgow,2025-04-09,2025-04-11
4b88445a,15b2c2b4-8cf0-49,2025-06-01,2025-06-02,Steam Deck,c912,499.99,website,email,mobile,London,2025-06-01,2025-06-02
83239ba9,3aeceaf8-5a00-40,01-04-2025,2025-04-03,Smartwatch,h301,249.99,website,email,unknown,Glasgow,2025-04-01,2025-04-03
83239ba9,3aeceaf8-5a00-40,2025-04-01,2025-04-07,Google Pixel 8,i920,699.99,mobile_app,social,unknown,Manchester,2025-04-01,2025-04-07
83239ba9,3aeceaf8-5a00-40,2025-04-01,2025-04-05,Smartwatch,h301,249.99,mobile_app,direct,mobile,Nottingham,2025-04-01,2025-04-05
5e15433b,737ea52f-6d15-4b,2025-04-18,2025-04-20,Xbox Series X,b104,499.99,mobile_app,social,desktop,Glasgow,2025-04-18,2025-04-20
71127f4b,45e49a9e-5128-40,2025-03-04,2025-03-09,Kindle Paperwhite,j877,129.99,mobile_app,direct,desktop,London,2025-03-04,2025-03-09
4b658517,136d6cce-a535-49,2025-01-18,2025-01-22,Smartwatch,h301,249.99,mobile_app,social,unknown,Liverpool,2025-01-18,2025-01-22
46c3c90c,8bf160df-8346-45,2025-05-18,2025-05-21,AirPods,d633,159.99,website,search,mobile,Manchester,2025-05-18,2025-05-21
8bc85d37,1e5bc68b-1931-46,2025-05-11,2025-05-13,MacBook Air,g770,1199.99,mobile_app,email,unknown,London,2025-05-11,2025-05-13
bec62bbe,acd3d56f-3257-49,2025-06-22,2025-06-26,PS5,a245,479.99,website,affiliate,unknown,Glasgow,2025-06-22,2025-06-26
9aa1f98b,d86f4bb4-aefc-4e,09-03-2025,2025-03-14,AirPods,d633,159.99,mobile_app,email,unknown,Manchester,2025-03-09,2025-03-14
8b0a4802,dae13a7f-ff97-49,2025-04-15,2025-04-20,Accessory,m001,24.99,mobile_app,social,desktop,Manchester,2025-04-15,2025-04-20
58bce5e4,c523b4e9-022f-46,2025-02-26,2025-02-28,PS5,a245,479.99,mobile_app,social,desktop,Manchester,2025-02-26,2025-02-28
c1ff9427,f220eeb5-6760-4a,2025-04-09,2025-04-11,iPhone 15,f521,899.99,website,direct,unknown,Manchester,2025-04-09,2025-04-11
f394c60d,a7728290-78d5-40,2025-01-21,2025-01-24,iPhone 15,f521,899.99,website,email,desktop,Manchester,2025-01-21,2025-01-24
35ba5e93,3a42958b-65c2-48,2025-02-23,2025-02-26,Nintendo Switch,e682,299.99,website,email,desktop,Nottingham,2025-02-23,2025-02-26
77ff3c31,9645dec1-840d-41,2025-04-22,2025-04-27,Smartwatch,h301,249.99,mobile_app,direct,unknown,Birmingham,2025-04-22,2025-04-27
d8867545,5735773c-761e-42,2025-04-03,2025-04-07,PS5,a245,479.99,mobile_app,search,desktop,London,2025-04-03,2025-04-07
704d628f,f1224f43-c527-4f,2025-04-19,2025-04-21,Google Pixel 8,i920,699.99,website,search,mobile,Glasgow,2025-04-19,2025-04-21
dfae1803,07b4e684-8ef6-4e,2025-01-16,2025-01-22,Kindle Paperwhite,j877,129.99,website,search,unknown,Glasgow,2025-01-16,2025-01-22
a8aa454e,bce0caef-f17f-45,2025-05-26,2025-06-01,MacBook Air,g770,1199.99,mobile_app,email,mobile,Manchester,2025-05-26,2025-06-01
c0ac1c00,39b9c13a-56fe-47,2025-04-24,2025-04-26,Steam Deck,c912,499.99,website,social,mobile,Manchester,2025-04-24,2025-04-26
9642b052,b0c5d3d5-c755-4c,2025-03-02,2025-03-05,Nintendo Switch,e682,299.99,mobile_app,affiliate,desktop,Glasgow,2025-03-02,2025-03-05
fa2c9e79,083ed925-c90d-45,2025-04-13,2025-04-15,Smartwatch,h301,249.99,mobile_app,search,mobile,Glasgow,2025-04-13,2025-04-15
e9eba9fe,9174f53b-548b-4c,2025-04-15,10-04-2025,Steam Deck,c912,499.99,website,email,,Glasgow,2025-04-15,2025-10-04
f2dd85f6,641118ec-ddf0-47,2025-04-25,2025-04-30,Accessory,m001,24.99,website,social,mobile,Manchester,2025-04-25,2025-04-30
542ef29e,62ed5403-88d4-4f,2025-03-13,2025-03-17,Xbox Series X,b104,499.99,website,search,unknown,Glasgow,2025-03-13,2025-03-17
2be26bd1,a395b867-7397-41,2025-03-08,2025-03-11,Nintendo Switch,e682,299.99,website,affiliate,mobile,Leeds,2025-03-08,2025-03-11
9a760ea9,2d798f3e-8d8b-4c,2025-04-18,2025-04-22,PS5,a245,479.99,mobile_app,email,mobile,London,2025-04-18,2025-04-22
9a760ea9,2d798f3e-8d8b-4c,2025-04-18,2025-04-22,iPhone 15,f521,899.99,website,search,mobile,Manchester,2025-04-18,2025-04-22
62c9f4fc,32f194d8-2fcb-4d,2025-03-07,2025-03-12,Smartwatch,h301,249.99,website,social,mobile,Glasgow,2025-03-07,2025-03-12
62c9f4fc,32f194d8-2fcb-4d,2025-03-07,2025-03-11,Smartwatch,h301,249.99,website,email,unknown,Manchester,2025-03-07,2025-03-11
62c9f4fc,32f194d8-2fcb-4d,2025-03-07,03-08-2025,PS5,a245,479.99,website,affiliate,desktop,Leeds,2025-03-07,2025-03-08
7464d6f2,4a85e443-3ba8-48,2025-03-11,2025-03-12,Xbox Series X,b104,499.99,mobile_app,social,desktop,Leeds,2025-03-11,2025-03-12
e8e977f0,02d3fb7e-84be-4e,2025-01-11,2025-01-12,Xbox Series X,b104,499.99,website,email,unknown,Manchester,2025-01-11,2025-01-12
6b1d20b9,fd561b27-2833-49,2025-04-23,04-29-2025,Nintendo Switch,e682,299.99,website,email,desktop,London,2025-04-23,2025-04-29
34dbda6b,639509c4-119a-43,2025-04-27,2025-04-28,PS5,a245,479.99,mobile_app,affiliate,mobile,Birmingham,2025-04-27,2025-04-28
aa2fd9d1,4f4c3f0b-34a7-4f,2025-02-17,2025-02-23,iPhone 15,f521,899.99,mobile_app,email,unknown,Manchester,2025-02-17,2025-02-23
aa2fd9d1,4f4c3f0b-34a7-4f,2025-02-17,2025-02-19,Xbox Series X,b104,499.99,mobile_app,affiliate,desktop,London,2025-02-17,2025-02-19
aa2fd9d1,4f4c3f0b-34a7-4f,2025-02-17,2025-02-19,iPhone 15,f521,899.99,mobile_app,social,unknown,London,2025-02-17,2025-02-19
33f60730,9339304b-9a8c-43,20-03-2025,2025-03-25,PS5,a245,479.99,website,search,mobile,Glasgow,2025-03-20,2025-03-25
fdb7c107,757e2b43-af51-48,2025-02-12,2025-02-16,Accessory,m001,24.99,mobile_app,email,unknown,Manchester,2025-02-12,2025-02-16
3f30ea12,d317d8c9-1060-47,2025-03-04,2025-03-06,Smartwatch,h301,249.99,website,email,mobile,London,2025-03-04,2025-03-06
76733597,91b8ff07-e909-46,2025-04-04,2025-04-07,PS5,a245,479.99,website,direct,unknown,Glasgow,2025-04-04,2025-04-07
eb3cc270,1752815c-bcbf-45,2025-01-10,2025-01-11,PS5,a245,479.99,mobile_app,affiliate,desktop,Birmingham,2025-01-10,2025-01-11
641e7f8c,d7b73862-b347-41,2025-04-21,2025-04-27,Nintendo Switch,e682,299.99,website,social,mobile,London,2025-04-21,2025-04-27
2df8d4a8,d98f5e83-cf5b-49,2025-05-03,2025-05-07,Steam Deck,c912,499.99,website,email,desktop,Manchester,2025-05-03,2025-05-07
2df8d4a8,d98f5e83-cf5b-49,2025-05-03,2025-05-08,Kindle Paperwhite,j877,129.99,mobile_app,email,unknown,Manchester,2025-05-03,2025-05-08
a8b97820,6e9c92ba-bbb5-40,2025-02-26,2025-03-04,Smartwatch,h301,249.99,website,search,desktop,Leeds,2025-02-26,2025-03-04
0b2d983a,1874ed7d-9190-45,2025-05-01,2025-05-03,Xbox Series X,b104,499.99,mobile_app,social,mobile,London,2025-05-01,2025-05-03
89a92af3,286e3f0a-dedb-4e,2025-04-23,2025-04-28,Kindle Paperwhite,j877,129.99,website,social,desktop,Manchester,2025-04-23,2025-04-28
e6f8dac3,11162039-ea92-45,2025-02-26,2025-03-01,PS5,a245,479.99,mobile_app,direct,unknown,London,2025-02-26,2025-03-01
e6f8dac3,11162039-ea92-45,2025-02-26,2025-03-03,AirPods,d633,159.99,website,direct,mobile,Manchester,2025-02-26,2025-03-03
1f08f855,69498671-7e55-43,15-05-2025,2025-05-21,PS5,a245,479.99,website,direct,desktop,London,2025-05-15,2025-05-21
c78e0272,c161b06c-1397-45,2025-06-22,06-24-2025,Smartwatch,h301,249.99,mobile_app,affiliate,,Manchester,2025-06-22,2025-06-24
c78e0272,c161b06c-1397-45,2025-06-22,2025-06-27,Accessory,m001,24.99,mobile_app,email,mobile,London,2025-06-22,2025-06-27
c78e0272,c161b06c-1397-45,2025-06-22,06-27-2025,PS5,a245,479.99,website,email,mobile,London,2025-06-22,2025-06-27
0b6d35d7,2a32e553-7370-4a,2025-03-16,03-18-2025,Steam Deck,c912,499.99,mobile_app,search,mobile,Glasgow,2025-03-16,2025-03-18
0b6d35d7,2a32e553-7370-4a,2025-03-16,2025-03-19,Google Pixel 8,i920,699.99,website,social,mobile,Liverpool,2025-03-16,2025-03-19
763f56ac,a38cc35f-12bc-40,2025-05-07,2025-05-08,iPhone 15,f521,899.99,website,social,unknown,London,2025-05-07,2025-05-08
763f56ac,a38cc35f-12bc-40,2025-05-07,2025-05-09,MacBook Air,g770,1199.99,mobile_app,direct,mobile,Leeds,2025-05-07,2025-05-09
09ab99a3,663b4427-bef7-41,2025-05-25,2025-05-30,Xbox Series X,b104,499.99,mobile_app,search,unknown,Glasgow,2025-05-25,2025-05-30
ab987d93,b5878d33-1d5b-48,2025-05-24,2025-05-29,Smartwatch,h301,249.99,mobile_app,affiliate,unknown,Manchester,2025-05-24,2025-05-29
a832a228,761b7e11-7c19-4e,18-03-2025,2025-03-24,Nintendo Switch,e682,299.99,website,affiliate,desktop,Manchester,2025-03-18,2025-03-24
a832a228,761b7e11-7c19-4e,2025-03-18,2025-03-19,PS5,a245,479.99,website,search,mobile,Birmingham,2025-03-18,2025-03-19
4775d7ab,700ea842-f334-48,2025-04-13,2025-04-14,Steam Deck,c912,499.99,website,email,desktop,Birmingham,2025-04-13,2025-04-14
2d5f60d9,d6a7aa06-2bab-4a,2025-06-03,2025-06-09,Kindle Paperwhite,j877,129.99,mobile_app,social,mobile,Bristol,2025-06-03,2025-06-09
abe05b22,bdcf6fd4-88df-42,2025-05-13,05-15-2025,PS5,a245,479.99,mobile_app,social,desktop,London,2025-05-13,2025-05-15
abe05b22,bdcf6fd4-88df-42,2025-05-13,2025-05-15,Xbox Series X,b104,499.99,mobile_app,email,unknown,Glasgow,2025-05-13,2025-05-15
2d8d7db8,45f3dc5a-ad68-4b,2025-01-07,2025-01-10,Kindle Paperwhite,j877,129.99,website,affiliate,desktop,Glasgow,2025-01-07,2025-01-10
2d8d7db8,45f3dc5a-ad68-4b,2025-01-07,2025-01-13,Google Pixel 8,029i,699.99,mobile_app,email,unknown,Liverpool,2025-01-07,2025-01-13
712ab8eb,e4872e77-08d1-40,2025-03-04,2025-03-06,Steam Deck,c912,499.99,mobile_app,affiliate,desktop,Liverpool,2025-03-04,2025-03-06
712ab8eb,e4872e77-08d1-40,2025-03-04,03-07-2025,Xbox Series X,b104,499.99,mobile_app,direct,desktop,Manchester,2025-03-04,2025-03-07
712ab8eb,e4872e77-08d1-40,2025-03-04,2025-03-08,Accessory,m001,24.99,mobile_app,email,desktop,Manchester,2025-03-04,2025-03-08
a99c37b3,a2819fce-d624-40,2025-06-04,2025-06-07,Xbox Series X,b104,499.99,website,direct,unknown,Manchester,2025-06-04,2025-06-07
71a91c81,1a50a93c-e5a2-40,2025-04-08,2025-04-13,Nintendo Switch,e682,299.99,mobile_app,social,unknown,Liverpool,2025-04-08,2025-04-13
71a91c81,1a50a93c-e5a2-40,2025-04-08,2025-04-12,Nintendo Switch,e682,299.99,website,social,desktop,Leicester,2025-04-08,2025-04-12
33a51ac6,0c754a17-0131-46,2025-01-23,2025-01-24,Nintendo Switch,e682,299.99,mobile_app,direct,unknown,Glasgow,2025-01-23,2025-01-24
041b1878,e8a44238-5fe8-47,2025-04-01,04-03-2025,Google Pixel 8,i920,699.99,website,affiliate,desktop,Leeds,2025-04-01,2025-04-03
ae11d3c2,03ba33a0-fd42-46,2025-03-09,2025-03-15,AirPods,d633,159.99,mobile_app,social,mobile,Birmingham,2025-03-09,2025-03-15
d5dbcbee,f5705436-3877-42,2025-06-03,2025-06-08,iPhone 15,f521,899.99,mobile_app,social,mobile,Birmingham,2025-06-03,2025-06-08
d5dbcbee,f5705436-3877-42,2025-06-03,2025-06-07,iPhone 15,f521,899.99,website,email,mobile,London,2025-06-03,2025-06-07
d5dbcbee,f5705436-3877-42,2025-06-03,2025-06-08,iPhone 15,f521,899.99,mobile_app,affiliate,mobile,Liverpool,2025-06-03,2025-06-08
833334f6,b958d153-2afa-4f,2025-03-21,2025-03-26,Accessory,m001,24.99,website,,mobile,Manchester,2025-03-21,2025-03-26
9fea97cc,529b20e0-53bf-4b,2025-04-21,2025-04-27,Steam Deck,c912,499.99,website,email,mobile,Leeds,2025-04-21,2025-04-27
3b7f1998,6522e8b9-8aad-46,2025-03-09,2025-03-11,Nintendo Switch,e682,299.99,mobile_app,email,desktop,London,2025-03-09,2025-03-11
a76c11cb,52c83bfc-5b48-46,2025-05-20,2025-05-22,PS5,a245,479.99,mobile_app,affiliate,mobile,Leicester,2025-05-20,2025-05-22
a76c11cb,52c83bfc-5b48-46,2025-05-20,2025-05-26,Accessory,m001,24.99,mobile_app,search,desktop,Manchester,2025-05-20,2025-05-26
a8702d97,3677f5b4-63a1-4c,2025-05-06,2025-05-12,AirPods,d633,159.99,mobile_app,email,mobile,Sheffield,2025-05-06,2025-05-12
e2ad828b,9fb886b2-a662-4b,2025-01-18,2025-01-22,Kindle Paperwhite,j877,129.99,mobile_app,email,desktop,London,2025-01-18,2025-01-22
fd8fb938,c47dd678-4d31-49,2025-04-05,2025-04-10,Nintendo Switch,e682,299.99,mobile_app,search,desktop,London,2025-04-05,2025-04-10
91b76c45,ca90001c-8943-41,2025-04-22,04-26-2025,MacBook Air,g770,1199.99,mobile_app,email,desktop,Glasgow,2025-04-22,2025-04-26
a180f402,18412e07-f583-4c,2025-01-05,2025-01-09,Nintendo Switch,e682,299.99,website,social,unknown,Manchester,2025-01-05,2025-01-09
a180f402,18412e07-f583-4c,2025-01-05,2025-01-10,Xbox Series X,b104,499.99,mobile_app,search,unknown,Birmingham,2025-01-05,2025-01-10
2207cb65,ecaf8800-ad8a-43,2025-05-24,2025-05-26,Accessory,m001,24.99,mobile_app,,mobile,Liverpool,2025-05-24,2025-05-26
fa5f9e72,c2ffd690-a2a6-46,2025-04-02,2025-04-05,PS5,a245,479.99,website,social,desktop,London,2025-04-02,2025-04-05
e97f995d,11489054-7b6c-45,2025-02-10,2025-02-13,Steam Deck,c912,499.99,website,affiliate,mobile,London,2025-02-10,2025-02-13
80e022c8,82d29bf8-61e3-47,2025-02-11,2025-02-12,AirPods,d633,159.99,mobile_app,email,unknown,Bristol,2025-02-11,2025-02-12
c249f59a,03671560-fd06-47,2025-04-21,2025-04-22,Nintendo Switch,e682,299.99,mobile_app,direct,mobile,Birmingham,2025-04-21,2025-04-22
3e59034b,3c847821-4f10-44,2025-04-12,2025-04-17,AirPods,d633,159.99,website,affiliate,unknown,Birmingham,2025-04-12,2025-04-17
33b70b63,2336d60b-0f57-4d,2025-04-27,2025-04-29,AirPods,d633,159.99,website,social,unknown,Glasgow,2025-04-27,2025-04-29
b9add00a,a45ca94a-3452-48,2025-06-05,2025-06-08,PS5,a245,479.99,website,affiliate,mobile,Birmingham,2025-06-05,2025-06-08
225f52ab,71980a55-f224-46,2025-01-19,2025-01-21,iPhone 15,f521,899.99,mobile_app,social,mobile,Leeds,2025-01-19,2025-01-21
225f52ab,71980a55-f224-46,2025-01-19,2025-01-22,PS5,a245,479.99,mobile_app,search,mobile,London,2025-01-19,2025-01-22
cab21438,c976ec61-a4c3-4a,2025-04-23,2025-04-28,Xbox Series X,b104,499.99,mobile_app,email,unknown,Birmingham,2025-04-23,2025-04-28
3aa06694,d00dcc4f-a5e6-4e,01-04-2025,2025-04-07,Xbox Series X,b104,499.99,website,email,desktop,Bristol,2025-04-01,2025-04-07
0dd7cac2,57bd0ca8-54ce-40,2025-05-16,2025-05-21,MacBook Air,g770,1199.99,website,email,mobile,,2025-05-16,2025-05-21
0dd7cac2,57bd0ca8-54ce-40,2025-05-16,2025-05-19,PS5,a245,479.99,mobile_app,search,desktop,Leeds,2025-05-16,2025-05-19
b23f4738,fd063a58-aa3d-45,16-03-2025,2025-03-20,MacBook Air,g770,1199.99,website,direct,unknown,Bristol,2025-03-16,2025-03-20
2efcd60c,df69a560-9baa-47,2025-02-20,2025-02-26,Smartwatch,h301,249.99,mobile_app,search,unknown,Glasgow,2025-02-20,2025-02-26
f42323d9,108abb5c-018c-43,2025-06-27,07-01-2025,iPhone 15,f521,899.99,mobile_app,social,mobile,London,2025-06-27,2025-07-01
2024c407,fdf48930-a265-4f,2025-04-09,2025-04-13,MacBook Air,g770,1199.99,mobile_app,affiliate,unknown,Birmingham,2025-04-09,2025-04-13
2024c407,fdf48930-a265-4f,2025-04-09,2025-04-13,Nintendo Switch,e682,299.99,website,direct,unknown,London,2025-04-09,2025-04-13
3451cf94,8c813e53-97b6-44,2025-03-09,2025-03-11,AirPods,d633,159.99,mobile_app,direct,,London,2025-03-09,2025-03-11
2a064fd2,6d1e0d7d-1402-46,2025-05-04,2025-05-09,Google Pixel 8,i920,699.99,mobile_app,affiliate,mobile,Manchester,2025-05-04,2025-05-09
2a064fd2,6d1e0d7d-1402-46,2025-05-04,2025-05-08,Xbox Series X,b104,499.99,website,social,unknown,Glasgow,2025-05-04,2025-05-08
4d980202,6c8c5d0e-3eb3-46,2025-05-03,2025-05-04,Smartwatch,h301,249.99,website,affiliate,mobile,Manchester,2025-05-03,2025-05-04
4d980202,6c8c5d0e-3eb3-46,2025-05-03,2025-05-04,Accessory,m001,24.99,mobile_app,search,desktop,London,2025-05-03,2025-05-04
dcc7eb51,f7bce0ef-72c1-46,2025-01-22,2025-01-27,AirPods,d633,159.99,mobile_app,email,desktop,Bristol,2025-01-22,2025-01-27
60b217f9,f37599aa-147b-4d,2025-01-23,2025-01-29,PS5,a245,479.99,website,direct,unknown,Manchester,2025-01-23,2025-01-29
60b217f9,f37599aa-147b-4d,2025-01-23,2025-01-28,Xbox Series X,b104,499.99,mobile_app,direct,desktop,Manchester,2025-01-23,2025-01-28
60b217f9,f37599aa-147b-4d,2025-01-23,2025-01-29,Accessory,m001,24.99,website,email,unknown,Birmingham,2025-01-23,2025-01-29
6ef54cee,6c35e33c-70fe-45,2025-02-09,2025-02-15,AirPods,d633,159.99,website,social,unknown,Birmingham,2025-02-09,2025-02-15
c30dcc74,f42973f5-d1d1-4e,2025-01-27,2025-01-28,Steam Deck,c912,499.99,website,affiliate,desktop,Manchester,2025-01-27,2025-01-28
c30dcc74,f42973f5-d1d1-4e,2025-01-27,2025-01-28,Kindle Paperwhite,j877,129.99,website,direct,desktop,Leeds,2025-01-27,2025-01-28
4cdbf99e,154ebf91-daa2-42,2025-05-04,2025-05-08,PS5,a245,479.99,website,search,mobile,Manchester,2025-05-04,2025-05-08
4cdbf99e,154ebf91-daa2-42,2025-05-04,2025-05-05,MacBook Air,g770,1199.99,website,email,mobile,Birmingham,2025-05-04,2025-05-05
61652fd3,8d87b7be-271d-40,23-05-2025,2025-05-25,Smartwatch,h301,249.99,website,search,mobile,Glasgow,2025-05-23,2025-05-25
7b189d5d,48817b98-741f-45,2025-04-09,2025-04-15,Kindle Paperwhite,j877,129.99,mobile_app,search,desktop,Birmingham,2025-04-09,2025-04-15
7b189d5d,48817b98-741f-45,2025-04-09,2025-04-11,MacBook Air,g770,1199.99,website,direct,desktop,Manchester,2025-04-09,2025-04-11
ea879f65,b7014925-22fb-49,2025-05-05,2025-05-07,Accessory,m001,24.99,website,search,unknown,London,2025-05-05,2025-05-07
5fcf5c22,dc956e31-0349-4b,2025-04-14,2025-04-16,Google Pixel 8,i920,699.99,mobile_app,social,mobile,Nottingham,2025-04-14,2025-04-16
5fcf5c22,dc956e31-0349-4b,2025-04-14,2025-04-20,AirPods,d633,159.99,website,search,mobile,Leicester,2025-04-14,2025-04-20
be006ccb,6a7330b3-ecfa-47,01-06-2025,2025-06-07,iPhone 15,f521,899.99,mobile_app,social,mobile,Nottingham,2025-06-01,2025-06-07
123c6a29,4eccb0ab-7d53-48,2025-01-03,2025-01-07,PS5,a245,479.99,mobile_app,social,desktop,Manchester,2025-01-03,2025-01-07
eea00af9,fe12ace5-09f0-4f,2025-04-03,2025-04-06,Nintendo Switch,e682,299.99,mobile_app,affiliate,unknown,Manchester,2025-04-03,2025-04-06
c571f9ab,c350bf4f-31b8-40,2025-04-17,2025-04-18,MacBook Air,g770,1199.99,mobile_app,affiliate,unknown,Glasgow,2025-04-17,2025-04-18
c571f9ab,c350bf4f-31b8-40,2025-04-17,2025-04-23,Accessory,m001,24.99,mobile_app,affiliate,mobile,Birmingham,2025-04-17,2025-04-23
a28e0841,593c73f2-b8e5-41,2025-04-19,2025-04-23,Xbox Series X,b104,499.99,mobile_app,email,desktop,Bristol,2025-04-19,2025-04-23
6c8de840,0ec5bad7-b24a-46,2025-02-11,2025-02-14,Xbox Series X,b104,499.99,website,email,unknown,London,2025-02-11,2025-02-14
5c85a58c,7a4c38ef-3e0a-46,2025-03-20,2025-03-24,Google Pixel 8,0i92,699.99,website,direct,unknown,Birmingham,2025-03-20,2025-03-24
25dbbe8d,073bca43-ad2a-4a,2025-01-23,2025-01-26,Xbox Series X,b104,499.99,mobile_app,social,unknown,London,2025-01-23,2025-01-26
3f569381,f1bb5d9b-7499-4b,2025-01-15,01-18-2025,Xbox Series X,b104,499.99,mobile_app,social,desktop,Manchester,2025-01-15,2025-01-18
1de20f2d,a9a0758e-f3a7-4d,2025-01-09,01-13-2025,Accessory,m001,24.99,mobile_app,social,unknown,Manchester,2025-01-09,2025-01-13
b4c0fd18,b62c09bf-a4f7-4a,2025-02-22,2025-02-24,Accessory,m001,24.99,mobile_app,direct,unknown,Glasgow,2025-02-22,2025-02-24
e041f0a3,1491b51d-e6a7-46,2025-02-06,2025-02-11,iPhone 15,f521,899.99,mobile_app,search,unknown,Bristol,2025-02-06,2025-02-11
802a63cc,6d4772f8-d46a-47,2025-06-18,2025-06-19,MacBook Air,g770,1199.99,website,affiliate,unknown,London,2025-06-18,2025-06-19
bbe30fd2,e2fb8d66-a892-4a,2025-01-16,2025-01-18,Xbox Series X,b104,499.99,website,affiliate,mobile,Bristol,2025-01-16,2025-01-18
1bf962a5,eca04629-e05b-47,2025-01-11,2025-01-15,Accessory,m001,24.99,mobile_app,direct,unknown,Birmingham,2025-01-11,2025-01-15
44de950f,cc2b2f49-c6d5-4a,2025-05-22,2025-05-23,Steam Deck,c912,499.99,website,social,mobile,Manchester,2025-05-22,2025-05-23
01a4c2d1,bf8ff33e-ee15-45,2025-05-16,2025-05-17,PS5,a245,479.99,mobile_app,affiliate,desktop,Liverpool,2025-05-16,2025-05-17
c6141017,7de1936b-d0fe-44,2025-04-19,2025-04-23,PS5,a245,479.99,mobile_app,search,unknown,Birmingham,2025-04-19,2025-04-23
6e52b671,6ab62dbf-8663-48,2025-04-05,2025-04-07,Nintendo Switch,e682,299.99,mobile_app,affiliate,unknown,Manchester,2025-04-05,2025-04-07
7c89617d,2fb7e9bd-5fe9-47,18-06-2025,2025-06-22,Smartwatch,h301,249.99,website,search,unknown,Glasgow,2025-06-18,2025-06-22
7c89617d,2fb7e9bd-5fe9-47,2025-06-18,2025-06-20,Steam Deck,c912,499.99,mobile_app,social,mobile,Manchester,2025-06-18,2025-06-20
366b3575,1c3892e8-f2cf-4d,2025-03-01,2025-03-04,Accessory,m001,24.99,website,direct,,Manchester,2025-03-01,2025-03-04
311f5d4a,bffa7a4f-0f19-42,2025-05-06,2025-05-10,Xbox Series X,b104,499.99,website,affiliate,unknown,Manchester,2025-05-06,2025-05-10
e9b87e7a,df223246-e6fb-41,2025-02-18,2025-02-24,Nintendo Switch,e682,299.99,website,direct,desktop,Bristol,2025-02-18,2025-02-24
15f0e5ea,a2ed50b9-de4c-48,08-04-2025,2025-04-09,Xbox Series X,b104,499.99,mobile_app,social,unknown,Glasgow,2025-04-08,2025-04-09
3c1a8ce2,107380cb-46d9-43,2025-05-07,2025-05-08,Google Pixel 8,i920,699.99,mobile_app,direct,unknown,Glasgow,2025-05-07,2025-05-08
3c1a8ce2,107380cb-46d9-43,2025-05-07,05-12-2025,Accessory,m001,24.99,mobile_app,direct,desktop,London,2025-05-07,2025-05-12
441dde33,c2b2547d-ac3c-4b,2025-01-15,2025-01-19,Kindle Paperwhite,j877,129.99,mobile_app,email,unknown,London,2025-01-15,2025-01-19
0ab74b5d,aa528f85-01d9-4b,2025-05-16,2025-05-18,Google Pixel 8,i920,699.99,website,social,mobile,Bristol,2025-05-16,2025-05-18
852393d7,cab285dc-85b7-47,2025-04-05,2025-04-09,Accessory,m001,24.99,website,search,desktop,Leeds,2025-04-05,2025-04-09
c1c4f618,440dd09f-c2e8-4f,02-04-2025,2025-04-07,Xbox Series X,b104,499.99,mobile_app,affiliate,desktop,Glasgow,2025-04-02,2025-04-07
c1c4f618,440dd09f-c2e8-4f,02-04-2025,2025-04-04,Smartwatch,h301,249.99,website,search,unknown,London,2025-04-02,2025-04-04
57d3ec63,56282768-6df0-4c,2025-03-07,2025-03-08,iPhone 15,f521,899.99,website,email,mobile,Glasgow,2025-03-07,2025-03-08
660237ed,3d563b0e-d11c-45,2025-06-21,2025-06-27,MacBook Air,g770,1199.99,mobile_app,affiliate,desktop,Glasgow,2025-06-21,2025-06-27
ce67b962,f9ad97ae-0ea7-41,2025-02-04,2025-02-05,AirPods,d633,159.99,website,search,unknown,Glasgow,2025-02-04,2025-02-05
d5de293b,dedbcef9-74f8-49,2025-02-06,02-09-2025,Google Pixel 8,i920,699.99,mobile_app,search,desktop,Liverpool,2025-02-06,2025-02-09
d5de293b,dedbcef9-74f8-49,2025-02-06,2025-02-12,Google Pixel 8,i920,699.99,website,search,mobile,,2025-02-06,2025-02-12
87d75309,0692fe02-238c-47,24-02-2025,2025-03-02,AirPods,d633,159.99,website,affiliate,mobile,London,2025-02-24,2025-03-02
73b0e73d,c05e5ade-b303-41,2025-03-05,2025-03-08,MacBook Air,g770,1199.99,website,email,desktop,Manchester,2025-03-05,2025-03-08
a904babd,deaeb0c0-a8ac-4a,2025-05-12,2025-05-14,Xbox Series X,b104,499.99,mobile_app,affiliate,desktop,Liverpool,2025-05-12,2025-05-14
527a9f7b,a358c4d3-fc76-42,2025-03-19,2025-03-20,Smartwatch,h301,249.99,website,email,desktop,Manchester,2025-03-19,2025-03-20
bc5e3e2f,df996726-5c36-4f,2025-02-05,2025-02-10,MacBook Air,g770,1199.99,website,search,mobile,Glasgow,2025-02-05,2025-02-10
bd3c83c3,3bca7ff6-71be-4c,2025-04-11,2025-04-14,Xbox Series X,b104,499.99,website,,desktop,Glasgow,2025-04-11,2025-04-14
f104ad27,592c6a0e-14d4-4d,2025-03-07,2025-03-12,Smartwatch,h301,249.99,website,email,mobile,Birmingham,2025-03-07,2025-03-12
19b7775f,a888e7af-fca3-4b,2025-05-12,2025-05-15,Smartwatch,h301,249.99,website,affiliate,desktop,,2025-05-12,2025-05-15
deaf0fa9,9b6fbe20-4b3a-4a,25-04-2025,2025-04-27,Nintendo Switch,e682,299.99,mobile_app,affiliate,unknown,London,2025-04-25,2025-04-27
08207d4e,c8ecb641-9267-4e,2025-05-22,2025-05-23,Smartwatch,h301,249.99,mobile_app,social,unknown,Liverpool,2025-05-22,2025-05-23
ff0dd3c2,164b85f0-cbfc-42,05-04-2025,2025-04-09,Xbox Series X,b104,499.99,mobile_app,search,desktop,Bristol,2025-04-05,2025-04-09
f47e3ca0,77806788-dff1-45,2025-04-09,04-13-2025,PS5,a245,479.99,website,search,mobile,Glasgow,2025-04-09,2025-04-13
f47e3ca0,77806788-dff1-45,2025-04-09,2025-04-11,iPhone 15,f521,899.99,mobile_app,social,desktop,London,2025-04-09,2025-04-11
2ba17f78,8a693650-a9a2-49,15-04-2025,2025-04-17,Steam Deck,c912,499.99,website,search,desktop,Liverpool,2025-04-15,2025-04-17
fe4cefed,b32d3c81-a8e5-4e,2025-05-18,2025-05-22,Steam Deck,c912,499.99,website,affiliate,unknown,Manchester,2025-05-18,2025-05-22
622c636f,edd32be9-2905-4d,2025-03-09,2025-03-10,Steam Deck,c912,499.99,website,affiliate,desktop,Manchester,2025-03-09,2025-03-10
f395c213,b81bda1d-386a-40,2025-04-05,2025-04-07,Smartwatch,h301,249.99,mobile_app,affiliate,mobile,London,2025-04-05,2025-04-07
f395c213,b81bda1d-386a-40,2025-04-05,04-10-2025,iPhone 15,f521,899.99,website,email,desktop,London,2025-04-05,2025-04-10
a23036d2,aa5ca8cd-1f83-4b,2025-02-11,2025-02-15,Kindle Paperwhite,j877,129.99,mobile_app,affiliate,unknown,London,2025-02-11,2025-02-15
394b5d35,cba88a28-1727-40,2025-01-24,2025-01-25,PS5,a245,479.99,mobile_app,search,desktop,Glasgow,2025-01-24,2025-01-25
57dda51e,ec814510-c42e-4f,2025-06-10,2025-06-16,Smartwatch,h301,249.99,mobile_app,direct,mobile,London,2025-06-10,2025-06-16
a7674726,be332380-b7aa-43,2025-03-18,03-21-2025,AirPods,d633,159.99,mobile_app,direct,unknown,Liverpool,2025-03-18,2025-03-21
a7674726,be332380-b7aa-43,2025-03-18,2025-03-21,AirPods,d633,159.99,website,affiliate,mobile,Manchester,2025-03-18,2025-03-21
a7674726,be332380-b7aa-43,2025-03-18,2025-03-24,MacBook Air,g770,1199.99,mobile_app,email,desktop,Sheffield,2025-03-18,2025-03-24
3bbdf80c,f75c0751-8fd8-4c,2025-04-14,2025-04-16,Steam Deck,c912,499.99,website,email,unknown,Manchester,2025-04-14,2025-04-16
3bbdf80c,f75c0751-8fd8-4c,2025-04-14,2025-04-16,Google Pixel 8,i920,699.99,website,email,unknown,London,2025-04-14,2025-04-16
5719d3e4,4a7d6fa1-1d9d-4b,2025-03-06,2025-03-07,Xbox Series X,b104,499.99,website,social,unknown,Manchester,2025-03-06,2025-03-07
92a593c8,302b0401-efed-49,2025-04-03,2025-04-04,Smartwatch,h301,249.99,website,social,desktop,Manchester,2025-04-03,2025-04-04
bca6a6b0,50392a8c-da73-4a,2025-02-11,2025-02-14,AirPods,d633,159.99,mobile_app,email,desktop,Sheffield,2025-02-11,2025-02-14
bca6a6b0,50392a8c-da73-4a,2025-02-11,2025-02-14,Nintendo Switch,e682,299.99,mobile_app,social,desktop,Glasgow,2025-02-11,2025-02-14
635d8150,970e287a-0fd7-40,2025-05-27,2025-05-31,MacBook Air,g770,1199.99,mobile_app,affiliate,desktop,Leeds,2025-05-27,2025-05-31
ef15b821,c572aa5b-51d4-4f,2025-04-07,04-11-2025,Steam Deck,c912,499.99,website,social,unknown,Birmingham,2025-04-07,2025-04-11
1b493710,a9eb0bf9-850e-4d,2025-02-20,02-26-2025,Nintendo Switch,e682,299.99,mobile_app,affiliate,unknown,London,2025-02-20,2025-02-26
d0ef1299,da3465d9-89cd-40,2025-05-23,2025-05-24,iPhone 15,f521,899.99,mobile_app,email,unknown,Leeds,2025-05-23,2025-05-24
25bdab14,380a1bb7-d653-44,2025-06-24,2025-06-25,Steam Deck,c912,499.99,mobile_app,search,mobile,London,2025-06-24,2025-06-25
d3e78237,bf3f51d5-2557-48,16-01-2025,2025-01-22,MacBook Air,g770,1199.99,website,affiliate,unknown,Bristol,2025-01-16,2025-01-22
d3e78237,bf3f51d5-2557-48,2025-01-16,2025-01-22,MacBook Air,g770,1199.99,mobile_app,search,mobile,London,2025-01-16,2025-01-22
b04816fd,51f4a724-9950-48,2025-01-01,2025-01-06,MacBook Air,g770,1199.99,mobile_app,direct,mobile,Glasgow,2025-01-01,2025-01-06
a18e4440,d900da4b-ff31-48,2025-03-13,2025-03-19,Smartwatch,13h0,249.99,website,direct,desktop,Manchester,2025-03-13,2025-03-19
a18e4440,d900da4b-ff31-48,2025-03-13,03-19-2025,AirPods,d633,159.99,mobile_app,affiliate,desktop,London,2025-03-13,2025-03-19
0f0e5767,4a9f6c5c-7eb9-4e,22-04-2025,2025-04-25,Google Pixel 8,i920,699.99,mobile_app,search,mobile,Manchester,2025-04-22,2025-04-25
d91b1cb6,27177e59-5548-46,2025-02-01,2025-02-06,Nintendo Switch,e682,299.99,mobile_app,email,mobile,Manchester,2025-02-01,2025-02-06
d91b1cb6,27177e59-5548-46,2025-02-01,2025-02-04,Accessory,m001,24.99,website,affiliate,mobile,Glasgow,2025-02-01,2025-02-04
ec5412b4,399e4d08-cf77-48,04-01-2025,2025-01-10,Kindle Paperwhite,j877,129.99,mobile_app,email,desktop,Leeds,2025-01-04,2025-01-10
4c91ef0e,db55daf5-2dd4-45,2025-03-06,03-10-2025,Smartwatch,h301,249.99,website,social,desktop,London,2025-03-06,2025-03-10
05855672,e9917f60-a8c4-40,2025-03-06,2025-03-07,Smartwatch,h301,249.99,mobile_app,social,unknown,Bristol,2025-03-06,2025-03-07
592aa87b,6c24dcaa-5660-42,2025-04-22,2025-04-24,Google Pixel 8,i920,699.99,mobile_app,affiliate,unknown,Bristol,2025-04-22,2025-04-24
4849032c,126301a0-641c-46,2025-03-12,2025-03-15,PS5,a245,479.99,mobile_app,affiliate,mobile,Nottingham,2025-03-12,2025-03-15
18e9ef77,b37bdb99-31f1-4f,2025-05-19,2025-05-22,Xbox Series X,b104,499.99,mobile_app,email,mobile,London,2025-05-19,2025-05-22
18e9ef77,b37bdb99-31f1-4f,2025-05-19,2025-05-21,Xbox Series X,b104,499.99,website,direct,unknown,Sheffield,2025-05-19,2025-05-21
18e9ef77,b37bdb99-31f1-4f,2025-05-19,2025-05-20,Accessory,m001,24.99,website,affiliate,,,2025-05-19,2025-05-20
0ddb0654,ca9128fb-c094-49,2025-01-03,2025-01-05,Nintendo Switch,e682,299.99,mobile_app,search,mobile,Liverpool,2025-01-03,2025-01-05
93c09687,4dd7cb5c-b5a7-47,2025-05-07,2025-05-12,Nintendo Switch,e682,299.99,website,affiliate,unknown,Manchester,2025-05-07,2025-05-12
93c09687,4dd7cb5c-b5a7-47,2025-05-07,2025-05-10,AirPods,d633,159.99,website,email,unknown,Manchester,2025-05-07,2025-05-10
35b33f54,7b814ce1-b22a-44,2025-03-20,2025-03-25,Nintendo Switch,e682,299.99,website,email,desktop,Leicester,2025-03-20,2025-03-25
35b33f54,7b814ce1-b22a-44,2025-03-20,2025-03-25,PS5,a245,479.99,mobile_app,affiliate,unknown,Bristol,2025-03-20,2025-03-25
5cbad410,32167340-bf95-4f,2025-01-26,2025-01-28,PS5,a245,479.99,website,email,unknown,Sheffield,2025-01-26,2025-01-28
dbc21e42,1a1940e4-935f-46,2025-01-21,2025-01-27,iPhone 15,f521,899.99,mobile_app,affiliate,unknown,Manchester,2025-01-21,2025-01-27
2b10a823,fb924354-f34d-4b,2025-04-17,2025-04-20,MacBook Air,g770,1199.99,website,affiliate,mobile,Bristol,2025-04-17,2025-04-20
2b10a823,fb924354-f34d-4b,2025-04-17,2025-04-20,Kindle Paperwhite,j877,129.99,mobile_app,social,unknown,Leeds,2025-04-17,2025-04-20
f1efa963,5b078b11-1896-45,2025-04-05,04-09-2025,iPhone 15,f521,899.99,mobile_app,search,desktop,Manchester,2025-04-05,2025-04-09
6f0eebef,83f38f4e-faf3-4a,2025-02-20,2025-02-23,Xbox Series X,b104,499.99,website,email,desktop,Glasgow,2025-02-20,2025-02-23
1e69d7ef,b8f91075-a081-45,2025-05-22,2025-05-23,Kindle Paperwhite,j877,129.99,website,search,desktop,Birmingham,2025-05-22,2025-05-23
2c281bbd,4d7d10f3-7d16-46,2025-04-21,2025-04-26,iPhone 15,f521,899.99,mobile_app,direct,mobile,,2025-04-21,2025-04-26
abb558e1,c69e17c9-6018-4b,2025-01-02,2025-01-03,Kindle Paperwhite,j877,129.99,website,social,unknown,Glasgow,2025-01-02,2025-01-03
61d15db2,76b35303-c719-4d,2025-03-18,2025-03-19,PS5,a245,479.99,website,search,unknown,Manchester,2025-03-18,2025-03-19
1ddb4f15,71f34593-a737-41,17-04-2025,2025-04-23,Kindle Paperwhite,j877,129.99,mobile_app,,unknown,Bristol,2025-04-17,2025-04-23
399557cb,a43366c9-7d3d-4b,2025-03-16,2025-03-21,PS5,a245,479.99,website,search,mobile,Liverpool,2025-03-16,2025-03-21
b198047f,fcc2ed18-92ae-41,2025-04-02,2025-04-07,Accessory,m001,24.99,mobile_app,email,mobile,Liverpool,2025-04-02,2025-04-07
fffcff63,97c6eb3c-cb5a-4c,2025-04-03,2025-04-08,Steam Deck,c912,499.99,mobile_app,direct,mobile,Glasgow,2025-04-03,2025-04-08
534234cf,4c618a43-6f04-4c,2025-03-06,2025-03-09,Steam Deck,c912,499.99,website,social,mobile,Glasgow,2025-03-06,2025-03-09
67c3bd9e,dcb9d394-e8ac-44,2025-05-10,2025-05-16,PS5,a245,479.99,website,social,unknown,Manchester,2025-05-10,2025-05-16
c891c9c6,64cfd9b9-050e-49,2025-04-09,2025-04-12,MacBook Air,g770,1199.99,website,email,unknown,Manchester,2025-04-09,2025-04-12
89fab5cc,105dd35c-7d12-4b,2025-05-08,2025-05-09,Google Pixel 8,i920,699.99,mobile_app,social,unknown,Liverpool,2025-05-08,2025-05-09
351c586a,a6d5dac6-ca41-40,2025-04-19,2025-04-23,Steam Deck,c912,499.99,mobile_app,direct,unknown,,2025-04-19,2025-04-23
b1f9ab31,1e0914d2-e5c9-43,2025-05-14,2025-05-19,Xbox Series X,b104,499.99,website,social,unknown,Leeds,2025-05-14,2025-05-19
0a054950,727dda84-8e02-4e,2025-05-27,2025-06-02,Kindle Paperwhite,j877,129.99,website,search,mobile,Nottingham,2025-05-27,2025-06-02
41bb0e0d,a71372ab-34cb-4b,2025-02-18,2025-02-21,AirPods,d633,159.99,mobile_app,affiliate,desktop,Bristol,2025-02-18,2025-02-21
41bb0e0d,a71372ab-34cb-4b,2025-02-18,2025-02-22,MacBook Air,g770,1199.99,website,search,mobile,Manchester,2025-02-18,2025-02-22
41bb0e0d,a71372ab-34cb-4b,2025-02-18,2025-02-20,Accessory,m001,24.99,website,social,desktop,Birmingham,2025-02-18,2025-02-20
4c6f9a45,15a905b4-08f6-4b,2025-03-01,2025-03-02,Xbox Series X,b104,499.99,mobile_app,email,unknown,Liverpool,2025-03-01,2025-03-02
4c6f9a45,15a905b4-08f6-4b,2025-03-01,2025-03-07,Smartwatch,h301,249.99,website,direct,desktop,Manchester,2025-03-01,2025-03-07
a87d21ff,2bee2fff-8b5f-43,2025-02-12,2025-02-13,MacBook Air,g770,1199.99,website,affiliate,desktop,Birmingham,2025-02-12,2025-02-13
e79524eb,0bd18d4a-4cf4-4e,2025-03-08,2025-03-13,Google Pixel 8,i920,699.99,mobile_app,social,mobile,Manchester,2025-03-08,2025-03-13
e79524eb,0bd18d4a-4cf4-4e,2025-03-08,2025-03-12,Xbox Series X,b104,499.99,website,email,desktop,Glasgow,2025-03-08,2025-03-12
7d8da92b,88baef4a-a8be-4d,2025-04-20,04-23-2025,iPhone 15,f521,899.99,website,affiliate,desktop,London,2025-04-20,2025-04-23
9b2e18c0,e92915a3-85cd-44,2025-06-24,2025-06-28,iPhone 15,f521,899.99,mobile_app,social,unknown,Manchester,2025-06-24,2025-06-28
0b73ca1c,b01c337e-35b8-4a,2025-03-17,2025-03-20,MacBook Air,g770,1199.99,mobile_app,direct,unknown,Manchester,2025-03-17,2025-03-20
371831f3,24444f64-3025-48,2025-02-01,2025-02-07,Xbox Series X,b104,499.99,website,direct,desktop,Birmingham,2025-02-01,2025-02-07
470367f7,8d548038-9a26-42,2025-05-22,2025-05-27,Kindle Paperwhite,j877,129.99,mobile_app,social,mobile,Glasgow,2025-05-22,2025-05-27
42bb8f63,6c092d0a-9f4f-43,2025-04-10,2025-04-14,iPhone 15,f521,899.99,website,search,unknown,Glasgow,2025-04-10,2025-04-14
f1da833d,29cf4c70-e756-41,2025-02-09,2025-02-12,Kindle Paperwhite,j877,129.99,website,direct,mobile,Birmingham,2025-02-09,2025-02-12
3429ce3b,f0b0e729-6ce3-4d,2025-03-19,2025-03-22,Smartwatch,h301,249.99,website,search,unknown,,2025-03-19,2025-03-22
3429ce3b,f0b0e729-6ce3-4d,2025-03-19,2025-03-24,Google Pixel 8,i920,699.99,mobile_app,email,mobile,Birmingham,2025-03-19,2025-03-24
a54427ec,44f760a8-bb90-45,2025-05-22,2025-05-25,MacBook Air,g770,1199.99,website,direct,desktop,London,2025-05-22,2025-05-25
82ece8aa,904ada37-5f44-47,2025-04-26,2025-04-30,Steam Deck,c912,499.99,mobile_app,search,unknown,Glasgow,2025-04-26,2025-04-30
c9ac376c,d2524487-6b70-42,2025-01-01,2025-01-02,iPhone 15,f521,899.99,mobile_app,email,desktop,Manchester,2025-01-01,2025-01-02
c9ac376c,d2524487-6b70-42,2025-01-01,01-04-2025,PS5,a245,479.99,mobile_app,social,mobile,Leeds,2025-01-01,2025-01-04
4526ed62,f6c9dd38-06a2-47,2025-03-11,2025-03-13,Steam Deck,c912,499.99,mobile_app,email,unknown,,2025-03-11,2025-03-13
4526ed62,f6c9dd38-06a2-47,11-03-2025,2025-03-13,PS5,a245,479.99,mobile_app,direct,desktop,Glasgow,2025-03-11,2025-03-13
5450c61f,af194390-1c28-40,2025-04-02,2025-04-07,Steam Deck,c912,499.99,website,,unknown,Glasgow,2025-04-02,2025-04-07
2575dbd1,e8c44e4c-5ce1-4c,2025-02-22,2025-02-27,Nintendo Switch,e682,299.99,website,affiliate,mobile,Nottingham,2025-02-22,2025-02-27
fabf8aef,460db751-39cb-44,2025-03-19,2025-03-22,Nintendo Switch,e682,299.99,website,email,unknown,Birmingham,2025-03-19,2025-03-22
1f9deccd,f3a80aa0-60ee-4c,2025-05-22,05-28-2025,MacBook Air,g770,1199.99,mobile_app,search,desktop,Glasgow,2025-05-22,2025-05-28
ce8a5306,e0218caf-ba73-4a,11-04-2025,2025-04-14,Smartwatch,h301,249.99,website,affiliate,mobile,Leicester,2025-04-11,2025-04-14
4830effe,59518620-8769-4e,2025-03-13,2025-03-17,MacBook Air,g770,1199.99,mobile_app,affiliate,desktop,Manchester,2025-03-13,2025-03-17
51683612,195c663b-9b82-44,02-01-2025,2025-01-08,AirPods,d633,159.99,website,email,desktop,Leeds,2025-01-02,2025-01-08
51683612,195c663b-9b82-44,2025-01-02,2025-01-08,Steam Deck,c912,499.99,website,email,desktop,Glasgow,2025-01-02,2025-01-08
ad851456,2e408d57-63ba-4c,2025-03-22,2025-03-25,Google Pixel 8,i920,699.99,mobile_app,social,unknown,Manchester,2025-03-22,2025-03-25
ad851456,2e408d57-63ba-4c,2025-03-22,2025-03-28,Google Pixel 8,i920,699.99,website,email,desktop,London,2025-03-22,2025-03-28
ad851456,2e408d57-63ba-4c,22-03-2025,2025-03-23,MacBook Air,g770,1199.99,mobile_app,direct,,Nottingham,2025-03-22,2025-03-23
6714272a,8d3a5b2d-881c-42,2025-03-10,2025-03-16,Accessory,m001,24.99,website,affiliate,desktop,London,2025-03-10,2025-03-16
b695c2bf,4251d2f0-20a8-42,2025-01-17,2025-01-22,Xbox Series X,b104,499.99,mobile_app,,unknown,Birmingham,2025-01-17,2025-01-22
44725ab7,248607c2-2059-4d,2025-03-27,2025-03-30,Steam Deck,c912,499.99,mobile_app,direct,mobile,London,2025-03-27,2025-03-30
c70c15e3,a3a22f35-b9b5-43,2025-04-04,2025-04-10,Xbox Series X,b104,499.99,mobile_app,email,desktop,Manchester,2025-04-04,2025-04-10
705faecd,6b1205aa-9bd3-45,20-05-2025,2025-05-26,Steam Deck,c912,499.99,website,search,unknown,Glasgow,2025-05-20,2025-05-26
705faecd,6b1205aa-9bd3-45,2025-05-20,2025-05-21,Steam Deck,c912,499.99,mobile_app,affiliate,mobile,Liverpool,2025-05-20,2025-05-21
f3dea9dc,77fa7bbc-cc68-45,2025-04-27,2025-05-02,Google Pixel 8,i920,699.99,website,direct,desktop,Nottingham,2025-04-27,2025-05-02
3a9048cc,b7ed70cf-f111-4e,2025-03-09,2025-03-15,MacBook Air,g770,1199.99,mobile_app,search,mobile,Sheffield,2025-03-09,2025-03-15
c544a049,1641d960-dba0-4d,2025-01-19,2025-01-24,Accessory,m001,24.99,website,email,mobile,Manchester,2025-01-19,2025-01-24
3d730c3b,a27a2bda-1713-44,2025-04-18,2025-04-24,Google Pixel 8,i920,699.99,website,email,desktop,Manchester,2025-04-18,2025-04-24
3d730c3b,a27a2bda-1713-44,2025-04-18,2025-04-24,AirPods,d633,159.99,mobile_app,social,unknown,Manchester,2025-04-18,2025-04-24
3d730c3b,a27a2bda-1713-44,2025-04-18,2025-04-23,MacBook Air,g770,1199.99,mobile_app,search,mobile,Birmingham,2025-04-18,2025-04-23
492d85a7,9347f486-2a44-4a,2025-06-01,2025-06-02,AirPods,d633,159.99,website,affiliate,mobile,Birmingham,2025-06-01,2025-06-02
492d85a7,9347f486-2a44-4a,2025-06-01,2025-06-05,MacBook Air,g770,1199.99,mobile_app,direct,unknown,Manchester,2025-06-01,2025-06-05
f2ca2002,ceefd2c9-7e2b-43,2025-01-25,2025-01-26,MacBook Air,g770,1199.99,website,social,mobile,Manchester,2025-01-25,2025-01-26
7f702973,eeb47b07-8239-41,12-03-2025,2025-03-13,Accessory,m001,24.99,mobile_app,social,unknown,Manchester,2025-03-12,2025-03-13
1febc9af,ad411244-ff79-40,2025-06-26,2025-06-30,Xbox Series X,b104,499.99,mobile_app,search,mobile,London,2025-06-26,2025-06-30
01ddc628,30afe613-9dc4-45,2025-02-18,2025-02-20,Accessory,m001,24.99,website,email,mobile,London,2025-02-18,2025-02-20
fe85544c,88c982ec-b3dd-4c,2025-03-16,2025-03-18,Google Pixel 8,i920,699.99,mobile_app,affiliate,unknown,Leeds,2025-03-16,2025-03-18
f1e7ada0,eba332b1-f36c-4c,2025-04-16,2025-04-19,iPhone 15,f521,899.99,mobile_app,social,mobile,Manchester,2025-04-16,2025-04-19
2b24ef63,0ad7d77c-9bf4-4c,2025-03-18,2025-03-22,Smartwatch,h301,249.99,mobile_app,email,desktop,Manchester,2025-03-18,2025-03-22
2cc09f87,c3828725-e1c6-43,2025-05-17,2025-05-21,AirPods,d633,159.99,website,email,unknown,Manchester,2025-05-17,2025-05-21
0d08367e,22212e52-d6e3-41,2025-03-10,2025-03-13,Nintendo Switch,e682,299.99,mobile_app,social,desktop,Leeds,2025-03-10,2025-03-13
56847457,2ba4d656-610c-4a,2025-06-12,2025-06-14,Kindle Paperwhite,j877,129.99,website,affiliate,unknown,London,2025-06-12,2025-06-14
56847457,2ba4d656-610c-4a,12-06-2025,2025-06-15,Kindle Paperwhite,j877,129.99,website,search,unknown,Glasgow,2025-06-12,2025-06-15
56847457,2ba4d656-610c-4a,2025-06-12,2025-06-18,Nintendo Switch,e682,299.99,website,social,desktop,Glasgow,2025-06-12,2025-06-18
db992f51,d4ec0595-3ff0-4d,2025-03-10,2025-03-13,iPhone 15,f521,899.99,website,,unknown,Bristol,2025-03-10,2025-03-13
00926d61,7bae0f3b-4c96-4d,2025-02-13,2025-02-16,Steam Deck,c912,499.99,website,direct,unknown,Bristol,2025-02-13,2025-02-16
00926d61,7bae0f3b-4c96-4d,2025-02-13,02-19-2025,MacBook Air,g770,1199.99,website,email,desktop,London,2025-02-13,2025-02-19
edda1677,64c46086-919f-40,2025-03-27,2025-03-30,iPhone 15,f521,899.99,mobile_app,direct,unknown,Leeds,2025-03-27,2025-03-30
ef775124,83f9b580-a499-4b,2025-01-24,2025-01-25,Steam Deck,c912,499.99,website,affiliate,unknown,London,2025-01-24,2025-01-25
0182144d,d92d9519-9e24-47,2025-04-21,2025-04-26,PS5,a245,479.99,mobile_app,social,desktop,Birmingham,2025-04-21,2025-04-26
0182144d,d92d9519-9e24-47,2025-04-21,2025-04-24,Xbox Series X,b104,499.99,mobile_app,affiliate,desktop,Leeds,2025-04-21,2025-04-24
59875c7d,4c60b543-541b-48,2025-02-17,2025-02-23,Accessory,m001,24.99,website,affiliate,mobile,London,2025-02-17,2025-02-23
6e4928ac,66edef30-2fa8-48,2025-04-22,2025-04-26,PS5,a245,479.99,mobile_app,direct,unknown,Birmingham,2025-04-22,2025-04-26
6924e248,8772df4a-15b1-44,2025-04-03,2025-04-04,AirPods,d633,159.99,website,affiliate,unknown,Bristol,2025-04-03,2025-04-04
4008d4da,01c4e229-7cc7-4b,2025-06-18,2025-06-19,MacBook Air,g770,1199.99,website,search,unknown,Manchester,2025-06-18,2025-06-19
4008d4da,01c4e229-7cc7-4b,18-06-2025,2025-06-19,Xbox Series X,b104,499.99,mobile_app,direct,unknown,Manchester,2025-06-18,2025-06-19
e466c937,5fd2bec3-6536-4c,2025-01-17,2025-01-20,AirPods,d633,159.99,mobile_app,search,,Leicester,2025-01-17,2025-01-20
e466c937,5fd2bec3-6536-4c,2025-01-17,2025-01-20,Nintendo Switch,e682,299.99,mobile_app,social,desktop,Glasgow,2025-01-17,2025-01-20
e466c937,5fd2bec3-6536-4c,2025-01-17,2025-01-20,PS5,a245,479.99,mobile_app,social,mobile,Leeds,2025-01-17,2025-01-20
a801f15e,44fcc054-cfc1-46,2025-02-26,2025-02-27,MacBook Air,g770,1199.99,website,social,unknown,Bristol,2025-02-26,2025-02-27
017cc74e,23cecf1e-296d-49,2025-03-10,03-14-2025,AirPods,d633,159.99,mobile_app,search,unknown,Birmingham,2025-03-10,2025-03-14
48ef30ff,b58f67b6-deda-42,2025-04-07,2025-04-11,Steam Deck,c912,499.99,website,social,unknown,Manchester,2025-04-07,2025-04-11
08175dd0,6bca4f86-6500-47,2025-04-10,2025-04-13,MacBook Air,g770,1199.99,website,social,desktop,Bristol,2025-04-10,2025-04-13
08175dd0,6bca4f86-6500-47,2025-04-10,2025-04-11,Kindle Paperwhite,j877,129.99,mobile_app,direct,mobile,Glasgow,2025-04-10,2025-04-11
fba13732,f2c8c25e-32f1-42,2025-01-17,2025-01-21,iPhone 15,f521,899.99,website,email,mobile,London,2025-01-17,2025-01-21
ae864837,7d338ca2-6bcc-47,2025-03-09,2025-03-15,Xbox Series X,b104,499.99,website,affiliate,unknown,,2025-03-09,2025-03-15
665e467f,c0476d80-532b-47,2025-05-19,2025-05-21,Xbox Series X,b104,499.99,mobile_app,search,desktop,Liverpool,2025-05-19,2025-05-21
21a496a8,bdecb67a-ec6e-42,2025-01-13,2025-01-15,PS5,a245,479.99,mobile_app,search,mobile,Bristol,2025-01-13,2025-01-15
581848c5,caef3c9e-1b9d-4f,2025-03-04,03-10-2025,Google Pixel 8,i920,699.99,website,affiliate,mobile,Manchester,2025-03-04,2025-03-10
d4701dd2,af374e8c-c473-47,2025-05-12,2025-05-16,AirPods,d633,159.99,mobile_app,email,desktop,Liverpool,2025-05-12,2025-05-16
7aededf4,98daae8c-f9f7-40,2025-04-18,2025-04-21,Nintendo Switch,e682,299.99,mobile_app,affiliate,mobile,Liverpool,2025-04-18,2025-04-21
7aededf4,98daae8c-f9f7-40,2025-04-18,2025-04-23,Steam Deck,c912,499.99,mobile_app,search,mobile,Leeds,2025-04-18,2025-04-23
7aededf4,98daae8c-f9f7-40,18-04-2025,2025-04-24,iPhone 15,f521,899.99,website,email,mobile,Manchester,2025-04-18,2025-04-24
9e1be56d,15263fef-7c65-4b,2025-02-12,2025-02-17,Smartwatch,h301,249.99,website,,mobile,Glasgow,2025-02-12,2025-02-17
1d71f339,2fd6129a-82e0-4d,2025-06-16,2025-06-20,PS5,a245,479.99,website,affiliate,desktop,London,2025-06-16,2025-06-20
1d71f339,2fd6129a-82e0-4d,2025-06-16,2025-06-22,Google Pixel 8,i920,699.99,website,direct,desktop,Glasgow,2025-06-16,2025-06-22
6ddd5c02,b371d64d-fe87-41,2025-03-13,2025-03-14,Smartwatch,h301,249.99,website,social,mobile,Liverpool,2025-03-13,2025-03-14
baff361a,c86022c4-b4da-4f,2025-06-03,2025-06-09,Xbox Series X,b104,499.99,mobile_app,direct,unknown,Liverpool,2025-06-03,2025-06-09
baff361a,c86022c4-b4da-4f,2025-06-03,2025-06-07,Google Pixel 8,i920,699.99,mobile_app,affiliate,,Birmingham,2025-06-03,2025-06-07
a1001bc8,304c9c7b-2e62-4a,2025-04-07,2025-04-11,PS5,a245,479.99,mobile_app,email,unknown,Manchester,2025-04-07,2025-04-11
a1001bc8,304c9c7b-2e62-4a,2025-04-07,2025-04-12,iPhone 15,f521,899.99,mobile_app,search,unknown,London,2025-04-07,2025-04-12
461bcbc3,1ed68b71-3ab8-4c,2025-04-21,2025-04-23,Xbox Series X,b104,499.99,mobile_app,search,unknown,Liverpool,2025-04-21,2025-04-23
331bd602,256df639-edd9-43,2025-06-04,2025-06-09,Steam Deck,c912,499.99,mobile_app,search,unknown,Bristol,2025-06-04,2025-06-09
b33d9c7c,615eca80-0d0b-49,2025-02-05,2025-02-09,AirPods,d633,159.99,mobile_app,direct,mobile,Leeds,2025-02-05,2025-02-09
0fb49d98,38c6430f-3b3e-47,2025-05-04,2025-05-06,Xbox Series X,b104,499.99,mobile_app,affiliate,mobile,Sheffield,2025-05-04,2025-05-06
5d13539c,0d394b57-a4d4-4f,2025-04-25,04-27-2025,MacBook Air,g770,1199.99,website,social,desktop,Glasgow,2025-04-25,2025-04-27
e525aeaf,b62a7941-59dc-4e,2025-02-16,2025-02-19,Nintendo Switch,e682,299.99,website,direct,unknown,London,2025-02-16,2025-02-19
5256f928,00231f70-0a77-45,2025-05-15,2025-05-20,PS5,a245,479.99,mobile_app,email,desktop,Birmingham,2025-05-15,2025-05-20
5256f928,00231f70-0a77-45,2025-05-15,2025-05-20,Nintendo Switch,e682,299.99,mobile_app,search,desktop,Liverpool,2025-05-15,2025-05-20
5256f928,00231f70-0a77-45,2025-05-15,2025-05-18,PS5,a245,479.99,website,email,unknown,Manchester,2025-05-15,2025-05-18
6e4ff4a4,47b885fa-78d8-4d,20-06-2025,2025-06-22,Nintendo Switch,e682,299.99,mobile_app,email,mobile,Liverpool,2025-06-20,2025-06-22
1c8d23b4,7dc4f12b-f2c5-42,2025-02-06,2025-02-12,Kindle Paperwhite,j877,129.99,mobile_app,email,unknown,London,2025-02-06,2025-02-12
215bdef5,aed690cc-037f-43,27-04-2025,2025-04-30,MacBook Air,g770,1199.99,website,affiliate,unknown,Manchester,2025-04-27,2025-04-30
215bdef5,aed690cc-037f-43,2025-04-27,04-28-2025,Xbox Series X,b104,499.99,website,email,desktop,Leeds,2025-04-27,2025-04-28
96c2e045,cf5e7840-bdc5-41,2025-02-06,2025-02-11,AirPods,d633,159.99,website,direct,unknown,Glasgow,2025-02-06,2025-02-11
959677e9,3cfe18e9-5f20-4c,2025-04-09,04-15-2025,Kindle Paperwhite,j877,129.99,mobile_app,email,unknown,Leeds,2025-04-09,2025-04-15
9a11ddf4,1b3ac54c-e31f-42,2025-01-01,2025-01-06,Kindle Paperwhite,j877,129.99,mobile_app,search,unknown,London,2025-01-01,2025-01-06
d141b9e4,f7e47c8c-9628-44,2025-04-18,2025-04-20,Smartwatch,h301,249.99,website,affiliate,desktop,Glasgow,2025-04-18,2025-04-20
f11afc00,721df83c-b464-49,2025-02-27,2025-02-28,Steam Deck,c912,499.99,website,direct,desktop,Glasgow,2025-02-27,2025-02-28
c2d01c42,4d2d8efd-57c8-49,2025-03-13,2025-03-14,Smartwatch,h301,249.99,mobile_app,affiliate,,Manchester,2025-03-13,2025-03-14
6b0ffa79,27571245-b884-49,2025-05-22,2025-05-27,Xbox Series X,b104,499.99,mobile_app,social,,Nottingham,2025-05-22,2025-05-27
d89939ba,e43f05c8-40a5-42,2025-04-19,2025-04-22,Smartwatch,h301,249.99,mobile_app,search,desktop,Sheffield,2025-04-19,2025-04-22
a13ecf15,58eb3e59-f9a1-4e,2025-06-19,2025-06-24,Steam Deck,c912,499.99,mobile_app,social,mobile,Birmingham,2025-06-19,2025-06-24
a13ecf15,58eb3e59-f9a1-4e,2025-06-19,2025-06-22,Smartwatch,h301,249.99,mobile_app,search,mobile,Leeds,2025-06-19,2025-06-22
861550f6,6fa5f03f-e92d-49,2025-04-27,04-28-2025,Google Pixel 8,i920,699.99,website,direct,unknown,London,2025-04-27,2025-04-28
462e9af3,ca77736e-80fd-46,2025-03-22,2025-03-28,AirPods,d633,159.99,website,social,unknown,Sheffield,2025-03-22,2025-03-28
462e9af3,ca77736e-80fd-46,2025-03-22,2025-03-26,Smartwatch,h301,249.99,mobile_app,affiliate,unknown,Glasgow,2025-03-22,2025-03-26
0f9027d5,4a26eb59-2101-45,2025-04-20,2025-04-26,MacBook Air,g770,1199.99,mobile_app,direct,desktop,Liverpool,2025-04-20,2025-04-26
7eba0464,30b05a0b-b19d-48,2025-01-12,2025-01-16,iPhone 15,f521,899.99,mobile_app,social,desktop,London,2025-01-12,2025-01-16
70100d7e,8373edf3-dec9-44,2025-06-15,2025-06-20,Kindle Paperwhite,j877,129.99,website,social,mobile,Leeds,2025-06-15,2025-06-20
9b72a9fe,8fffe845-6257-4e,2025-06-08,2025-06-14,Xbox Series X,b104,499.99,website,direct,mobile,Glasgow,2025-06-08,2025-06-14
9b72a9fe,8fffe845-6257-4e,2025-06-08,2025-06-13,iPhone 15,f521,899.99,website,,unknown,Leeds,2025-06-08,2025-06-13
9794b389,00ebf725-2f1e-48,2025-04-14,2025-04-17,AirPods,d633,159.99,website,email,mobile,Glasgow,2025-04-14,2025-04-17
80fa3363,edba84d1-e110-4d,2025-03-26,2025-03-27,Google Pixel 8,i920,699.99,mobile_app,affiliate,unknown,London,2025-03-26,2025-03-27
80fa3363,edba84d1-e110-4d,26-03-2025,2025-04-01,AirPods,d633,159.99,mobile_app,social,desktop,Manchester,2025-03-26,2025-04-01
4bde7d88,4242fc5c-866b-42,2025-03-01,2025-03-04,AirPods,d633,159.99,website,search,desktop,Manchester,2025-03-01,2025-03-04
4bde7d88,4242fc5c-866b-42,2025-03-01,2025-03-06,Smartwatch,h301,249.99,mobile_app,social,desktop,Birmingham,2025-03-01,2025-03-06
4bde7d88,4242fc5c-866b-42,01-03-2025,2025-03-07,Smartwatch,h301,249.99,website,affiliate,mobile,Manchester,2025-03-01,2025-03-07
8897c497,1e7d8f7b-8d59-43,2025-04-14,2025-04-19,Nintendo Switch,e682,299.99,website,direct,desktop,Manchester,2025-04-14,2025-04-19
471b0cc7,a3bdd4d6-0a01-48,2025-04-20,2025-04-24,PS5,a245,479.99,website,affiliate,mobile,London,2025-04-20,2025-04-24
fae2d4a8,df96048a-453b-47,2025-02-09,2025-02-15,Accessory,m001,24.99,website,email,desktop,Glasgow,2025-02-09,2025-02-15
a60da1aa,35c0c003-d2cb-43,2025-04-01,2025-04-04,Google Pixel 8,i920,699.99,website,search,unknown,Glasgow,2025-04-01,2025-04-04
f2491816,f8e351ea-9aeb-4c,2025-01-16,2025-01-19,Nintendo Switch,e682,299.99,mobile_app,direct,unknown,London,2025-01-16,2025-01-19
f2491816,f8e351ea-9aeb-4c,2025-01-16,2025-01-21,iPhone 15,f521,899.99,website,social,mobile,Bristol,2025-01-16,2025-01-21
e5f95507,4398018f-8c9d-4a,13-04-2025,2025-04-19,Accessory,m001,24.99,website,affiliate,desktop,Sheffield,2025-04-13,2025-04-19
02aa1c76,fc3a156a-531b-49,2025-04-03,2025-04-05,Google Pixel 8,i920,699.99,mobile_app,affiliate,desktop,Liverpool,2025-04-03,2025-04-05
418860b9,bb0084fa-3822-45,2025-04-13,2025-04-14,Smartwatch,h301,249.99,mobile_app,search,desktop,Bristol,2025-04-13,2025-04-14
f0636972,a845f723-8992-4e,2025-05-27,2025-05-31,Google Pixel 8,i920,699.99,website,affiliate,mobile,Sheffield,2025-05-27,2025-05-31
f216880d,b8fc7513-1b3f-44,2025-03-15,2025-03-20,AirPods,d633,159.99,mobile_app,affiliate,mobile,London,2025-03-15,2025-03-20
34c6d620,a05095fa-deba-42,2025-02-18,2025-02-23,Smartwatch,h301,249.99,website,search,mobile,Manchester,2025-02-18,2025-02-23
a13a9da2,5302e6e2-387b-4c,2025-06-27,2025-06-28,PS5,a245,479.99,website,direct,,Birmingham,2025-06-27,2025-06-28
bad4f3e0,653d171f-c0bd-47,2025-04-23,2025-04-21,PS5,a245,479.99,mobile_app,search,unknown,Manchester,2025-04-23,2025-04-21
7ef74fdb,25f93ab9-5e5f-41,2025-04-09,2025-04-11,Nintendo Switch,e682,299.99,website,,unknown,London,2025-04-09,2025-04-11
91d51b06,d0cb079f-2f5d-4f,2025-01-05,2025-01-09,iPhone 15,f521,899.99,website,direct,mobile,Manchester,2025-01-05,2025-01-09
4f66a914,2e2f2127-babf-43,2025-02-12,2025-02-18,Accessory,m001,24.99,website,direct,mobile,Manchester,2025-02-12,2025-02-18
3016cecc,d147a0bf-2d7f-4e,2025-05-21,2025-05-25,Nintendo Switch,e682,299.99,mobile_app,direct,mobile,Sheffield,2025-05-21,2025-05-25
3016cecc,d147a0bf-2d7f-4e,21-05-2025,2025-05-26,Xbox Series X,b104,499.99,mobile_app,social,desktop,Manchester,2025-05-21,2025-05-26
a52680b3,6d283989-1271-48,2025-06-21,2025-06-24,Steam Deck,c912,499.99,website,direct,mobile,Manchester,2025-06-21,2025-06-24
a52680b3,6d283989-1271-48,2025-06-21,2025-06-27,AirPods,d633,159.99,mobile_app,email,desktop,Manchester,2025-06-21,2025-06-27
a52680b3,6d283989-1271-48,2025-06-21,2025-06-24,Smartwatch,h301,249.99,mobile_app,email,unknown,Liverpool,2025-06-21,2025-06-24
c01d1c62,b96c2da0-19a8-4c,2025-04-16,04-20-2025,Google Pixel 8,i920,699.99,website,affiliate,unknown,Nottingham,2025-04-16,2025-04-20
1c2b498f,1987e6d0-9a71-41,2025-04-17,2025-04-19,MacBook Air,g770,1199.99,website,social,mobile,Glasgow,2025-04-17,2025-04-19
21d67c73,d49cc547-c371-4e,2025-03-21,2025-03-27,Accessory,m001,24.99,mobile_app,direct,mobile,Bristol,2025-03-21,2025-03-27
21d67c73,d49cc547-c371-4e,2025-03-21,2025-03-26,Google Pixel 8,i920,699.99,mobile_app,affiliate,unknown,London,2025-03-21,2025-03-26
9981d28f,44852295-1566-44,2025-01-12,2025-01-15,Steam Deck,c912,499.99,website,social,mobile,Manchester,2025-01-12,2025-01-15
9981d28f,44852295-1566-44,2025-01-12,2025-01-13,Nintendo Switch,e682,299.99,website,social,desktop,Sheffield,2025-01-12,2025-01-13
8ad8c568,0267c983-f763-4b,2025-04-05,04-10-2025,Smartwatch,h301,249.99,mobile_app,,unknown,Manchester,2025-04-05,2025-04-10
8ad8c568,0267c983-f763-4b,2025-04-05,2025-04-11,MacBook Air,g770,1199.99,website,email,unknown,Glasgow,2025-04-05,2025-04-11
23a49571,da4bdf2d-56a0-48,2025-04-07,2025-04-13,PS5,a245,479.99,mobile_app,affiliate,desktop,Glasgow,2025-04-07,2025-04-13
23a49571,da4bdf2d-56a0-48,2025-04-07,04-11-2025,MacBook Air,g770,1199.99,mobile_app,email,unknown,Manchester,2025-04-07,2025-04-11
4eb0c866,e473b0b0-9017-44,2025-05-21,2025-05-23,PS5,a245,479.99,mobile_app,email,desktop,Glasgow,2025-05-21,2025-05-23
447809c0,3e6a41f1-278e-4f,2025-01-17,2025-01-22,Smartwatch,h301,249.99,website,affiliate,mobile,London,2025-01-17,2025-01-22
447809c0,3e6a41f1-278e-4f,2025-01-17,2025-01-21,Kindle Paperwhite,j877,129.99,mobile_app,social,mobile,Glasgow,2025-01-17,2025-01-21
8b6daa25,056de195-1f81-40,2025-02-14,02-17-2025,Steam Deck,c912,499.99,mobile_app,search,mobile,Bristol,2025-02-14,2025-02-17
004f5362,e2eed64b-82f4-41,2025-05-24,2025-05-30,Smartwatch,h301,249.99,mobile_app,email,desktop,Leeds,2025-05-24,2025-05-30
5a7284a2,3a0761d9-0624-4b,2025-05-08,2025-05-13,Steam Deck,c912,499.99,website,social,mobile,London,2025-05-08,2025-05-13
afcfea4d,ebf3ef99-39d3-4f,2025-05-14,2025-05-19,AirPods,d633,159.99,mobile_app,search,desktop,Liverpool,2025-05-14,2025-05-19
fda2f9a0,e6d037c6-d2a2-47,2025-06-13,2025-06-18,Xbox Series X,b104,499.99,website,email,unknown,London,2025-06-13,2025-06-18
1387bcda,f4dafcc8-1a0b-43,2025-02-10,2025-02-12,Google Pixel 8,i920,699.99,website,direct,unknown,Birmingham,2025-02-10,2025-02-12
15b5bc25,5c494d63-1e4c-4f,2025-04-27,2025-04-28,iPhone 15,f521,899.99,website,email,desktop,Manchester,2025-04-27,2025-04-28
55b85720,26aeaf29-9ac0-4e,2025-03-09,2025-03-13,iPhone 15,f521,899.99,mobile_app,direct,mobile,Birmingham,2025-03-09,2025-03-13
afe9c3dc,6cdcd3be-adef-47,2025-04-07,2025-04-13,Nintendo Switch,e682,299.99,website,direct,desktop,Manchester,2025-04-07,2025-04-13
afe9c3dc,6cdcd3be-adef-47,07-04-2025,2025-04-10,AirPods,d633,159.99,website,direct,desktop,Glasgow,2025-04-07,2025-04-10
45665e79,49793220-d14b-47,2025-02-16,2025-02-20,Steam Deck,c912,499.99,website,direct,desktop,London,2025-02-16,2025-02-20
e830257d,5e7e2813-a967-4f,2025-02-14,2025-02-19,Accessory,m001,24.99,mobile_app,affiliate,mobile,Liverpool,2025-02-14,2025-02-19
fa61726a,c9f279a8-138c-43,2025-04-18,2025-04-21,Xbox Series X,b104,499.99,website,social,unknown,Birmingham,2025-04-18,2025-04-21
725aa10d,2586dcd1-a7e6-4e,2025-02-18,2025-02-22,Accessory,m001,24.99,website,social,,Leeds,2025-02-18,2025-02-22
1cf85164,f9f15e65-c919-4c,2025-02-17,2025-02-21,MacBook Air,g770,1199.99,website,affiliate,mobile,Leeds,2025-02-17,2025-02-21
1cf85164,f9f15e65-c919-4c,2025-02-17,2025-02-20,Xbox Series X,b104,499.99,website,social,mobile,Manchester,2025-02-17,2025-02-20
52b3a0d1,ba098484-f5a7-42,2025-05-15,2025-05-21,AirPods,d633,159.99,mobile_app,search,mobile,Birmingham,2025-05-15,2025-05-21
52b3a0d1,ba098484-f5a7-42,15-05-2025,2025-05-16,Google Pixel 8,i920,699.99,mobile_app,social,unknown,Liverpool,2025-05-15,2025-05-16
7e8450d7,c47d336f-2e8f-4f,13-03-2025,2025-03-14,Kindle Paperwhite,j877,129.99,website,search,desktop,Birmingham,2025-03-13,2025-03-14
a2f87dea,f90c9f84-b184-47,2025-04-09,2025-04-12,Steam Deck,c912,499.99,mobile_app,email,unknown,London,2025-04-09,2025-04-12
62186d10,f1abf7a0-cd59-4b,2025-01-21,2025-01-26,Nintendo Switch,e682,299.99,mobile_app,affiliate,unknown,Birmingham,2025-01-21,2025-01-26
894539ec,89eb56c1-7f42-48,2025-02-12,2025-02-14,Steam Deck,c912,499.99,mobile_app,direct,desktop,Glasgow,2025-02-12,2025-02-14
894539ec,89eb56c1-7f42-48,2025-02-12,2025-02-15,Steam Deck,c912,499.99,mobile_app,affiliate,mobile,,2025-02-12,2025-02-15
86e5edf4,1567f88e-6276-4e,2025-04-10,2025-04-16,MacBook Air,g770,1199.99,website,social,desktop,Liverpool,2025-04-10,2025-04-16
165607c0,cfb0d68d-b189-45,2025-06-01,2025-06-04,AirPods,d633,159.99,mobile_app,social,desktop,Glasgow,2025-06-01,2025-06-04
5cc624ef,340a22d7-00bb-45,2025-03-06,03-10-2025,AirPods,d633,159.99,website,direct,mobile,Sheffield,2025-03-06,2025-03-10
5cc624ef,340a22d7-00bb-45,2025-03-06,2025-03-11,Accessory,m001,24.99,website,social,desktop,Manchester,2025-03-06,2025-03-11
e94f03ec,2233212a-f526-4e,2025-02-01,2025-02-07,iPhone 15,f521,899.99,website,social,desktop,Liverpool,2025-02-01,2025-02-07
23ac64e5,d96da200-d947-47,18-06-2025,2025-06-21,Xbox Series X,b104,499.99,website,search,unknown,Manchester,2025-06-18,2025-06-21
ee6c69f7,d5d318cf-24e6-4f,26-03-2025,2025-04-01,MacBook Air,g770,1199.99,mobile_app,affiliate,mobile,London,2025-03-26,2025-04-01
bf3b1681,35f2e254-3e14-4f,2025-04-22,2025-04-28,Accessory,m001,24.99,mobile_app,social,desktop,Bristol,2025-04-22,2025-04-28
bbab3b0e,b21eafab-f649-49,2025-06-03,2025-06-07,AirPods,d633,159.99,mobile_app,affiliate,unknown,Leeds,2025-06-03,2025-06-07
1b2375d0,6cb9b655-f704-4d,2025-04-15,2025-04-20,Smartwatch,h301,249.99,mobile_app,social,unknown,Bristol,2025-04-15,2025-04-20
1b2375d0,6cb9b655-f704-4d,2025-04-15,2025-04-20,iPhone 15,f521,899.99,mobile_app,affiliate,desktop,London,2025-04-15,2025-04-20
287e09f1,7a114e56-12e2-4c,2025-03-04,2025-03-09,MacBook Air,g770,1199.99,mobile_app,affiliate,desktop,Manchester,2025-03-04,2025-03-09
0331bd0d,242ac30f-5d80-45,2025-03-05,2025-03-08,Nintendo Switch,e682,299.99,mobile_app,direct,unknown,Bristol,2025-03-05,2025-03-08
78428071,6a9f687a-d04f-41,2025-03-21,2025-03-27,Kindle Paperwhite,j877,129.99,mobile_app,social,desktop,Manchester,2025-03-21,2025-03-27
785e02ee,8706f724-bf83-42,2025-02-14,2025-02-17,Smartwatch,h301,249.99,website,affiliate,mobile,Manchester,2025-02-14,2025-02-17
0361b157,71a84189-565b-47,2025-04-20,2025-04-23,Smartwatch,h301,249.99,website,search,unknown,Manchester,2025-04-20,2025-04-23
9aab1efb,0f5c365a-27e8-4b,03-05-2025,05-06-2025,iPhone 15,f521,899.99,mobile_app,email,unknown,Nottingham,2025-05-03,2025-05-06
6c726915,290c9e51-80d7-48,2025-05-19,2025-05-20,AirPods,d633,159.99,mobile_app,direct,mobile,Glasgow,2025-05-19,2025-05-20
420fd9a8,744cc6ae-e03f-4f,2025-04-15,2025-04-19,iPhone 15,f521,899.99,website,social,mobile,Birmingham,2025-04-15,2025-04-19
ee7385d8,4e583dde-807a-46,2025-01-26,2025-02-01,AirPods,d633,159.99,website,search,desktop,Manchester,2025-01-26,2025-02-01
f37985df,178926f3-f91e-4b,2025-02-07,2025-02-13,iPhone 15,f521,899.99,website,search,unknown,Manchester,2025-02-07,2025-02-13
646d2e33,6680c5e3-363c-4c,2025-04-17,2025-04-19,MacBook Air,g770,1199.99,website,affiliate,unknown,Glasgow,2025-04-17,2025-04-19
13c3fc1b,f9da4f55-bef9-43,2025-01-13,2025-01-15,PS5,a245,479.99,website,social,mobile,Leicester,2025-01-13,2025-01-15
67b4a019,7a37f3d6-77eb-4d,18-03-2025,2025-03-21,AirPods,d633,159.99,mobile_app,search,desktop,Glasgow,2025-03-18,2025-03-21
67b4a019,7a37f3d6-77eb-4d,2025-03-18,2025-03-23,Google Pixel 8,i920,699.99,mobile_app,affiliate,desktop,London,2025-03-18,2025-03-23
6c99ce56,0dfef633-2a31-4d,2025-02-02,2025-02-05,iPhone 15,f521,899.99,website,direct,unknown,Glasgow,2025-02-02,2025-02-05
c75f41dc,1ab9f662-1bc0-49,2025-05-02,2025-05-03,Accessory,m001,24.99,mobile_app,search,unknown,Manchester,2025-05-02,2025-05-03
1b4142aa,3d51d528-072e-45,2025-04-03,2025-04-06,PS5,a245,479.99,mobile_app,social,mobile,Manchester,2025-04-03,2025-04-06
300ffa68,02cf63a8-98dc-40,2025-03-17,2025-03-19,Nintendo Switch,e682,299.99,mobile_app,affiliate,mobile,Bristol,2025-03-17,2025-03-19
300ffa68,02cf63a8-98dc-40,2025-03-17,2025-03-19,PS5,a245,479.99,mobile_app,email,unknown,,2025-03-17,2025-03-19
15c52392,ede02d33-a36d-45,22-02-2025,2025-02-27,Google Pixel 8,i920,699.99,website,affiliate,,Birmingham,2025-02-22,2025-02-27
7bdac670,0b7ce5c6-9096-46,22-05-2025,2025-05-26,Kindle Paperwhite,j877,129.99,website,social,mobile,Manchester,2025-05-22,2025-05-26
7bdac670,0b7ce5c6-9096-46,2025-05-22,2025-05-25,Xbox Series X,b104,499.99,website,search,mobile,Birmingham,2025-05-22,2025-05-25
fb04c6b1,17dcabf5-5088-45,2025-03-26,04-01-2025,Xbox Series X,b104,499.99,mobile_app,email,desktop,Liverpool,2025-03-26,2025-04-01
fb04c6b1,17dcabf5-5088-45,2025-03-26,2025-03-28,MacBook Air,g770,1199.99,website,social,unknown,Birmingham,2025-03-26,2025-03-28
50814407,f56febb1-484b-42,2025-01-12,2025-01-15,Xbox Series X,b104,499.99,mobile_app,social,unknown,Birmingham,2025-01-12,2025-01-15
50814407,f56febb1-484b-42,2025-01-12,2025-01-15,Accessory,m001,24.99,website,direct,desktop,Bristol,2025-01-12,2025-01-15
acb83fce,5b182716-b9c6-42,2025-03-21,2025-03-27,Nintendo Switch,e682,299.99,mobile_app,direct,desktop,Birmingham,2025-03-21,2025-03-27
808eadf2,e581c1bc-6843-4e,2025-06-12,06-15-2025,Kindle Paperwhite,j877,129.99,mobile_app,search,mobile,Birmingham,2025-06-12,2025-06-15
7a199807,06103d84-2672-42,2025-02-24,2025-03-01,Accessory,m001,24.99,mobile_app,search,mobile,Birmingham,2025-02-24,2025-03-01
aeb00fb9,099396ff-da1e-42,2025-02-10,2025-02-15,Smartwatch,h301,249.99,website,email,mobile,Manchester,2025-02-10,2025-02-15
3b482d28,a03e7003-e29c-48,2025-03-07,2025-03-10,iPhone 15,f521,899.99,mobile_app,direct,mobile,Glasgow,2025-03-07,2025-03-10
b7f330ad,ae742530-ceb6-4f,2025-02-13,2025-02-15,Smartwatch,h301,249.99,website,social,mobile,Glasgow,2025-02-13,2025-02-15
9bd65068,806a29ad-f6b2-47,2025-03-15,2025-03-16,MacBook Air,g770,1199.99,website,social,unknown,Manchester,2025-03-15,2025-03-16
21962a11,c4c557d8-ee23-4e,2025-04-20,2025-04-21,iPhone 15,f521,899.99,website,,mobile,Leeds,2025-04-20,2025-04-21
0a3e4918,9f9bc7bd-5c3d-41,19-06-2025,06-22-2025,AirPods,d633,159.99,mobile_app,social,unknown,Glasgow,2025-06-19,2025-06-22
ff3c03a6,aed0cbcf-c630-45,2025-02-14,2025-02-15,Smartwatch,h301,249.99,website,search,unknown,Liverpool,2025-02-14,2025-02-15
fe914b95,f540838e-1333-46,2025-02-06,2025-02-11,Xbox Series X,b104,499.99,mobile_app,search,mobile,London,2025-02-06,2025-02-11
4f3e2a2c,03d33907-ce02-4d,2025-04-15,2025-04-16,MacBook Air,g770,1199.99,mobile_app,search,unknown,Manchester,2025-04-15,2025-04-16
7fb8b6c6,cc214b4e-f80c-4b,2025-02-20,2025-02-22,Smartwatch,h301,249.99,mobile_app,search,desktop,Manchester,2025-02-20,2025-02-22
7fb8b6c6,cc214b4e-f80c-4b,2025-02-20,2025-02-25,MacBook Air,g770,1199.99,website,affiliate,,Leeds,2025-02-20,2025-02-25
11730df2,2b729d66-504f-4e,2025-02-14,2025-02-16,Steam Deck,c912,499.99,website,search,mobile,Glasgow,2025-02-14,2025-02-16
11730df2,2b729d66-504f-4e,2025-02-14,2025-02-16,Xbox Series X,b104,499.99,mobile_app,search,mobile,Bristol,2025-02-14,2025-02-16
b5ed7ce8,5a765b48-5d03-44,2025-04-22,2025-04-24,iPhone 15,f521,899.99,mobile_app,search,mobile,London,2025-04-22,2025-04-24
b5ed7ce8,5a765b48-5d03-44,2025-04-22,2025-04-25,iPhone 15,f521,899.99,website,email,unknown,Sheffield,2025-04-22,2025-04-25
c35d8f64,fc73e358-4208-4f,09-06-2025,2025-06-14,Google Pixel 8,i920,699.99,mobile_app,direct,mobile,London,2025-06-09,2025-06-14
f8c01007,ec95ccf1-a679-4a,2025-03-20,2025-03-24,Smartwatch,h301,249.99,mobile_app,social,desktop,London,2025-03-20,2025-03-24
f8c01007,ec95ccf1-a679-4a,2025-03-20,2025-03-24,Xbox Series X,b104,499.99,mobile_app,affiliate,unknown,Manchester,2025-03-20,2025-03-24
68b666d6,5d0c8205-0a22-4e,2025-04-27,23-04-2025,iPhone 15,f521,899.99,website,affiliate,mobile,Glasgow,2025-04-27,2025-04-23
8331d711,ae3acdf2-eac9-41,2025-01-26,02-01-2025,Kindle Paperwhite,j877,129.99,mobile_app,social,mobile,Bristol,2025-01-26,2025-02-01
69c718ee,504b10c8-f3b9-47,2025-02-20,2025-02-26,Steam Deck,c912,499.99,website,search,desktop,London,2025-02-20,2025-02-26
0aecc94d,e09dd9e8-4348-48,2025-04-18,2025-04-23,Xbox Series X,b104,499.99,website,search,unknown,Manchester,2025-04-18,2025-04-23
b32281f3,0e9b65bb-a4d4-44,2025-05-08,05-09-2025,MacBook Air,g770,1199.99,mobile_app,search,desktop,London,2025-05-08,2025-05-09
6035d9af,279163f4-0208-4c,2025-04-08,2025-04-13,Xbox Series X,b104,499.99,mobile_app,affiliate,mobile,Liverpool,2025-04-08,2025-04-13
dfc8e060,da948cdf-6637-4d,08-05-2025,2025-05-14,Nintendo Switch,e682,299.99,mobile_app,search,unknown,Manchester,2025-05-08,2025-05-14
88fd5890,5953ff90-17ef-42,2025-04-07,2025-04-09,Steam Deck,c912,499.99,mobile_app,email,unknown,Liverpool,2025-04-07,2025-04-09
1bbcb748,1bef39f1-7700-4b,12-04-2025,04-14-2025,Steam Deck,c912,499.99,mobile_app,direct,mobile,Manchester,2025-04-12,2025-04-14
66ca0baf,659e2deb-ec28-4a,2025-03-16,2025-03-19,Xbox Series X,b104,499.99,website,affiliate,desktop,London,2025-03-16,2025-03-19
66ca0baf,659e2deb-ec28-4a,16-03-2025,2025-03-20,Kindle Paperwhite,j877,129.99,mobile_app,direct,unknown,Manchester,2025-03-16,2025-03-20
366f4268,57a911b3-5139-44,08-02-2025,2025-02-12,Kindle Paperwhite,j877,129.99,website,direct,mobile,Birmingham,2025-02-08,2025-02-12
366f4268,57a911b3-5139-44,2025-02-08,2025-02-14,Google Pixel 8,i920,699.99,website,search,mobile,Manchester,2025-02-08,2025-02-14
366f4268,57a911b3-5139-44,2025-02-08,2025-02-10,Xbox Series X,b104,499.99,mobile_app,affiliate,desktop,London,2025-02-08,2025-02-10
8b8a7166,1d447f41-79e9-44,24-04-2025,2025-04-30,Nintendo Switch,e682,299.99,mobile_app,search,mobile,Manchester,2025-04-24,2025-04-30
9175fc63,2540647b-784f-4b,2025-03-27,2025-03-28,MacBook Air,g770,1199.99,mobile_app,email,unknown,Manchester,2025-03-27,2025-03-28
cefc0e85,c632554b-99e0-45,2025-04-23,2025-04-24,Google Pixel 8,i920,699.99,website,social,mobile,London,2025-04-23,2025-04-24
cefc0e85,c632554b-99e0-45,2025-04-23,2025-04-26,Nintendo Switch,e682,299.99,mobile_app,affiliate,mobile,Leeds,2025-04-23,2025-04-26
362465c1,fa82f65d-6e1b-4b,2025-03-13,03-19-2025,MacBook Air,g770,1199.99,mobile_app,social,desktop,Liverpool,2025-03-13,2025-03-19
362465c1,fa82f65d-6e1b-4b,2025-03-13,2025-03-15,PS5,a245,479.99,mobile_app,search,desktop,Manchester,2025-03-13,2025-03-15
4087be6a,c234af07-f3e0-4b,18-01-2025,2025-01-21,Xbox Series X,b104,499.99,mobile_app,email,desktop,,2025-01-18,2025-01-21
4087be6a,c234af07-f3e0-4b,18-01-2025,2025-01-22,Steam Deck,c912,499.99,website,email,desktop,Glasgow,2025-01-18,2025-01-22
14eae37c,2448ef43-1566-4d,2025-04-10,2025-04-16,iPhone 15,f521,899.99,website,social,unknown,Bristol,2025-04-10,2025-04-16
14eae37c,2448ef43-1566-4d,2025-04-10,2025-04-12,Smartwatch,h301,249.99,mobile_app,email,mobile,London,2025-04-10,2025-04-12
14eae37c,2448ef43-1566-4d,2025-04-10,2025-04-13,Smartwatch,h301,249.99,mobile_app,email,unknown,Manchester,2025-04-10,2025-04-13
36cf9429,73905263-b653-4d,2025-04-14,2025-04-19,AirPods,d633,159.99,website,direct,desktop,Leicester,2025-04-14,2025-04-19
e51bdfff,2f1fc132-426b-42,2025-04-14,2025-04-17,Google Pixel 8,i920,699.99,website,direct,mobile,Glasgow,2025-04-14,2025-04-17
32d7cc22,f69f239b-578e-41,2025-05-08,2025-05-11,Kindle Paperwhite,j877,129.99,mobile_app,email,unknown,Leeds,2025-05-08,2025-05-11
c8aae0c8,7b4bcaf8-6b4a-45,2025-04-21,2025-04-26,Xbox Series X,b104,499.99,mobile_app,social,unknown,London,2025-04-21,2025-04-26
c8aae0c8,7b4bcaf8-6b4a-45,2025-04-21,2025-04-27,Smartwatch,h301,249.99,mobile_app,direct,unknown,Glasgow,2025-04-21,2025-04-27
92004957,6fd1134e-b25a-48,2025-03-03,2025-03-05,Xbox Series X,b104,499.99,mobile_app,social,mobile,Birmingham,2025-03-03,2025-03-05
32d4d3a5,8f97b21d-028a-4f,2025-01-07,2025-01-09,Accessory,m001,24.99,website,direct,unknown,Bristol,2025-01-07,2025-01-09
aa000756,9417e0f5-aaff-46,2025-01-10,2025-01-12,AirPods,d633,159.99,website,email,mobile,Bristol,2025-01-10,2025-01-12
bbae2fbd,bbfecb11-f060-46,2025-05-13,2025-05-19,Google Pixel 8,i920,699.99,mobile_app,social,unknown,London,2025-05-13,2025-05-19
7fdbabc1,e58118d1-2687-44,2025-03-16,2025-03-19,Xbox Series X,b104,499.99,website,search,unknown,London,2025-03-16,2025-03-19
43470982,cac19d2e-1d15-47,2025-01-25,2025-01-30,iPhone 15,f521,899.99,mobile_app,social,mobile,London,2025-01-25,2025-01-30
db75dada,fcfd348c-00f0-47,2025-03-02,2025-03-04,Accessory,m001,24.99,mobile_app,direct,mobile,Manchester,2025-03-02,2025-03-04
09572517,a3900655-7307-43,2025-03-20,2025-03-21,MacBook Air,g770,1199.99,website,email,desktop,Manchester,2025-03-20,2025-03-21
09572517,a3900655-7307-43,2025-03-20,2025-03-22,AirPods,d633,159.99,website,direct,mobile,London,2025-03-20,2025-03-22
c63e0e47,300a491a-faa1-47,2025-01-23,2025-01-29,Kindle Paperwhite,j877,129.99,website,direct,mobile,London,2025-01-23,2025-01-29
30efcbd3,3754c5ec-60a7-4c,2025-03-04,2025-03-08,Smartwatch,h301,249.99,website,search,desktop,Leeds,2025-03-04,2025-03-08
5d21a235,f481b9cb-93ab-4d,2025-04-08,2025-04-11,Steam Deck,c912,499.99,website,social,unknown,Manchester,2025-04-08,2025-04-11
1fef4fb0,4e954929-e58b-4d,2025-03-23,2025-03-26,PS5,a245,479.99,website,email,unknown,Leeds,2025-03-23,2025-03-26
5a0ae917,ffc19ef6-a61f-43,2025-02-08,02-14-2025,Google Pixel 8,i920,699.99,website,affiliate,mobile,Liverpool,2025-02-08,2025-02-14
5a0ae917,ffc19ef6-a61f-43,2025-02-08,2025-02-13,Kindle Paperwhite,j877,129.99,website,,mobile,Manchester,2025-02-08,2025-02-13
55f8bbb8,6d0473e7-8adf-4e,2025-04-13,2025-04-19,Xbox Series X,b104,499.99,website,direct,unknown,Glasgow,2025-04-13,2025-04-19
55f8bbb8,6d0473e7-8adf-4e,2025-04-13,2025-04-15,Smartwatch,h301,249.99,website,search,mobile,Glasgow,2025-04-13,2025-04-15
55f8bbb8,6d0473e7-8adf-4e,13-04-2025,2025-04-16,Google Pixel 8,2i09,699.99,website,direct,unknown,Manchester,2025-04-13,2025-04-16
8d814215,75757602-2d02-42,2025-05-06,2025-05-08,PS5,a245,479.99,mobile_app,affiliate,desktop,Birmingham,2025-05-06,2025-05-08
a8dbe9a1,6f959489-8af2-42,2025-04-25,2025-04-27,Steam Deck,c912,499.99,mobile_app,,desktop,Manchester,2025-04-25,2025-04-27
f01a5097,a254da12-6fff-45,2025-03-04,2025-03-05,Google Pixel 8,i920,699.99,mobile_app,affiliate,desktop,Birmingham,2025-03-04,2025-03-05
f01a5097,a254da12-6fff-45,2025-03-04,2025-03-05,Smartwatch,h301,249.99,mobile_app,affiliate,mobile,Manchester,2025-03-04,2025-03-05
f01a5097,a254da12-6fff-45,2025-03-04,2025-03-05,Steam Deck,c912,499.99,website,search,mobile,Manchester,2025-03-04,2025-03-05
d655005d,1966d047-db64-4c,2025-05-08,2025-05-13,AirPods,d633,159.99,website,search,mobile,Bristol,2025-05-08,2025-05-13
1a8a76f3,043486c3-a64d-4c,15-03-2025,03-21-2025,PS5,a245,479.99,mobile_app,direct,unknown,Nottingham,2025-03-15,2025-03-21
a22eb45b,9fb30a4d-c071-4a,2025-03-23,2025-03-28,Accessory,m001,24.99,mobile_app,affiliate,mobile,London,2025-03-23,2025-03-28
da095b0c,ce4d89f3-94cb-49,2025-05-13,2025-05-18,MacBook Air,g770,1199.99,mobile_app,social,unknown,Manchester,2025-05-13,2025-05-18
da095b0c,ce4d89f3-94cb-49,2025-05-13,2025-05-16,Xbox Series X,b104,499.99,mobile_app,search,mobile,Glasgow,2025-05-13,2025-05-16
1d4ff1c8,c6e19fd7-390e-4f,2025-05-24,05-27-2025,Accessory,m001,24.99,mobile_app,search,desktop,Leeds,2025-05-24,2025-05-27
cb33478a,f35757c5-7836-44,2025-05-02,05-05-2025,iPhone 15,f521,899.99,mobile_app,social,desktop,Glasgow,2025-05-02,2025-05-05
cb33478a,f35757c5-7836-44,2025-05-02,2025-05-06,Xbox Series X,b104,499.99,website,email,unknown,Liverpool,2025-05-02,2025-05-06
c8ddd9bb,e8724434-69b6-47,2025-05-15,05-19-2025,Smartwatch,h301,249.99,website,direct,desktop,Glasgow,2025-05-15,2025-05-19
81ef8162,f08aba21-01f2-48,2025-01-25,2025-01-31,MacBook Air,g770,1199.99,mobile_app,affiliate,mobile,Leeds,2025-01-25,2025-01-31
e71594ff,a89f5f9d-e12d-4f,2025-04-16,2025-04-22,iPhone 15,f521,899.99,website,direct,desktop,Glasgow,2025-04-16,2025-04-22
e71594ff,a89f5f9d-e12d-4f,2025-04-16,2025-04-18,Steam Deck,c912,499.99,mobile_app,search,mobile,Manchester,2025-04-16,2025-04-18
e8b81813,ac5d7133-6a2a-4c,2025-04-01,04-06-2025,iPhone 15,f521,899.99,mobile_app,affiliate,unknown,London,2025-04-01,2025-04-06
d73cad84,06b81c8a-03f9-47,2025-02-12,2025-02-17,AirPods,d633,159.99,website,search,unknown,London,2025-02-12,2025-02-17
2ba009ec,bdc242a8-d1ed-46,2025-04-13,2025-04-16,Xbox Series X,b104,499.99,website,direct,mobile,Leeds,2025-04-13,2025-04-16
64305373,6e15c527-fe2a-4c,2025-04-11,2025-04-13,Xbox Series X,b104,499.99,website,email,unknown,Glasgow,2025-04-11,2025-04-13
ee93a4d0,64b078a7-a4f9-46,2025-04-19,2025-04-25,Smartwatch,h301,249.99,mobile_app,email,desktop,Sheffield,2025-04-19,2025-04-25
ba65983d,f07bf9bb-20fd-47,2025-04-01,2025-04-05,AirPods,d633,159.99,mobile_app,,desktop,Glasgow,2025-04-01,2025-04-05
ba65983d,f07bf9bb-20fd-47,2025-04-01,2025-04-04,AirPods,d633,159.99,mobile_app,email,mobile,Birmingham,2025-04-01,2025-04-04
3b20d154,5170a2ef-e777-46,2025-04-12,2025-04-16,AirPods,d633,159.99,mobile_app,social,desktop,Sheffield,2025-04-12,2025-04-16
93b1ee1d,20572e73-cd19-4b,2025-03-20,2025-03-21,MacBook Air,g770,1199.99,mobile_app,email,unknown,Sheffield,2025-03-20,2025-03-21
93b1ee1d,20572e73-cd19-4b,2025-03-20,2025-03-24,Xbox Series X,b104,499.99,mobile_app,affiliate,unknown,Bristol,2025-03-20,2025-03-24
d65bc676,c31db215-d7d0-4c,2025-04-25,2025-04-27,Steam Deck,c912,499.99,mobile_app,email,mobile,Liverpool,2025-04-25,2025-04-27
06905ba5,52891c31-f2de-45,2025-04-25,2025-04-28,Nintendo Switch,e682,299.99,mobile_app,social,mobile,Glasgow,2025-04-25,2025-04-28
9e3bc735,c520d50f-a0ff-44,2025-04-06,2025-04-11,Google Pixel 8,i920,699.99,website,direct,unknown,Bristol,2025-04-06,2025-04-11
067965ab,f8ef32ee-ebac-42,2025-04-01,2025-04-05,Google Pixel 8,i920,699.99,mobile_app,affiliate,desktop,Manchester,2025-04-01,2025-04-05
c7101f3d,fbc1085b-216b-48,2025-01-01,2025-01-03,Steam Deck,c912,499.99,mobile_app,social,unknown,Glasgow,2025-01-01,2025-01-03
319ec58b,a70bba9c-3d5e-49,2025-04-19,2025-04-23,Kindle Paperwhite,j877,129.99,website,social,unknown,Liverpool,2025-04-19,2025-04-23
60cb9e17,b9ef9fa8-3ec8-4e,2025-03-10,2025-03-12,Smartwatch,h301,249.99,mobile_app,search,unknown,Liverpool,2025-03-10,2025-03-12
24ce1460,0d3f69ed-a8c5-4c,2025-05-07,2025-05-08,MacBook Air,g770,1199.99,website,affiliate,unknown,Manchester,2025-05-07,2025-05-08
1c66021e,fc1bb61a-a36d-4d,2025-03-26,2025-03-29,iPhone 15,f521,899.99,mobile_app,social,mobile,London,2025-03-26,2025-03-29
4312153d,1f683d6f-988c-49,2025-04-13,2025-04-17,PS5,a245,479.99,website,affiliate,mobile,London,2025-04-13,2025-04-17
4312153d,1f683d6f-988c-49,2025-04-13,2025-04-15,MacBook Air,g770,1199.99,website,search,mobile,Glasgow,2025-04-13,2025-04-15
e9a7f5e0,13cf44fe-17c0-4e,2025-04-01,2025-04-03,Kindle Paperwhite,j877,129.99,website,social,desktop,Manchester,2025-04-01,2025-04-03
69eb337c,19c59f2d-640b-4b,2025-06-02,2025-06-07,iPhone 15,f521,899.99,mobile_app,search,unknown,London,2025-06-02,2025-06-07
6b7f0864,a02cbed2-f58f-41,2025-04-21,2025-04-27,AirPods,d633,159.99,website,direct,desktop,Glasgow,2025-04-21,2025-04-27
293e16b3,a2307350-5047-4a,2025-04-10,04-13-2025,iPhone 15,f521,899.99,mobile_app,direct,desktop,London,2025-04-10,2025-04-13
293e16b3,a2307350-5047-4a,2025-04-10,2025-04-14,iPhone 15,f521,899.99,website,social,mobile,Manchester,2025-04-10,2025-04-14
293e16b3,a2307350-5047-4a,2025-04-10,2025-04-12,iPhone 15,f521,899.99,mobile_app,email,unknown,Liverpool,2025-04-10,2025-04-12
a197339c,e754d4c3-0298-4d,21-03-2025,2025-03-23,Nintendo Switch,e682,299.99,website,social,mobile,Liverpool,2025-03-21,2025-03-23
a197339c,e754d4c3-0298-4d,2025-03-21,2025-03-25,MacBook Air,g770,1199.99,website,search,desktop,Manchester,2025-03-21,2025-03-25
a197339c,e754d4c3-0298-4d,2025-03-21,2025-03-24,Google Pixel 8,i920,699.99,website,search,mobile,Manchester,2025-03-21,2025-03-24
58c6d166,1e014975-080d-43,2025-06-21,2025-06-26,Nintendo Switch,e682,299.99,mobile_app,search,mobile,Leeds,2025-06-21,2025-06-26
85915036,999921ec-9d2f-4e,2025-04-08,2025-04-13,AirPods,d633,159.99,mobile_app,affiliate,unknown,London,2025-04-08,2025-04-13
89344b06,1f20c257-ed34-4e,2025-04-15,2025-04-20,PS5,a245,479.99,website,search,desktop,London,2025-04-15,2025-04-20
5d697934,c2ce56bd-8301-43,2025-02-05,2025-02-07,Google Pixel 8,i920,699.99,website,search,mobile,Manchester,2025-02-05,2025-02-07
5d697934,c2ce56bd-8301-43,2025-02-05,2025-02-11,Kindle Paperwhite,j877,129.99,website,affiliate,unknown,Birmingham,2025-02-05,2025-02-11
155c8139,078d27e5-378a-4b,2025-04-12,2025-04-15,MacBook Air,g770,1199.99,mobile_app,social,unknown,Leeds,2025-04-12,2025-04-15
155c8139,078d27e5-378a-4b,2025-04-12,2025-04-18,Xbox Series X,b104,499.99,mobile_app,affiliate,desktop,Birmingham,2025-04-12,2025-04-18
33013b08,2067902b-f099-42,2025-03-13,2025-03-18,Accessory,m001,24.99,mobile_app,social,unknown,London,2025-03-13,2025-03-18
77902ddf,b544f70c-593a-4b,2025-03-05,2025-03-06,MacBook Air,g770,1199.99,mobile_app,search,mobile,Glasgow,2025-03-05,2025-03-06
77902ddf,b544f70c-593a-4b,2025-03-05,2025-03-10,Nintendo Switch,e682,299.99,mobile_app,affiliate,desktop,Liverpool,2025-03-05,2025-03-10
ec1f0155,6fa1c232-7eec-4c,2025-01-24,2025-01-27,Steam Deck,c912,499.99,mobile_app,direct,mobile,London,2025-01-24,2025-01-27
ec1f0155,6fa1c232-7eec-4c,24-01-2025,2025-01-29,Steam Deck,c912,499.99,mobile_app,search,mobile,Manchester,2025-01-24,2025-01-29
b7a745e2,32a807cc-2c47-43,2025-04-15,2025-04-21,Accessory,m001,24.99,website,search,mobile,Manchester,2025-04-15,2025-04-21
966b91e7,1a574cee-6490-4d,2025-06-23,2025-06-25,Kindle Paperwhite,j877,129.99,website,direct,desktop,Glasgow,2025-06-23,2025-06-25
6ef7ffc3,34b16488-cb4a-4b,03-04-2025,2025-04-05,AirPods,d633,159.99,website,affiliate,unknown,Manchester,2025-04-03,2025-04-05
6ef7ffc3,34b16488-cb4a-4b,2025-04-03,2025-04-04,Kindle Paperwhite,j877,129.99,website,search,mobile,Manchester,2025-04-03,2025-04-04
5199839c,98a91187-6c7a-4c,2025-06-13,06-16-2025,PS5,a245,479.99,mobile_app,direct,unknown,Leeds,2025-06-13,2025-06-16
5a58abba,620f4af4-9b77-4a,2025-04-23,2025-04-25,Steam Deck,c912,499.99,mobile_app,direct,mobile,Birmingham,2025-04-23,2025-04-25
e3b2f985,d1c06099-a1f8-46,2025-02-16,2025-02-18,AirPods,d633,159.99,website,email,desktop,London,2025-02-16,2025-02-18
e3b2f985,d1c06099-a1f8-46,2025-02-16,2025-02-20,Xbox Series X,b104,499.99,website,social,desktop,London,2025-02-16,2025-02-20
9a980457,40c8c7a3-82e8-47,2025-06-08,2025-06-14,Smartwatch,h301,249.99,website,social,desktop,Glasgow,2025-06-08,2025-06-14
65f76d06,f34bfa59-a525-43,2025-03-17,2025-03-21,Smartwatch,h301,249.99,mobile_app,direct,desktop,Bristol,2025-03-17,2025-03-21
2f981e44,cf1d46be-2e0e-44,2025-05-11,2025-05-16,MacBook Air,g770,1199.99,website,affiliate,desktop,London,2025-05-11,2025-05-16
2f981e44,cf1d46be-2e0e-44,2025-05-11,2025-05-16,Google Pixel 8,i920,699.99,website,direct,desktop,Glasgow,2025-05-11,2025-05-16
2f981e44,cf1d46be-2e0e-44,2025-05-11,2025-05-15,PS5,a245,479.99,mobile_app,email,mobile,Birmingham,2025-05-11,2025-05-15
252151f9,37164f31-1298-4e,2025-02-05,2025-02-07,Steam Deck,c912,499.99,website,search,mobile,Birmingham,2025-02-05,2025-02-07
252151f9,37164f31-1298-4e,05-02-2025,2025-02-08,Smartwatch,h301,249.99,website,social,desktop,Birmingham,2025-02-05,2025-02-08
252151f9,37164f31-1298-4e,2025-02-05,2025-02-09,Nintendo Switch,e682,299.99,mobile_app,social,desktop,Manchester,2025-02-05,2025-02-09
b780606a,02774ef3-1f4f-4a,2025-05-23,2025-05-26,iPhone 15,f521,899.99,mobile_app,affiliate,mobile,London,2025-05-23,2025-05-26
3b8ede31,9145aa38-7722-4c,2025-04-13,2025-04-10,Accessory,m001,24.99,website,affiliate,unknown,Manchester,2025-04-13,2025-04-10
37abaed7,489af195-62b6-45,2025-04-24,2025-04-28,Accessory,m001,24.99,mobile_app,affiliate,mobile,Glasgow,2025-04-24,2025-04-28
37abaed7,489af195-62b6-45,2025-04-24,2025-04-27,Accessory,m001,24.99,website,direct,,London,2025-04-24,2025-04-27
37abaed7,489af195-62b6-45,2025-04-24,2025-04-29,Xbox Series X,b104,499.99,website,direct,unknown,Glasgow,2025-04-24,2025-04-29
ceb380ac,b75d2f0c-472e-4f,2025-05-07,2025-05-09,Xbox Series X,b104,499.99,mobile_app,affiliate,desktop,Glasgow,2025-05-07,2025-05-09
aea03292,92ee4820-1327-4d,2025-02-01,2025-02-03,Kindle Paperwhite,j877,129.99,mobile_app,email,unknown,Glasgow,2025-02-01,2025-02-03
0cb68029,d03a9ed2-515a-4e,15-04-2025,2025-04-17,MacBook Air,g770,1199.99,mobile_app,direct,desktop,Glasgow,2025-04-15,2025-04-17
1e87c27e,0bfa8cd5-7fa7-47,2025-03-09,2025-03-11,Google Pixel 8,i920,699.99,website,email,desktop,Manchester,2025-03-09,2025-03-11
3c862582,99f75c76-2bcf-40,2025-03-17,2025-03-18,Xbox Series X,b104,499.99,mobile_app,direct,mobile,Nottingham,2025-03-17,2025-03-18
3c862582,99f75c76-2bcf-40,2025-03-17,2025-03-23,MacBook Air,g770,1199.99,mobile_app,email,unknown,Liverpool,2025-03-17,2025-03-23
9364ecb5,0490eb68-48f8-4d,2025-02-01,2025-02-02,iPhone 15,f521,899.99,website,email,desktop,Manchester,2025-02-01,2025-02-02
9364ecb5,0490eb68-48f8-4d,2025-02-01,2025-02-02,Smartwatch,h301,249.99,website,social,desktop,Manchester,2025-02-01,2025-02-02
f783b6f6,7636ae1c-e961-41,2025-01-11,2025-01-15,Google Pixel 8,i920,699.99,website,direct,desktop,Glasgow,2025-01-11,2025-01-15
565f2ea8,88914b26-e555-45,2025-04-15,04-18-2025,Nintendo Switch,e682,299.99,website,affiliate,mobile,Leeds,2025-04-15,2025-04-18
6a429bd5,784aee43-11c7-4e,2025-01-01,2025-01-02,PS5,a245,479.99,mobile_app,social,mobile,Manchester,2025-01-01,2025-01-02
146b9fbc,5133577b-4651-41,2025-02-24,2025-02-28,Google Pixel 8,i920,699.99,website,search,unknown,Birmingham,2025-02-24,2025-02-28
4c66d04f,7e6ae55c-502c-46,2025-04-05,2025-04-08,Nintendo Switch,e682,299.99,mobile_app,social,mobile,London,2025-04-05,2025-04-08
e914ae70,7e4b4f10-745f-48,2025-05-04,2025-05-07,Xbox Series X,b104,499.99,mobile_app,search,unknown,Manchester,2025-05-04,2025-05-07
e914ae70,7e4b4f10-745f-48,2025-05-04,05-08-2025,PS5,a245,479.99,mobile_app,search,desktop,Sheffield,2025-05-04,2025-05-08
e914ae70,7e4b4f10-745f-48,2025-05-04,2025-05-06,Xbox Series X,b104,499.99,website,direct,desktop,Leeds,2025-05-04,2025-05-06
39590149,f00d5a65-5fb8-4f,2025-01-12,2025-01-13,Accessory,m001,24.99,website,social,mobile,Glasgow,2025-01-12,2025-01-13
39590149,f00d5a65-5fb8-4f,2025-01-12,2025-01-13,Kindle Paperwhite,j877,129.99,website,direct,mobile,Manchester,2025-01-12,2025-01-13
dc83f96f,23841977-02a9-40,2025-03-15,2025-03-21,Xbox Series X,b104,499.99,mobile_app,email,unknown,London,2025-03-15,2025-03-21
b95f22d5,39f18027-6f88-42,03-04-2025,2025-04-09,Smartwatch,h301,249.99,mobile_app,direct,mobile,London,2025-04-03,2025-04-09
0143d636,d0ef0cd4-5e6e-43,22-04-2025,04-25-2025,MacBook Air,g770,1199.99,website,search,unknown,Leeds,2025-04-22,2025-04-25
0b070a68,0d700c8b-de36-49,2025-06-09,2025-06-15,Nintendo Switch,e682,299.99,mobile_app,affiliate,desktop,Leeds,2025-06-09,2025-06-15
b01ba134,4de5f4af-f278-45,2025-04-11,2025-04-12,Xbox Series X,b104,499.99,website,affiliate,desktop,London,2025-04-11,2025-04-12
ecc38555,612a9cc6-cfff-4d,2025-06-08,2025-06-12,Xbox Series X,b104,499.99,mobile_app,affiliate,unknown,Leeds,2025-06-08,2025-06-12
25e36ccd,1eb1dc0c-75f0-46,2025-04-04,2025-04-08,Smartwatch,h301,249.99,mobile_app,direct,unknown,Glasgow,2025-04-04,2025-04-08
a30c1e0e,d9a3ac28-e346-41,2025-05-19,2025-05-23,Kindle Paperwhite,j877,129.99,mobile_app,direct,mobile,Glasgow,2025-05-19,2025-05-23
7a59697d,85924e5f-1f53-4b,2025-03-27,2025-03-30,Kindle Paperwhite,j877,129.99,mobile_app,affiliate,unknown,Birmingham,2025-03-27,2025-03-30
7b92a41d,47d1931c-f9f2-49,2025-02-23,2025-03-01,AirPods,d633,159.99,mobile_app,email,desktop,,2025-02-23,2025-03-01
5a5ed7eb,c425d020-4389-4f,2025-03-06,2025-03-09,AirPods,d633,159.99,mobile_app,search,mobile,Glasgow,2025-03-06,2025-03-09
db19de67,3e0c5ec5-df74-4f,2025-02-12,2025-02-13,Accessory,m001,24.99,mobile_app,search,mobile,London,2025-02-12,2025-02-13
3664cafa,133ca9cf-13f8-47,2025-04-22,2025-04-25,PS5,a245,479.99,mobile_app,affiliate,unknown,Manchester,2025-04-22,2025-04-25
7cd6572f,77d8b428-3754-47,2025-03-14,2025-03-15,Xbox Series X,b104,499.99,website,social,desktop,Manchester,2025-03-14,2025-03-15
8390bd94,d06200e3-356a-46,2025-05-23,2025-05-28,PS5,a245,479.99,mobile_app,direct,mobile,Manchester,2025-05-23,2025-05-28
a7c10adb,f1c2fa18-c2af-46,2025-05-19,2025-05-23,AirPods,d633,159.99,mobile_app,search,desktop,Leeds,2025-05-19,2025-05-23
eaacabb4,1b0c9092-8127-48,2025-06-08,06-10-2025,Google Pixel 8,i920,699.99,mobile_app,search,desktop,Manchester,2025-06-08,2025-06-10
33f92a87,73d2939e-f99d-46,2025-04-03,2025-04-09,Xbox Series X,b104,499.99,website,affiliate,desktop,London,2025-04-03,2025-04-09
afaf20ec,11925880-301d-48,2025-05-19,2025-05-24,iPhone 15,f521,899.99,website,search,unknown,London,2025-05-19,2025-05-24
760116cf,93c6267d-dead-44,2025-02-14,2025-02-15,Google Pixel 8,i920,699.99,mobile_app,search,desktop,Manchester,2025-02-14,2025-02-15
75fa0ebe,1c36036f-beba-46,2025-05-16,05-18-2025,Google Pixel 8,i920,699.99,mobile_app,direct,desktop,London,2025-05-16,2025-05-18
5a19d7ab,79eae461-0751-4d,2025-03-06,2025-03-04,Accessory,m001,24.99,website,direct,unknown,Glasgow,2025-03-06,2025-03-04
3649f585,8ce0bd8f-ed4b-42,16-06-2025,2025-06-20,Kindle Paperwhite,j877,129.99,website,email,desktop,London,2025-06-16,2025-06-20
70fbb28e,6e4c1501-808f-4c,2025-04-25,2025-04-28,MacBook Air,g770,1199.99,mobile_app,search,mobile,Sheffield,2025-04-25,2025-04-28
70fbb28e,6e4c1501-808f-4c,2025-04-25,04-29-2025,Smartwatch,h301,249.99,mobile_app,direct,unknown,Liverpool,2025-04-25,2025-04-29
ed92b753,0c941263-190a-40,2025-04-24,2025-04-25,AirPods,d633,159.99,website,email,unknown,London,2025-04-24,2025-04-25
46a3110a,307fc576-4b43-48,2025-04-14,2025-04-20,Google Pixel 8,i920,699.99,mobile_app,direct,unknown,London,2025-04-14,2025-04-20
0cc46000,84c42de1-7e5d-42,2025-03-22,2025-03-27,Kindle Paperwhite,j877,129.99,website,affiliate,mobile,Bristol,2025-03-22,2025-03-27
e5228d31,1c6fec01-f57f-4b,2025-05-16,2025-05-18,Xbox Series X,b104,499.99,mobile_app,direct,desktop,Manchester,2025-05-16,2025-05-18
e5228d31,1c6fec01-f57f-4b,2025-05-16,2025-05-18,MacBook Air,g770,1199.99,mobile_app,social,unknown,Manchester,2025-05-16,2025-05-18
4684833e,3d1fd7c0-4424-41,2025-02-27,2025-03-01,Steam Deck,c912,499.99,mobile_app,affiliate,desktop,Glasgow,2025-02-27,2025-03-01
4684833e,3d1fd7c0-4424-41,2025-02-27,2025-03-01,AirPods,d633,159.99,mobile_app,affiliate,unknown,Birmingham,2025-02-27,2025-03-01
649423aa,b3133c8e-9ec6-49,2025-02-12,2025-02-18,Kindle Paperwhite,j877,129.99,website,direct,mobile,Bristol,2025-02-12,2025-02-18
7ec391ef,d2f629ca-bbe2-47,2025-02-05,2025-02-11,Xbox Series X,b104,499.99,mobile_app,email,desktop,London,2025-02-05,2025-02-11
b4b2ce14,341d85cd-c925-42,2025-03-20,2025-03-21,Accessory,m001,24.99,mobile_app,search,desktop,Glasgow,2025-03-20,2025-03-21
e8646e0c,00cb9caa-bbdf-45,2025-05-08,2025-05-13,Accessory,m001,24.99,mobile_app,direct,,Glasgow,2025-05-08,2025-05-13
b01c9191,bd350d2a-7a0c-45,2025-02-22,2025-02-25,Smartwatch,h301,249.99,website,search,unknown,Glasgow,2025-02-22,2025-02-25
55082167,ae7303c0-50ab-46,2025-04-22,2025-04-26,Kindle Paperwhite,j877,129.99,website,affiliate,unknown,Sheffield,2025-04-22,2025-04-26
55082167,ae7303c0-50ab-46,2025-04-22,2025-04-25,iPhone 15,f521,899.99,website,social,mobile,Leeds,2025-04-22,2025-04-25
55082167,ae7303c0-50ab-46,2025-04-22,2025-04-28,PS5,a245,479.99,mobile_app,social,,Manchester,2025-04-22,2025-04-28
6d8c5504,f6558f35-244f-45,2025-05-15,2025-05-21,Xbox Series X,b104,499.99,mobile_app,email,desktop,London,2025-05-15,2025-05-21
2bb4a408,f9705e4b-2d71-40,2025-04-25,2025-04-26,Google Pixel 8,i920,699.99,website,search,unknown,London,2025-04-25,2025-04-26
2bb4a408,f9705e4b-2d71-40,2025-04-25,2025-04-27,iPhone 15,f521,899.99,mobile_app,social,mobile,Birmingham,2025-04-25,2025-04-27
794ceef2,027deb45-da64-45,2025-04-06,2025-04-12,Nintendo Switch,e682,299.99,website,email,unknown,London,2025-04-06,2025-04-12
0b90b03d,df8b4008-7d01-45,2025-04-25,2025-04-28,AirPods,d633,159.99,mobile_app,social,unknown,London,2025-04-25,2025-04-28
3a710f9e,ae1782f6-9138-44,2025-03-02,2025-02-27,AirPods,d633,159.99,website,affiliate,desktop,Leeds,2025-03-02,2025-02-27
19991b39,c1472ff2-2ad4-4b,2025-04-16,2025-04-18,Smartwatch,h301,249.99,mobile_app,direct,unknown,London,2025-04-16,2025-04-18
19991b39,c1472ff2-2ad4-4b,2025-04-16,2025-04-22,MacBook Air,g770,1199.99,mobile_app,affiliate,unknown,Glasgow,2025-04-16,2025-04-22
59ccc94a,55eef366-bc76-47,2025-05-26,2025-05-31,Smartwatch,h301,249.99,mobile_app,search,unknown,Manchester,2025-05-26,2025-05-31
7570b0ac,a9d52401-41e1-40,2025-05-12,2025-05-16,Accessory,m001,24.99,website,search,desktop,Manchester,2025-05-12,2025-05-16
7570b0ac,a9d52401-41e1-40,2025-05-12,2025-05-18,Kindle Paperwhite,j877,129.99,website,search,desktop,Birmingham,2025-05-12,2025-05-18
84909370,4d171ebc-5a45-48,2025-01-25,2025-01-27,PS5,a245,479.99,mobile_app,,unknown,London,2025-01-25,2025-01-27
7bfeadd1,dd7902fc-db61-4a,2025-03-19,2025-03-23,Kindle Paperwhite,j877,129.99,mobile_app,affiliate,mobile,Leeds,2025-03-19,2025-03-23
25dccca2,84f16d9d-af8f-4c,2025-02-10,2025-02-14,Accessory,m001,24.99,mobile_app,search,unknown,Glasgow,2025-02-10,2025-02-14
25dccca2,84f16d9d-af8f-4c,2025-02-10,2025-02-14,Nintendo Switch,e682,299.99,mobile_app,affiliate,desktop,Leeds,2025-02-10,2025-02-14
5b7117bd,3862abcf-db34-47,2025-01-13,2025-01-15,Kindle Paperwhite,j877,129.99,website,email,desktop,Leeds,2025-01-13,2025-01-15
6e43b319,93dc8eea-3e8e-43,19-04-2025,2025-04-23,AirPods,d633,159.99,website,social,mobile,London,2025-04-19,2025-04-23
60b61367,16daa8f5-be8e-46,2025-03-17,2025-03-23,iPhone 15,f521,899.99,mobile_app,email,desktop,Manchester,2025-03-17,2025-03-23
60b61367,16daa8f5-be8e-46,2025-03-17,2025-03-21,AirPods,d633,159.99,website,email,mobile,,2025-03-17,2025-03-21
8b7fa47e,461fe028-f727-4e,2025-04-07,2025-04-10,Accessory,m001,24.99,website,,unknown,Liverpool,2025-04-07,2025-04-10
2cc9abb6,fcc1c48c-7303-40,2025-02-10,2025-02-16,Google Pixel 8,i920,699.99,mobile_app,social,mobile,London,2025-02-10,2025-02-16
2cc9abb6,fcc1c48c-7303-40,2025-02-10,2025-02-14,Xbox Series X,b104,499.99,website,email,,Manchester,2025-02-10,2025-02-14
96d26487,594de8d7-add7-4b,2025-04-25,2025-04-30,Kindle Paperwhite,j877,129.99,website,email,mobile,Birmingham,2025-04-25,2025-04-30
945b3711,46b821c7-fe73-48,27-01-2025,2025-02-02,PS5,a245,479.99,website,social,mobile,Glasgow,2025-01-27,2025-02-02
cb9aefff,d58c449e-57e0-45,2025-04-19,2025-04-23,Kindle Paperwhite,j877,129.99,website,social,desktop,Birmingham,2025-04-19,2025-04-23
1c35730b,cae2f489-f7d8-40,2025-04-17,2025-04-23,AirPods,d633,159.99,mobile_app,email,mobile,London,2025-04-17,2025-04-23
ae50f96e,ed5f24c3-7fb9-4e,2025-01-17,2025-01-20,Smartwatch,h301,249.99,website,direct,mobile,Glasgow,2025-01-17,2025-01-20
29a099de,4a2f2373-f777-48,2025-04-25,2025-04-26,Nintendo Switch,e682,299.99,website,search,mobile,Birmingham,2025-04-25,2025-04-26
74300ccc,108ab4de-49cb-47,2025-01-07,2025-01-13,Google Pixel 8,i920,699.99,mobile_app,search,,London,2025-01-07,2025-01-13
7d05955b,d3520a91-4873-42,2025-04-16,2025-04-20,Xbox Series X,b104,499.99,website,direct,desktop,Manchester,2025-04-16,2025-04-20
0cc66163,5a2d6aee-6e29-43,2025-01-24,01-30-2025,PS5,a245,479.99,mobile_app,email,desktop,Glasgow,2025-01-24,2025-01-30
0cc66163,5a2d6aee-6e29-43,2025-01-24,2025-01-29,iPhone 15,f521,899.99,mobile_app,social,desktop,Glasgow,2025-01-24,2025-01-29
8082a0ee,e0f3ee66-59a7-46,2025-06-21,2025-06-22,MacBook Air,g770,1199.99,mobile_app,search,unknown,Leicester,2025-06-21,2025-06-22
b69415c7,8f8d4107-c4d5-4c,2025-04-20,2025-04-23,PS5,a245,479.99,website,social,desktop,Liverpool,2025-04-20,2025-04-23
eb1313b7,bba95ec4-fef4-4c,2025-02-25,2025-03-02,Steam Deck,c912,499.99,website,email,desktop,Birmingham,2025-02-25,2025-03-02
eb1313b7,bba95ec4-fef4-4c,2025-02-25,02-27-2025,Smartwatch,h301,249.99,website,direct,desktop,Leicester,2025-02-25,2025-02-27
3facabcc,083a1c27-3807-40,2025-04-20,2025-04-26,Smartwatch,h301,249.99,website,direct,desktop,Manchester,2025-04-20,2025-04-26
e7773701,62e0adf7-a315-4b,2025-04-14,2025-04-16,AirPods,d633,159.99,website,search,mobile,London,2025-04-14,2025-04-16
2c5d849c,eb91d7bc-42e1-4e,2025-01-20,2025-01-24,Smartwatch,h301,249.99,website,social,desktop,Manchester,2025-01-20,2025-01-24
23a10fdd,e03d1b30-adcd-49,18-04-2025,2025-04-23,Google Pixel 8,i920,699.99,mobile_app,search,mobile,London,2025-04-18,2025-04-23
3313f36c,4001570a-3312-4e,2025-03-08,2025-03-14,AirPods,d633,159.99,mobile_app,email,mobile,London,2025-03-08,2025-03-14
760e36aa,4c1e172a-15e9-4e,2025-03-10,2025-03-13,iPhone 15,f521,899.99,website,email,unknown,London,2025-03-10,2025-03-13
18963a6e,c84bbdf5-603f-4d,2025-04-18,2025-04-19,iPhone 15,f521,899.99,website,email,unknown,Birmingham,2025-04-18,2025-04-19
18963a6e,c84bbdf5-603f-4d,2025-04-18,04-23-2025,Steam Deck,c912,499.99,website,affiliate,unknown,Manchester,2025-04-18,2025-04-23
af66dc57,b1b2b9c6-7120-42,2025-04-04,2025-04-09,Smartwatch,h301,249.99,mobile_app,affiliate,unknown,Manchester,2025-04-04,2025-04-09
f62162ab,5aac72b1-77e7-4d,05-04-2025,2025-04-11,Steam Deck,c912,499.99,mobile_app,search,desktop,Glasgow,2025-04-05,2025-04-11
c44b04e8,e99d6b91-0715-42,2025-04-08,2025-04-11,Smartwatch,h301,249.99,website,social,unknown,Manchester,2025-04-08,2025-04-11
c960b851,23fd6ade-c17f-4f,2025-03-11,2025-03-15,Smartwatch,h301,249.99,mobile_app,affiliate,desktop,Leeds,2025-03-11,2025-03-15
e660a8e0,5f843666-831f-4c,2025-05-09,2025-05-14,Nintendo Switch,e682,299.99,mobile_app,search,unknown,London,2025-05-09,2025-05-14
e660a8e0,5f843666-831f-4c,2025-05-09,2025-05-12,Nintendo Switch,e682,299.99,mobile_app,direct,desktop,Birmingham,2025-05-09,2025-05-12
e660a8e0,5f843666-831f-4c,2025-05-09,2025-05-12,Accessory,m001,24.99,website,email,unknown,Birmingham,2025-05-09,2025-05-12
203d54c9,0db4897a-4b18-4a,01-22-2025,2025-01-16,AirPods,d633,159.99,website,search,mobile,Bristol,2025-01-22,2025-01-16
849c30c6,767a92b7-0186-40,2025-01-07,2025-01-13,MacBook Air,g770,1199.99,website,social,desktop,London,2025-01-07,2025-01-13
fc75de3d,15ac37f0-0de9-42,2025-04-20,04-24-2025,Accessory,m001,24.99,mobile_app,search,unknown,Manchester,2025-04-20,2025-04-24
90c0e607,9826a55f-555f-4b,2025-02-27,2025-03-02,Accessory,m001,24.99,mobile_app,direct,unknown,Glasgow,2025-02-27,2025-03-02
95a97dd7,dd43b0cf-54d0-43,2025-02-11,2025-02-15,Google Pixel 8,i920,699.99,website,search,unknown,Sheffield,2025-02-11,2025-02-15
8429e12c,b78a2037-bd46-4b,2025-04-18,2025-04-21,Kindle Paperwhite,j877,129.99,website,search,desktop,Sheffield,2025-04-18,2025-04-21
e522266c,f79f8fa9-bd8c-4f,2025-04-14,2025-04-19,iPhone 15,f521,899.99,website,affiliate,unknown,London,2025-04-16,2025-04-19
e522266c,f79f8fa9-bd8c-4f,2025-04-14,2025-04-19,PS5,a245,479.99,mobile_app,direct,unknown,Manchester,2025-04-16,2025-04-19
e522266c,f79f8fa9-bd8c-4f,04-16-2025,2025-04-14,Steam Deck,c912,499.99,website,direct,desktop,Glasgow,2025-04-16,2025-04-14
b819b15d,279f5df0-da2d-4d,2025-02-11,2025-02-15,Accessory,m001,24.99,website,email,desktop,Glasgow,2025-02-11,2025-02-15
33611134,ce3ce7ce-01a6-42,2025-04-17,2025-04-21,PS5,a245,479.99,mobile_app,social,mobile,Manchester,2025-04-17,2025-04-21
8513176c,272c7482-0002-47,2025-04-02,2025-04-04,Smartwatch,h301,249.99,mobile_app,direct,desktop,Glasgow,2025-04-02,2025-04-04
817c6779,1a85fd69-344c-46,2025-03-12,2025-03-15,AirPods,d633,159.99,website,social,mobile,Nottingham,2025-03-12,2025-03-15
7bd50aeb,ed113faf-0e3f-49,2025-03-26,2025-03-27,Smartwatch,h301,249.99,website,email,mobile,London,2025-03-26,2025-03-27
7bd50aeb,ed113faf-0e3f-49,2025-03-26,2025-03-28,Steam Deck,c912,499.99,mobile_app,affiliate,mobile,Bristol,2025-03-26,2025-03-28
42a1279b,3c243b45-d1fd-47,2025-06-25,2025-06-26,Smartwatch,h301,249.99,mobile_app,affiliate,unknown,Birmingham,2025-06-25,2025-06-26
1f89cec2,706ad042-ae6b-44,2025-02-03,2025-02-08,Nintendo Switch,e682,299.99,website,email,desktop,Manchester,2025-02-03,2025-02-08
1f89cec2,706ad042-ae6b-44,2025-02-03,2025-02-04,Xbox Series X,b104,499.99,website,affiliate,mobile,Manchester,2025-02-03,2025-02-04
1f89cec2,706ad042-ae6b-44,2025-02-03,2025-02-06,MacBook Air,g770,1199.99,website,search,unknown,Glasgow,2025-02-03,2025-02-06
be9e01a9,058b5ee1-a2dd-41,2025-04-16,2025-04-17,iPhone 15,f521,899.99,website,direct,unknown,Glasgow,2025-04-16,2025-04-17
334a34a8,82f2a59e-2bb7-41,2025-03-23,2025-03-27,Kindle Paperwhite,j877,129.99,website,search,desktop,Leeds,2025-03-23,2025-03-27
96b93974,4a1954ec-4a3f-4f,2025-01-05,2025-01-06,iPhone 15,f521,899.99,website,search,mobile,Manchester,2025-01-05,2025-01-06
ccc34f70,467248f6-aaee-4d,2025-04-08,2025-04-10,Kindle Paperwhite,j877,129.99,mobile_app,direct,unknown,Manchester,2025-04-08,2025-04-10
488e5bd8,d0411dec-6ab9-4a,2025-03-18,2025-03-22,Xbox Series X,b104,499.99,website,search,desktop,Glasgow,2025-03-18,2025-03-22
08b9b2e9,63b1a52e-9070-41,2025-05-10,2025-05-11,Google Pixel 8,i920,699.99,mobile_app,email,desktop,London,2025-05-10,2025-05-11
e879c9a6,a83db2df-e4aa-41,2025-05-26,2025-06-01,iPhone 15,f521,899.99,website,search,unknown,Liverpool,2025-05-26,2025-06-01
75566ff1,23a9654d-f679-45,2025-04-21,2025-04-22,Xbox Series X,b104,499.99,mobile_app,direct,unknown,Birmingham,2025-04-21,2025-04-22
dc6bf2c8,28874d02-fb54-45,2025-01-26,2025-01-31,Xbox Series X,b104,499.99,mobile_app,social,unknown,Bristol,2025-01-26,2025-01-31
8356ed61,e70d8d07-594d-40,2025-05-18,2025-05-22,Google Pixel 8,2i90,699.99,mobile_app,affiliate,unknown,Liverpool,2025-05-18,2025-05-22
902a73ae,26c25405-a7ea-42,2025-02-12,2025-02-13,Google Pixel 8,i920,699.99,mobile_app,direct,mobile,London,2025-02-12,2025-02-13
c8f3332a,dbd165a3-b716-40,2025-04-17,2025-04-19,Xbox Series X,b104,499.99,mobile_app,direct,mobile,Manchester,2025-04-17,2025-04-19
d6de0902,ec68fc07-4d8c-40,2025-06-16,2025-06-19,Nintendo Switch,e682,299.99,website,social,unknown,Glasgow,2025-06-16,2025-06-19
2e2d0681,f66a015b-6063-4b,2025-02-18,2025-02-19,Kindle Paperwhite,j877,129.99,website,email,unknown,London,2025-02-18,2025-02-19
425ca2e3,81c974a0-ed6a-43,2025-04-04,2025-04-09,Kindle Paperwhite,j877,129.99,mobile_app,search,unknown,London,2025-04-04,2025-04-09
95a15905,96bf02dd-52f6-4f,2025-04-08,2025-04-11,Steam Deck,c912,499.99,mobile_app,direct,mobile,Manchester,2025-04-08,2025-04-11
95a15905,96bf02dd-52f6-4f,2025-04-08,2025-04-11,Steam Deck,c912,499.99,mobile_app,social,mobile,Birmingham,2025-04-08,2025-04-11
bb9ddc31,114c440d-675d-49,2025-02-26,2025-02-27,MacBook Air,g770,1199.99,mobile_app,affiliate,mobile,Manchester,2025-02-26,2025-02-27
ade81084,aa4e8b03-18b6-4f,2025-02-12,2025-02-15,PS5,a245,479.99,mobile_app,search,mobile,Manchester,2025-02-12,2025-02-15
ead217d1,3b45d977-c289-4a,02-02-2025,2025-02-06,AirPods,d633,159.99,mobile_app,affiliate,unknown,Glasgow,2025-02-02,2025-02-06
ead217d1,3b45d977-c289-4a,2025-02-02,2025-02-04,Nintendo Switch,e682,299.99,website,email,unknown,London,2025-02-02,2025-02-04
ba68e69f,1afd943c-3c92-41,2025-01-20,2025-01-25,Kindle Paperwhite,j877,129.99,website,email,unknown,Manchester,2025-01-20,2025-01-25
ba68e69f,1afd943c-3c92-41,2025-01-20,2025-01-25,Nintendo Switch,e682,299.99,website,affiliate,mobile,,2025-01-20,2025-01-25
0fda6ca4,f92b7b46-c17d-44,2025-02-23,2025-02-25,MacBook Air,g770,1199.99,mobile_app,search,desktop,Manchester,2025-02-23,2025-02-25
7108022a,09943e76-1d4e-47,2025-05-06,2025-05-10,Accessory,m001,24.99,website,search,mobile,Manchester,2025-05-06,2025-05-10
7108022a,09943e76-1d4e-47,2025-05-06,2025-05-12,Accessory,m001,24.99,website,direct,,Bristol,2025-05-06,2025-05-12
7108022a,09943e76-1d4e-47,2025-05-06,2025-05-08,Smartwatch,h301,249.99,website,email,desktop,London,2025-05-06,2025-05-08
2c8fabbc,a19c7caf-9b45-44,25-04-2025,2025-04-29,Steam Deck,c912,499.99,website,search,unknown,Birmingham,2025-04-25,2025-04-29
a32c5e99,73131038-b2df-40,2025-03-14,2025-03-15,Kindle Paperwhite,j877,129.99,website,social,desktop,London,2025-03-14,2025-03-15
adc90caa,321a9240-3321-4b,2025-06-08,2025-06-11,PS5,a245,479.99,website,direct,unknown,Manchester,2025-06-08,2025-06-11
874db4a6,bdfdcc7b-3381-4e,2025-01-11,2025-01-13,iPhone 15,f521,899.99,mobile_app,direct,mobile,Bristol,2025-01-11,2025-01-13
f5b79271,16054b9e-313a-4c,2025-05-06,2025-05-07,MacBook Air,7g07,1199.99,website,direct,unknown,Manchester,2025-05-06,2025-05-07
01572a56,08825d14-341b-4c,2025-01-24,2025-01-29,Steam Deck,c912,499.99,mobile_app,social,unknown,Manchester,2025-01-24,2025-01-29
5738db52,917bc866-6874-4b,2025-01-23,2025-01-29,Kindle Paperwhite,j877,129.99,mobile_app,direct,unknown,London,2025-01-23,2025-01-29
87352231,f52eaf63-badf-47,2025-05-17,2025-05-21,AirPods,d633,159.99,website,social,mobile,Leicester,2025-05-17,2025-05-21
8037b969,351d1137-d518-4b,2025-04-01,2025-04-04,MacBook Air,g770,1199.99,website,social,mobile,Manchester,2025-04-01,2025-04-04
cd35637c,e65664ac-9e54-41,2025-02-21,2025-02-22,Kindle Paperwhite,j877,129.99,mobile_app,affiliate,unknown,Bristol,2025-02-21,2025-02-22
91b3f921,a01ed90e-6d71-48,2025-06-07,2025-06-09,Smartwatch,h301,249.99,website,affiliate,unknown,Glasgow,2025-06-07,2025-06-09
7fab9b07,846a4a71-c84a-49,2025-04-10,2025-04-11,PS5,a245,479.99,website,social,desktop,Liverpool,2025-04-10,2025-04-11
7fab9b07,846a4a71-c84a-49,2025-04-10,2025-04-15,Xbox Series X,b104,499.99,mobile_app,direct,unknown,London,2025-04-10,2025-04-15
d24289ea,8a60b332-99fb-48,2025-01-10,2025-01-16,AirPods,d633,159.99,mobile_app,email,unknown,Manchester,2025-01-10,2025-01-16
5b9facde,d4018a45-ec1a-4a,19-04-2025,2025-04-22,AirPods,d633,159.99,mobile_app,affiliate,desktop,London,2025-04-19,2025-04-22
88cfffa2,2869b5ee-df18-40,2025-03-26,2025-03-28,MacBook Air,g770,1199.99,website,search,mobile,London,2025-03-26,2025-03-28
4feeea91,848be725-da6b-40,2025-02-12,02-14-2025,Steam Deck,c912,499.99,website,social,mobile,Manchester,2025-02-12,2025-02-14
95309450,8bc2d46d-0e80-4f,2025-03-23,2025-03-24,PS5,a245,479.99,website,affiliate,mobile,Birmingham,2025-03-23,2025-03-24
0843280a,fc24a159-eada-48,2025-06-13,2025-06-14,Xbox Series X,b104,499.99,website,direct,mobile,Nottingham,2025-06-13,2025-06-14
0f344fe1,3354b4be-42c9-4a,2025-03-15,2025-03-18,Kindle Paperwhite,j877,129.99,mobile_app,direct,mobile,London,2025-03-15,2025-03-18
c1e158aa,d11756d5-8c0d-4a,2025-06-14,06-15-2025,Kindle Paperwhite,j877,129.99,website,direct,unknown,Birmingham,2025-06-14,2025-06-15
c1e158aa,d11756d5-8c0d-4a,2025-06-14,2025-06-15,iPhone 15,f521,899.99,website,direct,mobile,London,2025-06-14,2025-06-15
ce3fde9a,0ff4c2d6-e0d6-40,2025-02-19,2025-02-21,AirPods,d633,159.99,mobile_app,social,desktop,Manchester,2025-02-19,2025-02-21
ce3fde9a,0ff4c2d6-e0d6-40,2025-02-19,2025-02-20,Accessory,m001,24.99,mobile_app,social,desktop,Birmingham,2025-02-19,2025-02-20
ceb7803e,9c291269-e781-44,2025-05-01,2025-05-06,AirPods,d633,159.99,website,direct,desktop,Manchester,2025-05-01,2025-05-06
bd4211d1,121d87ac-fb26-4d,2025-04-27,2025-04-29,Accessory,m001,24.99,mobile_app,social,desktop,London,2025-04-27,2025-04-29
21249735,e3346bd8-14a1-46,2025-01-17,2025-01-18,Smartwatch,h301,249.99,website,search,unknown,Liverpool,2025-01-17,2025-01-18
39a9a8a9,1aa3c18e-0aaf-49,22-02-2025,2025-02-27,AirPods,d633,159.99,website,direct,unknown,Liverpool,2025-02-22,2025-02-27
e05f039c,7a438217-6e77-4d,2025-02-13,2025-02-14,iPhone 15,f521,899.99,website,affiliate,mobile,London,2025-02-13,2025-02-14
c82585fa,ee662c46-057d-4e,2025-04-07,2025-04-12,Google Pixel 8,i920,699.99,website,search,unknown,Manchester,2025-04-07,2025-04-12
af001605,9baefd9e-88c0-47,2025-05-10,2025-05-16,Xbox Series X,b104,499.99,mobile_app,email,desktop,Birmingham,2025-05-10,2025-05-16
60920068,7b6fb65b-8d70-40,2025-02-26,02-27-2025,Xbox Series X,b104,499.99,website,affiliate,mobile,London,2025-02-26,2025-02-27
1d96dc53,b38adf82-6e02-4a,2025-04-16,2025-04-21,Nintendo Switch,e682,299.99,website,social,unknown,Manchester,2025-04-16,2025-04-21
5a0ed9b7,9d9b72b9-e5ab-48,2025-04-12,2025-04-14,PS5,a245,479.99,website,search,unknown,London,2025-04-12,2025-04-14
178cb5a0,eb068b1e-6fc0-47,2025-03-16,2025-03-17,PS5,a245,479.99,mobile_app,search,unknown,Birmingham,2025-03-16,2025-03-17
178cb5a0,eb068b1e-6fc0-47,2025-03-16,2025-03-19,MacBook Air,g770,1199.99,mobile_app,social,unknown,Manchester,2025-03-16,2025-03-19
cec7b903,69bea8c9-3a24-4c,2025-04-08,2025-04-14,Steam Deck,c912,499.99,mobile_app,search,mobile,London,2025-04-08,2025-04-14
df8db157,0bb8382f-916b-42,2025-04-21,2025-04-27,iPhone 15,f521,899.99,mobile_app,social,desktop,Manchester,2025-04-21,2025-04-27
704532d5,0e8fed60-d007-4d,2025-05-13,2025-05-18,Smartwatch,h301,249.99,mobile_app,direct,desktop,Sheffield,2025-05-13,2025-05-18
e3f2df80,506a8dd3-0b31-42,2025-04-02,2025-04-08,AirPods,d633,159.99,website,social,mobile,Glasgow,2025-04-02,2025-04-08
e3f2df80,506a8dd3-0b31-42,2025-04-02,2025-04-05,Xbox Series X,b104,499.99,website,social,mobile,Leeds,2025-04-02,2025-04-05
a8575900,21351574-4adb-4f,2025-02-10,2025-02-11,Xbox Series X,b104,499.99,mobile_app,social,unknown,Manchester,2025-02-10,2025-02-11
34b34dcb,138d8006-13a9-4a,2025-04-21,2025-04-23,Google Pixel 8,i920,699.99,mobile_app,direct,unknown,Bristol,2025-04-21,2025-04-23
dbd7b4b4,d03c9c2c-bc37-49,2025-06-09,2025-06-11,iPhone 15,f521,899.99,mobile_app,social,mobile,Birmingham,2025-06-09,2025-06-11
8d28eef5,4d7efc8e-b68f-40,2025-05-06,2025-05-12,Smartwatch,h301,249.99,mobile_app,social,mobile,Leeds,2025-05-06,2025-05-12
51a0bd7c,3e84455f-a755-44,2025-04-17,2025-04-20,Smartwatch,h301,249.99,mobile_app,email,unknown,London,2025-04-17,2025-04-20
692c6843,1ab88733-80e1-4c,2025-03-19,03-21-2025,MacBook Air,g770,1199.99,website,direct,desktop,Glasgow,2025-03-19,2025-03-21
e97c0ea5,7c781b98-9f32-4d,2025-02-21,2025-02-26,Steam Deck,c912,499.99,website,search,mobile,London,2025-02-21,2025-02-26
8d8f2868,855fecc6-f9d7-49,2025-06-09,2025-06-14,Smartwatch,h301,249.99,mobile_app,email,unknown,Birmingham,2025-06-09,2025-06-14
092e9fab,b993c041-5f54-43,2025-04-20,2025-04-22,AirPods,d633,159.99,mobile_app,direct,mobile,Birmingham,2025-04-20,2025-04-22
092e9fab,b993c041-5f54-43,2025-04-20,2025-04-25,PS5,a245,479.99,mobile_app,email,unknown,Glasgow,2025-04-20,2025-04-25
f3fac150,70b6052f-b2c6-49,2025-01-25,2025-01-26,MacBook Air,g770,1199.99,website,direct,mobile,Manchester,2025-01-25,2025-01-26
9696e833,d61968aa-7fb8-46,2025-01-13,01-15-2025,Google Pixel 8,i920,699.99,mobile_app,search,mobile,Glasgow,2025-01-13,2025-01-15
dac5609e,f710900b-d3c1-4e,2025-05-25,2025-05-29,Xbox Series X,b104,499.99,website,direct,mobile,London,2025-05-25,2025-05-29
71ab4711,04d340e8-7ecf-4f,2025-02-09,2025-02-15,Kindle Paperwhite,j877,129.99,website,email,unknown,Manchester,2025-02-09,2025-02-15
88516447,611b92ab-34aa-4a,04-04-2025,2025-04-09,Accessory,m001,24.99,website,social,unknown,London,2025-04-04,2025-04-09
efede7bb,0803ad31-4e1e-4f,2025-02-13,2025-02-15,Steam Deck,c912,499.99,mobile_app,email,mobile,Leicester,2025-02-13,2025-02-15
d4022243,c125798e-9bd6-46,14-01-2025,2025-01-20,Steam Deck,c912,499.99,website,social,mobile,Manchester,2025-01-14,2025-01-20
07001750,c0d978e7-cf6c-41,2025-03-05,2025-03-10,Kindle Paperwhite,j877,129.99,website,affiliate,desktop,Birmingham,2025-03-05,2025-03-10
c8594dfb,9f1c9fd4-d449-49,2025-04-04,2025-04-05,PS5,a245,479.99,website,affiliate,mobile,London,2025-04-04,2025-04-05
8da4afbe,c09d557f-bc44-4f,2025-04-21,2025-04-24,PS5,a245,479.99,mobile_app,direct,unknown,Birmingham,2025-04-21,2025-04-24
fdab0afa,eeb687c3-b8a6-4b,20-04-2025,2025-04-22,Xbox Series X,b104,499.99,mobile_app,affiliate,mobile,Bristol,2025-04-20,2025-04-22
c4ddfe54,6c8073b7-76a8-4a,2025-03-01,2025-03-04,Kindle Paperwhite,j877,129.99,mobile_app,social,mobile,Birmingham,2025-03-01,2025-03-04
fe1be3e9,f5d68c8f-299c-4d,2025-05-01,2025-05-04,Xbox Series X,b104,499.99,mobile_app,affiliate,unknown,Glasgow,2025-05-01,2025-05-04
aebeca58,e85fda55-21c2-48,2025-01-13,2025-01-15,Xbox Series X,b104,499.99,website,social,desktop,Bristol,2025-01-13,2025-01-15
aebeca58,e85fda55-21c2-48,2025-01-18,2025-01-13,Google Pixel 8,i920,699.99,mobile_app,direct,unknown,Manchester,2025-01-18,2025-01-13
4bbb2e9a,ffb1c192-15e5-4e,2025-05-19,2025-05-25,Google Pixel 8,i920,699.99,mobile_app,email,unknown,Leeds,2025-05-19,2025-05-25
44cca057,09e218a7-6504-45,2025-05-12,2025-05-13,Steam Deck,c912,499.99,website,social,desktop,Leeds,2025-05-12,2025-05-13
0328a80d,a72d0bf4-c84d-46,2025-01-23,2025-01-25,Nintendo Switch,e682,299.99,mobile_app,social,mobile,Glasgow,2025-01-23,2025-01-25
0328a80d,a72d0bf4-c84d-46,2025-01-23,01-25-2025,Smartwatch,h301,249.99,website,search,unknown,Glasgow,2025-01-23,2025-01-25
d8fbd542,a928a5b2-9185-4a,2025-06-21,2025-06-25,iPhone 15,f521,899.99,website,social,desktop,Birmingham,2025-06-21,2025-06-25
09791408,046b96f9-7675-49,2025-06-21,2025-06-27,Smartwatch,h301,249.99,mobile_app,email,desktop,Manchester,2025-06-21,2025-06-27
09791408,046b96f9-7675-49,21-06-2025,2025-06-22,iPhone 15,f521,899.99,website,direct,unknown,Glasgow,2025-06-21,2025-06-22
689ab92d,a34321bf-7aee-47,2025-02-05,2025-02-11,AirPods,d633,159.99,mobile_app,direct,desktop,London,2025-02-05,2025-02-11
8d2bb00b,145d2f7e-f057-41,2025-04-26,2025-04-28,Accessory,m001,24.99,mobile_app,email,unknown,Birmingham,2025-04-26,2025-04-28
c96782fb,70c0a4f6-1065-47,2025-03-08,03-11-2025,PS5,a245,479.99,mobile_app,affiliate,unknown,Manchester,2025-03-08,2025-03-11
2cabb9ad,7eb3a98f-de7a-49,2025-05-26,2025-05-30,Kindle Paperwhite,j877,129.99,website,email,mobile,Glasgow,2025-05-26,2025-05-30
a793eb81,a7ee2f23-9e31-4c,2025-02-02,2025-02-07,Steam Deck,c912,499.99,mobile_app,search,desktop,Manchester,2025-02-02,2025-02-07
513cd464,81b85934-af37-4c,2025-03-11,2025-03-14,Smartwatch,h301,249.99,website,affiliate,unknown,Birmingham,2025-03-11,2025-03-14
fdf1d205,3a5b171c-b7a4-41,2025-03-02,03-08-2025,Steam Deck,c912,499.99,mobile_app,email,mobile,Glasgow,2025-03-02,2025-03-08
d972c236,0420521e-41e7-4b,2025-02-19,2025-02-22,MacBook Air,g770,1199.99,website,email,unknown,Birmingham,2025-02-19,2025-02-22
d972c236,0420521e-41e7-4b,2025-02-19,02-23-2025,Accessory,m001,24.99,website,email,unknown,Bristol,2025-02-19,2025-02-23
d972c236,0420521e-41e7-4b,2025-02-19,2025-02-21,Nintendo Switch,e682,299.99,website,search,desktop,Leeds,2025-02-19,2025-02-21
1bf2235c,0b73a040-b7e3-46,2025-03-12,2025-03-16,AirPods,d633,159.99,website,social,mobile,Manchester,2025-03-12,2025-03-16
343c1752,1cf98855-719d-45,16-04-2025,2025-04-17,MacBook Air,g770,1199.99,mobile_app,social,mobile,Leeds,2025-04-16,2025-04-17
343c1752,1cf98855-719d-45,2025-04-16,2025-04-21,iPhone 15,f521,899.99,mobile_app,social,unknown,Nottingham,2025-04-16,2025-04-21
1246d2a5,d44260d2-5f11-48,2025-02-09,2025-02-11,iPhone 15,f521,899.99,mobile_app,email,unknown,Manchester,2025-02-09,2025-02-11
9b622c0a,4878383a-e037-49,2025-03-19,2025-03-23,Steam Deck,c912,499.99,mobile_app,email,desktop,London,2025-03-19,2025-03-23
5fed5cb7,f9a013be-55c1-40,2025-03-03,2025-03-09,Smartwatch,h301,249.99,website,email,unknown,Liverpool,2025-03-03,2025-03-09
5fed5cb7,f9a013be-55c1-40,2025-03-03,2025-03-04,PS5,a245,479.99,website,affiliate,desktop,Manchester,2025-03-03,2025-03-04
5e4908c8,4b47b715-f937-4f,2025-01-24,2025-01-26,PS5,a245,479.99,mobile_app,affiliate,desktop,Manchester,2025-01-24,2025-01-26
1b3206f0,266a8b90-ee28-42,2025-05-25,2025-05-27,Kindle Paperwhite,j877,129.99,website,affiliate,desktop,Manchester,2025-05-25,2025-05-27
bdf68eb0,5027b309-cedb-44,2025-06-27,2025-07-03,Nintendo Switch,e682,299.99,mobile_app,search,desktop,Bristol,2025-06-27,2025-07-03
60fba34c,b67cb2ac-94dc-4c,2025-04-17,04-22-2025,Xbox Series X,b104,499.99,mobile_app,email,unknown,Glasgow,2025-04-17,2025-04-22
c33a8761,a8350a40-0858-41,2025-04-03,04-08-2025,PS5,a245,479.99,website,affiliate,unknown,Glasgow,2025-04-03,2025-04-08
fe08a540,f486a251-1414-48,2025-04-18,2025-04-16,Xbox Series X,b104,499.99,website,direct,desktop,Bristol,2025-04-18,2025-04-16
bbe43aa7,ff70abaa-80e5-4b,2025-01-18,01-19-2025,PS5,a245,479.99,mobile_app,direct,desktop,Manchester,2025-01-18,2025-01-19
bbe43aa7,ff70abaa-80e5-4b,2025-01-18,2025-01-24,Nintendo Switch,e682,299.99,website,social,,London,2025-01-18,2025-01-24
cc5732f2,1f09bd6b-bba8-41,2025-04-13,2025-04-18,Accessory,m001,24.99,website,social,desktop,Manchester,2025-04-13,2025-04-18
5122f001,a8c12f22-78ea-40,2025-04-12,2025-04-17,Smartwatch,h301,249.99,website,social,mobile,Manchester,2025-04-12,2025-04-17
5122f001,a8c12f22-78ea-40,2025-04-12,2025-04-17,Accessory,m001,24.99,website,social,desktop,Manchester,2025-04-12,2025-04-17
5424aae4,93432c76-d604-4e,2025-03-15,03-16-2025,Google Pixel 8,i920,699.99,website,direct,desktop,London,2025-03-15,2025-03-16
5097ce46,fa3bc921-c484-47,2025-06-18,2025-06-20,AirPods,d633,159.99,website,affiliate,unknown,London,2025-06-18,2025-06-20
f525d556,b16d3da7-1d8b-46,2025-04-15,2025-04-17,PS5,45a2,479.99,website,email,desktop,London,2025-04-15,2025-04-17
1391d18a,14669189-5ca4-4e,2025-03-11,03-15-2025,Xbox Series X,b104,499.99,mobile_app,search,mobile,Birmingham,2025-03-11,2025-03-15
1391d18a,14669189-5ca4-4e,11-03-2025,2025-03-17,Google Pixel 8,i920,699.99,mobile_app,direct,mobile,Leeds,2025-03-11,2025-03-17
c94b3a6f,7bf18cf4-a740-41,2025-02-13,2025-02-16,AirPods,d633,159.99,website,search,desktop,Leeds,2025-02-13,2025-02-16
ecfbc936,d3ec1562-91c0-49,2025-05-24,2025-05-30,Accessory,m001,24.99,mobile_app,email,desktop,Glasgow,2025-05-24,2025-05-30
ecfbc936,d3ec1562-91c0-49,2025-05-24,2025-05-25,PS5,a245,479.99,website,social,mobile,Glasgow,2025-05-24,2025-05-25
aa7898aa,e8c5a3b0-c6c5-40,2025-01-14,2025-01-19,Nintendo Switch,e682,299.99,mobile_app,affiliate,unknown,Manchester,2025-01-14,2025-01-19
1e32e3e1,cbbd3732-42a1-44,2025-06-02,2025-06-03,Smartwatch,h301,249.99,website,email,unknown,Sheffield,2025-06-02,2025-06-03
7e83e815,81496136-6bc8-42,02-05-2025,2025-05-08,iPhone 15,f521,899.99,website,search,mobile,Glasgow,2025-05-02,2025-05-08
7e83e815,81496136-6bc8-42,02-05-2025,2025-05-06,iPhone 15,f521,899.99,mobile_app,social,mobile,Liverpool,2025-05-02,2025-05-06
743de03a,32b6f533-c5cc-4f,2025-04-04,2025-04-07,Smartwatch,h301,249.99,mobile_app,email,unknown,Glasgow,2025-04-04,2025-04-07
743de03a,32b6f533-c5cc-4f,2025-04-04,2025-04-06,Steam Deck,c912,499.99,website,affiliate,unknown,Birmingham,2025-04-04,2025-04-06
743de03a,32b6f533-c5cc-4f,2025-04-04,2025-04-08,iPhone 15,f521,899.99,mobile_app,social,mobile,London,2025-04-04,2025-04-08
b61d1f43,6b2b0c27-1eec-44,2025-04-03,2025-04-07,MacBook Air,g770,1199.99,mobile_app,social,desktop,London,2025-04-03,2025-04-07
b61d1f43,6b2b0c27-1eec-44,2025-04-03,2025-04-09,Xbox Series X,b104,499.99,mobile_app,social,desktop,London,2025-04-03,2025-04-09
b61d1f43,6b2b0c27-1eec-44,2025-04-03,2025-04-06,Xbox Series X,b104,499.99,mobile_app,direct,mobile,Manchester,2025-04-03,2025-04-06
d577c131,19dad534-be2b-4d,2025-04-17,2025-04-18,iPhone 15,f521,899.99,mobile_app,direct,desktop,London,2025-04-17,2025-04-18
d577c131,19dad534-be2b-4d,2025-04-17,2025-04-19,Kindle Paperwhite,j877,129.99,website,affiliate,desktop,Leeds,2025-04-17,2025-04-19
83d04bac,2abc4b2f-b0a6-44,2025-05-24,2025-05-28,MacBook Air,g770,1199.99,website,email,mobile,Birmingham,2025-05-24,2025-05-28
20a0c244,635b729c-eb2a-40,2025-02-07,2025-02-08,Steam Deck,c912,499.99,mobile_app,social,desktop,London,2025-02-07,2025-02-08
5639117a,3dcead91-8e93-4b,2025-02-14,2025-02-19,AirPods,d633,159.99,mobile_app,direct,desktop,Leeds,2025-02-14,2025-02-19
1b96ee81,562e121f-e5fa-45,2025-03-06,2025-03-11,Smartwatch,h301,249.99,mobile_app,social,mobile,Glasgow,2025-03-06,2025-03-11
1b96ee81,562e121f-e5fa-45,2025-03-06,2025-03-10,Xbox Series X,b104,499.99,website,email,desktop,Leeds,2025-03-06,2025-03-10
f32de530,12e1725b-0b94-42,2025-05-04,2025-05-07,PS5,a245,479.99,mobile_app,search,mobile,Glasgow,2025-05-04,2025-05-07
f32de530,12e1725b-0b94-42,2025-05-04,2025-05-06,Xbox Series X,b104,499.99,mobile_app,direct,mobile,Glasgow,2025-05-04,2025-05-06
6f8963b3,a17e34b0-68ac-43,2025-04-24,2025-04-25,Smartwatch,h301,249.99,mobile_app,direct,mobile,Manchester,2025-04-24,2025-04-25
b944e469,b33aa6b9-7a23-4f,2025-01-10,2025-01-13,Accessory,m001,24.99,mobile_app,search,desktop,Manchester,2025-01-10,2025-01-13
26fa466b,d1f2789b-ea95-41,2025-06-08,2025-06-10,Kindle Paperwhite,j877,129.99,mobile_app,email,unknown,Manchester,2025-06-08,2025-06-10
741a5b09,97d20300-97f3-4b,2025-04-13,2025-04-19,iPhone 15,f521,899.99,website,email,unknown,Bristol,2025-04-13,2025-04-19
47802d60,2d3dab8a-7047-4d,2025-04-25,2025-04-26,Smartwatch,h301,249.99,website,social,mobile,Glasgow,2025-04-25,2025-04-26
0c5c9940,3b759faa-18ce-48,2025-04-01,2025-04-03,MacBook Air,g770,1199.99,website,email,unknown,Sheffield,2025-04-01,2025-04-03
0c5c9940,3b759faa-18ce-48,2025-04-01,2025-04-04,Steam Deck,129c,499.99,mobile_app,email,unknown,Manchester,2025-04-01,2025-04-04
0c5c9940,3b759faa-18ce-48,2025-04-01,2025-04-06,iPhone 15,f521,899.99,mobile_app,direct,desktop,London,2025-04-01,2025-04-06
ed944378,8673173a-e5b5-4f,2025-05-06,2025-05-12,iPhone 15,f521,899.99,website,search,unknown,Bristol,2025-05-06,2025-05-12
ed944378,8673173a-e5b5-4f,2025-05-06,2025-05-08,Steam Deck,c912,499.99,mobile_app,search,mobile,Manchester,2025-05-06,2025-05-08
f41978cd,62524390-52a3-46,2025-04-08,2025-04-11,Nintendo Switch,e682,299.99,website,social,desktop,London,2025-04-08,2025-04-11
bb21d347,f1eef895-d061-46,2025-03-07,03-10-2025,Kindle Paperwhite,j877,129.99,website,search,mobile,Leeds,2025-03-07,2025-03-10
507a61a9,473bccd4-84e6-47,2025-05-20,05-25-2025,Smartwatch,h301,249.99,mobile_app,affiliate,mobile,Birmingham,2025-05-20,2025-05-25
507a61a9,473bccd4-84e6-47,2025-05-20,2025-05-22,MacBook Air,g770,1199.99,mobile_app,direct,mobile,London,2025-05-20,2025-05-22
507a61a9,473bccd4-84e6-47,2025-05-20,2025-05-24,Nintendo Switch,e682,299.99,website,direct,unknown,Glasgow,2025-05-20,2025-05-24
7c9428af,2a6445d3-48e8-4f,2025-03-16,2025-03-19,Nintendo Switch,e682,299.99,mobile_app,search,mobile,Liverpool,2025-03-16,2025-03-19
4269f091,2b589b3f-e2a6-4e,18-04-2025,04-20-2025,Google Pixel 8,i920,699.99,mobile_app,email,,Manchester,2025-04-18,2025-04-20
4269f091,2b589b3f-e2a6-4e,2025-04-23,2025-04-18,iPhone 15,f521,899.99,website,direct,unknown,Glasgow,2025-04-23,2025-04-18
47543604,1b2aa4e4-c0e3-44,2025-02-13,2025-02-14,Kindle Paperwhite,j877,129.99,mobile_app,affiliate,unknown,Manchester,2025-02-13,2025-02-14
2b39e995,8d5a9549-34f3-4b,2025-04-03,2025-04-08,Steam Deck,c912,499.99,mobile_app,direct,mobile,Bristol,2025-04-03,2025-04-08
2b39e995,8d5a9549-34f3-4b,2025-04-03,2025-04-09,MacBook Air,g770,1199.99,website,email,mobile,Sheffield,2025-04-03,2025-04-09
89b4db80,0a2cbb1b-e70c-42,2025-04-14,2025-04-16,Steam Deck,c912,499.99,mobile_app,affiliate,desktop,London,2025-04-14,2025-04-16
89b4db80,0a2cbb1b-e70c-42,2025-04-14,2025-04-20,Accessory,m001,24.99,mobile_app,affiliate,mobile,Manchester,2025-04-14,2025-04-20
5e9a35cf,7d058c07-01b4-4d,07-04-2025,2025-04-09,Smartwatch,h301,249.99,mobile_app,social,unknown,Manchester,2025-04-07,2025-04-09
71e007b0,f2a83faa-f11a-41,2025-04-25,2025-04-30,Xbox Series X,b104,499.99,mobile_app,email,desktop,London,2025-04-25,2025-04-30
71e007b0,f2a83faa-f11a-41,2025-04-25,2025-04-29,AirPods,d633,159.99,mobile_app,direct,unknown,Birmingham,2025-04-25,2025-04-29
71e007b0,f2a83faa-f11a-41,2025-04-25,2025-04-29,Kindle Paperwhite,j877,129.99,mobile_app,direct,unknown,Leeds,2025-04-25,2025-04-29
b75c3825,742f790e-d4be-44,2025-01-17,2025-01-20,Xbox Series X,b104,499.99,website,affiliate,desktop,London,2025-01-17,2025-01-20
7e45fee4,1eb46d3b-d841-46,08-02-2025,2025-02-13,iPhone 15,f521,899.99,mobile_app,email,desktop,London,2025-02-08,2025-02-13
7e45fee4,1eb46d3b-d841-46,2025-02-08,2025-02-14,iPhone 15,f521,899.99,mobile_app,search,desktop,London,2025-02-08,2025-02-14
ab30f1b1,230681aa-dd50-4d,2025-06-20,2025-06-24,Accessory,m001,24.99,mobile_app,social,desktop,London,2025-06-20,2025-06-24
38f1f1ab,cdbb6c1f-5a8d-48,2025-04-17,2025-04-22,iPhone 15,f521,899.99,website,email,mobile,Manchester,2025-04-17,2025-04-22
7416386b,281f45ff-53bd-4b,2025-04-08,2025-04-13,Kindle Paperwhite,787j,129.99,website,search,desktop,Leicester,2025-04-08,2025-04-13
b01cad4e,ac0d8818-8349-40,2025-04-22,2025-04-26,Xbox Series X,b104,499.99,website,affiliate,desktop,London,2025-04-22,2025-04-26
b481acde,09d1c11f-ecbb-4a,2025-04-02,2025-04-03,Xbox Series X,b104,499.99,website,direct,desktop,Manchester,2025-04-02,2025-04-03
d66f3fff,30bdf7be-5149-46,2025-01-23,2025-01-26,iPhone 15,f521,899.99,mobile_app,affiliate,mobile,Manchester,2025-01-23,2025-01-26
3ef433df,f2fda085-091f-43,2025-02-17,2025-02-18,iPhone 15,f521,899.99,mobile_app,social,unknown,Manchester,2025-02-17,2025-02-18
3217f93c,df42eabd-604f-4c,08-01-2025,2025-01-13,Nintendo Switch,e682,299.99,mobile_app,social,unknown,Manchester,2025-01-08,2025-01-13
7f297630,7c08a960-26c4-41,2025-04-22,2025-04-27,Xbox Series X,b104,499.99,website,direct,mobile,Birmingham,2025-04-22,2025-04-27
7f297630,7c08a960-26c4-41,2025-04-22,2025-04-23,Xbox Series X,b104,499.99,mobile_app,direct,desktop,Manchester,2025-04-22,2025-04-23
7f297630,7c08a960-26c4-41,2025-04-22,2025-04-28,Nintendo Switch,e682,299.99,website,affiliate,unknown,Liverpool,2025-04-22,2025-04-28
842ca512,a2807710-32d5-4d,2025-05-06,2025-05-10,Steam Deck,c912,499.99,website,affiliate,desktop,Glasgow,2025-05-06,2025-05-10
7d9def75,36d5187b-bfdb-41,24-02-2025,02-26-2025,Steam Deck,c912,499.99,website,search,mobile,Glasgow,2025-02-24,2025-02-26
b01f90e7,b5c1f027-3563-45,2025-01-04,2025-01-08,iPhone 15,f521,899.99,mobile_app,affiliate,unknown,Glasgow,2025-01-04,2025-01-08
5944a69c,a18af1fd-615a-43,2025-04-24,04-28-2025,AirPods,d633,159.99,website,social,unknown,London,2025-04-24,2025-04-28
5944a69c,a18af1fd-615a-43,2025-04-24,2025-04-25,PS5,a245,479.99,website,search,desktop,London,2025-04-24,2025-04-25
d73794d5,f44f5031-a82d-48,2025-05-13,2025-05-15,Steam Deck,c912,499.99,mobile_app,affiliate,mobile,Glasgow,2025-05-13,2025-05-15
d73794d5,f44f5031-a82d-48,2025-05-13,2025-05-18,PS5,a245,479.99,mobile_app,search,desktop,Leeds,2025-05-13,2025-05-18
a1497b65,ab00764e-4ac8-4b,2025-04-25,2025-04-27,MacBook Air,g770,1199.99,website,search,desktop,Liverpool,2025-04-25,2025-04-27
a1497b65,ab00764e-4ac8-4b,2025-04-25,2025-05-01,Accessory,m001,24.99,mobile_app,email,unknown,Glasgow,2025-04-25,2025-05-01
380bd4cb,8b1d2284-5b6c-4b,2025-04-16,2025-04-21,iPhone 15,f521,899.99,mobile_app,direct,desktop,Manchester,2025-04-16,2025-04-21
6b6a838e,e595e3fa-e182-48,2025-03-22,2025-03-25,Kindle Paperwhite,j877,129.99,mobile_app,direct,mobile,Manchester,2025-03-22,2025-03-25
6b6a838e,e595e3fa-e182-48,2025-03-22,2025-03-26,AirPods,d633,159.99,website,email,mobile,Bristol,2025-03-22,2025-03-26
2d1b143e,3f555c7d-534d-48,2025-04-07,2025-04-11,Nintendo Switch,e682,299.99,mobile_app,direct,desktop,Liverpool,2025-04-07,2025-04-11
2d1b143e,3f555c7d-534d-48,07-04-2025,04-08-2025,PS5,a245,479.99,mobile_app,affiliate,unknown,London,2025-04-07,2025-04-08
65e92e49,a91decb2-51a3-42,2025-01-17,2025-01-19,Steam Deck,c912,499.99,mobile_app,direct,,London,2025-01-17,2025-01-19
dd2fb568,e1d5fcea-c610-42,2025-04-22,2025-04-25,AirPods,d633,159.99,mobile_app,affiliate,unknown,London,2025-04-22,2025-04-25
4496a883,afedc6c3-6979-45,2025-02-13,2025-02-15,Accessory,m001,24.99,mobile_app,direct,unknown,Manchester,2025-02-13,2025-02-15
8ff01845,d9da5f47-e3ca-40,2025-01-18,2025-01-21,Nintendo Switch,e682,299.99,website,direct,desktop,Birmingham,2025-01-18,2025-01-21
cf1ca021,accc1507-42f8-4f,2025-03-02,2025-03-04,iPhone 15,f521,899.99,mobile_app,social,unknown,Birmingham,2025-03-02,2025-03-04
7c4a14cf,42bd31c4-660f-4c,2025-03-07,2025-03-11,iPhone 15,f521,899.99,mobile_app,search,desktop,Bristol,2025-03-07,2025-03-11
72984bb6,a2e25753-56ff-4b,2025-02-15,2025-02-19,Smartwatch,h301,249.99,mobile_app,direct,desktop,Liverpool,2025-02-15,2025-02-19
c790b84c,e028c315-928f-4b,2025-02-18,2025-02-19,Kindle Paperwhite,j877,129.99,website,affiliate,unknown,Manchester,2025-02-18,2025-02-19
21144198,f7df9baf-f2a8-4e,2025-04-20,2025-04-21,Nintendo Switch,e682,299.99,mobile_app,affiliate,mobile,Manchester,2025-04-20,2025-04-21
61127927,f34574ae-0519-48,2025-04-21,04-25-2025,Smartwatch,h301,249.99,website,affiliate,desktop,Birmingham,2025-04-21,2025-04-25
61127927,f34574ae-0519-48,2025-04-21,2025-04-23,iPhone 15,f521,899.99,website,social,unknown,Manchester,2025-04-21,2025-04-23
c4196c8a,55525e11-b469-48,2025-04-08,2025-04-09,iPhone 15,15f2,899.99,mobile_app,social,unknown,London,2025-04-08,2025-04-09
8914bc96,0c995e2d-a7a9-48,09-02-2025,2025-02-12,Nintendo Switch,e682,299.99,website,affiliate,mobile,Birmingham,2025-02-09,2025-02-12
b7c315a2,d690efa9-2830-4f,2025-04-21,2025-04-24,Xbox Series X,b104,499.99,mobile_app,direct,desktop,Glasgow,2025-04-21,2025-04-24
69d445f3,2951c8a7-cd21-4a,07-04-2025,2025-04-13,Accessory,m001,24.99,website,social,desktop,Glasgow,2025-04-07,2025-04-13
69d445f3,2951c8a7-cd21-4a,2025-04-08,2025-04-07,Nintendo Switch,e682,299.99,website,direct,mobile,Bristol,2025-04-08,2025-04-07
d8718196,3fab0c74-bbbb-4c,2025-04-05,2025-04-11,Kindle Paperwhite,j877,129.99,mobile_app,email,desktop,Manchester,2025-04-05,2025-04-11
d8718196,3fab0c74-bbbb-4c,2025-04-05,2025-04-09,Kindle Paperwhite,j877,129.99,website,direct,desktop,Birmingham,2025-04-05,2025-04-09
ca957c2e,86cc556b-f0bb-4e,2025-03-05,2025-03-09,PS5,a245,479.99,mobile_app,affiliate,desktop,Nottingham,2025-03-05,2025-03-09
a1ad9f14,4878917a-282d-44,2025-01-02,01-06-2025,Smartwatch,h301,249.99,mobile_app,social,desktop,Birmingham,2025-01-02,2025-01-06
d0207ede,08a5ad03-3f4f-40,2025-02-12,2025-02-17,Nintendo Switch,e682,299.99,website,affiliate,mobile,London,2025-02-12,2025-02-17
d0207ede,08a5ad03-3f4f-40,12-02-2025,2025-02-18,AirPods,d633,159.99,mobile_app,,mobile,London,2025-02-12,2025-02-18
e06a46b2,66979d0f-a7c0-4a,2025-04-03,2025-04-09,Nintendo Switch,e682,299.99,mobile_app,direct,desktop,Leeds,2025-04-03,2025-04-09
b417dee1,13974770-15bd-48,2025-05-18,2025-05-19,Smartwatch,h301,249.99,website,search,mobile,London,2025-05-18,2025-05-19
8aacb783,0528d309-6a56-48,2025-03-10,2025-03-16,Google Pixel 8,i920,699.99,mobile_app,direct,unknown,Manchester,2025-03-10,2025-03-16
6420b22a,187666ec-26df-4b,2025-03-06,03-09-2025,Nintendo Switch,e682,299.99,mobile_app,affiliate,unknown,Glasgow,2025-03-06,2025-03-09
6cd6cedf,dbfb491a-9b0e-4a,2025-05-31,2025-05-27,iPhone 15,f521,899.99,mobile_app,search,desktop,Leicester,2025-05-31,2025-05-27
198493ce,4d59f68e-05ff-42,01-04-2025,2025-04-07,iPhone 15,f521,899.99,mobile_app,search,unknown,,2025-04-01,2025-04-07
6df5fa4a,9381ebb3-a7f2-40,2025-06-09,2025-06-12,Xbox Series X,b104,499.99,mobile_app,social,desktop,,2025-06-09,2025-06-12
6df5fa4a,9381ebb3-a7f2-40,2025-06-09,2025-06-13,Kindle Paperwhite,j877,129.99,mobile_app,social,mobile,Glasgow,2025-06-09,2025-06-13
48cff1da,68054a24-f785-4c,2025-05-11,05-13-2025,AirPods,d633,159.99,mobile_app,search,mobile,London,2025-05-11,2025-05-13
fe3f5662,81b01ca4-8880-4d,2025-04-13,2025-04-17,iPhone 15,f521,899.99,website,search,mobile,Sheffield,2025-04-13,2025-04-17
b6eea1cf,f392b60b-64c5-4e,2025-01-05,2025-01-08,Xbox Series X,b104,499.99,mobile_app,social,mobile,London,2025-01-05,2025-01-08
b6eea1cf,f392b60b-64c5-4e,2025-01-05,2025-01-11,Google Pixel 8,i920,699.99,website,affiliate,mobile,London,2025-01-05,2025-01-11
c56dbe29,93efe8f0-395c-4d,2025-03-10,2025-03-16,Google Pixel 8,i920,699.99,website,search,mobile,Leeds,2025-03-10,2025-03-16
4f842010,7a0ffa86-5eac-41,2025-04-26,2025-05-02,Google Pixel 8,i920,699.99,website,search,desktop,Glasgow,2025-04-26,2025-05-02
8f962ff2,a1420851-cf47-4d,2025-04-22,2025-04-28,Steam Deck,c912,499.99,mobile_app,affiliate,mobile,London,2025-04-22,2025-04-28
1579bc24,f12d0664-dd65-49,2025-03-17,2025-03-22,PS5,a245,479.99,website,search,desktop,Birmingham,2025-03-17,2025-03-22
d6f34d9b,d68bc80f-9dd2-40,2025-06-08,2025-06-09,Kindle Paperwhite,j877,129.99,mobile_app,search,unknown,London,2025-06-08,2025-06-09
696f9074,0f163af8-3b80-44,2025-04-22,2025-04-28,Xbox Series X,b104,499.99,website,email,mobile,Manchester,2025-04-22,2025-04-28
b062259e,d5963842-567e-4c,2025-05-12,05-15-2025,PS5,a245,479.99,mobile_app,search,mobile,London,2025-05-12,2025-05-15
358fb73f,df15e667-6812-41,2025-05-17,2025-05-23,Google Pixel 8,i920,699.99,mobile_app,direct,unknown,London,2025-05-17,2025-05-23
358fb73f,df15e667-6812-41,2025-05-17,2025-05-23,iPhone 15,f521,899.99,mobile_app,affiliate,desktop,Manchester,2025-05-17,2025-05-23
f5a02c0a,7d1d3494-cb71-4e,2025-06-24,2025-06-30,Accessory,m001,24.99,mobile_app,direct,unknown,London,2025-06-24,2025-06-30
f5a02c0a,7d1d3494-cb71-4e,2025-06-24,06-30-2025,Steam Deck,c912,499.99,website,search,desktop,London,2025-06-24,2025-06-30
8e07d8fc,761c7a2b-5263-48,2025-04-09,2025-04-11,Smartwatch,h301,249.99,website,email,desktop,Bristol,2025-04-09,2025-04-11
6cfacecc,bbaa6e4a-fe25-47,2025-06-26,2025-06-29,MacBook Air,g770,1199.99,website,search,unknown,London,2025-06-26,2025-06-29
851ab93f,209595a4-602c-46,2025-06-16,2025-06-18,PS5,a245,479.99,website,affiliate,desktop,Manchester,2025-06-16,2025-06-18
1d191f64,3286af00-2a8b-42,2025-04-02,2025-04-03,AirPods,d633,159.99,website,direct,unknown,Glasgow,2025-04-02,2025-04-03
864b789a,7ec469d8-6c97-44,2025-05-13,2025-05-14,PS5,a245,479.99,mobile_app,social,desktop,Glasgow,2025-05-13,2025-05-14
025ec446,dfcc8eb4-bfbe-48,2025-06-17,2025-06-20,MacBook Air,g770,1199.99,mobile_app,affiliate,unknown,Leeds,2025-06-17,2025-06-20
e15680e9,fee91972-6f7b-43,2025-01-01,2025-01-04,Kindle Paperwhite,j877,129.99,mobile_app,social,mobile,Manchester,2025-01-01,2025-01-04
e15680e9,fee91972-6f7b-43,2025-01-01,2025-01-04,Steam Deck,c912,499.99,mobile_app,search,unknown,Glasgow,2025-01-01,2025-01-04
e15680e9,fee91972-6f7b-43,2025-01-01,2025-01-07,Smartwatch,h301,249.99,website,social,desktop,Liverpool,2025-01-01,2025-01-07
9055e085,5287e5f4-85c1-41,2025-04-24,2025-04-27,Smartwatch,h301,249.99,mobile_app,affiliate,mobile,London,2025-04-24,2025-04-27
cd853347,4a4a5612-243a-4f,2025-02-25,2025-03-01,Smartwatch,h301,249.99,website,social,unknown,Manchester,2025-02-25,2025-03-01
78dc340b,5f0a74fb-b6e7-42,2025-03-06,2025-03-11,Kindle Paperwhite,j877,129.99,mobile_app,social,desktop,Birmingham,2025-03-06,2025-03-11
ff0614bb,54867db3-efaa-47,2025-04-04,2025-04-05,MacBook Air,g770,1199.99,mobile_app,affiliate,mobile,Bristol,2025-04-04,2025-04-05
ff0614bb,54867db3-efaa-47,2025-04-04,2025-04-09,AirPods,d633,159.99,website,affiliate,desktop,London,2025-04-04,2025-04-09
ff0614bb,54867db3-efaa-47,2025-04-04,2025-04-05,Accessory,m001,24.99,mobile_app,social,unknown,Glasgow,2025-04-04,2025-04-05
794f9276,2a0b83f4-22a5-47,2025-04-02,2025-04-04,iPhone 15,f521,899.99,mobile_app,affiliate,mobile,Glasgow,2025-04-02,2025-04-04
794f9276,2a0b83f4-22a5-47,2025-04-02,2025-04-07,AirPods,d633,159.99,mobile_app,direct,unknown,Manchester,2025-04-02,2025-04-07
fe4995a4,2de1bda4-6a92-44,2025-05-25,2025-05-26,MacBook Air,g770,1199.99,website,direct,unknown,London,2025-05-25,2025-05-26
1806699f,b3932fb8-4fd4-47,2025-05-26,2025-05-27,Accessory,m001,24.99,mobile_app,affiliate,unknown,Leeds,2025-05-26,2025-05-27
982e2afd,183f36db-54be-47,2025-04-24,2025-04-28,Xbox Series X,b104,499.99,mobile_app,search,mobile,Manchester,2025-04-24,2025-04-28
584f218a,a2e768d7-59b7-46,2025-03-14,03-20-2025,Google Pixel 8,i920,699.99,website,email,unknown,London,2025-03-14,2025-03-20
584f218a,a2e768d7-59b7-46,2025-03-14,03-20-2025,PS5,a245,479.99,mobile_app,direct,mobile,Leeds,2025-03-14,2025-03-20
e958c430,3150e60d-ed89-42,2025-04-21,04-23-2025,AirPods,d633,159.99,website,email,unknown,London,2025-04-21,2025-04-23
c4596172,bab4eb77-959f-48,2025-04-15,2025-04-19,iPhone 15,f521,899.99,website,direct,desktop,Manchester,2025-04-15,2025-04-19
c4596172,bab4eb77-959f-48,2025-04-15,2025-04-19,Steam Deck,c912,499.99,mobile_app,direct,desktop,Glasgow,2025-04-15,2025-04-19
33dcd09c,8fa50e32-4137-41,2025-01-04,01-10-2025,MacBook Air,g770,1199.99,website,social,desktop,Leeds,2025-01-04,2025-01-10
2da6b974,1a5ca752-2705-4d,2025-05-10,2025-05-12,AirPods,d633,159.99,website,email,unknown,Manchester,2025-05-10,2025-05-12
2da6b974,1a5ca752-2705-4d,2025-05-10,2025-05-14,Kindle Paperwhite,j877,129.99,website,social,unknown,,2025-05-10,2025-05-14
a513964e,206faddb-1a31-48,2025-02-21,2025-02-22,PS5,a245,479.99,website,direct,desktop,,2025-02-21,2025-02-22
a513964e,206faddb-1a31-48,2025-02-21,02-26-2025,Kindle Paperwhite,j877,129.99,website,social,mobile,Liverpool,2025-02-21,2025-02-26
9ad28c4a,935e2c27-5485-40,2025-05-09,2025-05-15,iPhone 15,f521,899.99,mobile_app,affiliate,unknown,Leeds,2025-05-09,2025-05-15
9ad28c4a,935e2c27-5485-40,2025-05-09,2025-05-15,Google Pixel 8,i920,699.99,mobile_app,search,desktop,London,2025-05-09,2025-05-15
e8c347d0,bcbd6eeb-ceab-4f,2025-05-19,2025-05-23,MacBook Air,g770,1199.99,website,email,mobile,Glasgow,2025-05-19,2025-05-23
e8c347d0,bcbd6eeb-ceab-4f,2025-05-19,2025-05-25,Google Pixel 8,i920,699.99,mobile_app,affiliate,desktop,Glasgow,2025-05-19,2025-05-25
3768d6aa,00af085d-2b08-4f,2025-04-01,2025-04-04,PS5,a245,479.99,mobile_app,social,mobile,Nottingham,2025-04-01,2025-04-04
79b8023d,9d6ba3b5-cda8-48,2025-03-17,2025-03-19,Google Pixel 8,i920,699.99,website,affiliate,desktop,Nottingham,2025-03-17,2025-03-19
2310c9fb,13e9e070-52c6-45,22-02-2025,2025-02-23,Xbox Series X,b104,499.99,website,direct,mobile,Manchester,2025-02-22,2025-02-23
4d747649,6ce763e1-708f-45,2025-05-07,2025-05-12,Accessory,m001,24.99,mobile_app,search,,Leeds,2025-05-07,2025-05-12
c61f98b1,3da34aca-1e07-44,2025-03-24,2025-03-25,Smartwatch,h301,249.99,website,search,mobile,Manchester,2025-03-24,2025-03-25
51251262,5ae0bb5a-7977-43,2025-03-23,2025-03-28,PS5,a245,479.99,website,direct,desktop,London,2025-03-23,2025-03-28
2a869922,9afa3fb4-e21f-41,2025-02-06,2025-02-09,Xbox Series X,b104,499.99,website,social,desktop,London,2025-02-06,2025-02-09
6fef2c5d,4719c1a8-d567-42,2025-02-06,2025-02-07,iPhone 15,f521,899.99,website,affiliate,unknown,London,2025-02-06,2025-02-07
1ec80917,b1f20ebf-7d76-44,2025-05-04,2025-05-07,Accessory,m001,24.99,website,email,desktop,Liverpool,2025-05-04,2025-05-07
ddbb3fa4,a6ef8273-6f77-40,2025-01-25,2025-01-27,iPhone 15,f521,899.99,mobile_app,direct,desktop,Birmingham,2025-01-25,2025-01-27
6c905f13,c54f87ad-7750-4f,2025-04-24,2025-04-28,Accessory,m001,24.99,mobile_app,social,desktop,London,2025-04-24,2025-04-28
6c905f13,c54f87ad-7750-4f,24-04-2025,2025-04-26,PS5,a245,479.99,mobile_app,search,unknown,Glasgow,2025-04-24,2025-04-26
6c905f13,c54f87ad-7750-4f,2025-04-24,2025-04-29,Accessory,m001,24.99,website,direct,unknown,London,2025-04-24,2025-04-29
30e4541b,e054dba1-8f4e-49,06-04-2025,2025-04-11,Xbox Series X,b104,499.99,website,affiliate,mobile,Glasgow,2025-04-06,2025-04-11
3222504f,eee5b33e-2dd3-4f,27-02-2025,2025-02-28,Google Pixel 8,i920,699.99,website,direct,unknown,Manchester,2025-02-27,2025-02-28
5415668e,31e43850-86a8-4b,2025-06-15,2025-06-21,MacBook Air,g770,1199.99,mobile_app,direct,mobile,Leicester,2025-06-15,2025-06-21
03539b9a,ea725584-5e6e-48,2025-06-13,2025-06-14,MacBook Air,g770,1199.99,mobile_app,affiliate,,Bristol,2025-06-13,2025-06-14
65f69897,a5b01639-0895-4d,2025-03-14,2025-03-15,MacBook Air,g770,1199.99,website,email,mobile,Manchester,2025-03-14,2025-03-15
0ea66dbf,b44aad77-b20c-4a,2025-01-09,2025-01-14,Smartwatch,h301,249.99,website,direct,mobile,London,2025-01-09,2025-01-14
7886f504,07ca07d8-d2c5-49,2025-01-08,2025-01-13,Kindle Paperwhite,j877,129.99,mobile_app,direct,desktop,Bristol,2025-01-08,2025-01-13
bffbce28,7458d92c-a1da-4c,2025-03-15,2025-03-20,Kindle Paperwhite,j877,129.99,mobile_app,social,desktop,Manchester,2025-03-15,2025-03-20
5e99c568,8bab9c9c-c026-4d,2025-01-14,2025-01-19,MacBook Air,g770,1199.99,website,social,desktop,Glasgow,2025-01-14,2025-01-19
2d49d235,b69b8391-e4ee-4f,2025-05-19,2025-05-20,Google Pixel 8,i920,699.99,website,affiliate,mobile,Manchester,2025-05-19,2025-05-20
2d49d235,b69b8391-e4ee-4f,2025-05-19,2025-05-23,AirPods,d633,159.99,mobile_app,social,unknown,London,2025-05-19,2025-05-23
1e92c0ae,1533fe82-21b3-42,2025-03-19,2025-03-22,iPhone 15,f521,899.99,mobile_app,,mobile,Glasgow,2025-03-19,2025-03-22
1e92c0ae,1533fe82-21b3-42,2025-03-19,03-23-2025,Google Pixel 8,i920,699.99,mobile_app,search,unknown,London,2025-03-19,2025-03-23
db9eb2e6,b5e9489c-a331-44,2025-04-23,2025-04-29,Google Pixel 8,i920,699.99,website,social,mobile,Manchester,2025-04-23,2025-04-29
bcc9c2e6,da42698b-fbc0-43,2025-05-26,2025-06-01,PS5,a245,479.99,mobile_app,email,unknown,Liverpool,2025-05-26,2025-06-01
e5d20eae,ac0798c7-d657-4e,2025-04-18,2025-04-23,Google Pixel 8,i920,699.99,website,email,unknown,Manchester,2025-04-18,2025-04-23
e5d20eae,ac0798c7-d657-4e,2025-04-18,2025-04-21,AirPods,d633,159.99,mobile_app,search,unknown,,2025-04-18,2025-04-21
5dc2fd9b,fc7c356d-e7dd-43,2025-02-27,2025-03-02,Steam Deck,c912,499.99,mobile_app,direct,unknown,Manchester,2025-02-27,2025-03-02
aaefdbe1,aa1c5dca-f0c7-41,08-04-2025,2025-04-11,Steam Deck,c912,499.99,mobile_app,direct,mobile,Glasgow,2025-04-08,2025-04-11
25c37945,316482fe-10a0-42,2025-02-28,2025-02-22,Google Pixel 8,i920,699.99,mobile_app,email,mobile,Birmingham,2025-02-28,2025-02-22
25c37945,316482fe-10a0-42,2025-02-22,02-26-2025,Kindle Paperwhite,j877,129.99,website,search,desktop,London,2025-02-22,2025-02-26
9bc88efe,2c2e8ba0-157e-49,2025-03-09,2025-03-11,AirPods,d633,159.99,mobile_app,search,unknown,Bristol,2025-03-09,2025-03-11
9bc88efe,2c2e8ba0-157e-49,2025-03-09,2025-03-11,iPhone 15,f521,899.99,mobile_app,search,unknown,,2025-03-09,2025-03-11
d79570be,68c4b51a-8166-45,2025-02-25,2025-02-26,Xbox Series X,b104,499.99,mobile_app,direct,desktop,Glasgow,2025-02-25,2025-02-26
1e228ade,4fa87a65-00d3-40,2025-03-07,2025-03-13,Kindle Paperwhite,j877,129.99,mobile_app,direct,unknown,London,2025-03-07,2025-03-13
ee265c95,d60b04a9-9173-4d,2025-04-06,2025-04-09,Smartwatch,h301,249.99,website,social,mobile,Birmingham,2025-04-06,2025-04-09
161f77a1,eb02c661-1dc3-43,2025-04-06,2025-04-11,AirPods,d633,159.99,mobile_app,search,mobile,Leicester,2025-04-06,2025-04-11
2b5997f2,a06a7de4-9755-42,2025-02-18,2025-02-21,Xbox Series X,b104,499.99,website,email,desktop,Liverpool,2025-02-18,2025-02-21
e09012d7,a3506764-37af-46,2025-04-21,2025-04-26,MacBook Air,g770,1199.99,mobile_app,affiliate,desktop,Manchester,2025-04-21,2025-04-26
f151ff15,4ecad266-3f29-46,2025-05-18,2025-05-21,Steam Deck,c912,499.99,mobile_app,social,unknown,Manchester,2025-05-18,2025-05-21
4f7c1491,bf5628b9-30eb-44,2025-03-17,2025-03-20,Kindle Paperwhite,j877,129.99,mobile_app,direct,mobile,Manchester,2025-03-17,2025-03-20
90a67567,497dd968-b4b6-47,2025-04-06,2025-04-10,Nintendo Switch,e682,299.99,mobile_app,search,desktop,Liverpool,2025-04-06,2025-04-10
90a67567,497dd968-b4b6-47,2025-04-06,2025-04-10,Smartwatch,h301,249.99,mobile_app,email,desktop,Manchester,2025-04-06,2025-04-10
90a67567,497dd968-b4b6-47,2025-04-06,2025-04-08,Xbox Series X,b104,499.99,website,email,desktop,Manchester,2025-04-06,2025-04-08
330062f1,d5d4999b-39d8-4a,21-03-2025,2025-03-22,Nintendo Switch,e682,299.99,mobile_app,affiliate,unknown,Liverpool,2025-03-21,2025-03-22
17a85108,42650798-4b80-4f,2025-02-14,2025-02-17,Google Pixel 8,i920,699.99,website,affiliate,unknown,London,2025-02-14,2025-02-17
85e620fe,5d15c129-9425-4e,2025-04-07,2025-04-11,Accessory,m001,24.99,website,affiliate,unknown,Manchester,2025-04-07,2025-04-11
f31d40e2,afe1d845-a18a-42,2025-04-01,2025-04-02,Kindle Paperwhite,j877,129.99,website,affiliate,,London,2025-04-01,2025-04-02
fe66c4fa,27dc3b65-62bb-48,2025-01-03,2025-01-09,Kindle Paperwhite,j877,129.99,mobile_app,email,mobile,Manchester,2025-01-03,2025-01-09
fe66c4fa,27dc3b65-62bb-48,2025-01-03,2025-01-05,Steam Deck,c912,499.99,website,search,,Sheffield,2025-01-03,2025-01-05
fe66c4fa,27dc3b65-62bb-48,2025-01-03,2025-01-06,Kindle Paperwhite,j877,129.99,mobile_app,direct,desktop,Glasgow,2025-01-03,2025-01-06
49e785c7,a560c775-58cf-49,2025-04-15,2025-04-20,Nintendo Switch,e682,299.99,mobile_app,direct,desktop,London,2025-04-15,2025-04-20
49e785c7,a560c775-58cf-49,2025-04-15,2025-04-17,MacBook Air,g770,1199.99,website,direct,desktop,London,2025-04-15,2025-04-17
49e785c7,a560c775-58cf-49,2025-04-15,2025-04-21,Kindle Paperwhite,j877,129.99,mobile_app,social,desktop,Manchester,2025-04-15,2025-04-21
be3de265,f7eefd84-b31c-43,2025-04-02,2025-04-04,PS5,a245,479.99,mobile_app,direct,,London,2025-04-02,2025-04-04
37df8dfb,8365d2cf-173b-42,2025-06-24,06-29-2025,Smartwatch,h301,249.99,website,direct,desktop,Birmingham,2025-06-24,2025-06-29
37df8dfb,8365d2cf-173b-42,2025-06-24,2025-06-25,AirPods,d633,159.99,website,direct,unknown,Liverpool,2025-06-24,2025-06-25
a190aa44,ec02e881-080c-4a,2025-02-12,2025-02-16,AirPods,d633,159.99,mobile_app,social,desktop,Leicester,2025-02-12,2025-02-16
9053317b,779d7db4-23ca-4f,2025-04-13,2025-04-14,Steam Deck,c912,499.99,website,social,unknown,London,2025-04-13,2025-04-14
1ac7ea5b,e6b9f3a3-96a0-47,2025-03-03,2025-03-07,Smartwatch,h301,249.99,website,social,unknown,Leeds,2025-03-03,2025-03-07
79ba19db,e6a98352-de8c-4a,2025-05-19,2025-05-20,MacBook Air,g770,1199.99,mobile_app,direct,unknown,Glasgow,2025-05-19,2025-05-20
5ba62f73,e729b06f-a5db-4c,13-04-2025,2025-04-17,Smartwatch,h301,249.99,mobile_app,email,desktop,Birmingham,2025-04-13,2025-04-17
7062dff6,8bf9a66d-7782-48,2025-04-02,2025-04-07,Smartwatch,h301,249.99,mobile_app,social,unknown,Manchester,2025-04-02,2025-04-07
bb1fdb98,97f483d6-74d9-4f,2025-02-09,2025-02-12,Steam Deck,c912,499.99,website,affiliate,unknown,Birmingham,2025-02-09,2025-02-12
99d75477,3e5bd4af-d587-47,02-03-2025,2025-03-06,Accessory,m001,24.99,website,social,desktop,London,2025-03-02,2025-03-06
99d75477,3e5bd4af-d587-47,2025-03-02,03-05-2025,Steam Deck,c912,499.99,mobile_app,social,mobile,Nottingham,2025-03-02,2025-03-05
edd24200,66b1f859-adb5-45,2025-03-23,2025-03-29,Steam Deck,c912,499.99,mobile_app,direct,mobile,Glasgow,2025-03-23,2025-03-29
1b9c67e0,ef4c113d-c35f-4e,2025-02-05,2025-02-09,Kindle Paperwhite,j877,129.99,website,search,desktop,Glasgow,2025-02-05,2025-02-09
1b9c67e0,ef4c113d-c35f-4e,2025-02-05,2025-02-11,Accessory,m001,24.99,website,social,unknown,Leeds,2025-02-05,2025-02-11
97d3d50e,44f4d74f-c629-4c,2025-02-20,2025-02-24,Nintendo Switch,e682,299.99,mobile_app,email,mobile,Manchester,2025-02-20,2025-02-24
98cb3cb4,2a983090-831f-43,2025-03-07,2025-03-11,Nintendo Switch,e682,299.99,mobile_app,social,mobile,Manchester,2025-03-07,2025-03-11
9167adea,862a76f2-f15e-40,2025-01-07,01-11-2025,PS5,a245,479.99,mobile_app,email,desktop,Birmingham,2025-01-07,2025-01-11
0dc5d7d9,a9d500dd-2140-46,2025-04-12,2025-04-15,AirPods,d633,159.99,mobile_app,social,desktop,Glasgow,2025-04-12,2025-04-15
0dc5d7d9,a9d500dd-2140-46,2025-04-12,2025-04-14,Xbox Series X,b104,499.99,website,affiliate,mobile,Glasgow,2025-04-12,2025-04-14
589a2b88,caf91924-4f2c-4c,2025-02-05,2025-02-06,iPhone 15,f521,899.99,website,affiliate,unknown,Birmingham,2025-02-05,2025-02-06
334dd7aa,75e913d8-2a53-4b,2025-04-22,2025-04-23,Xbox Series X,b104,499.99,website,email,desktop,Leeds,2025-04-22,2025-04-23
334dd7aa,75e913d8-2a53-4b,2025-04-22,2025-04-25,Google Pixel 8,i920,699.99,mobile_app,direct,mobile,Leeds,2025-04-22,2025-04-25
db964db1,4eba12da-4d20-46,2025-04-01,2025-04-05,Xbox Series X,b104,499.99,mobile_app,direct,desktop,London,2025-04-01,2025-04-05
8e2b4d2c,b960df1f-1715-4d,2025-02-18,02-21-2025,MacBook Air,g770,1199.99,website,search,desktop,Birmingham,2025-02-18,2025-02-21
8e2b4d2c,b960df1f-1715-4d,2025-02-18,2025-02-19,Steam Deck,c912,499.99,website,search,unknown,London,2025-02-18,2025-02-19
1993edfe,01440fa3-5fcf-4c,2025-06-27,2025-06-30,Xbox Series X,b104,499.99,mobile_app,social,desktop,Sheffield,2025-06-27,2025-06-30
78e90ae9,64e04880-afd1-4c,2025-05-07,2025-05-08,Steam Deck,c912,499.99,website,search,unknown,,2025-05-07,2025-05-08
78e90ae9,64e04880-afd1-4c,2025-05-07,2025-05-08,PS5,a245,479.99,website,email,desktop,Glasgow,2025-05-07,2025-05-08
eabd37da,76a6e2e6-d4d3-48,2025-04-24,04-25-2025,Google Pixel 8,i920,699.99,mobile_app,search,mobile,London,2025-04-24,2025-04-25
665ec4dd,517fd316-20e5-48,10-04-2025,2025-04-12,Xbox Series X,b104,499.99,website,,desktop,Birmingham,2025-04-10,2025-04-12
df683491,487f70f0-e5e4-49,2025-04-27,2025-04-29,iPhone 15,f521,899.99,mobile_app,search,desktop,Manchester,2025-04-27,2025-04-29
ab7d09b2,88bbc5bb-64d3-40,2025-02-09,2025-02-14,Google Pixel 8,i920,699.99,website,social,desktop,London,2025-02-09,2025-02-14
2d9be542,06e2ac94-9620-45,2025-02-24,2025-02-25,Xbox Series X,b104,499.99,mobile_app,direct,desktop,Manchester,2025-02-24,2025-02-25
00684d9c,5cbe693e-5e7f-48,2025-01-07,01-12-2025,Steam Deck,c912,499.99,mobile_app,search,mobile,London,2025-01-07,2025-01-12
3ae61863,65ef2c84-c06e-44,08-04-2025,2025-04-10,Smartwatch,h301,249.99,mobile_app,direct,unknown,London,2025-04-08,2025-04-10
17c50a7c,0b53d4e6-301e-46,2025-06-07,2025-06-13,PS5,a245,479.99,website,direct,unknown,Manchester,2025-06-07,2025-06-13
4fa3baf6,2e0c5488-a76f-4d,2025-01-02,2025-01-03,Kindle Paperwhite,j877,129.99,website,social,desktop,London,2025-01-02,2025-01-03
4fa3baf6,2e0c5488-a76f-4d,2025-01-02,2025-01-05,Nintendo Switch,e682,299.99,mobile_app,search,mobile,Manchester,2025-01-02,2025-01-05
f47bffba,7b0c036b-d23f-44,2025-02-22,2025-02-26,Accessory,m001,24.99,mobile_app,search,mobile,Manchester,2025-02-22,2025-02-26
f47bffba,7b0c036b-d23f-44,22-02-2025,2025-02-27,Accessory,m001,24.99,mobile_app,search,unknown,Manchester,2025-02-22,2025-02-27
1b3f0866,65f17e33-29dd-42,2025-05-21,2025-05-24,MacBook Air,g770,1199.99,mobile_app,direct,unknown,Leeds,2025-05-21,2025-05-24
a7e70139,58a64190-1527-4d,2025-04-14,2025-04-16,Smartwatch,h301,249.99,website,direct,desktop,London,2025-04-14,2025-04-16
a7e70139,58a64190-1527-4d,14-04-2025,2025-04-17,Kindle Paperwhite,j877,129.99,mobile_app,affiliate,unknown,Manchester,2025-04-14,2025-04-17
a7e70139,58a64190-1527-4d,2025-04-14,2025-04-18,MacBook Air,g770,1199.99,mobile_app,email,mobile,London,2025-04-14,2025-04-18
20f5128d,ce9205ae-cdb5-48,2025-06-16,2025-06-19,Nintendo Switch,e682,299.99,mobile_app,direct,desktop,London,2025-06-16,2025-06-19
a76090e7,afb144b5-624d-4f,2025-03-03,2025-03-07,Steam Deck,c912,499.99,website,social,unknown,Birmingham,2025-03-03,2025-03-07
a76090e7,afb144b5-624d-4f,2025-03-03,2025-03-09,Xbox Series X,b104,499.99,mobile_app,social,desktop,,2025-03-03,2025-03-09
6ccb9163,6c262577-66d6-48,2025-03-06,2025-03-07,Xbox Series X,b104,499.99,website,social,mobile,Manchester,2025-03-06,2025-03-07
e88081f9,1daf7374-a255-40,2025-02-14,2025-02-18,Smartwatch,h301,249.99,mobile_app,social,mobile,London,2025-02-14,2025-02-18
e88081f9,1daf7374-a255-40,2025-02-14,2025-02-18,Steam Deck,c912,499.99,website,social,desktop,Manchester,2025-02-14,2025-02-18
d81b6bb7,c7efd8e2-5f71-4a,14-02-2025,2025-02-16,Steam Deck,c912,499.99,website,email,mobile,,2025-02-14,2025-02-16
6c8f8833,1c968b9b-5d67-45,2025-06-10,2025-06-13,Nintendo Switch,e682,299.99,mobile_app,social,unknown,Birmingham,2025-06-10,2025-06-13
01c7ea8b,decceaea-622b-45,2025-03-08,2025-03-09,MacBook Air,g770,1199.99,mobile_app,email,unknown,Glasgow,2025-03-08,2025-03-09
83d03e33,b522f610-ef26-4a,2025-04-16,2025-04-20,Google Pixel 8,i920,699.99,website,social,desktop,Liverpool,2025-04-16,2025-04-20
83d03e33,b522f610-ef26-4a,2025-04-16,2025-04-19,iPhone 15,f521,899.99,website,email,unknown,Leeds,2025-04-16,2025-04-19
83d03e33,b522f610-ef26-4a,2025-04-16,2025-04-17,Xbox Series X,b104,499.99,website,direct,unknown,Glasgow,2025-04-16,2025-04-17
76fab828,df48d6fa-ba45-40,2025-02-24,2025-02-27,Google Pixel 8,i920,699.99,website,affiliate,unknown,Glasgow,2025-02-24,2025-02-27
0cd19e0c,de2e7abc-1f1d-4e,2025-02-27,2025-03-05,Steam Deck,c912,499.99,mobile_app,affiliate,mobile,Leeds,2025-02-27,2025-03-05
accc8e70,5e8a35cb-afb7-49,2025-04-08,2025-04-11,MacBook Air,g770,1199.99,mobile_app,email,unknown,Glasgow,2025-04-08,2025-04-11
4b11c181,060615bf-d1b5-45,09-05-2025,05-12-2025,iPhone 15,f521,899.99,mobile_app,affiliate,unknown,Glasgow,2025-05-09,2025-05-12
4b11c181,060615bf-d1b5-45,2025-05-09,2025-05-10,Kindle Paperwhite,j877,129.99,mobile_app,social,mobile,Manchester,2025-05-09,2025-05-10
091e11df,725f875a-047c-4f,2025-03-20,2025-03-21,Google Pixel 8,i920,699.99,website,direct,mobile,Birmingham,2025-03-20,2025-03-21
656e5170,bb5e14d6-5b74-4f,2025-04-21,2025-04-27,iPhone 15,f521,899.99,mobile_app,email,desktop,London,2025-04-21,2025-04-27
250768f2,88f4ca54-1584-48,2025-01-14,2025-01-16,Xbox Series X,b104,499.99,website,search,mobile,Manchester,2025-01-14,2025-01-16
754182e8,e489149f-6e5c-4a,2025-04-13,2025-04-17,AirPods,d633,159.99,website,affiliate,desktop,Manchester,2025-04-13,2025-04-17
eea90156,eb34d8de-3e7d-42,2025-04-05,2025-04-06,AirPods,d633,159.99,website,direct,mobile,,2025-04-05,2025-04-06
539b4d73,91ae757c-8607-42,2025-04-25,2025-04-27,Kindle Paperwhite,j877,129.99,mobile_app,direct,mobile,Glasgow,2025-04-25,2025-04-27
cffe7547,9bfe970a-2591-4f,2025-01-03,2025-01-08,Google Pixel 8,i920,699.99,mobile_app,direct,desktop,Manchester,2025-01-03,2025-01-08
cffe7547,9bfe970a-2591-4f,2025-01-03,2025-01-05,PS5,a245,479.99,website,email,unknown,Manchester,2025-01-03,2025-01-05
56784633,833bde78-61c5-4c,2025-04-13,2025-04-14,Smartwatch,h301,249.99,website,social,desktop,London,2025-04-13,2025-04-14
2f160f3d,4d4ef3fa-bfcf-46,2025-03-03,03-07-2025,Accessory,m001,24.99,website,affiliate,unknown,London,2025-03-03,2025-03-07
144be8bc,b8ba61b8-41c1-42,2025-04-26,2025-04-29,Smartwatch,h301,249.99,mobile_app,social,mobile,Manchester,2025-04-26,2025-04-29
92262ecf,f714bab7-6ef5-4d,2025-04-22,04-27-2025,Kindle Paperwhite,j877,129.99,mobile_app,email,unknown,Glasgow,2025-04-22,2025-04-27
cb317618,9d96bf5e-4d9e-4b,2025-03-08,2025-03-14,Xbox Series X,b104,499.99,mobile_app,search,desktop,Manchester,2025-03-08,2025-03-14
3717f44b,0c8033f0-cc88-41,22-03-2025,2025-03-23,Steam Deck,c912,499.99,mobile_app,social,mobile,London,2025-03-22,2025-03-23
2f8aeb01,46586cb2-6fdb-4b,2025-01-26,2025-01-31,iPhone 15,f521,899.99,mobile_app,social,unknown,,2025-01-26,2025-01-31
2f8aeb01,46586cb2-6fdb-4b,2025-01-26,2025-01-27,MacBook Air,g770,1199.99,mobile_app,email,desktop,Glasgow,2025-01-26,2025-01-27
2e671517,0bb5c276-abe3-47,2025-04-23,2025-04-28,Xbox Series X,b104,499.99,website,direct,desktop,Manchester,2025-04-23,2025-04-28
2e671517,0bb5c276-abe3-47,23-04-2025,2025-04-25,Smartwatch,h301,249.99,website,search,unknown,London,2025-04-23,2025-04-25
c8347776,014b069c-45ce-41,2025-05-02,2025-05-06,iPhone 15,f521,899.99,mobile_app,social,unknown,Leeds,2025-05-02,2025-05-06
ca4e5cc5,46573d38-2138-48,03-03-2025,2025-03-06,iPhone 15,f521,899.99,website,direct,desktop,Liverpool,2025-03-03,2025-03-06
b58194e0,18deabfe-5172-44,2025-04-03,2025-04-07,Kindle Paperwhite,j877,129.99,website,email,desktop,,2025-04-03,2025-04-07
9bfc24bd,9c83cfae-1050-4d,10-04-2025,04-14-2025,MacBook Air,g770,1199.99,mobile_app,direct,mobile,Glasgow,2025-04-10,2025-04-14
8a9cfc8d,6bb73dac-9681-4a,2025-06-26,06-27-2025,Smartwatch,h301,249.99,mobile_app,email,desktop,Leeds,2025-06-26,2025-06-27
51d41c6a,8ec29e07-ee0c-43,2025-04-09,2025-04-11,AirPods,d633,159.99,mobile_app,social,mobile,Bristol,2025-04-09,2025-04-11
7fbccd75,26daf6d1-71c3-46,2025-04-14,04-16-2025,Kindle Paperwhite,j877,129.99,mobile_app,social,desktop,Manchester,2025-04-14,2025-04-16
7fbccd75,26daf6d1-71c3-46,2025-04-14,2025-04-16,AirPods,d633,159.99,website,email,desktop,Manchester,2025-04-14,2025-04-16
6726f5b4,2b85ffb7-b29e-41,2025-04-16,2025-04-19,Kindle Paperwhite,j877,129.99,mobile_app,affiliate,desktop,Nottingham,2025-04-16,2025-04-19
6726f5b4,2b85ffb7-b29e-41,2025-04-16,2025-04-17,PS5,a245,479.99,website,direct,unknown,Glasgow,2025-04-16,2025-04-17
6726f5b4,2b85ffb7-b29e-41,2025-04-16,2025-04-20,MacBook Air,g770,1199.99,website,direct,desktop,Bristol,2025-04-16,2025-04-20
7c8dc9d0,92419671-da2f-49,2025-04-02,2025-04-06,Nintendo Switch,e682,299.99,website,affiliate,desktop,London,2025-04-02,2025-04-06
87935334,15458478-5865-47,05-04-2025,04-08-2025,AirPods,d633,159.99,mobile_app,search,desktop,Manchester,2025-04-05,2025-04-08
87935334,15458478-5865-47,2025-04-05,2025-04-07,Nintendo Switch,e682,299.99,mobile_app,email,desktop,Liverpool,2025-04-05,2025-04-07
77a63918,c03832d0-4ab4-4a,2025-05-02,2025-05-07,Nintendo Switch,e682,299.99,website,affiliate,unknown,Nottingham,2025-05-02,2025-05-07
909cca67,95be6c8a-9ff7-40,2025-04-14,2025-04-16,Nintendo Switch,e682,299.99,website,social,mobile,Glasgow,2025-04-14,2025-04-16
48acdcf8,c3d31e5c-feee-41,2025-03-11,2025-03-14,PS5,a245,479.99,mobile_app,search,unknown,Manchester,2025-03-11,2025-03-14
48acdcf8,c3d31e5c-feee-41,2025-03-11,03-16-2025,PS5,a245,479.99,mobile_app,direct,desktop,Leeds,2025-03-11,2025-03-16
899fad03,fd5baf20-7da2-4e,2025-04-22,2025-04-27,Smartwatch,h301,249.99,mobile_app,direct,unknown,Sheffield,2025-04-22,2025-04-27
654fda31,f2e5cecf-9b6c-44,2025-01-17,2025-01-18,Google Pixel 8,i920,699.99,mobile_app,search,desktop,London,2025-01-17,2025-01-18
dd69a596,1c526dd1-fdfc-4a,2025-02-18,2025-02-19,AirPods,d633,159.99,mobile_app,email,unknown,Leeds,2025-02-18,2025-02-19
dd69a596,1c526dd1-fdfc-4a,2025-02-18,2025-02-24,Xbox Series X,b104,499.99,mobile_app,social,mobile,Glasgow,2025-02-18,2025-02-24
8cd1692d,fc00814b-c70b-4b,2025-01-16,01-19-2025,Google Pixel 8,i920,699.99,mobile_app,social,mobile,Leicester,2025-01-16,2025-01-19
4764a956,37bea260-c053-42,2025-04-05,2025-04-08,Steam Deck,c912,499.99,mobile_app,direct,desktop,London,2025-04-05,2025-04-08
4764a956,37bea260-c053-42,2025-04-05,2025-04-07,Smartwatch,h301,249.99,website,affiliate,desktop,London,2025-04-05,2025-04-07
4764a956,37bea260-c053-42,2025-04-05,2025-04-10,Nintendo Switch,e682,299.99,website,direct,desktop,Glasgow,2025-04-05,2025-04-10
afd50018,a159bef3-5cf9-44,2025-06-19,2025-06-21,Smartwatch,h301,249.99,website,affiliate,mobile,London,2025-06-19,2025-06-21
8852787c,a2ded1de-c302-40,2025-03-20,2025-03-26,iPhone 15,f521,899.99,mobile_app,search,desktop,Glasgow,2025-03-20,2025-03-26
4949ded7,676a504c-dbeb-41,04-01-2025,2025-01-08,Smartwatch,h301,249.99,mobile_app,affiliate,unknown,Manchester,2025-01-04,2025-01-08
6669f679,282f0aa6-730f-4b,2025-02-13,2025-02-19,Accessory,m001,24.99,mobile_app,direct,mobile,Manchester,2025-02-13,2025-02-19
a7fc1bad,d4721e33-885c-47,2025-03-16,2025-03-17,Accessory,m001,24.99,mobile_app,direct,mobile,Glasgow,2025-03-16,2025-03-17
a7fc1bad,d4721e33-885c-47,2025-03-16,2025-03-19,Steam Deck,c912,499.99,website,affiliate,desktop,London,2025-03-16,2025-03-19
6b08984b,192bb3bc-e843-4f,2025-02-07,2025-02-11,AirPods,d633,159.99,website,social,mobile,London,2025-02-07,2025-02-11
3964afe6,305a1bef-6909-43,2025-04-23,2025-04-27,Accessory,m001,24.99,mobile_app,social,desktop,Leeds,2025-04-23,2025-04-27
9211d6cc,80dc4873-9eb3-48,2025-03-09,03-15-2025,iPhone 15,f521,899.99,mobile_app,email,unknown,London,2025-03-09,2025-03-15
2a9d0c6a,05d86c95-f20b-41,2025-05-11,2025-05-12,Xbox Series X,b104,499.99,website,email,mobile,Manchester,2025-05-11,2025-05-12
05d0f23a,af326af5-78cf-43,2025-05-25,2025-05-29,PS5,a245,479.99,mobile_app,,desktop,Bristol,2025-05-25,2025-05-29
82e6e14d,ca359116-e22d-4f,2025-01-18,2025-01-20,Xbox Series X,b104,499.99,mobile_app,email,desktop,Manchester,2025-01-18,2025-01-20
82e6e14d,ca359116-e22d-4f,2025-01-18,2025-01-22,Xbox Series X,b104,499.99,website,affiliate,unknown,Manchester,2025-01-18,2025-01-22
b91a7793,e9c7eb29-d9ad-49,2025-04-02,2025-04-08,iPhone 15,f521,899.99,mobile_app,search,mobile,Glasgow,2025-04-02,2025-04-08
33252134,78e00f78-2cda-40,2025-01-13,2025-01-14,iPhone 15,f521,899.99,website,social,unknown,London,2025-01-13,2025-01-14
93ddbda1,109792a4-4b00-4c,2025-06-01,2025-06-03,Steam Deck,c912,499.99,website,email,unknown,Glasgow,2025-06-01,2025-06-03
3dec163c,af051197-3ebb-45,2025-05-23,2025-05-29,Accessory,m001,24.99,mobile_app,search,mobile,London,2025-05-23,2025-05-29
3dec163c,af051197-3ebb-45,2025-05-23,2025-05-28,Google Pixel 8,i920,699.99,website,social,unknown,Glasgow,2025-05-23,2025-05-28
cdbe6de6,761eb7e3-f909-44,2025-06-02,2025-06-06,Nintendo Switch,e682,299.99,mobile_app,search,mobile,Bristol,2025-06-02,2025-06-06
3eaf5f08,df40fe04-54cd-47,2025-01-13,2025-01-16,Nintendo Switch,e682,299.99,mobile_app,affiliate,mobile,Glasgow,2025-01-13,2025-01-16
ae991937,11e12ee9-f664-42,2025-03-18,2025-03-24,Kindle Paperwhite,j877,129.99,website,social,mobile,Bristol,2025-03-18,2025-03-24
62a40afe,850f7bdc-ddf7-42,2025-05-27,2025-06-01,Smartwatch,h301,249.99,website,email,unknown,Bristol,2025-05-27,2025-06-01
62a40afe,850f7bdc-ddf7-42,2025-05-27,05-31-2025,Steam Deck,c912,499.99,mobile_app,email,unknown,Manchester,2025-05-27,2025-05-31
898f3586,f5239f95-6ac6-42,2025-02-25,2025-02-27,Nintendo Switch,e682,299.99,mobile_app,social,mobile,Manchester,2025-02-25,2025-02-27
898f3586,f5239f95-6ac6-42,2025-02-25,03-02-2025,Nintendo Switch,e682,299.99,website,affiliate,desktop,,2025-02-25,2025-03-02
898f3586,f5239f95-6ac6-42,25-02-2025,2025-02-27,Smartwatch,h301,249.99,mobile_app,affiliate,mobile,Sheffield,2025-02-25,2025-02-27
b6fac9b9,9b62d6d2-c6cf-47,2025-02-10,2025-02-11,Nintendo Switch,e682,299.99,mobile_app,search,unknown,Glasgow,2025-02-10,2025-02-11
b6fac9b9,9b62d6d2-c6cf-47,2025-02-10,02-11-2025,MacBook Air,g770,1199.99,mobile_app,search,unknown,Liverpool,2025-02-10,2025-02-11
cfc91b52,d3e7acd9-7b16-44,2025-04-20,2025-04-24,Nintendo Switch,e682,299.99,website,search,unknown,Bristol,2025-04-20,2025-04-24
664101fa,b9a3773d-d283-49,26-03-2025,2025-03-29,Google Pixel 8,i920,699.99,website,direct,mobile,Bristol,2025-03-26,2025-03-29
664101fa,b9a3773d-d283-49,2025-03-26,2025-04-01,Google Pixel 8,i920,699.99,mobile_app,direct,unknown,Manchester,2025-03-26,2025-04-01
c99496ab,a117b864-82f5-43,2025-02-17,2025-02-19,Accessory,m001,24.99,website,social,desktop,Sheffield,2025-02-17,2025-02-19
946e8ec2,d8d99ad8-255f-40,2025-04-26,2025-05-02,iPhone 15,f521,899.99,website,social,desktop,London,2025-04-26,2025-05-02
a812cf1b,b8d49cf2-1c9d-4b,2025-04-14,2025-04-16,PS5,a245,479.99,mobile_app,direct,unknown,Glasgow,2025-04-14,2025-04-16
a812cf1b,b8d49cf2-1c9d-4b,2025-04-14,04-20-2025,AirPods,d633,159.99,mobile_app,social,desktop,Birmingham,2025-04-14,2025-04-20
43b6c6ef,3e39bf9b-e9b8-43,2025-05-26,05-28-2025,MacBook Air,g770,1199.99,website,email,desktop,London,2025-05-26,2025-05-28
b58674b5,b197603c-a45c-41,2025-01-27,2025-01-30,AirPods,d633,159.99,website,affiliate,desktop,Glasgow,2025-01-27,2025-01-30
b06f0681,c1c97ab6-3ea6-45,2025-05-19,05-20-2025,PS5,a245,479.99,website,affiliate,mobile,Glasgow,2025-05-19,2025-05-20
4679fe6e,734bda19-c991-46,09-04-2025,2025-04-10,Xbox Series X,b104,499.99,mobile_app,email,desktop,Liverpool,2025-04-09,2025-04-10
4679fe6e,734bda19-c991-46,2025-04-09,2025-04-14,Google Pixel 8,i920,699.99,mobile_app,search,desktop,Leeds,2025-04-09,2025-04-14
06a4093b,23d86a4f-c2e6-4c,2025-04-07,2025-04-13,Smartwatch,h301,249.99,mobile_app,affiliate,mobile,,2025-04-07,2025-04-13
06a4093b,23d86a4f-c2e6-4c,2025-04-07,2025-04-10,PS5,a245,479.99,website,social,desktop,Glasgow,2025-04-07,2025-04-10
4e8172da,90441ec6-5ef0-49,2025-04-11,2025-04-14,Google Pixel 8,i920,699.99,website,search,desktop,Sheffield,2025-04-11,2025-04-14
b68c55b2,9150d9b2-2886-42,2025-05-03,2025-05-05,PS5,a245,479.99,website,email,desktop,Leicester,2025-05-03,2025-05-05
20e8dae1,278976c9-4b7d-4b,2025-02-22,2025-02-28,Google Pixel 8,i920,699.99,website,social,unknown,Nottingham,2025-02-22,2025-02-28
3a58d606,dbf11941-4ad6-43,2025-05-23,2025-05-24,iPhone 15,f521,899.99,mobile_app,social,mobile,Glasgow,2025-05-23,2025-05-24
0316cde5,954e95fb-362f-4b,2025-05-13,2025-05-18,PS5,a245,479.99,mobile_app,direct,desktop,Sheffield,2025-05-13,2025-05-18
844e2e8b,82330e6e-b89c-46,2025-01-20,2025-01-25,Steam Deck,c912,499.99,mobile_app,search,unknown,Manchester,2025-01-20,2025-01-25
a4d37418,e666a9b4-9e53-44,2025-01-04,2025-01-10,PS5,a245,479.99,website,social,unknown,Manchester,2025-01-04,2025-01-10
60c336eb,8047c7e1-da44-4e,2025-05-19,2025-05-23,Smartwatch,h301,249.99,mobile_app,email,desktop,Glasgow,2025-05-19,2025-05-23
7b67caba,a5fc00b5-7c39-41,2025-01-26,2025-01-27,Nintendo Switch,e682,299.99,mobile_app,direct,desktop,Birmingham,2025-01-26,2025-01-27
1093a05b,613f50db-e5aa-4c,2025-06-22,2025-06-25,Kindle Paperwhite,j877,129.99,website,email,unknown,Glasgow,2025-06-22,2025-06-25
1093a05b,613f50db-e5aa-4c,2025-06-22,2025-06-26,iPhone 15,f521,899.99,website,email,mobile,Glasgow,2025-06-22,2025-06-26
9bcfe969,34d88c51-4f2e-43,2025-06-10,2025-06-12,PS5,a245,479.99,website,search,unknown,Birmingham,2025-06-10,2025-06-12
7fb0b7b6,1e9d8b00-ca0d-40,2025-04-02,2025-04-03,Google Pixel 8,i920,699.99,website,social,mobile,London,2025-04-02,2025-04-03
7fb0b7b6,1e9d8b00-ca0d-40,2025-04-02,2025-04-07,Google Pixel 8,i920,699.99,mobile_app,affiliate,unknown,London,2025-04-02,2025-04-07
bf0aabdf,a37dafca-e9a6-4f,2025-05-08,2025-05-14,Nintendo Switch,e682,299.99,mobile_app,direct,mobile,Leeds,2025-05-08,2025-05-14
bdcaf089,c9a5c042-c878-4b,2025-04-05,2025-04-09,Google Pixel 8,i920,699.99,mobile_app,affiliate,desktop,Leeds,2025-04-05,2025-04-09
f3b81fe4,08683cbf-aa0b-46,2025-03-04,2025-03-07,Nintendo Switch,e682,299.99,website,email,mobile,London,2025-03-04,2025-03-07
f3b81fe4,08683cbf-aa0b-46,2025-03-04,03-07-2025,Xbox Series X,b104,499.99,mobile_app,social,desktop,Manchester,2025-03-04,2025-03-07
f3b81fe4,08683cbf-aa0b-46,2025-03-04,2025-03-07,Google Pixel 8,i920,699.99,website,social,mobile,London,2025-03-04,2025-03-07
d8bb254c,457f4a84-1133-4e,06-02-2025,2025-02-10,AirPods,d633,159.99,website,affiliate,mobile,Birmingham,2025-02-06,2025-02-10
725687c2,1456a858-df63-4c,18-04-2025,2025-04-20,iPhone 15,f521,899.99,website,direct,unknown,Manchester,2025-04-18,2025-04-20
2ec46bfe,3ea426b8-3f7b-46,2025-04-27,2025-05-02,Kindle Paperwhite,j877,129.99,website,email,desktop,Glasgow,2025-04-27,2025-05-02
b7a63ca5,db869a02-a69b-4d,2025-06-02,2025-06-05,PS5,a245,479.99,mobile_app,email,desktop,Manchester,2025-06-02,2025-06-05
4708b42e,fab87bb6-0a4c-42,2025-04-04,2025-04-09,Xbox Series X,b104,499.99,website,search,,Glasgow,2025-04-04,2025-04-09
e7f8daa8,bbbbfd67-30a4-44,2025-02-12,2025-02-13,Steam Deck,c912,499.99,mobile_app,email,unknown,Manchester,2025-02-12,2025-02-13
3e72e402,4d81bc5e-85c6-47,13-04-2025,2025-04-14,Google Pixel 8,i920,699.99,mobile_app,search,unknown,Birmingham,2025-04-13,2025-04-14
e1b33498,7a2f2c57-94ce-43,2025-06-02,2025-06-03,AirPods,d633,159.99,mobile_app,affiliate,mobile,Manchester,2025-06-02,2025-06-03
7a71ce7b,ca3e7f3a-51a0-43,2025-04-07,2025-04-08,MacBook Air,g770,1199.99,mobile_app,email,unknown,Leeds,2025-04-07,2025-04-08
7a71ce7b,ca3e7f3a-51a0-43,2025-04-07,2025-04-09,Nintendo Switch,e682,299.99,website,affiliate,unknown,Manchester,2025-04-07,2025-04-09
96e15645,79dd7b95-1558-4c,2025-04-19,2025-04-20,Nintendo Switch,e682,299.99,mobile_app,affiliate,mobile,Sheffield,2025-04-19,2025-04-20
6e047758,4cca3dda-7cbb-46,2025-01-19,2025-01-23,iPhone 15,f521,899.99,website,email,desktop,Leicester,2025-01-19,2025-01-23
a48339f7,b850b440-1c8c-44,2025-05-06,05-11-2025,Kindle Paperwhite,j877,129.99,website,affiliate,mobile,London,2025-05-06,2025-05-11
fe034a0e,a28af08d-ce46-4b,2025-03-03,03-05-2025,Xbox Series X,b104,499.99,website,affiliate,mobile,Glasgow,2025-03-03,2025-03-05
fe034a0e,a28af08d-ce46-4b,2025-03-03,2025-03-09,Steam Deck,c912,499.99,website,direct,unknown,Manchester,2025-03-03,2025-03-09
fe034a0e,a28af08d-ce46-4b,2025-03-03,2025-03-08,Accessory,01m0,24.99,website,social,desktop,Bristol,2025-03-03,2025-03-08
a1919e12,683c3806-c12a-4c,2025-04-01,2025-04-06,Accessory,m001,24.99,mobile_app,search,unknown,Manchester,2025-04-01,2025-04-06
a5310be0,7bb8373c-81dd-43,2025-04-13,2025-04-17,Steam Deck,c912,499.99,website,affiliate,mobile,Leeds,2025-04-13,2025-04-17
ad8716e1,883d9b03-de04-40,2025-06-13,2025-06-18,Steam Deck,c912,499.99,mobile_app,direct,unknown,London,2025-06-13,2025-06-18
c1b156bd,a03c67ff-4f0d-47,2025-02-19,2025-02-22,AirPods,d633,159.99,website,social,unknown,Glasgow,2025-02-19,2025-02-22
8271bbba,01ab1df1-7cd2-42,21-05-2025,2025-05-26,MacBook Air,g770,1199.99,mobile_app,email,desktop,Liverpool,2025-05-21,2025-05-26
ac482af2,2dc58521-29c2-41,2025-03-06,2025-03-07,Kindle Paperwhite,j877,129.99,mobile_app,email,unknown,London,2025-03-06,2025-03-07
afdc8a51,dcadfda8-ece0-47,2025-04-10,04-14-2025,Kindle Paperwhite,j877,129.99,website,affiliate,mobile,Birmingham,2025-04-10,2025-04-14
afdc8a51,dcadfda8-ece0-47,2025-04-10,2025-04-12,Kindle Paperwhite,j877,129.99,mobile_app,direct,unknown,Glasgow,2025-04-10,2025-04-12
3b576da7,318f7980-2ec2-45,2025-03-26,2025-04-01,Xbox Series X,b104,499.99,website,direct,desktop,Birmingham,2025-03-26,2025-04-01
78ccd788,4e2da257-8074-41,2025-05-23,2025-05-25,Nintendo Switch,e682,299.99,website,,unknown,Manchester,2025-05-23,2025-05-25
78ccd788,4e2da257-8074-41,2025-05-23,2025-05-29,PS5,a245,479.99,mobile_app,direct,desktop,Manchester,2025-05-23,2025-05-29
78ccd788,4e2da257-8074-41,23-05-2025,2025-05-24,AirPods,d633,159.99,website,direct,unknown,Manchester,2025-05-23,2025-05-24
ac00cd5e,ed7403c6-4cd0-43,2025-02-09,2025-02-15,PS5,a245,479.99,website,social,desktop,London,2025-02-09,2025-02-15
2bf998ad,31209ff4-2809-46,21-05-2025,2025-05-23,iPhone 15,f521,899.99,mobile_app,direct,desktop,Manchester,2025-05-21,2025-05-23
2bf998ad,31209ff4-2809-46,2025-05-21,2025-05-22,Accessory,m001,24.99,mobile_app,email,mobile,Birmingham,2025-05-21,2025-05-22
84372286,a99f8c03-9c31-49,2025-02-15,2025-02-21,MacBook Air,g770,1199.99,mobile_app,social,unknown,Manchester,2025-02-15,2025-02-21
b9f9d376,9860f848-a74b-49,2025-01-04,2025-01-10,Steam Deck,c912,499.99,website,direct,mobile,Birmingham,2025-01-04,2025-01-10
b9f9d376,9860f848-a74b-49,2025-01-04,2025-01-06,iPhone 15,f521,899.99,website,social,mobile,Manchester,2025-01-04,2025-01-06
d59dcbfa,434a7e17-eece-45,10-05-2025,2025-05-14,AirPods,d633,159.99,website,email,desktop,London,2025-05-10,2025-05-14
d4488069,4e653eee-251d-46,2025-01-21,2025-01-25,MacBook Air,g770,1199.99,website,affiliate,desktop,Manchester,2025-01-21,2025-01-25
c33ffef7,4eda31cc-7320-4e,2025-03-01,2025-03-06,Smartwatch,h301,249.99,mobile_app,direct,mobile,Birmingham,2025-03-01,2025-03-06
68a650ce,f0a30219-c321-47,2025-04-10,2025-04-13,PS5,a245,479.99,website,email,mobile,Glasgow,2025-04-10,2025-04-13
68a650ce,f0a30219-c321-47,2025-04-10,2025-04-14,Xbox Series X,b104,499.99,website,social,unknown,London,2025-04-10,2025-04-14
46327360,23d2789d-ce2c-47,2025-03-09,2025-03-14,PS5,a245,479.99,mobile_app,email,mobile,Manchester,2025-03-09,2025-03-14
418495a4,33c43cd1-b44f-4e,2025-06-21,2025-06-23,Accessory,m001,24.99,mobile_app,direct,unknown,Glasgow,2025-06-21,2025-06-23
61e561bb,060fd3b6-5f9c-41,2025-03-19,2025-03-23,AirPods,d633,159.99,mobile_app,email,desktop,Manchester,2025-03-19,2025-03-23
9e1823a2,bd303739-8f5a-47,2025-03-09,2025-03-11,Smartwatch,h301,249.99,mobile_app,direct,desktop,Birmingham,2025-03-09,2025-03-11
2911268f,462270cb-db3d-41,2025-03-04,03-10-2025,Steam Deck,c912,499.99,mobile_app,social,desktop,Glasgow,2025-03-04,2025-03-10
2911268f,462270cb-db3d-41,2025-03-04,2025-03-09,Google Pixel 8,i920,699.99,website,,mobile,Manchester,2025-03-04,2025-03-09
f3b93ebe,f105c2d8-7acc-4c,2025-05-11,2025-05-16,iPhone 15,f521,899.99,mobile_app,affiliate,mobile,Leeds,2025-05-11,2025-05-16
f5b0fa1c,c7fe8dee-0bc6-47,13-04-2025,2025-04-18,Accessory,m001,24.99,mobile_app,social,desktop,Leeds,2025-04-13,2025-04-18
960b9746,3ff5ea79-7cae-4d,05-06-2025,2025-06-10,PS5,a245,479.99,website,direct,mobile,Bristol,2025-06-05,2025-06-10
960b9746,3ff5ea79-7cae-4d,2025-06-05,06-07-2025,AirPods,d633,159.99,website,social,unknown,Leeds,2025-06-05,2025-06-07
89b3889d,0e5d8626-19f7-47,2025-01-18,2025-01-16,Nintendo Switch,e682,299.99,website,email,unknown,Leicester,2025-01-18,2025-01-16
e17f5e53,48c3a59d-ec71-42,2025-01-23,2025-01-27,Google Pixel 8,i920,699.99,mobile_app,affiliate,mobile,Manchester,2025-01-23,2025-01-27
d30606ae,fa286316-5315-4a,2025-02-17,2025-02-19,Steam Deck,c912,499.99,website,email,unknown,Manchester,2025-02-17,2025-02-19
d30606ae,fa286316-5315-4a,2025-02-17,2025-02-20,MacBook Air,g770,1199.99,mobile_app,search,desktop,London,2025-02-17,2025-02-20
8fd48278,96fdad96-2681-45,2025-03-18,2025-03-22,Accessory,m001,24.99,mobile_app,affiliate,mobile,Manchester,2025-03-18,2025-03-22
8fd48278,96fdad96-2681-45,2025-03-18,2025-03-23,Smartwatch,h301,249.99,website,direct,mobile,Glasgow,2025-03-18,2025-03-23
a9230810,53ed75f6-3ec7-4c,2025-03-26,2025-03-29,Nintendo Switch,e682,299.99,mobile_app,social,desktop,Birmingham,2025-03-26,2025-03-29
23f5aea6,d13b3a4d-87f1-4a,15-02-2025,2025-02-18,Google Pixel 8,i920,699.99,mobile_app,direct,mobile,London,2025-02-15,2025-02-18
23f5aea6,d13b3a4d-87f1-4a,2025-02-15,2025-02-16,Google Pixel 8,i920,699.99,website,affiliate,unknown,London,2025-02-15,2025-02-16
bd32ebda,dee7dad7-1168-44,2025-05-13,2025-05-15,Xbox Series X,b104,499.99,mobile_app,affiliate,desktop,Manchester,2025-05-13,2025-05-15
bf4d4bd8,5c798b20-da7a-4b,2025-04-11,2025-04-15,Smartwatch,h301,249.99,website,affiliate,unknown,Glasgow,2025-04-11,2025-04-15
5cb9635c,523e901f-2f23-4d,05-01-2025,2025-01-09,Google Pixel 8,i920,699.99,website,direct,unknown,Glasgow,2025-01-05,2025-01-09
9a86a2f5,f8b03457-ad7b-43,2025-04-13,2025-04-15,Steam Deck,c912,499.99,mobile_app,affiliate,desktop,Leeds,2025-04-13,2025-04-15
6d658f44,23e8bb05-05ec-44,2025-03-14,2025-03-15,AirPods,d633,159.99,mobile_app,affiliate,mobile,Liverpool,2025-03-14,2025-03-15
0f6eed31,cc5015cf-7c81-4d,2025-04-21,04-26-2025,Accessory,m001,24.99,mobile_app,direct,desktop,Glasgow,2025-04-21,2025-04-26
fee33607,5f9c041d-8323-44,2025-06-21,2025-06-23,iPhone 15,f521,899.99,website,affiliate,mobile,Manchester,2025-06-21,2025-06-23
89ef698a,df823a94-8114-42,2025-05-05,2025-05-10,Kindle Paperwhite,j877,129.99,website,affiliate,mobile,Manchester,2025-05-05,2025-05-10
135769cb,5570cefc-9327-4b,2025-04-27,2025-05-02,AirPods,d633,159.99,website,affiliate,mobile,London,2025-04-27,2025-05-02
135769cb,5570cefc-9327-4b,2025-04-27,2025-05-01,Steam Deck,c912,499.99,mobile_app,affiliate,desktop,Birmingham,2025-04-27,2025-05-01
28815cd9,8eec22a4-f966-49,2025-04-14,2025-04-19,Google Pixel 8,i920,699.99,website,search,mobile,Glasgow,2025-04-14,2025-04-19
28815cd9,8eec22a4-f966-49,2025-04-14,2025-04-18,Nintendo Switch,e682,299.99,mobile_app,email,mobile,Bristol,2025-04-14,2025-04-18
77ec2100,d9fafbb9-d8a7-42,2025-05-16,2025-05-22,Google Pixel 8,i920,699.99,website,affiliate,unknown,Glasgow,2025-05-16,2025-05-22
af178dbb,30de0010-fe31-44,2025-02-13,2025-02-19,PS5,a245,479.99,website,email,desktop,London,2025-02-13,2025-02-19
fe8db353,77391bee-46e0-4e,2025-02-07,2025-02-09,Xbox Series X,b104,499.99,website,affiliate,unknown,Leeds,2025-02-07,2025-02-09
9341dd73,5497062b-a683-4a,2025-02-22,2025-02-20,Xbox Series X,b104,499.99,website,direct,desktop,Bristol,2025-02-22,2025-02-20
f2d1235d,c7f7040b-8718-43,2025-02-26,2025-03-02,AirPods,d633,159.99,website,social,desktop,Sheffield,2025-02-26,2025-03-02
9faa2180,66c67afa-057f-41,22-03-2025,03-24-2025,Kindle Paperwhite,j877,129.99,website,affiliate,unknown,Manchester,2025-03-22,2025-03-24
2686d5c6,022f8a47-04d4-45,2025-04-21,2025-04-24,Steam Deck,c912,499.99,mobile_app,social,desktop,Birmingham,2025-04-21,2025-04-24
2686d5c6,022f8a47-04d4-45,2025-04-21,2025-04-23,PS5,a245,479.99,mobile_app,social,desktop,Manchester,2025-04-21,2025-04-23
8849066e,9599b267-390f-41,17-04-2025,2025-04-20,Xbox Series X,b104,499.99,website,search,desktop,London,2025-04-17,2025-04-20
ece42aa5,3348eda0-aa57-46,2025-03-14,2025-03-18,Accessory,m001,24.99,website,affiliate,desktop,Manchester,2025-03-14,2025-03-18
30584d20,b703fa9f-e15c-4c,2025-01-14,2025-01-15,Steam Deck,c912,499.99,website,social,desktop,Manchester,2025-01-14,2025-01-15
888e58e7,4ef8a787-34c5-4d,2025-02-14,2025-02-16,MacBook Air,g770,1199.99,website,email,unknown,Manchester,2025-02-14,2025-02-16
888e58e7,4ef8a787-34c5-4d,2025-02-14,2025-02-20,Google Pixel 8,i920,699.99,mobile_app,social,desktop,Manchester,2025-02-14,2025-02-20
888e58e7,4ef8a787-34c5-4d,2025-02-14,2025-02-19,Kindle Paperwhite,j877,129.99,website,social,mobile,Glasgow,2025-02-14,2025-02-19
5938949e,0a199083-d83e-46,2025-06-08,2025-06-13,Xbox Series X,b104,499.99,mobile_app,email,mobile,Liverpool,2025-06-08,2025-06-13
a87da2af,dedcc2ff-53d4-4c,2025-04-21,2025-04-26,AirPods,d633,159.99,website,affiliate,desktop,Glasgow,2025-04-21,2025-04-26
3ba4807e,29cd4d5c-4d8c-49,2025-05-05,2025-05-08,MacBook Air,g770,1199.99,mobile_app,search,mobile,Manchester,2025-05-05,2025-05-08
3ba4807e,29cd4d5c-4d8c-49,2025-05-05,2025-05-10,PS5,a245,479.99,website,direct,desktop,Birmingham,2025-05-05,2025-05-10
e0acdb75,c5b86c82-379c-44,2025-02-17,2025-02-23,Steam Deck,c912,499.99,website,search,mobile,Liverpool,2025-02-17,2025-02-23
06822e13,1f8424bd-708c-4f,16-05-2025,2025-05-22,MacBook Air,g770,1199.99,website,affiliate,unknown,Bristol,2025-05-16,2025-05-22
0c994ec1,daac1277-be73-41,2025-02-18,2025-02-23,Xbox Series X,b104,499.99,website,direct,desktop,London,2025-02-18,2025-02-23
97187943,32d9ec3e-6630-4a,2025-04-27,2025-05-02,Nintendo Switch,e682,299.99,website,direct,unknown,London,2025-04-27,2025-05-02
940bb34d,f8205c5f-17c5-42,2025-02-22,2025-02-23,Google Pixel 8,i920,699.99,mobile_app,search,unknown,Birmingham,2025-02-22,2025-02-23
f0d1701b,29b2b32c-1f27-4a,2025-04-27,2025-04-30,PS5,a245,479.99,mobile_app,email,unknown,Sheffield,2025-04-27,2025-04-30
f0d1701b,29b2b32c-1f27-4a,2025-04-27,2025-04-29,Xbox Series X,b104,499.99,website,social,mobile,Manchester,2025-04-27,2025-04-29
6a45d1e9,5bbf785b-9ad7-48,2025-05-01,2025-05-03,Steam Deck,c912,499.99,website,affiliate,unknown,Manchester,2025-05-01,2025-05-03
7a5cd426,173e13d9-fc32-4d,2025-03-27,2025-04-01,Xbox Series X,b104,499.99,mobile_app,affiliate,mobile,Leeds,2025-03-27,2025-04-01
7a5cd426,173e13d9-fc32-4d,2025-03-27,2025-04-01,Accessory,m001,24.99,website,email,mobile,Manchester,2025-03-27,2025-04-01
7a5cd426,173e13d9-fc32-4d,2025-03-27,2025-04-02,Xbox Series X,b104,499.99,mobile_app,email,desktop,Manchester,2025-03-27,2025-04-02
614996d1,f1e4c27a-1cab-47,2025-05-26,2025-05-27,Nintendo Switch,e682,299.99,website,affiliate,unknown,Leeds,2025-05-26,2025-05-27
614996d1,f1e4c27a-1cab-47,2025-05-26,2025-05-27,Nintendo Switch,e682,299.99,mobile_app,direct,unknown,London,2025-05-26,2025-05-27
5c42adcf,f6295eb4-667a-4b,2025-03-15,2025-03-20,Accessory,m001,24.99,website,affiliate,unknown,Sheffield,2025-03-15,2025-03-20
5c42adcf,f6295eb4-667a-4b,2025-03-15,03-19-2025,Steam Deck,c912,499.99,website,social,unknown,Manchester,2025-03-15,2025-03-19
a6e997ae,10b7de33-d627-42,2025-02-17,2025-02-20,Accessory,m001,24.99,website,search,desktop,Bristol,2025-02-17,2025-02-20
cf674365,b382c1ae-ffec-44,2025-02-10,2025-02-13,Xbox Series X,b104,499.99,mobile_app,social,unknown,London,2025-02-10,2025-02-13
cf674365,b382c1ae-ffec-44,2025-02-10,2025-02-15,PS5,a245,479.99,mobile_app,email,mobile,Manchester,2025-02-10,2025-02-15
bac8f92f,040ebf47-78ab-45,03-02-2025,2025-02-04,Xbox Series X,b104,499.99,website,search,unknown,London,2025-02-03,2025-02-04
2d675be3,0b9d55cd-52c1-42,2025-02-02,2025-02-07,Kindle Paperwhite,j877,129.99,mobile_app,email,mobile,London,2025-02-02,2025-02-07
7845a524,84c469b1-20c1-48,2025-01-26,2025-01-27,Google Pixel 8,i920,699.99,website,direct,mobile,London,2025-01-26,2025-01-27
bd66c203,98a0db61-0fa9-46,2025-01-04,2025-01-09,Google Pixel 8,i920,699.99,website,email,mobile,London,2025-01-04,2025-01-09
6b5341c0,9e181620-5f27-4e,21-03-2025,2025-03-22,Smartwatch,h301,249.99,mobile_app,social,desktop,Manchester,2025-03-21,2025-03-22
6b5341c0,9e181620-5f27-4e,2025-03-21,2025-03-26,Nintendo Switch,e682,299.99,website,affiliate,unknown,Birmingham,2025-03-21,2025-03-26
6b5341c0,9e181620-5f27-4e,2025-03-21,2025-03-23,AirPods,d633,159.99,mobile_app,email,unknown,Glasgow,2025-03-21,2025-03-23
cf35fdb9,84c2f2c4-efb0-4e,15-02-2025,2025-02-16,iPhone 15,f521,899.99,mobile_app,search,mobile,Birmingham,2025-02-15,2025-02-16
cf35fdb9,84c2f2c4-efb0-4e,2025-02-15,02-17-2025,Google Pixel 8,i920,699.99,mobile_app,social,unknown,Manchester,2025-02-15,2025-02-17
c95bc917,5d7518d4-2e7e-4c,2025-05-07,05-09-2025,PS5,a245,479.99,mobile_app,direct,mobile,London,2025-05-07,2025-05-09
5f88fe99,343e623f-7f5f-4a,2025-03-04,2025-03-06,Google Pixel 8,i920,699.99,mobile_app,email,unknown,Liverpool,2025-03-04,2025-03-06
5f88fe99,343e623f-7f5f-4a,2025-03-04,2025-03-07,Nintendo Switch,e682,299.99,mobile_app,direct,unknown,Glasgow,2025-03-04,2025-03-07
069ccc0a,9f35ba40-43e2-4c,2025-05-09,2025-05-15,MacBook Air,g770,1199.99,website,search,unknown,London,2025-05-09,2025-05-15
24f384ef,7872d73f-e389-4c,2025-03-24,2025-03-30,Nintendo Switch,e682,299.99,mobile_app,affiliate,mobile,Liverpool,2025-03-24,2025-03-30
b8f73fad,8a1b0744-0be7-43,2025-01-27,2025-01-29,Steam Deck,c912,499.99,mobile_app,search,unknown,Bristol,2025-01-27,2025-01-29
3902d8a7,19a12723-287d-4f,2025-05-21,2025-05-25,Google Pixel 8,i920,699.99,mobile_app,affiliate,unknown,Manchester,2025-05-21,2025-05-25
76e51a12,10fab909-fcfa-4e,2025-02-27,2025-03-04,Accessory,m001,24.99,website,direct,desktop,Glasgow,2025-02-27,2025-03-04
76e51a12,10fab909-fcfa-4e,2025-02-27,2025-03-02,Nintendo Switch,e682,299.99,website,affiliate,mobile,Liverpool,2025-02-27,2025-03-02
db5ed35a,e5ecb9dc-db2c-44,2025-01-04,2025-01-09,AirPods,d633,159.99,website,search,unknown,Birmingham,2025-01-04,2025-01-09
e648d7ae,002f4aee-a308-41,2025-03-20,2025-03-23,Nintendo Switch,e682,299.99,mobile_app,direct,unknown,Leeds,2025-03-20,2025-03-23
f4f7bfdc,52a80809-20d1-4f,2025-06-01,2025-06-05,Smartwatch,h301,249.99,website,search,desktop,Glasgow,2025-06-01,2025-06-05
d4c2459b,18ad8eeb-b760-40,20-06-2025,2025-06-26,MacBook Air,g770,1199.99,website,,unknown,Bristol,2025-06-20,2025-06-26
ce31ce5c,2036971a-323f-4f,2025-01-05,2025-01-09,PS5,a245,479.99,mobile_app,direct,desktop,Manchester,2025-01-05,2025-01-09
b79ee140,a8c1fb64-39bd-43,2025-04-24,2025-04-25,Accessory,m001,24.99,website,social,unknown,Birmingham,2025-04-24,2025-04-25
402bf495,9d719800-e30d-4d,2025-05-15,05-18-2025,Accessory,m001,24.99,website,search,unknown,Liverpool,2025-05-15,2025-05-18
764f6842,4d156c62-a8cc-4e,2025-04-07,2025-04-13,Accessory,m001,24.99,mobile_app,social,mobile,Glasgow,2025-04-07,2025-04-13
44482593,8453d803-8519-46,2025-04-20,2025-04-21,Xbox Series X,b104,499.99,website,social,unknown,Manchester,2025-04-20,2025-04-21
252d3404,53f42383-21b7-4e,2025-04-01,2025-04-04,Xbox Series X,b104,499.99,mobile_app,direct,,Manchester,2025-04-01,2025-04-04
ccbdd15e,d9caa609-ef43-4b,2025-04-09,2025-04-12,AirPods,d633,159.99,website,social,desktop,London,2025-04-09,2025-04-12
03aa96d2,cb505aa3-0c4a-4f,2025-04-13,2025-04-16,MacBook Air,g770,1199.99,mobile_app,direct,mobile,Birmingham,2025-04-13,2025-04-16
03aa96d2,cb505aa3-0c4a-4f,2025-04-13,2025-04-16,iPhone 15,f521,899.99,website,direct,mobile,Manchester,2025-04-13,2025-04-16
65924c9f,d5db677f-08bb-42,2025-01-03,01-09-2025,Steam Deck,c912,499.99,mobile_app,,unknown,Manchester,2025-01-03,2025-01-09
65924c9f,d5db677f-08bb-42,2025-01-03,2025-01-05,Accessory,m001,24.99,mobile_app,direct,unknown,Liverpool,2025-01-03,2025-01-05
30104525,7b142917-9274-46,2025-02-24,2025-03-02,Nintendo Switch,e682,299.99,website,social,mobile,Glasgow,2025-02-24,2025-03-02
fe2181fd,f88505f9-d126-49,2025-03-21,2025-03-17,AirPods,d633,159.99,mobile_app,email,unknown,Glasgow,2025-03-21,2025-03-17
beb5ba0f,43472a28-9f0e-47,2025-04-11,2025-04-16,Kindle Paperwhite,j877,129.99,website,direct,unknown,Glasgow,2025-04-11,2025-04-16
ff26cb58,83b5ad03-c4bd-43,27-04-2025,2025-04-30,PS5,a245,479.99,website,search,unknown,London,2025-04-27,2025-04-30
ff26cb58,83b5ad03-c4bd-43,2025-04-27,2025-05-02,Google Pixel 8,i920,699.99,website,email,mobile,Leeds,2025-04-27,2025-05-02
c5a24d77,574aa942-415a-41,23-06-2025,2025-06-27,Xbox Series X,b104,499.99,website,email,desktop,Nottingham,2025-06-23,2025-06-27
c3659e51,18b47298-a9ca-40,09-02-2025,2025-02-15,AirPods,d633,159.99,website,email,desktop,Glasgow,2025-02-09,2025-02-15
c3659e51,18b47298-a9ca-40,2025-02-09,02-11-2025,Steam Deck,c912,499.99,website,email,desktop,Manchester,2025-02-09,2025-02-11
068187e9,c82e27a3-1028-4c,2025-03-21,2025-03-24,Google Pixel 8,i920,699.99,mobile_app,affiliate,mobile,London,2025-03-21,2025-03-24
d47ffd35,1836a027-2050-4d,04-04-2025,2025-04-06,Steam Deck,c912,499.99,website,affiliate,desktop,Liverpool,2025-04-04,2025-04-06
d47ffd35,1836a027-2050-4d,2025-04-04,2025-04-08,Kindle Paperwhite,j877,129.99,mobile_app,affiliate,unknown,London,2025-04-04,2025-04-08
58fde70b,b67333e0-8ceb-42,2025-06-26,2025-07-01,Nintendo Switch,e682,299.99,website,direct,unknown,London,2025-06-26,2025-07-01
f75ef2cf,8da4f916-6fa8-43,2025-01-02,2025-01-08,PS5,a245,479.99,website,social,desktop,Sheffield,2025-01-02,2025-01-08
e2b845b7,2ebfaf4c-8135-42,2025-03-14,2025-03-18,Xbox Series X,b104,499.99,mobile_app,direct,desktop,Glasgow,2025-03-14,2025-03-18
c6a22085,244700ca-31e3-46,2025-02-23,2025-02-24,MacBook Air,g770,1199.99,website,affiliate,unknown,Sheffield,2025-02-23,2025-02-24
c7a9ff30,be9dd48c-bbc0-48,2025-04-16,2025-04-20,Google Pixel 8,i920,699.99,mobile_app,social,desktop,Manchester,2025-04-16,2025-04-20
887cedb9,87d2e18f-dc24-4f,2025-04-26,05-01-2025,Smartwatch,h301,249.99,mobile_app,search,unknown,London,2025-04-26,2025-05-01
2ab05af8,b195fa9f-3afd-49,2025-04-16,2025-04-17,Google Pixel 8,i920,699.99,website,direct,desktop,Birmingham,2025-04-16,2025-04-17
dbe38b89,ae2e7dd2-19a2-46,2025-01-08,2025-01-09,Nintendo Switch,e682,299.99,website,email,mobile,Leeds,2025-01-08,2025-01-09
dbe38b89,ae2e7dd2-19a2-46,2025-01-08,2025-01-13,PS5,a245,479.99,website,search,unknown,London,2025-01-08,2025-01-13
dbe38b89,ae2e7dd2-19a2-46,2025-01-08,2025-01-10,Nintendo Switch,e682,299.99,mobile_app,email,mobile,Manchester,2025-01-08,2025-01-10
8a73483e,ee3f0127-d7de-4f,2025-04-07,2025-04-13,Accessory,m001,24.99,mobile_app,email,unknown,Glasgow,2025-04-07,2025-04-13
0c858238,6c8c4bac-9c13-4a,04-05-2025,05-09-2025,AirPods,d633,159.99,website,social,desktop,Manchester,2025-05-04,2025-05-09
85915047,669f9a4a-f2eb-4d,2025-04-20,2025-04-26,Kindle Paperwhite,877j,129.99,website,social,mobile,London,2025-04-20,2025-04-26
b8b758b8,79fee842-e4cc-40,2025-06-06,06-09-2025,Kindle Paperwhite,j877,129.99,website,affiliate,desktop,,2025-06-06,2025-06-09
ab09ec62,132ab649-0017-4c,2025-04-09,04-14-2025,AirPods,d633,159.99,website,affiliate,unknown,Leeds,2025-04-09,2025-04-14
111ac671,bbc41107-ec4d-45,15-04-2025,2025-04-20,Accessory,m001,24.99,mobile_app,affiliate,unknown,Manchester,2025-04-15,2025-04-20
2906567d,23eaea4f-690e-4e,2025-04-15,2025-04-17,AirPods,d633,159.99,website,social,unknown,London,2025-04-15,2025-04-17
642830f3,f9f8f5f4-ce96-48,2025-02-22,2025-02-25,Smartwatch,h301,249.99,website,search,desktop,Manchester,2025-02-22,2025-02-25
3fa27ffd,6b44312a-a565-4d,2025-03-01,03-03-2025,MacBook Air,g770,1199.99,website,direct,desktop,Glasgow,2025-03-01,2025-03-03
23f3e5c5,39ef20ea-120e-4c,2025-05-26,2025-05-31,Kindle Paperwhite,j877,129.99,website,affiliate,desktop,Glasgow,2025-05-26,2025-05-31
ac1cfcfc,b9d9c1dc-1f9b-42,2025-03-03,2025-03-06,Smartwatch,h301,249.99,mobile_app,email,mobile,Bristol,2025-03-03,2025-03-06
53d509af,2474e10f-7181-40,2025-06-20,2025-06-21,PS5,a245,479.99,mobile_app,affiliate,unknown,London,2025-06-20,2025-06-21
c58b6161,85475ee1-1e06-49,2025-04-26,2025-04-28,AirPods,d633,159.99,mobile_app,affiliate,mobile,Bristol,2025-04-26,2025-04-28
d27e5846,3b7039b0-789a-4f,2025-04-15,2025-04-16,Accessory,m001,24.99,mobile_app,direct,mobile,Manchester,2025-04-15,2025-04-16
e1568c60,9c2b4ca9-be2f-46,2025-05-27,2025-05-31,MacBook Air,g770,1199.99,mobile_app,affiliate,unknown,,2025-05-27,2025-05-31
f311a3a1,b8525de3-e916-4e,2025-05-08,2025-05-09,PS5,a245,479.99,website,social,desktop,London,2025-05-08,2025-05-09
a07c68c2,d685b08b-61aa-48,2025-05-11,2025-05-13,Nintendo Switch,e682,299.99,website,search,desktop,Glasgow,2025-05-11,2025-05-13
a07c68c2,d685b08b-61aa-48,2025-05-11,2025-05-15,iPhone 15,f521,899.99,mobile_app,search,desktop,Manchester,2025-05-11,2025-05-15
dd91cf6b,2b1feecd-95c1-47,2025-04-16,2025-04-20,Nintendo Switch,e682,299.99,website,social,desktop,Manchester,2025-04-16,2025-04-20
16acb78e,4a85fbd1-c22a-47,2025-01-27,2025-02-02,iPhone 15,f521,899.99,website,affiliate,desktop,London,2025-01-27,2025-02-02
3dc559fc,f5b127e1-9a72-4b,22-03-2025,2025-03-25,Steam Deck,c912,499.99,mobile_app,email,desktop,Manchester,2025-03-22,2025-03-25
3dc559fc,f5b127e1-9a72-4b,2025-03-22,2025-03-27,MacBook Air,g770,1199.99,website,social,unknown,Manchester,2025-03-22,2025-03-27
6eb6d54b,7e99a2c2-aa37-44,2025-05-10,2025-05-14,PS5,a245,479.99,mobile_app,social,unknown,Manchester,2025-05-10,2025-05-14
6eb6d54b,7e99a2c2-aa37-44,2025-05-10,2025-05-12,Accessory,m001,24.99,website,search,mobile,Nottingham,2025-05-10,2025-05-12
d7a29c6c,1aedbcfd-a357-44,2025-05-22,2025-05-28,AirPods,d633,159.99,website,affiliate,desktop,Manchester,2025-05-22,2025-05-28
542e2e6a,e79c797d-469f-41,2025-02-08,2025-02-13,AirPods,d633,159.99,website,search,mobile,Leeds,2025-02-08,2025-02-13
542e2e6a,e79c797d-469f-41,2025-02-08,2025-02-11,Steam Deck,c912,499.99,mobile_app,direct,mobile,Manchester,2025-02-08,2025-02-11
034f2029,4051dbda-d617-42,2025-04-14,2025-04-19,Accessory,m001,24.99,website,social,desktop,Manchester,2025-04-14,2025-04-19
034f2029,4051dbda-d617-42,2025-04-14,04-16-2025,Steam Deck,c912,499.99,mobile_app,search,unknown,Leeds,2025-04-14,2025-04-16
38ace486,7c4cec7d-ce55-45,2025-03-16,2025-03-17,PS5,a245,479.99,website,email,mobile,Glasgow,2025-03-16,2025-03-17
d385d453,44087701-aa66-40,24-01-2025,01-29-2025,Nintendo Switch,e682,299.99,website,search,mobile,Bristol,2025-01-24,2025-01-29
9b4bf636,9b4cccb0-8f88-4e,2025-03-12,2025-03-17,Kindle Paperwhite,j877,129.99,website,email,mobile,Birmingham,2025-03-12,2025-03-17
1b98a0e3,aae50490-ecdc-4b,2025-05-01,2025-05-03,Kindle Paperwhite,j877,129.99,website,social,mobile,Leicester,2025-05-01,2025-05-03
1b98a0e3,aae50490-ecdc-4b,2025-05-01,05-03-2025,Kindle Paperwhite,j877,129.99,mobile_app,search,unknown,Liverpool,2025-05-01,2025-05-03
184c4178,a48687d4-cb29-4e,2025-04-24,2025-04-29,Kindle Paperwhite,j877,129.99,mobile_app,search,unknown,Manchester,2025-04-24,2025-04-29
b5950807,3d15d3ee-c397-43,2025-04-25,2025-05-01,MacBook Air,g770,1199.99,mobile_app,search,unknown,Manchester,2025-04-25,2025-05-01
0a349670,d0b66c10-6bfd-41,2025-03-14,03-19-2025,Kindle Paperwhite,j877,129.99,mobile_app,affiliate,unknown,Glasgow,2025-03-14,2025-03-19
0a349670,d0b66c10-6bfd-41,2025-03-14,2025-03-16,AirPods,d633,159.99,mobile_app,search,mobile,Sheffield,2025-03-14,2025-03-16
dd088545,70b3e6df-c9c3-4d,2025-03-17,03-22-2025,Accessory,m001,24.99,website,direct,mobile,Leicester,2025-03-17,2025-03-22
dd088545,70b3e6df-c9c3-4d,2025-03-17,2025-03-18,Kindle Paperwhite,j877,129.99,mobile_app,affiliate,unknown,London,2025-03-17,2025-03-18
be901a64,6610ba20-f0b0-40,2025-05-21,05-26-2025,AirPods,d633,159.99,website,direct,desktop,,2025-05-21,2025-05-26
2e44d349,e8780458-ab48-40,2025-02-26,2025-02-28,PS5,a245,479.99,website,email,desktop,London,2025-02-26,2025-02-28
2e44d349,e8780458-ab48-40,2025-02-26,2025-03-02,MacBook Air,g770,1199.99,website,social,unknown,Birmingham,2025-02-26,2025-03-02
69824369,5436deb3-f229-43,14-01-2025,2025-01-19,Nintendo Switch,e682,299.99,mobile_app,direct,mobile,London,2025-01-14,2025-01-19
69824369,5436deb3-f229-43,2025-01-14,2025-01-15,Accessory,m001,24.99,mobile_app,social,desktop,Manchester,2025-01-14,2025-01-15
69824369,5436deb3-f229-43,2025-01-14,01-18-2025,Accessory,m001,24.99,website,direct,mobile,Manchester,2025-01-14,2025-01-18
5bcc7bfb,74e5418d-baa3-40,14-01-2025,2025-01-20,Google Pixel 8,i920,699.99,website,search,unknown,Manchester,2025-01-14,2025-01-20
5bcc7bfb,74e5418d-baa3-40,2025-01-14,2025-01-17,Steam Deck,c912,499.99,mobile_app,direct,unknown,Manchester,2025-01-14,2025-01-17
46d162d6,5a357945-5813-44,2025-03-02,2025-03-08,Xbox Series X,b104,499.99,website,email,desktop,Bristol,2025-03-02,2025-03-08
a282bbab,53133ea1-0c3c-40,2025-04-21,2025-04-25,iPhone 15,f521,899.99,website,direct,unknown,Sheffield,2025-04-21,2025-04-25
dd0d3739,291c9094-cb2c-4e,2025-01-25,2025-01-30,Kindle Paperwhite,j877,129.99,mobile_app,email,desktop,Manchester,2025-01-25,2025-01-30
c7ed8888,bd9ed3fc-5266-4d,2025-04-05,2025-04-07,Google Pixel 8,i920,699.99,mobile_app,search,,Glasgow,2025-04-05,2025-04-07
5a0fdf61,7ff5475c-d83f-4f,2025-06-09,2025-06-15,Google Pixel 8,i920,699.99,website,social,unknown,Manchester,2025-06-09,2025-06-15
5a0fdf61,7ff5475c-d83f-4f,2025-06-09,2025-06-10,AirPods,d633,159.99,mobile_app,search,,Manchester,2025-06-09,2025-06-10
510861bb,ce1eaeb5-bd67-4b,2025-02-27,2025-03-03,iPhone 15,f521,899.99,website,direct,desktop,Manchester,2025-02-27,2025-03-03
67f3e4bf,ea072198-19ee-4d,2025-04-22,2025-04-26,Google Pixel 8,i920,699.99,mobile_app,affiliate,unknown,Glasgow,2025-04-22,2025-04-26
33c00b7d,a3b4a240-7f48-45,2025-03-13,03-15-2025,Accessory,m001,24.99,website,search,mobile,Sheffield,2025-03-13,2025-03-15
7011a2be,7c45d65d-b517-48,02-03-2025,2025-03-05,Kindle Paperwhite,j877,129.99,website,email,desktop,Manchester,2025-03-02,2025-03-05
7011a2be,7c45d65d-b517-48,2025-03-02,2025-03-06,AirPods,d633,159.99,website,direct,unknown,Manchester,2025-03-02,2025-03-06
7011a2be,7c45d65d-b517-48,2025-03-02,2025-03-07,AirPods,d633,159.99,mobile_app,affiliate,desktop,Glasgow,2025-03-02,2025-03-07
0413d049,28c2783d-c138-49,2025-03-13,2025-03-17,Xbox Series X,b104,499.99,website,affiliate,desktop,London,2025-03-13,2025-03-17
a46e47a2,4f7ebc54-94f3-4a,2025-04-05,2025-04-10,Accessory,m001,24.99,mobile_app,search,mobile,London,2025-04-05,2025-04-10
9e541d3e,8f56fffc-c1bb-47,2025-05-03,2025-05-04,MacBook Air,g770,1199.99,website,affiliate,mobile,Manchester,2025-05-03,2025-05-04
ea299a22,17e6ae99-32d8-4c,2025-06-21,06-23-2025,Google Pixel 8,i920,699.99,website,affiliate,unknown,Manchester,2025-06-21,2025-06-23
5714fc0b,da2a5b5f-6796-4b,2025-02-06,2025-02-11,Steam Deck,c912,499.99,mobile_app,affiliate,desktop,Manchester,2025-02-06,2025-02-11
d8528abb,220e674e-6591-49,2025-03-21,2025-03-25,PS5,a245,479.99,website,,unknown,London,2025-03-21,2025-03-25
9d091856,e05ff96e-d087-4c,2025-04-18,2025-04-19,AirPods,d633,159.99,mobile_app,search,desktop,Liverpool,2025-04-18,2025-04-19
d37d8533,52e6ef74-150b-41,2025-06-27,2025-06-28,iPhone 15,f521,899.99,mobile_app,social,desktop,Leeds,2025-06-27,2025-06-28
d37d8533,52e6ef74-150b-41,2025-06-27,2025-07-02,Accessory,m001,24.99,website,search,mobile,Glasgow,2025-06-27,2025-07-02
06bf79cf,27aedaae-8c48-43,2025-06-08,2025-06-12,Accessory,m001,24.99,website,affiliate,unknown,Manchester,2025-06-08,2025-06-12
e008e8ed,b1f0b429-d54f-4d,16-01-2025,2025-01-18,iPhone 15,f521,899.99,mobile_app,email,desktop,Bristol,2025-01-16,2025-01-18
4bfaa29e,cfc01fbc-a5dc-43,2025-01-04,01-08-2025,Smartwatch,h301,249.99,mobile_app,search,mobile,Leeds,2025-01-04,2025-01-08
705f052b,db872c8f-0551-41,2025-06-16,2025-06-18,MacBook Air,g770,1199.99,website,social,desktop,Leeds,2025-06-16,2025-06-18
2fa17fe6,ff9558a3-8d1d-48,2025-06-09,2025-06-13,MacBook Air,g770,1199.99,website,search,desktop,Glasgow,2025-06-09,2025-06-13
2fa17fe6,ff9558a3-8d1d-48,09-06-2025,06-10-2025,iPhone 15,f521,899.99,website,social,unknown,Manchester,2025-06-09,2025-06-10
e6ffee2a,664d49fa-94b5-43,2025-05-08,2025-05-12,Accessory,m001,24.99,mobile_app,affiliate,desktop,London,2025-05-08,2025-05-12
e6ffee2a,664d49fa-94b5-43,2025-05-08,2025-05-14,Kindle Paperwhite,j877,129.99,website,email,desktop,Glasgow,2025-05-08,2025-05-14
5d2d113b,42f1287b-bf2d-4f,2025-01-15,2025-01-20,MacBook Air,g770,1199.99,mobile_app,affiliate,desktop,Sheffield,2025-01-15,2025-01-20
ecedf328,6e6aa3ec-4378-4e,2025-05-10,2025-05-12,Steam Deck,c912,499.99,mobile_app,direct,desktop,Manchester,2025-05-10,2025-05-12
b1757e7d,8a55a14b-51f5-48,2025-06-10,2025-06-13,Xbox Series X,b104,499.99,mobile_app,direct,desktop,Manchester,2025-06-10,2025-06-13
cba9a0f0,d3d39ff9-dc25-45,22-02-2025,2025-02-26,iPhone 15,f521,899.99,website,social,unknown,Birmingham,2025-02-22,2025-02-26
fc4a013f,18bc2e3b-20f6-48,20-04-2025,2025-04-24,PS5,a245,479.99,website,direct,desktop,Birmingham,2025-04-20,2025-04-24
d387fcd8,890d58e5-79c9-42,2025-01-12,2025-01-13,Accessory,m001,24.99,website,search,desktop,Liverpool,2025-01-12,2025-01-13
f9fb722d,592cfe25-b858-42,2025-03-12,2025-03-16,Nintendo Switch,e682,299.99,website,direct,mobile,London,2025-03-12,2025-03-16
d62c4be4,3955b110-fc2e-43,19-04-2025,2025-04-24,Steam Deck,c912,499.99,mobile_app,direct,mobile,Manchester,2025-04-19,2025-04-24
d62c4be4,3955b110-fc2e-43,2025-04-19,2025-04-24,Smartwatch,h301,249.99,mobile_app,social,desktop,London,2025-04-19,2025-04-24
108d692f,70184f95-9e6a-40,2025-02-10,2025-02-12,Steam Deck,c912,499.99,mobile_app,affiliate,unknown,Birmingham,2025-02-10,2025-02-12
108d692f,70184f95-9e6a-40,2025-02-10,2025-02-13,Google Pixel 8,i920,699.99,mobile_app,email,unknown,Leicester,2025-02-10,2025-02-13
a6789753,05a95733-2bdd-44,2025-03-08,2025-03-14,Nintendo Switch,e682,299.99,website,search,mobile,London,2025-03-08,2025-03-14
a6789753,05a95733-2bdd-44,2025-03-08,2025-03-10,Nintendo Switch,e682,299.99,mobile_app,email,,Leicester,2025-03-08,2025-03-10
1053adba,7a0430c4-58fc-44,2025-01-19,2025-01-20,Nintendo Switch,e682,299.99,mobile_app,email,mobile,Manchester,2025-01-19,2025-01-20
1053adba,7a0430c4-58fc-44,2025-01-19,2025-01-21,Nintendo Switch,e682,299.99,mobile_app,direct,unknown,Birmingham,2025-01-19,2025-01-21
1053adba,7a0430c4-58fc-44,2025-01-19,2025-01-20,AirPods,d633,159.99,mobile_app,social,unknown,Birmingham,2025-01-19,2025-01-20
4083dcf3,f46976af-10be-43,2025-03-14,2025-03-16,PS5,a245,479.99,mobile_app,social,unknown,Manchester,2025-03-14,2025-03-16
4083dcf3,f46976af-10be-43,2025-03-14,2025-03-16,Google Pixel 8,i920,699.99,website,affiliate,desktop,Manchester,2025-03-14,2025-03-16
4083dcf3,f46976af-10be-43,2025-03-14,2025-03-20,Xbox Series X,b104,499.99,website,social,unknown,Manchester,2025-03-14,2025-03-20
6e4ae071,070f48c2-ba4e-43,2025-04-21,04-23-2025,Google Pixel 8,i920,699.99,website,direct,mobile,Leeds,2025-04-21,2025-04-23
a96bc761,2223ab94-f157-41,2025-01-20,01-24-2025,Google Pixel 8,i920,699.99,website,search,unknown,Birmingham,2025-01-20,2025-01-24
3b895644,b27c1721-89d4-4c,2025-05-21,2025-05-27,iPhone 15,f521,899.99,mobile_app,search,mobile,Leeds,2025-05-21,2025-05-27
c42c40ce,82095583-e03f-4c,2025-02-14,2025-02-18,Steam Deck,c912,499.99,website,search,desktop,Manchester,2025-02-14,2025-02-18
f88c2664,963d4606-ae6b-49,2025-04-18,2025-04-23,PS5,a245,479.99,website,search,,London,2025-04-18,2025-04-23
c64d8e70,c124b471-b64d-45,2025-05-26,2025-05-30,iPhone 15,f521,899.99,website,email,desktop,Liverpool,2025-05-26,2025-05-30
c64d8e70,c124b471-b64d-45,2025-05-26,2025-05-30,Kindle Paperwhite,j877,129.99,website,social,unknown,Glasgow,2025-05-26,2025-05-30
